user_input,retrieved_contexts,response,reference,faithfulness,answer_relevancy,context_precision,context_recall,nv_context_relevance,answer_correctness,semantic_similarity
¿Cuáles son los síntomas comunes de la diabetes?,"['y las recomendaciones para cada una de las características específicas de \nlos diferentes tipos de diabetes y sus etapas. En consecuencia, siguiendo el \nllamamiento a la individualización terapéutica, este tema se subdivide en cuatro \npartes principales:\n• Diabetes de tipo 1 (DT1).\n• Diabetes de tipo 2 (DT2), sobrepeso, recientemente diagnosticada, \nresistente a la insulina.', 'comprende y utiliza correctamente los aspectos cruciales para su tipo específico \nde diabetes.\nDiabetes Tipo 2.\nLa DT2 se caracteriza por su desarrollo progresivo que está determinado por el \nritmo individualmente diferente en el curso de la insuficiencia/disfunción de las \ncélulas ß (12)(13)(14). Los pacientes con DT2 presentan diferentes características', 'complicando el tratamiento de la diabetes (9)(10).\nConducta alimentaria problemática y trastornos alimentarios son más prevalentes \nen la diabetes, particularmente entre las mujeres jóvenes con diabetes tipo 1 \n(11). Los más comunes son el trastorno por atracón y la bulimia nerviosa, a \nmenudo asociada con una disregulación emocional y disturbios de la imagen.', 'significativo cuando se asocia a estado de ánimo disminuido, problemas en el \nautocuidado de la diabetes y valores elevados de HbA1c (1). El DD puede ocurrir \nen cualquier momento, pero al diagnóstico (tipo 1, tipo 2 y diabetes gestacional) \ny la aparición de complicaciones de la diabetes son momentos críticos que \nrequieren especial atención y seguimiento por parte del equipo tratante (2).', 'Propósitos\nLos propósitos de la guía de práctica clínica de educación en diabetes están \norientados a: \n• Sistematizar prácticas educativas basadas en evidencia, para promover, \nconservar y recuperar la salud de las personas con diabetes tipo 1, tipo 2 \ny gestacional, para reducir y minimizar complicaciones agudas y crónicas \nque podrían presentarse, permitiéndoles mejorar su calidad de vida.', 'Población objetivo.\nLa guía se dirige a personas con diabetes tipo 1, tipo 2, gestacional y otros tipos \nde diabetes, personas con prediabetes y personas con un puntaje de Findrisc \nalto, con involucramiento del entorno familiar (porque la población pediátrica \ndepende significativamente del conocimiento adquirido por sus tutores legales,', 'consulta de la persona con diabetes, para que mejore su manejo metabólico \ny prevenga o disminuyan las complicaciones?\n• ¿Qué variables deben ser tomadas en cuenta, dentro de la evaluación \ninicial de las personas con diabetes, para determinar sus prioridades \neducativas?\n• ¿Qué método pedagógico se debería emplear, en los programas educativos,', '8\nde los aspectos en los que no se hubiere alcanzado el desarrollo requerido, para \nconcretar un verdadero apoyo a las personas con diabetes y sus familiares.\nPoblación objetivo.\nLa guía se dirige a personas con diabetes tipo 1, tipo 2, gestacional y otros tipos \nde diabetes, personas con prediabetes y personas con un puntaje de Findrisc', '(11). Los más comunes son el trastorno por atracón y la bulimia nerviosa, a \nmenudo asociada con una disregulación emocional y disturbios de la imagen. \nPacientes con diabetes tratados con insulina pueden omitir inyecciones con el \nobjetivo de perder peso, lo que se conoce como ‘diabulimia’ con obvio impacto \nsignificativo sobre los riesgos en la salud (12).', 'Co-morbilidades psicológicas.\nEstudios epidemiológicos han demostrado que los desórdenes mentales son \nmás prevalentes en personas con diabetes que en la población general (3)(4)\n(5)(6)(7). La depresión es común y está asociada con altos niveles de DD y \nafecta negativamente la calidad de vida de los pacientes, el autocuidado y el', 'zados especíﬁcamente para personas con diabetes.\nSe sugiere que las recomendaciones al paciente incluyan ade-\nmás otros aspectos de la modiﬁcación del estilo de vida, como el\naumento de la actividad física y la pérdida de peso. En aquellos\nadultos con diabetes tipo 2 con sobrepeso u obesidad, se debe\ndiscutir y acordar un objetivo inicial de pérdida de peso corporal\nde 5 a 10 %.', 'partes principales:\n• Diabetes de tipo 1 (DT1).\n• Diabetes de tipo 2 (DT2), sobrepeso, recientemente diagnosticada, \nresistente a la insulina.\n• DT2, peso normal, no resistente a la insulina.\n• DT2, tratamiento con insulina.', 'symptoms for years before diabetes is diagnosed.\nCommon signs and symptoms of type 2 \ndiabetes include:\n■ urinating more than usual.\n■ feeling very thirsty.\n■ feeling hungry even after eating.\n■ feeling tired.\n■ having blurred vision.\n■ having frequent infections or slow-healing cuts \n   and sores.\n■ having tingling, pain, or numbness in the hands \n   or feet.\nHow is diabetes diagnosed?', 'Don’t delay—early detection and treatment of diabetes \ndecreases the risk of developing the complications of \ndiabetes.\nWhat are the symptoms?\nYou may have no noticeable symptoms or only mild \nsymptoms for years before diabetes is diagnosed.\nCommon signs and symptoms of type 2 \ndiabetes include:\n■ urinating more than usual.\n■ feeling very thirsty.\n■ feeling hungry even after eating.', 'presence of complications at diagnosis. \nType 1 diabetes is more likely to present with symptoms and its onset is typically \nin children and young adults. However, the type of diabetes cannot always be \ndetermined at diagnosis, and initial treatment decisions should be based on clinical \npresentation and plasma glucose values.\nTable 2 Symptoms and signs of diabetes\nSymptoms of diabetes', 'una glucemia casi normal. Los aspectos generales de la “dieta saludable” \npodrían cubrirse posteriormente, siempre que el paciente haya demostrado que \ncomprende y utiliza correctamente los aspectos cruciales para su tipo específico \nde diabetes.\nDiabetes Tipo 2.\nLa DT2 se caracteriza por su desarrollo progresivo que está determinado por el', '1 Clinical manifestations of \ndiabetes and diagnostic \ncriteria\nClinical manifestations \nDiabetes may present with characteristic symptoms and signs (Table 2). It is \nestimated that a significant percentage of cases of type 2 diabetes (T2DM) (30% \nto 80%, depending on the country) are undiagnosed. The most severe clinical', 'the most common form of diabetes.\nGestational (jes-TAY-shon-al) \ndiabetes — occurs in some women \nwhen they become pregnant.  It \nraises her future risk of developing \ndiabetes, mostly type 2.  It may raise \nher child’s risk of being overweight \nand developing type 2 diabetes.   \n3', 'Symptoms of diabetes\n • thirst  \n • frequent urination\n • blurring  of vision\n • fatigue\nSigns of diabetes\n • unintentional weight loss \n • signs of acute metabolic deterioration (signs of severe \ndehydration, Kussmaul’s respiration, vomiting, altered level of \nconsciousness)\n • clinical signs of chronic complications (acute coronary disease, \nstroke, kidney disease, vision loss, diabetic foot)', 'enfermedad de fácil detección, pero con sintomatología inespecífica, y todas las medidas \npreventivas dependen principalmente de la implementación de estrategias orientadas al \napoyo al autocuidado, a través de programas de educación en diabetes.\nLa Guía de Práctica Clínica (GPC) propuesta por la Federación Internacional de Diabetes', 'determined at diagnosis, and initial treatment decisions should be based on clinical \npresentation and plasma glucose values.\nTable 2 Symptoms and signs of diabetes\nSymptoms of diabetes\n • thirst  \n • frequent urination\n • blurring  of vision\n • fatigue\nSigns of diabetes\n • unintentional weight loss \n • signs of acute metabolic deterioration (signs of severe', 'ring throughout pregnancy, such as\ntype 1 diabetes).\nThis section reviews most common forms\nof diabetes but is not comprehensive. For\nadditional information, see the ADA posi-\ntion statement“Diagnosis and Classiﬁca-\ntion of Diabetes Mellitus” (2).\nType 1 diabetes and type 2 diabetes are\nheterogeneous diseases in which clinical\npresentation and disease progression may', '4. Gestational diabetes mellitus (diabe-\ntes diagnosed in the second or third\ntrimester of pregnancy that was not\nclearly overt diabetes prior to gesta-\ntion or other types of diabetes occur-\nring throughout pregnancy, such as\ntype 1 diabetes).\nThis section reviews most common forms\nof diabetes but is not comprehensive. For\nadditional information, see the ADA posi-', 'symptoms of polyuria/polydipsia, and ap-\nproximately half present with diabetic\nketoacidosis (DKA) (30–32). The onset of\ntype 1 diabetes may be more variable in\nadults; they may not present with the classic\nsymptoms seen in children and may experi-\nence temporary remission from the need\nfor anticipated full-dose insulin replacement\n(33–35). The features most useful in discrim-', '(8). La ansiedad es común y a menudo se presenta combinada con depresión. \nLa ansiedad puede ser general o específica de la diabetes, por ejemplo: \nmiedo extremo a la hipoglucemia o a las complicaciones y fobia a las agujas, \ncomplicando el tratamiento de la diabetes (9)(10).\nConducta alimentaria problemática y trastornos alimentarios son más prevalentes', 'seleccionados para asegurar la transmisión exitosa de lo esencial.\n• Es más probable que se sigan las pocas recomendaciones básicas que una \nserie de abundantes recomendaciones no focalizadas.\nDiabetes Tipo 1.\nEste tipo de diabetes se caracteriza por una falta absoluta de insulina endógena. \nEn el 2021 se celebró el centenario del descubrimiento de la insulina por parte', 'Pensar en la neuropatía autonómica como complicación de la\nDM2 en pacientes que presenten, por ejemplo:\n\x0f pérdida de los signos de alarma de hipoglucemias (afectación\ndel sistema nervioso simpático);\n\x0f diarrea inexplicable, que ocurre en particular por la noche\n(neuropatía autonómica);\n\x0f diﬁcultades del vaciado vesical (neuropatía autonómica).', 'Gestational diabetes comprises those cases in which the disease\nappears for the ﬁrst time during pregnancy (usually after the 28th week\nof pregnancy).\nWhat is the frequency of DM?\nDiabetes mellitus frequency, both Type 1 and Type 2, varies from\ncountry to country. In western countries, it is estimated that DM affects,\non average, 6–8 percent of the adult population. Type 2 DM is, however,', 'Diabetes Tipo 1.\nEste tipo de diabetes se caracteriza por una falta absoluta de insulina endógena. \nEn el 2021 se celebró el centenario del descubrimiento de la insulina por parte \nde Banting y Best, como única terapia decisiva para la DT1 (3). Así, la aplicación \nde insulina es la terapia principal para la DT1. Diversos enfoques dietéticos en', '7\nIntroducción.\nLa diabetes mellitus es una de las enfermedades crónicas más frecuentes y graves del \nmundo, es una de las principales causas de muerte, discapacidad y pérdidas económicas, \nque impone altos costos individuales, familiares e institucionales, derivados -sobre \ntodo- de las complicaciones (1)(2), mismas que son prevenibles. Por otro lado, es una', 'paradigms of type 2 diabetes occurring\nonly in adults and type 1 diabetes only in\nchildren are not accurate, as both diseases\noccur in all age-groups. Children with type 1\ndiabetes often present with the hallmark\nsymptoms of polyuria/polydipsia, and ap-\nproximately half present with diabetic\nketoacidosis (DKA) (30–32). The onset of\ntype 1 diabetes may be more variable in', '(5)(6)(7). La depresión es común y está asociada con altos niveles de DD y \nafecta negativamente la calidad de vida de los pacientes, el autocuidado y el \ncontrol glucémico, llevando a tasas más altas de complicaciones y mortalidad \n(8). La ansiedad es común y a menudo se presenta combinada con depresión. \nLa ansiedad puede ser general o específica de la diabetes, por ejemplo:', '130\nDT2, sobrepeso, recientemente diagnosticado, resistente a la insulina\nEn una persona con sobrepeso y con una DT2 recientemente diagnosticada, \nes común que se manifieste la resistencia a la insulina. A pesar de la \nhiperinsulinemia, la capacidad restante de producción de insulina de las células \nß no es suficiente para alcanzar niveles normoglucémicos (deficiencia relativa', 'capacitar y/o mejorar el autocuidado en las personas con diabetes?\n• ¿Cuáles son los temas claves que el equipo de salud debe tratar en la \nconsulta de la persona con diabetes, para que mejore su manejo metabólico \ny prevenga o disminuyan las complicaciones?\n• ¿Qué variables deben ser tomadas en cuenta, dentro de la evaluación', 'con diabetes mellitus. \nEl contexto de implementación de las recomendaciones toma en cuenta los \nsiguientes entornos:\nPrimer nivel de atención ambulatoria y hospitalización. Segundo nivel de \natención (debe implementar a todo nivel, sin importar la división dentro de un \nsistema público particular, pues el manejo siempre será multidisciplinario).', 'ination of type 1 diabetes include younger\nage at diagnosis (<35 years) with lower\nBMI (<25 kg/m2), unintentional weight\nloss, ketoacidosis, and plasma glucose\n>360 mg/dL (>20 mmol/L) at presenta-\ntion (36) (Fig. 2.1). Other features classi-\ncally associated with type 1 diabetes,\nsuch as ketosis without acidosis, osmotic\nsymptoms, family history, or a history of', '37\nPREGUNTA 2. ¿Cuáles son los temas claves que el equipo de salud debe \ntratar en la consulta de la persona con diabetes para que mejore su manejo \nmetabólico y prevenga o disminuya las complicaciones?\nSe recomienda un programa de apoyo al autocuidado estandarizado, adaptado \na las necesidades de la región, que tenga como mínimo más de 12 horas', 'ritmo individualmente diferente en el curso de la insuficiencia/disfunción de las \ncélulas ß (12)(13)(14). Los pacientes con DT2 presentan diferentes características \ny estrategias de tratamiento. Por lo tanto, el papel y la importancia de la terapia \nnutricional van desde la “terapia de primera línea” hasta la “baja” para la \npersona individual con DT2.', 'de la persona, siendo sensible a su voluntad de cambio y los efec-\ntos en su calidad de vida.\nSe aconseja estimular a los adultos con diabetes tipo 2 a seguir\nlos mismos consejos de alimentación saludable que la población\ngeneral, que incluyen: comer fuentes de carbohidratos con alto\ncontenido de ﬁbra y bajo índice glucémico, como frutas, verdu-', '■ feeling tired.\n■ having blurred vision.\n■ having frequent infections or slow-healing cuts \n   and sores.\n■ having tingling, pain, or numbness in the hands \n   or feet.\nHow is diabetes diagnosed?  \nThere are several ways to diagnose diabetes, \nand testing sometimes needs to be repeated to \nconfirm the diagnosis. Testing should be carried \nout in a health care setting (such as your health care', 'plasma or increased A1C in the blood. Diabetes is classiﬁed conventionally into several\nclinical categories (e.g., type 1 or type 2 diabetes, gestational diabetes mellitus, and\nother speciﬁc types derived from other causes, such as genetic causes, exocrine pan-\ncreatic disorders, and medications) (2).\nDIAGNOSTIC TESTS FOR DIABETES\nRecommendations', 'hospitales, fomentando el abordaje integral para evitar futuras complicaciones y \nmejorar la adherencia al tratamiento, así como reducción de la angustia y A1c en \npersonas con diabetes tipo 1 y diabetes tipo 2. C2\nJustificación\nCuando se habla de autocontrol en la diabetes, se hace referencia a comportamientos \nrelacionados con la salud que pueden mejorar la salud de un individuo; por tanto,', 'un conjunto inespecífico de reglas, independientemente del tipo, el estadio y \nla estrategia de medicación de la enfermedad. Afortunadamente, en los últimos \naños esta actitud ha cambiado: los componentes relevantes de la intervención \nnutricional en el tratamiento de la diabetes dependen del tipo de diabetes, \nde la medicación utilizada y de las preferencias particulares del paciente. La', 'primaria y secundaria, depende de la organización del sistema de salud público-\nprivado), Ministerio de Educación (universidades e instituciones educativas) y \nMinisterio de Economía (responsables de la financiación).\nBeneficiarios: Personas con diabetes tipo 1, tipo 2, gestacional y otros tipos de \ndiabetes y sus familias con necesidad de educación en diabetes.', 'en sangre, normalmente con insulina.\nObjetivos de aprendizaje / contenidos de la educación sobre la DT2 (peso \nnormal, no resistente a la insulina):\n1. Entender la importancia de mantenerse dentro del rango de peso normal. –› 2. \nIdentificar y elegir alimentos que contengan CHO de bajo índice glucémico. –› \n3. Elaborar un plan individual de distribución de pequeñas porciones de CHO', 'DIABETES IN PREGNANCY\nThe prevalence of diabetes in pregnancy has been increasing in the U.S. in parallel\nwith the worldwide epidemic of obesity. Not only is the prevalence of type 1 diabetes\nand type 2 diabetes increasing in individuals of reproductive age, but there is also a\ndramatic increase in the reported rates of gestational diabetes mellitus (GDM). Diabe-', 'Most common types of diabetes and their risk factors 9\nClassification of diabetes  10\n1 Clinical manifestations of diabetes and diagnostic criteria 12\nClinical manifestations  12\nDiagnostic criteria for diabetes 13\nDiagnostic tests  13\n2 Management of diabetes 14\nBlood glucose management protocol  14\nMonitoring of glycaemic control 17\n3 Prevention and management of complications of diabetes  18', 'La diabetes no controlada, genera repercusiones negativas sobre la calidad de \nvida de las personas, entre otras razones, debido a la presencia de sensación \nde enfermedad generalizada, dificultad para controlar el peso corporal, \ndisfunciones sexuales, fluctuaciones en el estado de ánimo y pensamientos \ndistorsionados, siendo las últimas objeto de intervención psicológica, pues se', 'y crónicas. Alrededor del 30% de personas con diabetes, tanto jóvenes como \nadultos, presentan distrés por diabetes (DD) en algún momento del curso de la \nLa diabetes tiene un impacto significativo sobre la vida de las personas que la \npadecen, y factores psicológicos pueden jugar un rol clave en el proceso de \nautocuidado de la enfermedad;', 'Impacto.\nLa diabetes tiene un profundo impacto en la calidad de vida de los que la \npadecen, incluyendo a la familia, parejas y amigos. En parte debido a las \ndemandas continuas de cuidado diario, y al riesgo de complicaciones agudas \ny crónicas. Alrededor del 30% de personas con diabetes, tanto jóvenes como \nadultos, presentan distrés por diabetes (DD) en algún momento del curso de la']","Los síntomas comunes de la diabetes incluyen:

- Orinar más de lo habitual.
- Sentirse muy sediento.
- Sentir hambre a pesar de haber comido.
- Sentirse cansado.
- Tener visión borrosa.
- Tener infecciones frecuentes o cortes y llagas que tardan en sanar.
- Sentir hormigueo, dolor o entumecimiento en las manos o pies.

Estos síntomas pueden ser leves y pasar desapercibidos durante años antes de que se diagnostique la diabetes.","Los síntomas comunes de la diabetes incluyen aumento de la sed y la frecuencia urinaria, aumento del apetito, fatiga, visión borrosa, cicatrización lenta de cortes y moretones, hormigueo o entumecimiento en manos/pies (tipo 2), pérdida de peso inexplicada (tipo 1) e infecciones recurrentes. Estos síntomas surgen por los altos niveles de azúcar en sangre debido a la incapacidad del cuerpo para producir o utilizar adecuadamente la insulina. Aunque los síntomas pueden ser leves al principio, especialmente en la diabetes tipo 2, la detección temprana mediante exámenes es crucial para prevenir complicaciones.",1.0,1.0000000000000002,,1.0,1.0,0.824265246947105,0.8425155332429661
¿Qué desencadena el inicio de la diabetes tipo 1?,"['y crónicas. Alrededor del 30% de personas con diabetes, tanto jóvenes como \nadultos, presentan distrés por diabetes (DD) en algún momento del curso de la \nLa diabetes tiene un impacto significativo sobre la vida de las personas que la \npadecen, y factores psicológicos pueden jugar un rol clave en el proceso de \nautocuidado de la enfermedad;', 'terapéuticos en el estilo de vida?\nSe recomienda el uso de un programa conductual para mejorar los resultados \nen las personas con diabetes mellitus. C1\nJustificación\nEl manejo de la diabetes mellitus tipo 1 y tipo 2, implica atención clínica y permite \nque las personas con diabetes adopten comportamientos de autocuidado. Es', 'significativo cuando se asocia a estado de ánimo disminuido, problemas en el \nautocuidado de la diabetes y valores elevados de HbA1c (1). El DD puede ocurrir \nen cualquier momento, pero al diagnóstico (tipo 1, tipo 2 y diabetes gestacional) \ny la aparición de complicaciones de la diabetes son momentos críticos que \nrequieren especial atención y seguimiento por parte del equipo tratante (2).', 'La diabetes tiene un impacto significativo sobre la vida de las personas que la \npadecen, y factores psicológicos pueden jugar un rol clave en el proceso de \nautocuidado de la enfermedad;\nLa detección y monitoreo de las necesidades psicológicas deben formar parte \nintegral del cuidado de la diabetes;\nLa atención psicológica de las personas con diabetes puede ayudar significa-', 'un conjunto inespecífico de reglas, independientemente del tipo, el estadio y \nla estrategia de medicación de la enfermedad. Afortunadamente, en los últimos \naños esta actitud ha cambiado: los componentes relevantes de la intervención \nnutricional en el tratamiento de la diabetes dependen del tipo de diabetes, \nde la medicación utilizada y de las preferencias particulares del paciente. La', '(36).\nIn both type 1 and type 2 diabetes, ge-\nnetic and environmental factors can re-\nsult in the progressive loss ofb-cell mass\nand/or function that manifests clinically\nas hyperglycemia. Once hyperglycemia\noccurs, people with all forms of diabetes\nare at risk for developing the same\nchronic complications, although rates of\nprogression may differ. The identiﬁcation', 'diabetes); Control (e.g., level of glucose\ncontrol on noninsulin therapies); and Co-\nmorbidities (e.g., treatment with immune\ncheckpoint inhibitors for cancer can cause\nacute autoimmune type 1 diabetes)\n(36).\nIn both type 1 and type 2 diabetes, ge-\nnetic and environmental factors can re-\nsult in the progressive loss ofb-cell mass\nand/or function that manifests clinically', 'Diabetes Tipo 1.\nEste tipo de diabetes se caracteriza por una falta absoluta de insulina endógena. \nEn el 2021 se celebró el centenario del descubrimiento de la insulina por parte \nde Banting y Best, como única terapia decisiva para la DT1 (3). Así, la aplicación \nde insulina es la terapia principal para la DT1. Diversos enfoques dietéticos en', 'partes principales:\n• Diabetes de tipo 1 (DT1).\n• Diabetes de tipo 2 (DT2), sobrepeso, recientemente diagnosticada, \nresistente a la insulina.\n• DT2, peso normal, no resistente a la insulina.\n• DT2, tratamiento con insulina.', 'those with islet autoantibodies, factors\nthat may increaseb-cell demand includ-\ning less physical activity (65), higher die-\ntary glycemic index (66), and total sugar\nintake (67) are associated with progression\nto clinical diabetes. Similar associations\nhave not been seen in the development of\nautoantibodies. In The Environmental\nDeterminants of Diabetes in the Young', 'seleccionados para asegurar la transmisión exitosa de lo esencial.\n• Es más probable que se sigan las pocas recomendaciones básicas que una \nserie de abundantes recomendaciones no focalizadas.\nDiabetes Tipo 1.\nEste tipo de diabetes se caracteriza por una falta absoluta de insulina endógena. \nEn el 2021 se celebró el centenario del descubrimiento de la insulina por parte', 'mechanisms can lead to a decline in function or the complete destruction of \nbeta-cells. These mechanisms include genetic predisposition and abnormalities, \nepigenetic processes, insulin resistance, auto-immunity, concurrent illnesses, \ninflammation, and environmental factors. \nMost common types of diabetes and their risk factors\nRisk factors for type 2 diabetes\n • overweight/obesity', 'type 1 diabetes); Autoimmunity (e.g., per-\nsonal or family history of autoimmune\ndisease or polyglandular autoimmune syn-\ndromes); Body habitus (e.g., BMI<25 kg/m2);\nBackground (e.g., family history of type 1\ndiabetes); Control (e.g., level of glucose\ncontrol on noninsulin therapies); and Co-\nmorbidities (e.g., treatment with immune\ncheckpoint inhibitors for cancer can cause', 'and among people of Indian descent living in high-income countries. \nRisk factors for type 1 diabetes\n • certain genetic haplotypes\n • unknown environmental factors\nType 1 diabetes is much less common, the risk being highest in populations of \nEuropean origin. This module is specifically for management of type 2 diabetes, as \ntype 1 is usually not managed in primary care facilities.', 'lated to environmental factors that are\nstill poorly deﬁned. Although individuals\ndo not typically have obesity when they\npresent with type 1 diabetes, obesity is\nincreasingly common in the general pop-\nulation; as such, obesity should not pre-\nclude testing for type 1 diabetes. People\nwith type 1 diabetes are also prone to\nother autoimmune disorders, such as', 'clinical disease in both“sporadic” and fa-\nmilial cases of type 1 diabetes. Indeed,\nthe risk of type 1 diabetes increases as\nthe number of relevant autoantibodies\ndetected increases (55,74,75). In The\nEnvironmental Determinants of Diabetes\nin the Young (TEDDY) study, type 1 diabe-\ntes developed in 21% of 363 subjects\nwith at least one autoantibody at 3 years', 'inflammation, and environmental factors. \nMost common types of diabetes and their risk factors\nRisk factors for type 2 diabetes\n • overweight/obesity\n • physical inactivity\n • age\n • diabetes in first degree relatives\n • history of gestational diabetes \n • cardiovascular disease and its risk factors\n • ethnicity (South Asian, Afro-Caribbean, Hispanic)', 'y las recomendaciones para cada una de las características específicas de \nlos diferentes tipos de diabetes y sus etapas. En consecuencia, siguiendo el \nllamamiento a la individualización terapéutica, este tema se subdivide en cuatro \npartes principales:\n• Diabetes de tipo 1 (DT1).\n• Diabetes de tipo 2 (DT2), sobrepeso, recientemente diagnosticada, \nresistente a la insulina.', 'islet autoimmunity (trialnet.org/our-research/\nprevention-studies) (42–44,49,55,56). The\ndisease has strong HLA associations, with\nlinkage to the DQB1 and DRB1 haplo-\ntypes, and genetic screening has been\nused in some research studies to identify\nhigh-risk populations. Speciﬁc alleles in\nthese genes can be either predisposing\n(e.g., DRB1*0301-DQB1*0201 [DR3-DQ2]\nand DRB1*0401-DQB1*0302 [DR4-DQ8])', 'However, in some populations, such as Asians, beta-cell dysfunction appears to \nbe a more prominent feature than in populations of European descent. This is also \nobserved in thinner people from low- and middle-income countries such as India, \nand among people of Indian descent living in high-income countries. \nRisk factors for type 1 diabetes\n • certain genetic haplotypes', 'strong genetic predisposition or family his-\ntory inﬁrst-degree relatives (more so than\ntype 1 diabetes). However, the genetics of\ntype 2 diabetes are poorly understood and\nunder intense investigation in this era of\nprecision medicine (52). In adults without\ntraditional risk factors for type 2 diabetes\nand/or of younger age, consider islet auto-\nantibody testing (e.g., GAD autoantibod-', 'específicos para enfermedades pueden actuar como un impulso para brindar \natención a las personas con diabetes (159).\nLas enfermedades crónicas como la diabetes mellitus tipo 1 (DM1), representan \nuna carga emocional y biológica importante para las personas, sus familias y \nentorno, especialmente durante la infancia y adolescencia (160). Se conoce', 'tases islet antigen 2 (IA-2) and IA-2b,a n d\nzinc transporter 8 (ZnT8). Numerous clini-\ncal studies are being conducted to test\nvarious methods of preventing or delaying\ntype 1 diabetes in those with evidence of\nislet autoimmunity (trialnet.org/our-research/\nprevention-studies) (42–44,49,55,56). The\ndisease has strong HLA associations, with\nlinkage to the DQB1 and DRB1 haplo-', 'comprende y utiliza correctamente los aspectos cruciales para su tipo específico \nde diabetes.\nDiabetes Tipo 2.\nLa DT2 se caracteriza por su desarrollo progresivo que está determinado por el \nritmo individualmente diferente en el curso de la insuficiencia/disfunción de las \ncélulas ß (12)(13)(14). Los pacientes con DT2 presentan diferentes características', 'type 1 diabetes, the Finnish and American\ngroups were recruited from the general\npopulation. Remarkably, theﬁndings in all\nthree groups were the same, suggesting\nthat the same sequence of events led to\nclinical disease in both“sporadic” and fa-\nmilial cases of type 1 diabetes. Indeed,\nthe risk of type 1 diabetes increases as\nthe number of relevant autoantibodies', 'levels of plasma C-peptide. Immune-\nmediated diabetes is the most com-\nmon form of diabetes in childhood and\nadolescence, but it can occur at any\nage.\nAutoimmune destruction ofb-cells has\nmultiple genetic factors and is also re-\nlated to environmental factors that are\nstill poorly deﬁned. Although individuals\ndo not typically have obesity when they\npresent with type 1 diabetes, obesity is', 'Review of previous treatment plans and responseReview of previous treatment plans and response\nAssess frequency/cause/severity of past hospitalizationsAssess frequency/cause/severity of past hospitalizations\nFamily history of diabetes in a first-degree relativeFamily history of diabetes in a first-degree relative\nFamily history of autoimmune disorderFamily history of autoimmune disorder', 'con la educación presencial, para promover el empoderamiento para el \nautocuidado de las personas con diabetes?\n• ¿Cómo debería ser la transición de personas con diabetes en edad pediátrica-\nadultos?\n• ¿Cuál es la importancia de la tecnología en la educación en diabetes?\n• ¿Qué impacto psicológico tiene la diabetes, su tratamiento y cómo \ndetectarlo?', 'progresión de la pérdida individual de células ß.\nÉnfasis de la dieta en la terapia de las personas con sobrepeso/obesidad \ncon diagnóstico reciente de DT2 y resistencia a la insulina:\nMedios terapéuticos primarios: En estos pacientes el principal componente \nterapéutico es la reducción de peso para reducir la resistencia a la insulina.', 'importancia de la dieta y la lucha contra el sedentarismo para evitar la obesidad, \nasí como para prevenir el inicio de la diabetes y también mostrar el papel de \nestas medidas en el control y el tratamiento de esta enfermedad”. Esta frase fue \ncreada en 1925 por un papá interesado en diabetes y con una gran experiencia \nen la formación de médicos de todo el mundo en el campo de la diabetes', '(e.g., DRB1*0301-DQB1*0201 [DR3-DQ2]\nand DRB1*0401-DQB1*0302 [DR4-DQ8])\nor protective (e.g., DRB1*1501 and DQA1*\n0102-DQB1*0602). Stage 1 of type 1 diabe-\ntes is deﬁned by the presence of two or\nmore of these autoantibodies and normo-\nglycemia. At stage 1, the 5-year risk of de-\nveloping symptomatic type 1 diabetes is\n/C2444% overall but varies considerably', '“Comprehensive Medical Evaluation and\nAssessment of Comorbidities”). Type 1 di-\nabetes can be associated with monogenic\npolyglandular autoimmune syndromes,\nincluding immune dysregulation, polyen-\ndocrinopathy, enteropathy, and X-linked\n(IPEX) syndrome, which is an early-onset\nsystemic autoimmune, genetic disorder\ncaused by mutation of the forkhead box\nprotein 3 (FOXP3) gene, and another dis-', 'Población objetivo.\nLa guía se dirige a personas con diabetes tipo 1, tipo 2, gestacional y otros tipos \nde diabetes, personas con prediabetes y personas con un puntaje de Findrisc \nalto, con involucramiento del entorno familiar (porque la población pediátrica \ndepende significativamente del conocimiento adquirido por sus tutores legales,', 'to clinical diabetes. Similar associations\nhave not been seen in the development of\nautoantibodies. In The Environmental\nDeterminants of Diabetes in the Young\n(TEDDY) longitudinal study, daily minutes\nspent in moderate to vigorous physical\nactivity were associated with a reduced\nrisk of progression to type 1 diabetes in\nchildren 5 to 15 years of age with multiple', 'diabetes y otros actores involucrados. Para ello, se definieron tres estrategias \ngenerales, fundamentadas en el flujo de información que comparten el grupo \ndesarrollador y el público (5):\n1. Consulta: Se recolectó información de parte de personas con diabetes y \npúblico en general, a través de entrevistas directas y participación en una', 'con el programa KiDS de la Federación Internacional de Diabetes (IDF) (48)(49).\nConsideraciones finales.\nExisten muchos factores que son obstáculos para el éxito de la ED, pero ya son \nconocidas las maneras de minimizarlos, y las asociaciones de diabetes tienen \nun rol central en eso. Es necesario observar las características del educando,', '162. Gagnum V, Stene LC, Jenssen TG, Berteussen LM, Sandvik L, Joner G, et al. Causes of death in childhood-onset Type 1 \ndiabetes: long-term follow-up. Diabet Med. enero de 2017;34(1):56-63. \n163. Diabetes Control and Complications Trial (DCCT)/Epidemiology of Diabetes Interventions and Complications (EDIC)', '19. DeFronzo RA, Bonadonna RC, Ferrannini E. Pathogenesis of NIDDM: A balanced overview. Diabetes \nCare 1992; 15: 318-68. doi: 10.2337/diacare.15.3.318\n20. Gagliardino JJ, Assad D, Gagliardino GG, Kronsbein P, Lahera E, Mercuri N, Rizzuti L, Zufriategui Z. \nCómo tratar mi diabetes. 3rd ed. CENEXA-press, Buenos Aires. ISBN 987-98423-4-0', 'saludable y brinda apoyo social y emocional, que ayuda a mejora la calidad \nde vida de la persona con diabetes (223). Numerosas evidencias, reportadas \nen la literatura, demuestran que las intervenciones educativas en diabetes son \nefectivas y mejoran a corto y mediano plazo el control metabólico (HbA1c, \nlípidos), los factores de riesgo cardiovascular asociados (peso e hipertensión),', 'etapa de la enfermedad (masa funcional restante de células ß).\nEl papel de la nutrición y el enfoque dietético.\nPara la terapia de insulina intensificada, la terapia de insulina convencional \ny una estrategia de insulina solo prandial, de acción corta, ver para la idea \ngeneral en la parte de DT1.\nEn el caso de una estrategia de insulina basal, de acción prolongada, la nutrición', 'La diabetes forma parte de la vida cotidiana de las personas y está repleta de \nsignificados relacionados con su contexto vital real y su historia personal y \nrelacional. Tratarse bien mientras se vive con diabetes requiere cambios de \ncomportamiento, adquirir nuevos hábitos y abandonar los antiguos (1)(2). Todos \nlos estudios demuestran que estos resultados pueden alcanzarse a través de', '50\nExisten pruebas de que el acceso temprano a MCG al inicio del diagnóstico \nen personas con diabetes que requieren insulina, permite un seguimiento más \nestrecho con ajustes más oportunos de dosis y modificaciones en el estilo de \nvida y eliminación de la carga del automonitoreo frecuente (105)(106).\nEs muy importante tener en cuenta que las interrupciones en el MCG se han', '1 Diabetes Have Poor Prognostic Factors. Diabetes Care. mayo de 2018;41(5):1017-24. \n137. Schwarz PEH, Gallein G, Ebermann D, Müller A, Lindner A, Rothe U, et al. Global Diabetes Survey-An annual report on \nquality of diabetes care. Diabetes Research and Clinical Practice. 1 de abril de 2013; 100(1):11-8. Disponible en: http:// http://\nwww.hgp.gob.ec/clay/redcap/surveys/?s=TXJK99T7RK', 'hospitales y asociaciones de diabetes, la educación en salud y en diabetes \ntambién debe ser parte de lo que se aprende en las escuelas, como por ejemplo, \ncon el programa KiDS de la Federación Internacional de Diabetes (IDF) (48)(49).\nConsideraciones finales.\nExisten muchos factores que son obstáculos para el éxito de la ED, pero ya son', 'detected increases (55,74,75). In The\nEnvironmental Determinants of Diabetes\nin the Young (TEDDY) study, type 1 diabe-\ntes developed in 21% of 363 subjects\nwith at least one autoantibody at 3 years\nof age (76). Such testing, coupled with\neducation about diabetes symptoms and\nclose follow-up, has been shown to en-\nable earlier diagnosis and to prevent\nDKA (77,78).', '(36%).\nNumerous clinical studies are being\nconducted to test methods for preventing\nor delaying the onset of stage 3 type 1 di-\nabetes in those with evidence of autoim-\nmunity without symptoms or for delaying\nloss of insulin secretory capacity after on-\nset of stage 3, some with promising re-\nsults (see ClinicalTrials.gov and TrialNet\n.org).\nReferences\n1. Ziegler AG, Rewers M, Simell O, et al.', 'de masa corporal y presión arterial) y metabólicos (HbA1c y dislipidemia) \nde personas con DM tipo 2, y disminuyó un 64% el costo del tratamiento \nmedicamentoso de la hiperglucemia y otros factores de riesgo cardiovascular \nasociados (241). Complementariamente, la implementación de un programa \neducativo de médicos del primer nivel de atención y personas con DM', 'situación de glucemia casi normoglucémica.\nÉnfasis de la dieta en la DT1\nLos medios terapéuticos primarios: En la DT1 el componente terapéutico \nprimario es la insulina para poder sobrevivir.\nEl objetivo terapéutico: La casi-normoglucemia como objetivo terapéutico \nporque previene el desarrollo y la progresión de las complicaciones crónicas', '37\nPREGUNTA 2. ¿Cuáles son los temas claves que el equipo de salud debe \ntratar en la consulta de la persona con diabetes para que mejore su manejo \nmetabólico y prevenga o disminuya las complicaciones?\nSe recomienda un programa de apoyo al autocuidado estandarizado, adaptado \na las necesidades de la región, que tenga como mínimo más de 12 horas', 'younger age at diagnosis, unintentional\nweight loss, ketoacidosis, or short time\nto insulin treatment).E\nImmune-Mediated Diabetes\nAutoimmune type 1 diabetes accounts for\n5–10% of diabetes and is caused by auto-\nimmune destruction of the pancreatic\nb-cells. Autoimmune markers include islet\ncell autoantibodies and autoantibodies to\nglutamic acid decarboxylase (GAD) (such']","La diabetes tipo 1 se desencadena por la destrucción autoinmune de las células beta del páncreas, que son responsables de producir insulina. Esta destrucción puede estar influenciada por factores genéticos y ambientales. Los factores genéticos incluyen ciertos haplotipos específicos, mientras que los factores ambientales aún no están completamente definidos. La presencia de autoanticuerpos específicos, como los autoanticuerpos contra las células islote y la glutamato descarboxilasa (GAD), es un indicador clave de la autoinmunidad que lleva a la diabetes tipo 1.","La causa o desencadenante exacto del inicio de la diabetes tipo 1 aún se desconoce, pero se cree que implica una reacción autoinmune en la que el sistema inmunológico del cuerpo ataca y destruye por error las células beta productoras de insulina en el páncreas. Si bien los factores genéticos aumentan la susceptibilidad, desencadenantes ambientales como infecciones virales o exposición a ciertas toxinas pueden iniciar el proceso autoinmune en individuos genéticamente predispuestos. Sin embargo, a pesar de la investigación en curso, los factores específicos que inician este ataque autoinmune siguen sin estar claros, lo que sugiere una compleja interacción entre factores genéticos y ambientales.",1.0,0.6967546125406167,,1.0,1.0,0.7027388389415157,0.8109553557660629
¿Cuáles son las principales causas de la diabetes tipo 2?,"['comprende y utiliza correctamente los aspectos cruciales para su tipo específico \nde diabetes.\nDiabetes Tipo 2.\nLa DT2 se caracteriza por su desarrollo progresivo que está determinado por el \nritmo individualmente diferente en el curso de la insuficiencia/disfunción de las \ncélulas ß (12)(13)(14). Los pacientes con DT2 presentan diferentes características', '7\nIntroducción.\nLa diabetes mellitus es una de las enfermedades crónicas más frecuentes y graves del \nmundo, es una de las principales causas de muerte, discapacidad y pérdidas económicas, \nque impone altos costos individuales, familiares e institucionales, derivados -sobre \ntodo- de las complicaciones (1)(2), mismas que son prevenibles. Por otro lado, es una', 'paciente y su riesgo cardiovascular (según sus factores de ries-\ngo, la presencia de enfermedad cardiovascular establecida y/o la\npresencia de insuﬁciencia cardíaca crónica). Se considera que\npresentan alto riesgo cardiovascular aquellos adultos con DM2\nque tienen:\nenfermedad cardiovascular ya establecida,\ninsuﬁciencia cardíaca crónica,\nedad de 40 años o más y riesgo por QRISK2 mayor al\n10 %, o', 'Las recomendaciones no se emitirán para ser implementadas en el nivel de \nurgencias.\nUna de las condiciones claves a tener en cuenta en las recomendaciones, fueron \nlos factores de riesgo cardiovascular asociados a los distintos tipos de diabetes y \nsus complicaciones agudas y crónicas.\nLas intervenciones que cubre la guía están orientadas de la siguiente manera:\nIntervención diagnóstica:', 'las familias que tienen un miembro con diabetes o en riesgo de desarrollar \nesta condición.\nAsociada a la adopción de hábitos saludables y al uso racional y oportuno de los \nmedicamentos e insumos, la ED tiende a dirigir a una reducción de la necesidad \nde utilizar los servicios de salud de emergencia y a mejorar los marcadores', 'inflammation, and environmental factors. \nMost common types of diabetes and their risk factors\nRisk factors for type 2 diabetes\n • overweight/obesity\n • physical inactivity\n • age\n • diabetes in first degree relatives\n • history of gestational diabetes \n • cardiovascular disease and its risk factors\n • ethnicity (South Asian, Afro-Caribbean, Hispanic)', 'zados especíﬁcamente para personas con diabetes.\nSe sugiere que las recomendaciones al paciente incluyan ade-\nmás otros aspectos de la modiﬁcación del estilo de vida, como el\naumento de la actividad física y la pérdida de peso. En aquellos\nadultos con diabetes tipo 2 con sobrepeso u obesidad, se debe\ndiscutir y acordar un objetivo inicial de pérdida de peso corporal\nde 5 a 10 %.', 'partes principales:\n• Diabetes de tipo 1 (DT1).\n• Diabetes de tipo 2 (DT2), sobrepeso, recientemente diagnosticada, \nresistente a la insulina.\n• DT2, peso normal, no resistente a la insulina.\n• DT2, tratamiento con insulina.', 'Your health care provider will make changes based on your treatment needs.\nRisk Factors for Type 2 Diabetes? \nScientists do not know the exact cause of type 2 diabetes. However, developing type 2 diabetes has been \nlinked with several risk factors. These include if you: \n• Have a history of hyperglycemia (high blood glucose), such as prediabetes and/or gestational \ndiabetes.', 'causes of diabetes. Most, but not all,\npeople with type 2 diabetes have over-\nweight or obesity. Excess weight itself\ncauses some degree of insulin resistance.\nIndividuals who do not have obesity or\noverweight by traditional weight criteria\nmay have an increased percentage of\nbody fat distributed predominantly in\nthe abdominal region, including sites in-\nvolved in nonalcoholic fatty liver disease', 'mechanisms can lead to a decline in function or the complete destruction of \nbeta-cells. These mechanisms include genetic predisposition and abnormalities, \nepigenetic processes, insulin resistance, auto-immunity, concurrent illnesses, \ninflammation, and environmental factors. \nMost common types of diabetes and their risk factors\nRisk factors for type 2 diabetes\n • overweight/obesity', '• age\n • diabetes in first degree relatives\n • history of gestational diabetes \n • cardiovascular disease and its risk factors\n • ethnicity (South Asian, Afro-Caribbean, Hispanic)\nThe most common type of diabetes mellitus is type 2 diabetes (T2DM). The majority \nof people with T2DM are overweight or obese, which either causes or aggravates \n9\nHEARTS – D  Diagnosis and management of Type 2 diabetes', 'There are various causes of type 2 dia-\nbetes. Although the speciﬁc etiologies\nare not known, autoimmune destruction\nofb-cells does not occur, and individuals\ndo not have any of the other known\ncauses of diabetes. Most, but not all,\npeople with type 2 diabetes have over-\nweight or obesity. Excess weight itself\ncauses some degree of insulin resistance.\nIndividuals who do not have obesity or', 'Associated Comorbidities.”\nType 2 Diabetes\nType 2 diabetes accounts for 90–95% of\nall diabetes. This form encompasses indi-\nviduals who generally have relative (rather\nthan absolute) insulin deﬁciency and have\nperipheral insulin resistance (i.e., decreased\nbiological response to insulin).\nThere are various causes of type 2 dia-\nbetes. Although the speciﬁc etiologies', 'una glucemia casi normal. Los aspectos generales de la “dieta saludable” \npodrían cubrirse posteriormente, siempre que el paciente haya demostrado que \ncomprende y utiliza correctamente los aspectos cruciales para su tipo específico \nde diabetes.\nDiabetes Tipo 2.\nLa DT2 se caracteriza por su desarrollo progresivo que está determinado por el', 'tivity compared to fasting plasma glucose in diagnosing DM.\nTable 1.4. Risk factors for development of Type 2 diabetes mellitus\n. Age /C2145 years\n. Increased body weight (body mass index /C2125 Kg/m2)\n. Family history of Type 2 diabetes\n. Sedentary lifestyle\n. History of gestational diabetes or child birth weighing > 4k g\n. Hypertension (/C21140/90 mmHg)', 'progresión de la pérdida individual de células ß.\nÉnfasis de la dieta en la terapia de las personas con sobrepeso/obesidad \ncon diagnóstico reciente de DT2 y resistencia a la insulina:\nMedios terapéuticos primarios: En estos pacientes el principal componente \nterapéutico es la reducción de peso para reducir la resistencia a la insulina.', 'y las recomendaciones para cada una de las características específicas de \nlos diferentes tipos de diabetes y sus etapas. En consecuencia, siguiendo el \nllamamiento a la individualización terapéutica, este tema se subdivide en cuatro \npartes principales:\n• Diabetes de tipo 1 (DT1).\n• Diabetes de tipo 2 (DT2), sobrepeso, recientemente diagnosticada, \nresistente a la insulina.', '. Family history of Type 2 diabetes\n. Sedentary lifestyle\n. History of gestational diabetes or child birth weighing > 4k g\n. Hypertension (/C21140/90 mmHg)\n. Dyslipidaemia (HDL-cholesterol /C2035 mg/dl [0.9 mmol/L] or/and fasting\ntriglycerides /C21250 mg/dl [2.8 mmol/L])\n. Polycystic ovary syndrome\n. History of impaired fasting glucose or impaired glucose tolerance', 'are risk factors for it.\nYour chances go up if:\n\uf0a7 You are living with overweight or obesity.\n\uf0a7 You have a parent, brother, or sister with diabetes.\n\uf0a7 Your family background is Black, Asian American, Latino/Hispanic, Native American,\nor Pacific Islander.\n\uf0a7 You’re 25 years old or older.\n\uf0a7 You’ve had GDM before or you’ve had a baby who weighed more than nine pounds at birth.', 'increases with age, obesity, and lack of\nphysical activity (93,94). It occurs more\nfrequently in individuals with prediabetes,\nprior gestational diabetes mellitus, or poly-\ncystic ovary syndrome. It is also more com-\nmon in people with hypertension or\ndyslipidemia and in certain racial and eth-\nnic subgroups (e.g., African American, Na-\ntive American, Hispanic/Latino, and Asian', 'linked with several risk factors. These include if you: \n• Have a history of hyperglycemia (high blood glucose), such as prediabetes and/or gestational \ndiabetes.\n• Are 45 years old or older. \n• Are Black or African American, Hispanic or Latino, American Indian or Alaska Native, Asian,  \nor Native Hawaiian or other Pacific Islander. \n• Have a parent, brother, or sister with diabetes.', '(36).\nIn both type 1 and type 2 diabetes, ge-\nnetic and environmental factors can re-\nsult in the progressive loss ofb-cell mass\nand/or function that manifests clinically\nas hyperglycemia. Once hyperglycemia\noccurs, people with all forms of diabetes\nare at risk for developing the same\nchronic complications, although rates of\nprogression may differ. The identiﬁcation', 'or surgical weight loss have led to diabe-\ntes remission (86–92) (see Section 8,\n“Obesity and Weight Management for\nthe Prevention and Treatment of Type 2\nDiabetes”).\nThe risk of developing type 2 diabetes\nincreases with age, obesity, and lack of\nphysical activity (93,94). It occurs more\nfrequently in individuals with prediabetes,\nprior gestational diabetes mellitus, or poly-', '130\nDT2, sobrepeso, recientemente diagnosticado, resistente a la insulina\nEn una persona con sobrepeso y con una DT2 recientemente diagnosticada, \nes común que se manifieste la resistencia a la insulina. A pesar de la \nhiperinsulinemia, la capacidad restante de producción de insulina de las células \nß no es suficiente para alcanzar niveles normoglucémicos (deficiencia relativa', 'Cómo tratar mi diabetes. 3rd ed. CENEXA-press, Buenos Aires. ISBN 987-98423-4-0\n21. Lencioni C, Lupi R, Del Prato S. Beta-cell failure in type 2 diabetes mellitus. Curr Diab Rep 2008; 8: \n179-84. doi: 10.1007/s11892-008-0031-0\n22. The Look AHEAD Research Group (2014) Eight-year weight losses with an intensive lifestyle \nintervention. Obesity (Silver Spring) 22: 5-13', '•    Being overweight and not being active can contribute to      \n      development of type 2 diabetes, but there are also other factors,    \n      such as genetics, that are out of your control. \n•    Eating more than you planned or not being able to exercise can  \n  happen to anyone. You don’t have to be perfect on your diabetes  \n journey.', '19. DeFronzo RA, Bonadonna RC, Ferrannini E. Pathogenesis of NIDDM: A balanced overview. Diabetes \nCare 1992; 15: 318-68. doi: 10.2337/diacare.15.3.318\n20. Gagliardino JJ, Assad D, Gagliardino GG, Kronsbein P, Lahera E, Mercuri N, Rizzuti L, Zufriategui Z. \nCómo tratar mi diabetes. 3rd ed. CENEXA-press, Buenos Aires. ISBN 987-98423-4-0', 'creciente a nivel mundial. Asimismo, como consecuencia de la combinación \nde un diagnóstico tardío, inadecuada calidad de la atención y acceso desigual \na la atención y tratamiento, muchas personas con diabetes no alcanzan los \nobjetivos terapéuticos recomendados, incrementando el riego del desarrollo y \nprogresión de sus complicaciones crónicas (222). Este contexto convierte a la', 'strong genetic predisposition or family his-\ntory inﬁrst-degree relatives (more so than\ntype 1 diabetes). However, the genetics of\ntype 2 diabetes are poorly understood and\nunder intense investigation in this era of\nprecision medicine (52). In adults without\ntraditional risk factors for type 2 diabetes\nand/or of younger age, consider islet auto-\nantibody testing (e.g., GAD autoantibod-', 'en sangre, normalmente con insulina.\nObjetivos de aprendizaje / contenidos de la educación sobre la DT2 (peso \nnormal, no resistente a la insulina):\n1. Entender la importancia de mantenerse dentro del rango de peso normal. –› 2. \nIdentificar y elegir alimentos que contengan CHO de bajo índice glucémico. –› \n3. Elaborar un plan individual de distribución de pequeñas porciones de CHO', 'peso. –› 3. Documentar y explorar sus efectos. –› 4. Elegir el método o métodos \nque mejor coincidan con las preferencias individuales para su aplicación. –› 5. \nMantener el contacto.\nDT2, peso normal, no resistente a la insulina\nEn la mayoría de las personas de peso normal con DT2, la capacidad de producción \nrestante de insulina de las células ß es de sobra y no se observa una resistencia', 'En la mayoría de las personas de peso normal con DT2, la capacidad de producción \nrestante de insulina de las células ß es de sobra y no se observa una resistencia \na la insulina (pronunciada). Una mayor reducción de peso está contraindicada \npor el riesgo de bajo peso y la hemostasia de la glucosa que no puede mejorarse', 'objetivos terapéuticos recomendados, incrementando el riego del desarrollo y \nprogresión de sus complicaciones crónicas (222). Este contexto convierte a la \ndiabetes en un creciente problema de salud pública, constituyendo una pesada \ncarga para los sistemas de salud y la sociedad. Esta carga socioeconómica se \npuede reducir mediante un adecuado control de la glucemia y de los factores', '• Are Black or African American, Hispanic or Latino, American Indian or Alaska Native, Asian,  \nor Native Hawaiian or other Pacific Islander. \n• Have a parent, brother, or sister with diabetes. \n• Are overweight. \n• Are physically inactive. \n• Have high blood pressure or take medication for high blood pressure. \n• Have low HDL cholesterol and/or high triglycerides.', 'que tienen:\nenfermedad cardiovascular ya establecida,\ninsuﬁciencia cardíaca crónica,\nedad de 40 años o más y riesgo por QRISK2 mayor al\n10 %, o\nriesgo elevado para el desarrollo de enfermedad cardio-\nvascular a lo largo de la vida, deﬁnido como la presencia\nde uno o más factores de riesgo cardiovascular (hiperten-\nsión, dislipidemia, tabaquismo, obesidad y antecedente en', 'earlier-onset type 2 diabetes is likely re-\nlated to prolonged lifetime exposure to\nhyperglycemia and other atherogenic risk\nfactors, including insulin resistance, dys-\nlipidemia, hypertension, and chronic in-\nﬂammation. There is a low risk of\nhypoglycemia in youth with type 2 dia-\nbetes, even if they are being treated\nwith insulin (264), and there are high\nrates of complications (224–227). These', '37\nPREGUNTA 2. ¿Cuáles son los temas claves que el equipo de salud debe \ntratar en la consulta de la persona con diabetes para que mejore su manejo \nmetabólico y prevenga o disminuya las complicaciones?\nSe recomienda un programa de apoyo al autocuidado estandarizado, adaptado \na las necesidades de la región, que tenga como mínimo más de 12 horas', 'de la persona, siendo sensible a su voluntad de cambio y los efec-\ntos en su calidad de vida.\nSe aconseja estimular a los adultos con diabetes tipo 2 a seguir\nlos mismos consejos de alimentación saludable que la población\ngeneral, que incluyen: comer fuentes de carbohidratos con alto\ncontenido de ﬁbra y bajo índice glucémico, como frutas, verdu-', 'However, in some populations, such as Asians, beta-cell dysfunction appears to \nbe a more prominent feature than in populations of European descent. This is also \nobserved in thinner people from low- and middle-income countries such as India, \nand among people of Indian descent living in high-income countries. \nRisk factors for type 1 diabetes\n • certain genetic haplotypes', 'complicando el tratamiento de la diabetes (9)(10).\nConducta alimentaria problemática y trastornos alimentarios son más prevalentes \nen la diabetes, particularmente entre las mujeres jóvenes con diabetes tipo 1 \n(11). Los más comunes son el trastorno por atracón y la bulimia nerviosa, a \nmenudo asociada con una disregulación emocional y disturbios de la imagen.', 'Family history of diabetes in a first-degree relativeFamily history of diabetes in a first-degree relative\nFamily history of autoimmune disorderFamily history of autoimmune disorder\nCommon comorbidities (e.g., obesity, OSA, NAFLD)Common comorbidities (e.g., obesity, OSA, NAFLD)\nHigh blood pressure or abnormal lipidsHigh blood pressure or abnormal lipids', 'saludable y brinda apoyo social y emocional, que ayuda a mejora la calidad \nde vida de la persona con diabetes (223). Numerosas evidencias, reportadas \nen la literatura, demuestran que las intervenciones educativas en diabetes son \nefectivas y mejoran a corto y mediano plazo el control metabólico (HbA1c, \nlípidos), los factores de riesgo cardiovascular asociados (peso e hipertensión),', 'de riesgo cardiovascular asociados.\nLa educación de las personas con riesgo de desarrollar diabetes se considera \nun aspecto fundamental de las estrategias de prevención y tratamiento de la \nenfermedad. La educación es un proceso continuo y progresivo, que permite \na la persona comprender y formar parte activa y efectiva de su control y', 'are risk factors for the development of\ntype 2 diabetes, especially if the individ-\nual has other risk factors, such as obesity\nand family history of type 2 diabetes\n(467–469). Elevated depressive symptoms\nand depressive disorders are common\namong people with diabetes (385,459), af-\nfecting approximately one in four people\nwith type 1 or type 2 diabetes (390), and', 'or more risk factors for diabetes.\nMedications\nCertain medications, such as glucocorti-\ncoids, statins (101), proprotein convertase\nsubtilisin/kexin type 9 (PCSK9) inhibitors,\nthiazide diuretics, some HIV medications\n(19), and second-generation antipsychotic\nmedications (102), should be considered\nwhen deciding whether to screen for pre-\ndiabetes or diabetes, as these medica-', '10\nIntervención preventiva:\n• Educación orientada a los factores de riesgo de desarrollo de la diabetes.\n• Educación orientada a la comprensión de aspectos fisiopatológicos de \nla diabetes y su tratamiento para evitar el desarrollo de complicaciones \nagudas y crónicas.\nIntervención terapéutica:\n• Educación orientada a adquirir, desarrollar destrezas y mantener', 'mon in people with hypertension or\ndyslipidemia and in certain racial and eth-\nnic subgroups (e.g., African American, Na-\ntive American, Hispanic/Latino, and Asian\nAmerican). It is often associated with a\nstrong genetic predisposition or family his-\ntory inﬁrst-degree relatives (more so than\ntype 1 diabetes). However, the genetics of\ntype 2 diabetes are poorly understood and', 'and among people of Indian descent living in high-income countries. \nRisk factors for type 1 diabetes\n • certain genetic haplotypes\n • unknown environmental factors\nType 1 diabetes is much less common, the risk being highest in populations of \nEuropean origin. This module is specifically for management of type 2 diabetes, as \ntype 1 is usually not managed in primary care facilities.', 'carga para los sistemas de salud y la sociedad. Esta carga socioeconómica se \npuede reducir mediante un adecuado control de la glucemia y de los factores \nde riesgo cardiovascular asociados.\nLa educación de las personas con riesgo de desarrollar diabetes se considera \nun aspecto fundamental de las estrategias de prevención y tratamiento de la']","La diabetes tipo 2 (DT2) se desarrolla progresivamente y está determinada por la disfunción de las células ß, que producen insulina. Aunque no se conoce la causa exacta, varios factores de riesgo están asociados con su desarrollo:

- Sobrepeso u obesidad
- Inactividad física
- Edad
- Antecedentes familiares de diabetes en parientes de primer grado
- Historia de diabetes gestacional
- Enfermedad cardiovascular y sus factores de riesgo
- Etnicidad (sudasiáticos, afrocaribeños, hispanos)

Estos factores contribuyen a la resistencia a la insulina y, en algunos casos, a la disfunción de las células ß, lo que lleva a niveles elevados de glucosa en sangre.","Las principales causas de la diabetes tipo 2 son la resistencia a la insulina, donde las células del cuerpo se vuelven resistentes a los efectos de la insulina, así como el sobrepeso u obesidad, la falta de actividad física, factores genéticos, síndrome metabólico, envejecimiento y ciertos orígenes étnicos. Sin embargo, los factores de estilo de vida como la obesidad y la inactividad son los principales factores de riesgo modificables que pueden contribuir significativamente al desarrollo de esta condición.",1.0,0.5657328057616579,,1.0,1.0,0.763318945140545,0.7830055102919097
¿Qué aumenta el riesgo de diabetes gestacional durante el embarazo?,"['Las recomendaciones no se emitirán para ser implementadas en el nivel de \nurgencias.\nUna de las condiciones claves a tener en cuenta en las recomendaciones, fueron \nlos factores de riesgo cardiovascular asociados a los distintos tipos de diabetes y \nsus complicaciones agudas y crónicas.\nLas intervenciones que cubre la guía están orientadas de la siguiente manera:\nIntervención diagnóstica:', 'paciente y su riesgo cardiovascular (según sus factores de ries-\ngo, la presencia de enfermedad cardiovascular establecida y/o la\npresencia de insuﬁciencia cardíaca crónica). Se considera que\npresentan alto riesgo cardiovascular aquellos adultos con DM2\nque tienen:\nenfermedad cardiovascular ya establecida,\ninsuﬁciencia cardíaca crónica,\nedad de 40 años o más y riesgo por QRISK2 mayor al\n10 %, o', 'are risk factors for it.\nYour chances go up if:\n\uf0a7 You are living with overweight or obesity.\n\uf0a7 You have a parent, brother, or sister with diabetes.\n\uf0a7 Your family background is Black, Asian American, Latino/Hispanic, Native American,\nor Pacific Islander.\n\uf0a7 You’re 25 years old or older.\n\uf0a7 You’ve had GDM before or you’ve had a baby who weighed more than nine pounds at birth.', 'glucose levels can cause your baby to gain too much weight during the pregnancy.\nWHAT ARE THE RISK FACTORS FOR GESTATIONAL DIABETES? \nYour chance of getting GDM isn’t caused by something you did or didn’t do, but there\nare risk factors for it.\nYour chances go up if:\n\uf0a7 You are living with overweight or obesity.\n\uf0a7 You have a parent, brother, or sister with diabetes.', 'your body can’t make enough insulin to keep up. Without enough insulin, your blood glucose \nrises higher than a healthy range. This is called high blood glucose (hyperglycemia). Higher blood \nglucose levels can cause your baby to gain too much weight during the pregnancy.\nWHAT ARE THE RISK FACTORS FOR GESTATIONAL DIABETES?', 'factors based on the strength of their association with diabetes:\n\x81 Maternal history of diabetes or GDM during the child’s gestation A\n\x81 Family history of type 2 diabetes inﬁrst- or second-degree relativeA\n\x81 Race/ethnicity (Native American, African American, Latino, Asian American, Paciﬁc Islander) A', '. Family history of Type 2 diabetes\n. Sedentary lifestyle\n. History of gestational diabetes or child birth weighing > 4k g\n. Hypertension (/C21140/90 mmHg)\n. Dyslipidaemia (HDL-cholesterol /C2035 mg/dl [0.9 mmol/L] or/and fasting\ntriglycerides /C21250 mg/dl [2.8 mmol/L])\n. Polycystic ovary syndrome\n. History of impaired fasting glucose or impaired glucose tolerance', 'linked with several risk factors. These include if you: \n• Have a history of hyperglycemia (high blood glucose), such as prediabetes and/or gestational \ndiabetes.\n• Are 45 years old or older. \n• Are Black or African American, Hispanic or Latino, American Indian or Alaska Native, Asian,  \nor Native Hawaiian or other Pacific Islander. \n• Have a parent, brother, or sister with diabetes.', 'tivity compared to fasting plasma glucose in diagnosing DM.\nTable 1.4. Risk factors for development of Type 2 diabetes mellitus\n. Age /C2145 years\n. Increased body weight (body mass index /C2125 Kg/m2)\n. Family history of Type 2 diabetes\n. Sedentary lifestyle\n. History of gestational diabetes or child birth weighing > 4k g\n. Hypertension (/C21140/90 mmHg)', 'increases with age, obesity, and lack of\nphysical activity (93,94). It occurs more\nfrequently in individuals with prediabetes,\nprior gestational diabetes mellitus, or poly-\ncystic ovary syndrome. It is also more com-\nmon in people with hypertension or\ndyslipidemia and in certain racial and eth-\nnic subgroups (e.g., African American, Na-\ntive American, Hispanic/Latino, and Asian', 'in women of reproductive age, and there also has\nbeen a dramatic increase in rates of GDM. Diabetes\nconfers an increase maternal and fetal risk. Speciﬁc\nrisks of diabetes in pregnancy include spontaneous\nabortion, fetal anomalies, preeclampsia, fetal demise,\nmacrosomia, neonatal hypoglycemia, hyperbilirubinemia,\nand neonatal respiratory distress syndrome, among others.', 'overweight (body mass index: 27.9 kg/m 2); ii) she has a positive family\nhistory of Type 2 DM (one ﬁrst degree relative with Type 2 DM); and\niii) she most likely had gestational DM in one of her pregnancies\n(a neonate ’s birth weight of > 4 kg is considered to be evidence of\nmacrosomia, most likely due to gestational DM).\nAccording to the recommendations of international scienti ﬁc organi-', '\x81 Family history of type 2 diabetes inﬁrst- or second-degree relativeA\n\x81 Race/ethnicity (Native American, African American, Latino, Asian American, Paciﬁc Islander) A\n\x81 Signs of insulin resistance or conditions associated with insulin resistance (acanthosis nigricans, hypertension, dyslipidemia, polycystic ovary syndrome, or\nsmall-for-gestational-age birth weight) B', '75-g OGTT using thresholds for nonpreg-\nnant individuals).\nIndividuals with a history of GDM\nhave an increased lifetime maternal\nrisk for diabetes estimated at 50–60%\n(133,134), and those with GDM have\na 10-fold increased risk of developing\ntype 2 diabetes compared with those\nwithout GDM (133). Absolute risk of\ndeveloping type 2 diabetes after GDM\nincreases linearly through a person’s', 'or Pacific Islander.\n\uf0a7 You’re 25 years old or older.\n\uf0a7 You’ve had GDM before or you’ve had a baby who weighed more than nine pounds at birth.\n\uf0a7 Your blood glucose levels are higher than normal but not high enough to be diagnosed as\ndiabetes (prediabetes).\ndiabetes.org   |   1-800-DIABETES (800-342-2383)\n10-24', 'following risk factors:\n\x81 First-degree relative with diabetes\n\x81 High-risk race/ethnicity (e.g., African American, Latino, Native American, Asian American, Paciﬁc Islander)\n\x81 History of CVD\n\x81 Hypertension ($140/90 mmHg or on therapy for hypertension)\n\x81 HDL cholesterol level ,35 mg/dL (0.90 mmol/L) and/or a triglyceride level.250 mg/dL (2.82 mmol/L)\n\x81 Women with polycystic ovary syndrome', 'partes principales:\n• Diabetes de tipo 1 (DT1).\n• Diabetes de tipo 2 (DT2), sobrepeso, recientemente diagnosticada, \nresistente a la insulina.\n• DT2, peso normal, no resistente a la insulina.\n• DT2, tratamiento con insulina.', 'inflammation, and environmental factors. \nMost common types of diabetes and their risk factors\nRisk factors for type 2 diabetes\n • overweight/obesity\n • physical inactivity\n • age\n • diabetes in first degree relatives\n • history of gestational diabetes \n • cardiovascular disease and its risk factors\n • ethnicity (South Asian, Afro-Caribbean, Hispanic)', 'and type 2 diabetes increasing in individuals of reproductive age, but there is also a\ndramatic increase in the reported rates of gestational diabetes mellitus (GDM). Diabe-\ntes confers signiﬁcantly greater maternal and fetal risk largely related to the degree of\nhyperglycemia but also related to chronic complications and comorbidities of diabe-', 'GDM is characterized by an increased risk\nof large-for-gestational-age birth weight\nand neonatal and pregnancy complica-\ntions and an increased risk of long-term\nmaternal type 2 diabetes and abnormal\nglucose metabolism of offspring in child-\nhood. These associations with maternal\noral glucose tolerance test (OGTT) results\nare continuous with no clear inﬂection', 'a 10-fold increased risk of developing\ntype 2 diabetes compared with those\nwithout GDM (133). Absolute risk of\ndeveloping type 2 diabetes after GDM\nincreases linearly through a person’s\nlifetime, being approximately 20% at\n10 years, 30% at 20 years, 40% at 30 years,\n5 0 %a t4 0y e a r s ,a n d6 0 %a t5 0y e a r s\n(134). In the prospective Nurses’ Health\nStudy II (NHS II), subsequent diabetes', 'or more additional risk factors for diabetes\n(Table 2.3).B\n2.8 Testing for prediabetes and/or type 2 diabetes\nshould be considered in women planning pregnancy\nVOLUME 38, NUMBER 1, WINTER 2020 11\nAMERICAN DIABETES ASSOCIATION\nDownloaded from http://diabetesjournals.org/clinical/article-pdf/38/1/10/501543/10.pdf by guest on 02 March 2025', 'DIABETES IN PREGNANCY\nThe prevalence of diabetes in pregnancy has been increasing in the U.S. in parallel\nwith the worldwide epidemic of obesity. Not only is the prevalence of type 1 diabetes\nand type 2 diabetes increasing in individuals of reproductive age, but there is also a\ndramatic increase in the reported rates of gestational diabetes mellitus (GDM). Diabe-', 'tes. In general, speciﬁc risks of diabetes in pregnancy include spontaneous abortion,\nfetal anomalies, preeclampsia, fetal demise, macrosomia, neonatal hypoglycemia, neo-\nnatal hyperbilirubinemia, and neonatal respiratory distress syndrome, among others.\nIn addition, diabetes in pregnancy increases the risks of obesity, hypertension, and\ntype 2 diabetes in offspring later in life (1,2).', 'Individuals with GDM may be candidates\nfor aspirin therapy for preeclampsia pre-\nvention if they have a single high risk fac-\ntor, such as chronic hypertension or an\nautoimmune disease, or multiple moder-\nate risk factors, such as being nulliparous,\nhaving obesity, being age$35 years, or\nother factors per the U.S. Preventive\nS e r v i c e sT a s kF o r c e( 1 1 6 ) .M o r es t u d i e s', 'on the strength of their association with diabetes:\n/C15Maternal history of diabetes or GDM during the child’s gestation A\n/C15Family history of type 2 diabetes inﬁrst- or second-degree relativeA\n/C15Race and ethnicity (e.g., Native American, African American, Latino, Asian American,\nPaciﬁc Islander) A\n/C15Signs of insulin resistance or conditions associated with insulin resistance (acanthosis', '2 diabetes right away and you are at a higher risk for developing it later in life.  GDM is a condition \nthat needs to be taken seriously, but you can learn how to manage it, taking steps to have a healthy \npregnancy for you and your baby.\nWHAT CAUSES GESTATIONAL DIABETES?\nWhen you eat (or drink beverages), your body breaks food down into glucose and sends it into the', '• Are Black or African American, Hispanic or Latino, American Indian or Alaska Native, Asian,  \nor Native Hawaiian or other Pacific Islander. \n• Have a parent, brother, or sister with diabetes. \n• Are overweight. \n• Are physically inactive. \n• Have high blood pressure or take medication for high blood pressure. \n• Have low HDL cholesterol and/or high triglycerides.', 'also demonstrated a high risk of new-\nonset retinopathy and progression of ex-\nisting retinopathy in pregnant individuals\nwith type 1 or type 2 diabetes (110,111).\nType 2 Diabetes\nType 2 diabetes is often associated with\nobesity. Recommended weight gain dur-\ning pregnancy for people with overweight\nis 15–25 lb (6.8–11.3 kg) and for those\nwith obesity is 10–20 lb (4.5–9.1 kg)', 'Gestational Diabetes\nWHAT IS GESTATIONAL DIABETES?\nGestational diabetes (GDM) is diabetes that is only present during pregnancy when you did not \nhave diabetes before you became pregnant. After birth, GDM goes away, but you may develop type \n2 diabetes right away and you are at a higher risk for developing it later in life.  GDM is a condition', 'Luengo M, Mart/C19 ınez-Vizca/C19 ıno V. Interpregnancy\nweight change and gestational diabetes mellitus:\na systematic review and meta-analysis. Obesity\n(Silver Spring) 2021;29:454–464\n138. Dennison RA, Chen ES, Green ME, et al. The\nabsolute and relative risk of type 2 diabetes after\ngestational diabetes: a systematic review and\nmeta-analysis of 129 studies. Diabetes Res Clin\nPract 2021;171:108625', 'the most common form of diabetes.\nGestational (jes-TAY-shon-al) \ndiabetes — occurs in some women \nwhen they become pregnant.  It \nraises her future risk of developing \ndiabetes, mostly type 2.  It may raise \nher child’s risk of being overweight \nand developing type 2 diabetes.   \n3', 'nancy weight gain is associated with\nincreased risk of adverse pregnancy out-\ncomes (136) and higher risk of GDM,\nwhile in people with BMI>25 kg/m2,\nweight loss is associated with lower risk\nof developing GDM in the subsequent\npregnancy (137). Development of type 2\ndiabetes is 18% higher per unit of BMI\nincrease from prepregnancy BMI at\nfollow-up, highlighting the importance of', 'carga para los sistemas de salud y la sociedad. Esta carga socioeconómica se \npuede reducir mediante un adecuado control de la glucemia y de los factores \nde riesgo cardiovascular asociados.\nLa educación de las personas con riesgo de desarrollar diabetes se considera \nun aspecto fundamental de las estrategias de prevención y tratamiento de la', 'obesity ($95th percentile) A and who have one or more additional risk factors based\non the strength of their association with diabetes:\n/C15Maternal history of diabetes or GDM during the child’s gestation A\n/C15Family history of type 2 diabetes inﬁrst- or second-degree relativeA', '10\nIntervención preventiva:\n• Educación orientada a los factores de riesgo de desarrollo de la diabetes.\n• Educación orientada a la comprensión de aspectos fisiopatológicos de \nla diabetes y su tratamiento para evitar el desarrollo de complicaciones \nagudas y crónicas.\nIntervención terapéutica:\n• Educación orientada a adquirir, desarrollar destrezas y mantener', 'During pregnancy, your placenta makes a lot of hormones. Some of these hormones block insulin \nfrom moving glucose into the cells. If you have GDM, your body’s insulin can’t keep your blood \nglucose in a healthy range.  This is called insulin resistance.\nTo make up for this “resistance,” your body then makes more insulin. However, if you have GDM,', 'In addition, diabetes in pregnancy increases the risks of obesity, hypertension, and\ntype 2 diabetes in offspring later in life (1,2).\nPreconception Counseling', 'saludable y brinda apoyo social y emocional, que ayuda a mejora la calidad \nde vida de la persona con diabetes (223). Numerosas evidencias, reportadas \nen la literatura, demuestran que las intervenciones educativas en diabetes son \nefectivas y mejoran a corto y mediano plazo el control metabólico (HbA1c, \nlípidos), los factores de riesgo cardiovascular asociados (peso e hipertensión),', 'diagnosed with gestational diabetes?..................\nLess than 40 years (0 points)\n40–49 years (1 point)\n50–59 years (2 points)\n60 years or older (3 points)\n4. Do you have a mother, father, sister or brother\n    with diabetes? ........................................................\n5. Have you ever been diagnosed with high', '37\nPREGUNTA 2. ¿Cuáles son los temas claves que el equipo de salud debe \ntratar en la consulta de la persona con diabetes para que mejore su manejo \nmetabólico y prevenga o disminuya las complicaciones?\nSe recomienda un programa de apoyo al autocuidado estandarizado, adaptado \na las necesidades de la región, que tenga como mínimo más de 12 horas', 'Early abnormal glucose metabolism,\ndeﬁned as a fasting glucose threshold\nof 110 mg/dL (6.1 mmol/L) or an A1C\nof 5.9% (41 mmol/mol), may identify\nindividuals who are at higher risk of\nadverse pregnancy and neonatal out-\ncomes (preeclampsia, macrosomia, shoul-\nder dystocia, and perinatal death), are\nmore likely to need insulin treatment,\nand are at high risk of a later GDM diag-', 'Your health care provider will make changes based on your treatment needs.\nRisk Factors for Type 2 Diabetes? \nScientists do not know the exact cause of type 2 diabetes. However, developing type 2 diabetes has been \nlinked with several risk factors. These include if you: \n• Have a history of hyperglycemia (high blood glucose), such as prediabetes and/or gestational \ndiabetes.', 'capacitar y/o mejorar el autocuidado en las personas con diabetes?\n• ¿Cuáles son los temas claves que el equipo de salud debe tratar en la \nconsulta de la persona con diabetes, para que mejore su manejo metabólico \ny prevenga o disminuyan las complicaciones?\n• ¿Qué variables deben ser tomadas en cuenta, dentro de la evaluación', 'the DPP/DPPOS who were at particularly\nhigh risk of progression to diabetes (crude\nincidence of diabetes 14–22 cases per 100\nperson-years) included BMI$35 kg/m2,\nhigher glucose levels (e.g., fasting plasma\nglucose 110–125 mg/dL [6–6.9 mmol/L],\n2–h postchallenge glucose 173–199 mg/dL\n[9.6–11.0 mmol/L], and A1C $6.0%\n[$42 mmol/mol]), and a history of GDM\n(4,91,92). In contrast, in the community-', 'Los campamentos para niños y jóvenes con DM1 son una excelente instancia \nrecreativa-educativa, que complementa la educación recibida por el equipo \nde salud. El rol de los pares, así como la posibilidad de ajustar la terapia \ndurante situaciones de la vida real, representa una fortaleza que puede ser \nusada para entrenar a los jóvenes con DM1 y los profesionales de la salud que', 'tant factor in reducing the risk of progres-\nsion, with every kilogram of weight loss\nconferring a 16% reduction in risk of pro-\ngression over 3.2 years (12). In individuals\nwith previous history of GDM, the risk of\ntype 2 diabetes increased by 18% for ev-\nery 1 unit BMI above the preconception\nbaseline (76). Several medications evalu-\nated for weight loss (e.g., orlistat, phenter-', '21\nLista de preguntas clave.\nEl comité seleccionó las siguientes preguntas, como componentes que se \ncubrieron en la guía:\n• ¿En qué modelo de atención debería basarse un programa educativo para \ncapacitar y/o mejorar el autocuidado en las personas con diabetes?\n• ¿Cuáles son los temas claves que el equipo de salud debe tratar en la', 'objetivos terapéuticos recomendados, incrementando el riego del desarrollo y \nprogresión de sus complicaciones crónicas (222). Este contexto convierte a la \ndiabetes en un creciente problema de salud pública, constituyendo una pesada \ncarga para los sistemas de salud y la sociedad. Esta carga socioeconómica se \npuede reducir mediante un adecuado control de la glucemia y de los factores', 'disminución en la utilización de los servicios de salud se asocia con peores \nresultados (82), estos hallazgos sugieren que  los jóvenes adultos necesitan un \nsoporte adicional durante la transición. Sin el apoyo adecuado, los adolescentes \nque pasan del sistema de atención pediátrico al de adultos, tienen un mayor \nriesgo de sufrir inadecuados resultados en su salud (83).']","El riesgo de diabetes gestacional durante el embarazo aumenta si:

- Tienes sobrepeso u obesidad.
- Tienes un familiar cercano (padre, hermano, hermana) con diabetes.
- Tienes un historial de diabetes gestacional o has tenido un bebé que pesó más de nueve libras al nacer.
- Eres de ciertos grupos étnicos, como afroamericana, hispana, nativa americana, asiática americana o isleña del Pacífico.
- Tienes 25 años o más.
- Tienes niveles de glucosa en sangre más altos de lo normal, pero no lo suficientemente altos como para ser diagnosticada con diabetes (prediabetes).

Estos factores pueden aumentar tu riesgo de desarrollar diabetes gestacional, pero es importante recordar que la diabetes gestacional puede ser manejada con el cuidado adecuado para asegurar un embarazo saludable.","Varios factores clave aumentan el riesgo de desarrollar diabetes gestacional durante el embarazo, incluyendo tener sobrepeso u obesidad antes del embarazo, antecedentes familiares de diabetes, edad materna avanzada, antecedentes previos de diabetes gestacional, ciertos orígenes étnicos, falta de actividad física y haber tenido previamente un bebé grande. Otros posibles factores de riesgo son el síndrome de ovario poliquístico, la prediabetes y la hipertensión durante el embarazo. El cribado y manejo adecuados son cruciales para reducir los riesgos asociados.",1.0,0.9362964559940204,,1.0,1.0,0.7146606816802543,0.8586427267210179
¿Cómo influyen los factores genéticos en el riesgo de diabetes tipo 2?,"['comprende y utiliza correctamente los aspectos cruciales para su tipo específico \nde diabetes.\nDiabetes Tipo 2.\nLa DT2 se caracteriza por su desarrollo progresivo que está determinado por el \nritmo individualmente diferente en el curso de la insuficiencia/disfunción de las \ncélulas ß (12)(13)(14). Los pacientes con DT2 presentan diferentes características', 'y las recomendaciones para cada una de las características específicas de \nlos diferentes tipos de diabetes y sus etapas. En consecuencia, siguiendo el \nllamamiento a la individualización terapéutica, este tema se subdivide en cuatro \npartes principales:\n• Diabetes de tipo 1 (DT1).\n• Diabetes de tipo 2 (DT2), sobrepeso, recientemente diagnosticada, \nresistente a la insulina.', '8\nde los aspectos en los que no se hubiere alcanzado el desarrollo requerido, para \nconcretar un verdadero apoyo a las personas con diabetes y sus familiares.\nPoblación objetivo.\nLa guía se dirige a personas con diabetes tipo 1, tipo 2, gestacional y otros tipos \nde diabetes, personas con prediabetes y personas con un puntaje de Findrisc', 'strong genetic predisposition or family his-\ntory inﬁrst-degree relatives (more so than\ntype 1 diabetes). However, the genetics of\ntype 2 diabetes are poorly understood and\nunder intense investigation in this era of\nprecision medicine (52). In adults without\ntraditional risk factors for type 2 diabetes\nand/or of younger age, consider islet auto-\nantibody testing (e.g., GAD autoantibod-', 'partes principales:\n• Diabetes de tipo 1 (DT1).\n• Diabetes de tipo 2 (DT2), sobrepeso, recientemente diagnosticada, \nresistente a la insulina.\n• DT2, peso normal, no resistente a la insulina.\n• DT2, tratamiento con insulina.', 'are risk factors for it.\nYour chances go up if:\n\uf0a7 You are living with overweight or obesity.\n\uf0a7 You have a parent, brother, or sister with diabetes.\n\uf0a7 Your family background is Black, Asian American, Latino/Hispanic, Native American,\nor Pacific Islander.\n\uf0a7 You’re 25 years old or older.\n\uf0a7 You’ve had GDM before or you’ve had a baby who weighed more than nine pounds at birth.', 'linked with several risk factors. These include if you: \n• Have a history of hyperglycemia (high blood glucose), such as prediabetes and/or gestational \ndiabetes.\n• Are 45 years old or older. \n• Are Black or African American, Hispanic or Latino, American Indian or Alaska Native, Asian,  \nor Native Hawaiian or other Pacific Islander. \n• Have a parent, brother, or sister with diabetes.', '(36).\nIn both type 1 and type 2 diabetes, ge-\nnetic and environmental factors can re-\nsult in the progressive loss ofb-cell mass\nand/or function that manifests clinically\nas hyperglycemia. Once hyperglycemia\noccurs, people with all forms of diabetes\nare at risk for developing the same\nchronic complications, although rates of\nprogression may differ. The identiﬁcation', 'However, in some populations, such as Asians, beta-cell dysfunction appears to \nbe a more prominent feature than in populations of European descent. This is also \nobserved in thinner people from low- and middle-income countries such as India, \nand among people of Indian descent living in high-income countries. \nRisk factors for type 1 diabetes\n • certain genetic haplotypes', 'mon in people with hypertension or\ndyslipidemia and in certain racial and eth-\nnic subgroups (e.g., African American, Na-\ntive American, Hispanic/Latino, and Asian\nAmerican). It is often associated with a\nstrong genetic predisposition or family his-\ntory inﬁrst-degree relatives (more so than\ntype 1 diabetes). However, the genetics of\ntype 2 diabetes are poorly understood and', 'inflammation, and environmental factors. \nMost common types of diabetes and their risk factors\nRisk factors for type 2 diabetes\n • overweight/obesity\n • physical inactivity\n • age\n • diabetes in first degree relatives\n • history of gestational diabetes \n • cardiovascular disease and its risk factors\n • ethnicity (South Asian, Afro-Caribbean, Hispanic)', 'Your health care provider will make changes based on your treatment needs.\nRisk Factors for Type 2 Diabetes? \nScientists do not know the exact cause of type 2 diabetes. However, developing type 2 diabetes has been \nlinked with several risk factors. These include if you: \n• Have a history of hyperglycemia (high blood glucose), such as prediabetes and/or gestational \ndiabetes.', 'factors based on the strength of their association with diabetes:\n\x81 Maternal history of diabetes or GDM during the child’s gestation A\n\x81 Family history of type 2 diabetes inﬁrst- or second-degree relativeA\n\x81 Race/ethnicity (Native American, African American, Latino, Asian American, Paciﬁc Islander) A', 'una glucemia casi normal. Los aspectos generales de la “dieta saludable” \npodrían cubrirse posteriormente, siempre que el paciente haya demostrado que \ncomprende y utiliza correctamente los aspectos cruciales para su tipo específico \nde diabetes.\nDiabetes Tipo 2.\nLa DT2 se caracteriza por su desarrollo progresivo que está determinado por el', 'mechanisms can lead to a decline in function or the complete destruction of \nbeta-cells. These mechanisms include genetic predisposition and abnormalities, \nepigenetic processes, insulin resistance, auto-immunity, concurrent illnesses, \ninflammation, and environmental factors. \nMost common types of diabetes and their risk factors\nRisk factors for type 2 diabetes\n • overweight/obesity', '. Family history of Type 2 diabetes\n. Sedentary lifestyle\n. History of gestational diabetes or child birth weighing > 4k g\n. Hypertension (/C21140/90 mmHg)\n. Dyslipidaemia (HDL-cholesterol /C2035 mg/dl [0.9 mmol/L] or/and fasting\ntriglycerides /C21250 mg/dl [2.8 mmol/L])\n. Polycystic ovary syndrome\n. History of impaired fasting glucose or impaired glucose tolerance', '\x81 Family history of type 2 diabetes inﬁrst- or second-degree relativeA\n\x81 Race/ethnicity (Native American, African American, Latino, Asian American, Paciﬁc Islander) A\n\x81 Signs of insulin resistance or conditions associated with insulin resistance (acanthosis nigricans, hypertension, dyslipidemia, polycystic ovary syndrome, or\nsmall-for-gestational-age birth weight) B', 'and among people of Indian descent living in high-income countries. \nRisk factors for type 1 diabetes\n • certain genetic haplotypes\n • unknown environmental factors\nType 1 diabetes is much less common, the risk being highest in populations of \nEuropean origin. This module is specifically for management of type 2 diabetes, as \ntype 1 is usually not managed in primary care facilities.', 'En la mayoría de las personas de peso normal con DT2, la capacidad de producción \nrestante de insulina de las células ß es de sobra y no se observa una resistencia \na la insulina (pronunciada). Una mayor reducción de peso está contraindicada \npor el riesgo de bajo peso y la hemostasia de la glucosa que no puede mejorarse', '• Are Black or African American, Hispanic or Latino, American Indian or Alaska Native, Asian,  \nor Native Hawaiian or other Pacific Islander. \n• Have a parent, brother, or sister with diabetes. \n• Are overweight. \n• Are physically inactive. \n• Have high blood pressure or take medication for high blood pressure. \n• Have low HDL cholesterol and/or high triglycerides.', 'ritmo individualmente diferente en el curso de la insuficiencia/disfunción de las \ncélulas ß (12)(13)(14). Los pacientes con DT2 presentan diferentes características \ny estrategias de tratamiento. Por lo tanto, el papel y la importancia de la terapia \nnutricional van desde la “terapia de primera línea” hasta la “baja” para la \npersona individual con DT2.', '• age\n • diabetes in first degree relatives\n • history of gestational diabetes \n • cardiovascular disease and its risk factors\n • ethnicity (South Asian, Afro-Caribbean, Hispanic)\nThe most common type of diabetes mellitus is type 2 diabetes (T2DM). The majority \nof people with T2DM are overweight or obese, which either causes or aggravates \n9\nHEARTS – D  Diagnosis and management of Type 2 diabetes', 'las familias que tienen un miembro con diabetes o en riesgo de desarrollar \nesta condición.\nAsociada a la adopción de hábitos saludables y al uso racional y oportuno de los \nmedicamentos e insumos, la ED tiende a dirigir a una reducción de la necesidad \nde utilizar los servicios de salud de emergencia y a mejorar los marcadores', '19. DeFronzo RA, Bonadonna RC, Ferrannini E. Pathogenesis of NIDDM: A balanced overview. Diabetes \nCare 1992; 15: 318-68. doi: 10.2337/diacare.15.3.318\n20. Gagliardino JJ, Assad D, Gagliardino GG, Kronsbein P, Lahera E, Mercuri N, Rizzuti L, Zufriategui Z. \nCómo tratar mi diabetes. 3rd ed. CENEXA-press, Buenos Aires. ISBN 987-98423-4-0', '130\nDT2, sobrepeso, recientemente diagnosticado, resistente a la insulina\nEn una persona con sobrepeso y con una DT2 recientemente diagnosticada, \nes común que se manifieste la resistencia a la insulina. A pesar de la \nhiperinsulinemia, la capacidad restante de producción de insulina de las células \nß no es suficiente para alcanzar niveles normoglucémicos (deficiencia relativa', 'progresión de la pérdida individual de células ß.\nÉnfasis de la dieta en la terapia de las personas con sobrepeso/obesidad \ncon diagnóstico reciente de DT2 y resistencia a la insulina:\nMedios terapéuticos primarios: En estos pacientes el principal componente \nterapéutico es la reducción de peso para reducir la resistencia a la insulina.', 'en sangre, normalmente con insulina.\nObjetivos de aprendizaje / contenidos de la educación sobre la DT2 (peso \nnormal, no resistente a la insulina):\n1. Entender la importancia de mantenerse dentro del rango de peso normal. –› 2. \nIdentificar y elegir alimentos que contengan CHO de bajo índice glucémico. –› \n3. Elaborar un plan individual de distribución de pequeñas porciones de CHO', 'tivity compared to fasting plasma glucose in diagnosing DM.\nTable 1.4. Risk factors for development of Type 2 diabetes mellitus\n. Age /C2145 years\n. Increased body weight (body mass index /C2125 Kg/m2)\n. Family history of Type 2 diabetes\n. Sedentary lifestyle\n. History of gestational diabetes or child birth weighing > 4k g\n. Hypertension (/C21140/90 mmHg)', 'peso. –› 3. Documentar y explorar sus efectos. –› 4. Elegir el método o métodos \nque mejor coincidan con las preferencias individuales para su aplicación. –› 5. \nMantener el contacto.\nDT2, peso normal, no resistente a la insulina\nEn la mayoría de las personas de peso normal con DT2, la capacidad de producción \nrestante de insulina de las células ß es de sobra y no se observa una resistencia', 'seleccionados para asegurar la transmisión exitosa de lo esencial.\n• Es más probable que se sigan las pocas recomendaciones básicas que una \nserie de abundantes recomendaciones no focalizadas.\nDiabetes Tipo 1.\nEste tipo de diabetes se caracteriza por una falta absoluta de insulina endógena. \nEn el 2021 se celebró el centenario del descubrimiento de la insulina por parte', 'Población objetivo.\nLa guía se dirige a personas con diabetes tipo 1, tipo 2, gestacional y otros tipos \nde diabetes, personas con prediabetes y personas con un puntaje de Findrisc \nalto, con involucramiento del entorno familiar (porque la población pediátrica \ndepende significativamente del conocimiento adquirido por sus tutores legales,', 'tion are less well deﬁn e di nt y p e2d i a b e -\ntes, but deﬁcient b-cell insulin secretion,\nfrequently in the setting of insulin resistance,\nappears to be the common denominator.\nType 2 diabetes is associated with insulin\nsecretory defects related to genetic predis-\nposition, epigenetic changes, inﬂammation,\nand metabolic stress. Future classiﬁcation\nschemes for diabetes will likely focus on', 'paciente y su riesgo cardiovascular (según sus factores de ries-\ngo, la presencia de enfermedad cardiovascular establecida y/o la\npresencia de insuﬁciencia cardíaca crónica). Se considera que\npresentan alto riesgo cardiovascular aquellos adultos con DM2\nque tienen:\nenfermedad cardiovascular ya establecida,\ninsuﬁciencia cardíaca crónica,\nedad de 40 años o más y riesgo por QRISK2 mayor al\n10 %, o', 'Las recomendaciones no se emitirán para ser implementadas en el nivel de \nurgencias.\nUna de las condiciones claves a tener en cuenta en las recomendaciones, fueron \nlos factores de riesgo cardiovascular asociados a los distintos tipos de diabetes y \nsus complicaciones agudas y crónicas.\nLas intervenciones que cubre la guía están orientadas de la siguiente manera:\nIntervención diagnóstica:', 'de la persona, siendo sensible a su voluntad de cambio y los efec-\ntos en su calidad de vida.\nSe aconseja estimular a los adultos con diabetes tipo 2 a seguir\nlos mismos consejos de alimentación saludable que la población\ngeneral, que incluyen: comer fuentes de carbohidratos con alto\ncontenido de ﬁbra y bajo índice glucémico, como frutas, verdu-', 'respecto sea prematura (78).\nUn estudio reciente, realizado en Latinoamérica durante la pandemia de \nCovid-19, sugiere que los niños con diabetes tipo 1 tuvieron un mayor número \nde visitas y realización de A1c con respecto a los que no tuvieron acceso durante \nel periodo de confinamiento (79).\nPREGUNTA 6. ¿Cómo debería ser la transición de personas con diabetes \nen edad pediátrica-adultos?', '•    Being overweight and not being active can contribute to      \n      development of type 2 diabetes, but there are also other factors,    \n      such as genetics, that are out of your control. \n•    Eating more than you planned or not being able to exercise can  \n  happen to anyone. You don’t have to be perfect on your diabetes  \n journey.', 'se encuentran cursando una enfermedad intercurrente, si siguen\nuna dieta muy baja en carbohidratos o cetogénica): de ser así,\nintervenir sobre los factores de riesgo de desarrollo de cetosis\nque sean modiﬁcables, educando al paciente al respecto.\nLos inhibidores de SGLT2 también pueden indicarse luego a lo\nlargo del tratamiento si el paciente progresa a alto riesgo cardio-\nvascular.', 'used in some research studies to identify\nhigh-risk populations. Speciﬁc alleles in\nthese genes can be either predisposing\n(e.g., DRB1*0301-DQB1*0201 [DR3-DQ2]\nand DRB1*0401-DQB1*0302 [DR4-DQ8])\nor protective (e.g., DRB1*1501 and DQA1*\n0102-DQB1*0602). Stage 1 of type 1 diabe-\ntes is deﬁned by the presence of two or', 'efectivas y mejoran a corto y mediano plazo el control metabólico (HbA1c, \nlípidos), los factores de riesgo cardiovascular asociados (peso e hipertensión), \nlos conocimientos sobre la diabetes y la adopción de estilos de vida saludable, \nmejorando así la calidad de vida (224)(225)(226).', 'following risk factors:\n\x81 First-degree relative with diabetes\n\x81 High-risk race/ethnicity (e.g., African American, Latino, Native American, Asian American, Paciﬁc Islander)\n\x81 History of CVD\n\x81 Hypertension ($140/90 mmHg or on therapy for hypertension)\n\x81 HDL cholesterol level ,35 mg/dL (0.90 mmol/L) and/or a triglyceride level.250 mg/dL (2.82 mmol/L)\n\x81 Women with polycystic ovary syndrome', 'Cómo tratar mi diabetes. 3rd ed. CENEXA-press, Buenos Aires. ISBN 987-98423-4-0\n21. Lencioni C, Lupi R, Del Prato S. Beta-cell failure in type 2 diabetes mellitus. Curr Diab Rep 2008; 8: \n179-84. doi: 10.1007/s11892-008-0031-0\n22. The Look AHEAD Research Group (2014) Eight-year weight losses with an intensive lifestyle \nintervention. Obesity (Silver Spring) 22: 5-13', 'vascular a lo largo de la vida, deﬁnido como la presencia\nde uno o más factores de riesgo cardiovascular (hiperten-\nsión, dislipidemia, tabaquismo, obesidad y antecedente en\nun familiar de primer grado de enfermedad cardiovascular\nprematura) en alguien menor de 40 años.\nUna vez realizada la evaluación del riesgo cardiovascular, el algo-', 'recomienda determinar el perfil de la persona con diabetes, teniendo en cuenta \nlas siguientes variables: conocimiento de recomendaciones de comportamientos \nde autocuidado, actitudes hacia la diabetes y las tareas de autocuidado, aspectos \nemocionales (angustia por diabetes y depresión), funcionamiento cognitivo, \ndisposición al cambio, apoyo familiar y alfabetización en salud. Punto de buena', 'saludable y brinda apoyo social y emocional, que ayuda a mejora la calidad \nde vida de la persona con diabetes (223). Numerosas evidencias, reportadas \nen la literatura, demuestran que las intervenciones educativas en diabetes son \nefectivas y mejoran a corto y mediano plazo el control metabólico (HbA1c, \nlípidos), los factores de riesgo cardiovascular asociados (peso e hipertensión),', 'zados especíﬁcamente para personas con diabetes.\nSe sugiere que las recomendaciones al paciente incluyan ade-\nmás otros aspectos de la modiﬁcación del estilo de vida, como el\naumento de la actividad física y la pérdida de peso. En aquellos\nadultos con diabetes tipo 2 con sobrepeso u obesidad, se debe\ndiscutir y acordar un objetivo inicial de pérdida de peso corporal\nde 5 a 10 %.', 'are risk factors for the development of\ntype 2 diabetes, especially if the individ-\nual has other risk factors, such as obesity\nand family history of type 2 diabetes\n(467–469). Elevated depressive symptoms\nand depressive disorders are common\namong people with diabetes (385,459), af-\nfecting approximately one in four people\nwith type 1 or type 2 diabetes (390), and', 'que tienen:\nenfermedad cardiovascular ya establecida,\ninsuﬁciencia cardíaca crónica,\nedad de 40 años o más y riesgo por QRISK2 mayor al\n10 %, o\nriesgo elevado para el desarrollo de enfermedad cardio-\nvascular a lo largo de la vida, deﬁnido como la presencia\nde uno o más factores de riesgo cardiovascular (hiperten-\nsión, dislipidemia, tabaquismo, obesidad y antecedente en', 'de masa corporal y presión arterial) y metabólicos (HbA1c y dislipidemia) \nde personas con DM tipo 2, y disminuyó un 64% el costo del tratamiento \nmedicamentoso de la hiperglucemia y otros factores de riesgo cardiovascular \nasociados (241). Complementariamente, la implementación de un programa \neducativo de médicos del primer nivel de atención y personas con DM', 'a 10-fold increased risk of developing\ntype 2 diabetes compared with those\nwithout GDM (133). Absolute risk of\ndeveloping type 2 diabetes after GDM\nincreases linearly through a person’s\nlifetime, being approximately 20% at\n10 years, 30% at 20 years, 40% at 30 years,\n5 0 %a t4 0y e a r s ,a n d6 0 %a t5 0y e a r s\n(134). In the prospective Nurses’ Health\nStudy II (NHS II), subsequent diabetes']","Los factores genéticos juegan un papel importante en el riesgo de desarrollar diabetes tipo 2. La predisposición genética puede influir en la disfunción de las células ß, que son responsables de producir insulina. Aunque la genética de la diabetes tipo 2 no está completamente comprendida, se sabe que tener un familiar de primer grado con diabetes aumenta significativamente el riesgo de desarrollar la enfermedad. Además, ciertos grupos étnicos, como los afroamericanos, latinos, nativos americanos, asiáticos y habitantes de las islas del Pacífico, tienen un mayor riesgo genético de desarrollar diabetes tipo 2. Es importante tener en cuenta estos factores para la prevención y el manejo adecuado de la enfermedad.","Los factores genéticos desempeñan un papel significativo en la influencia del riesgo de desarrollar diabetes tipo 2. Tener un familiar cercano con la condición aumenta el riesgo debido a variantes genéticas compartidas o mutaciones que pueden afectar la secreción de insulina, promover la resistencia a la insulina, contribuir a la obesidad y afectar la función de las células beta. Si bien una sola variante genética puede aumentar ligeramente el riesgo, portar múltiples variantes de riesgo complica la susceptibilidad general. Sin embargo, estas predisposiciones genéticas interactúan con factores ambientales y de estilo de vida como la obesidad y la inactividad, que pueden desencadenar o agravar los efectos del riesgo genético.",1.0,0.9286177749231287,,0.75,1.0,0.5757635228641951,0.8746961384283034
¿Cuál es la relación entre el peso corporal y la resistencia a la insulina?,"['de insulina). Como la reducción de peso resulta en la reducción o incluso la \nabolición de la resistencia a la insulina, esta es la terapia primaria para estos \npacientes. En condiciones normales de peso corporal, la cantidad de insulina \nnecesaria para lograr una hemostasia normal de la glucosa es baja y puede ser \ncontrolada por la producción de insulina endógena restante, lo que resulta en', 'En la mayoría de las personas de peso normal con DT2, la capacidad de producción \nrestante de insulina de las células ß es de sobra y no se observa una resistencia \na la insulina (pronunciada). Una mayor reducción de peso está contraindicada \npor el riesgo de bajo peso y la hemostasia de la glucosa que no puede mejorarse', 'hiperinsulinemia, la capacidad restante de producción de insulina de las células \nß no es suficiente para alcanzar niveles normoglucémicos (deficiencia relativa \nde insulina). Como la reducción de peso resulta en la reducción o incluso la \nabolición de la resistencia a la insulina, esta es la terapia primaria para estos', 'peso. –› 3. Documentar y explorar sus efectos. –› 4. Elegir el método o métodos \nque mejor coincidan con las preferencias individuales para su aplicación. –› 5. \nMantener el contacto.\nDT2, peso normal, no resistente a la insulina\nEn la mayoría de las personas de peso normal con DT2, la capacidad de producción \nrestante de insulina de las células ß es de sobra y no se observa una resistencia', 'progresión de la pérdida individual de células ß.\nÉnfasis de la dieta en la terapia de las personas con sobrepeso/obesidad \ncon diagnóstico reciente de DT2 y resistencia a la insulina:\nMedios terapéuticos primarios: En estos pacientes el principal componente \nterapéutico es la reducción de peso para reducir la resistencia a la insulina.', 'Medios terapéuticos primarios: En estos pacientes el principal componente \nterapéutico es la reducción de peso para reducir la resistencia a la insulina.\nObjetivo terapéutico: Alcanzar el objetivo terapéutico de glucemia acordado \nmutuamente mediante la mejor reducción posible de la resistencia a la insulina \nexistente.\nEl papel de la nutrición y el enfoque dietético:  La intervención dietética', '(recién diagnosticada, con sobrepeso):\n1. Entender la importancia de la reducción de peso para reducir la resistencia a \nla insulina –› 2. Aprender a saber y experimentar varios métodos de reducción de \npeso. –› 3. Documentar y explorar sus efectos. –› 4. Elegir el método o métodos \nque mejor coincidan con las preferencias individuales para su aplicación. –› 5. \nMantener el contacto.', '130\nDT2, sobrepeso, recientemente diagnosticado, resistente a la insulina\nEn una persona con sobrepeso y con una DT2 recientemente diagnosticada, \nes común que se manifieste la resistencia a la insulina. A pesar de la \nhiperinsulinemia, la capacidad restante de producción de insulina de las células \nß no es suficiente para alcanzar niveles normoglucémicos (deficiencia relativa', 'mutuamente mediante la mejor reducción posible de la resistencia a la insulina \nexistente.\nEl papel de la nutrición y el enfoque dietético:  La intervención dietética \nhipocalórica será según las preferencias individuales y la situación psicosocial', 'a la insulina (pronunciada). Una mayor reducción de peso está contraindicada \npor el riesgo de bajo peso y la hemostasia de la glucosa que no puede mejorarse \npor la pérdida de peso adicional. La remisión eventualmente experimentada de \nla diabetes en los últimos años está a punto de desaparecer como resultado de la \nprogresión del deterioro de las células ß individuales.', 'ensayo clínico piloto aleatorio y controlado de cinco años de duración (7). Los \npacientes seguidos por el Group Care redujeron su peso corporal y mejoraron \nla HbA1c y el colesterol HDL sin aumentar la prescripción de medicamentos. \nNada de lo anterior ocurrió en las personas de control seguidas de la relación \ntradicional proveedor-paciente. El conocimiento de la diabetes y la capacidad de', 'zados especíﬁcamente para personas con diabetes.\nSe sugiere que las recomendaciones al paciente incluyan ade-\nmás otros aspectos de la modiﬁcación del estilo de vida, como el\naumento de la actividad física y la pérdida de peso. En aquellos\nadultos con diabetes tipo 2 con sobrepeso u obesidad, se debe\ndiscutir y acordar un objetivo inicial de pérdida de peso corporal\nde 5 a 10 %.', 'en que cada uno elija sobre la base de experiencias estructuradas y mediadas, \nen vez de seguir un plan determinado según una convicción institucional.\nObjetivos de aprendizaje / contenidos de la educación sobre la diabetes tipo 2 \n(recién diagnosticada, con sobrepeso):\n1. Entender la importancia de la reducción de peso para reducir la resistencia a', 'necesaria para lograr una hemostasia normal de la glucosa es baja y puede ser \ncontrolada por la producción de insulina endógena restante, lo que resulta en \nuna situación metabólica normoglucémica. Los estudios recientes informan de \nuna remisión de la DT2 tras una pérdida de peso sustancial (15), y el objetivo \nterapéutico previsto se puede lograr durante años. No obstante, dicha remisión', 'La diabetes no controlada, genera repercusiones negativas sobre la calidad de \nvida de las personas, entre otras razones, debido a la presencia de sensación \nde enfermedad generalizada, dificultad para controlar el peso corporal, \ndisfunciones sexuales, fluctuaciones en el estado de ánimo y pensamientos \ndistorsionados, siendo las últimas objeto de intervención psicológica, pues se', 'medida que los participantes en el seguimiento de un año lograban reducciones \nde peso bajas (<5%) a importantes (≥15%) (15).\nLos resultados del estudio Look AHEAD demostraron de forma impresionante \nque cuanto mayor era la pérdida de peso inicial, menor era la recuperación de \npeso durante ocho años de seguimiento (16). Como la reducción de peso es fácil', 'insulin resistance. Many of those who are not obese by BMI criteria have a higher \nproportion of body fat distributed predominantly in the abdominal region, indicating \nvisceral adiposity, compared to people without diabetes. \nHowever, in some populations, such as Asians, beta-cell dysfunction appears to \nbe a more prominent feature than in populations of European descent. This is also', 'en sangre, normalmente con insulina.\nObjetivos de aprendizaje / contenidos de la educación sobre la DT2 (peso \nnormal, no resistente a la insulina):\n1. Entender la importancia de mantenerse dentro del rango de peso normal. –› 2. \nIdentificar y elegir alimentos que contengan CHO de bajo índice glucémico. –› \n3. Elaborar un plan individual de distribución de pequeñas porciones de CHO', 'partes principales:\n• Diabetes de tipo 1 (DT1).\n• Diabetes de tipo 2 (DT2), sobrepeso, recientemente diagnosticada, \nresistente a la insulina.\n• DT2, peso normal, no resistente a la insulina.\n• DT2, tratamiento con insulina.', 'creer que la suerte o el destino dirigen su enfermedad y tenían un mayor control \ninterno. No había diferencias en la confianza en los otros. De forma interesante, \nla calificación de las personas internadas se correlacionó con el índice HOMA-\nIR de resistencia a la insulina que, en un estudio de intervención separado, \nse había encontrado que mejoraba en una cohorte más pequeña de personas', '46% de los participantes. Las tasas de remisión estaban relacionadas con la \nmagnitud de la pérdida de peso, aumentando progresivamente del 7% al 86% a \nmedida que los participantes en el seguimiento de un año lograban reducciones \nde peso bajas (<5%) a importantes (≥15%) (15).\nLos resultados del estudio Look AHEAD demostraron de forma impresionante', 'discutir y acordar un objetivo inicial de pérdida de peso corporal\nde 5 a 10 %.\nLa reducción del riesgo de hipoglucemia será un objetivo pri-\nmordial para las personas que usan insulina o un secretagogo de\ninsulina.\nFinalmente, la cirugía bariátrica está indicada para pacientes\ncon un IMC de 35 o más que tengan diabetes tipo 2 de inicio\nreciente (diagnosticada en los 10 años previos).', 'insulina.\nFinalmente, la cirugía bariátrica está indicada para pacientes\ncon un IMC de 35 o más que tengan diabetes tipo 2 de inicio\nreciente (diagnosticada en los 10 años previos).\n4. Diagnóstico y manejo de la hipertensión arterial\nEl diagnóstico, tratamiento y monitoreo de la hipertensión arte-\nrial (HTA) es, en general, el mismo para las personas con dia-', 'adultos con diabetes tipo 2 con sobrepeso u obesidad, se debe\ndiscutir y acordar un objetivo inicial de pérdida de peso corporal\nde 5 a 10 %.\nLa reducción del riesgo de hipoglucemia será un objetivo pri-', 'IR de resistencia a la insulina que, en un estudio de intervención separado, \nse había encontrado que mejoraba en una cohorte más pequeña de personas \nseguidas por Group Care (11).\nRecientemente, en un nuevo estudio clínico controlado y aleatorio de cuatro \naños de duración (ISRCTN14558376), se confirma que un método educativo de', 'the disease course may have insulin levels\nthat appear normal or elevated, yet the\nfailure to normalize blood glucose reﬂects\na relative defect in glucose-stimulated\ninsulin secretion that is insufﬁcient to\ncompensate for insulin resistance. Insu-\nlin resistance may improve with weight', '134\nÉnfasis de la dieta en la terapia de personas de peso normal, no resistentes \na la insulina con DT2:\nMedios terapéuticos primarios: En estos pacientes el componente terapéutico \nprincipal será la medicación/insulina para bajar la glucosa en sangre. Antes de \niniciar la medicación para bajar la glucosa en sangre, una dieta que contenga', '19. DeFronzo RA, Bonadonna RC, Ferrannini E. Pathogenesis of NIDDM: A balanced overview. Diabetes \nCare 1992; 15: 318-68. doi: 10.2337/diacare.15.3.318\n20. Gagliardino JJ, Assad D, Gagliardino GG, Kronsbein P, Lahera E, Mercuri N, Rizzuti L, Zufriategui Z. \nCómo tratar mi diabetes. 3rd ed. CENEXA-press, Buenos Aires. ISBN 987-98423-4-0', 'una remisión de la DT2 tras una pérdida de peso sustancial (15), y el objetivo \nterapéutico previsto se puede lograr durante años. No obstante, dicha remisión \nserá temporal (durará desde unos pocos años hasta décadas) dependiendo de la \nprogresión de la pérdida individual de células ß.\nÉnfasis de la dieta en la terapia de las personas con sobrepeso/obesidad', 'Cómo tratar mi diabetes. 3rd ed. CENEXA-press, Buenos Aires. ISBN 987-98423-4-0\n21. Lencioni C, Lupi R, Del Prato S. Beta-cell failure in type 2 diabetes mellitus. Curr Diab Rep 2008; 8: \n179-84. doi: 10.1007/s11892-008-0031-0\n22. The Look AHEAD Research Group (2014) Eight-year weight losses with an intensive lifestyle \nintervention. Obesity (Silver Spring) 22: 5-13', 'El papel de la nutrición y el enfoque dietético: Igualando la cantidad de ingesta \nde carbohidratos que aumentan la glucosa en sangre (CHO) con la cantidad/\ndosis adecuada de insulina prandial de acción corta (durante las comidas).\nJustificación: En una dieta mixta, solo los alimentos ricos en CHO provocan un \naumento sustancial de la glucosa en sangre. Por lo tanto, es muy importante', 'células ß, es necesario realizar una evaluación periódica de su función para \nasegurarse de que se sigue cumpliendo el objetivo terapéutico con este tipo de \ndieta. La próxima opción terapéutica es la medicación para reducir la glucosa \nen sangre, normalmente con insulina.\nObjetivos de aprendizaje / contenidos de la educación sobre la DT2 (peso \nnormal, no resistente a la insulina):', '(11). Los más comunes son el trastorno por atracón y la bulimia nerviosa, a \nmenudo asociada con una disregulación emocional y disturbios de la imagen. \nPacientes con diabetes tratados con insulina pueden omitir inyecciones con el \nobjetivo de perder peso, lo que se conoce como ‘diabulimia’ con obvio impacto \nsignificativo sobre los riesgos en la salud (12).', 'cuerpo. Numerosas personas con diabetes piensan que el azúcar solo puede \nperjudicar al organismo. Otros piensan que “a la larga, toda esa insulina que \nhe tomado durante años debe acumularse en mi interior”. La lista es sin fin. Las \nconcepciones existen en todas las mentes: se forman involuntariamente y echan \nraíces influidas por las influencias socioculturales. A diferencia de los niños, los', 'estudio, los resultados del ensayo DIRECT se publicaron recientemente. Los \nautores demostraron que, al cabo de un año, la pérdida de peso asociada a la \nintervención sobre el estilo de vida resultó en la remisión de la diabetes en el \n46% de los participantes. Las tasas de remisión estaban relacionadas con la \nmagnitud de la pérdida de peso, aumentando progresivamente del 7% al 86% a', 'la glucosa en sangre postprandial. La idea es que durante un cierto periodo de \ntiempo la secreción de insulina limitada restante sea capaz de metabolizar las \ncomidas pequeñas y de bajo IG, de forma normal o aceptable.', 'a relative defect in glucose-stimulated\ninsulin secretion that is insufﬁcient to\ncompensate for insulin resistance. Insu-\nlin resistance may improve with weight\nreduction, physical activity, and/or phar-\nmacologic treatment of hyperglycemia\nbut is seldom restored to normal. Recent\ninterventions with intensive diet and exer-\ncise, newer pharmacological agents (e.g.,', 'diabetes (who already have, by deﬁni-\ntion, one cardiometabolic risk factor),\nlimitations include the need for better\nvalidation, as cardiometabolic risk factors\nmay carry different weights and thus\nsome may also have lower speciﬁcity as\nsurrogates for insulin resistance (e.g., hy-\npertension). In addition, some people\nmay have insulin resistance and steatosis', '(con respecto a la alimentación y la actividad física) siempre puede ser dominado \neficazmente por una determinada proporción de la cohorte de pacientes. A la \nvista de los que no logran la necesaria modificación del estilo de vida, desde \nhace décadas surgieron enfoques farmacológicos con varios tipos de fármacos \nreductores de peso que desaparecieron ampliamente debido a su fracaso o', 'y la actividad física para maximizar la capacidad de alcanzar y mantener el \nplan de alimentación (2).\nSi un paciente ya está tratado con medicación oral del tipo sulfonilurea o \nglinida, esta medicación debe ser suspendida desde el primer día de la dieta \nhipocalórica para prevenir el riesgo de hipoglucemia.', 'adultos?\n• ¿Cuál es la importancia de la tecnología en la educación en diabetes?\n• ¿Qué impacto psicológico tiene la diabetes, su tratamiento y cómo \ndetectarlo?\n• ¿Son los campamentos recreativos-educativos una estrategia eficaz para \naumentar el empoderamiento del autocuidado de las personas con \ndiabetes?\n• ¿Cuál es el mejor enfoque con base en la evidencia para lograr cambios', 'estimador de efecto reportado en el cuerpo de evidencia.\nFuerza de la recomendación\nFuerte “ 1” Los f actores que i nfluyeron en l a solidez d e la r ecomendación i ncluyeron l a \ncalidad d e la e videncia, l os r esultados p resuntamente importantes para la persona con \ndiabetes y el costo.\nDébil “2” Variabilidad e n valores y preferencias, o  más i ncertidumbre (calidad). La', 'Medios terapéuticos primarios: En estos pacientes, el tratamiento con insulina \npuede ser un componente terapéutico primario o de apoyo, dependiendo de la \netapa de la enfermedad (masa funcional restante de células ß).\nEl papel de la nutrición y el enfoque dietético.\nPara la terapia de insulina intensificada, la terapia de insulina convencional', 'to implicate excess visceral and overall adi-\nposity in people with overweight and obe-\nsity in the pathogenesis of the disease\n(221,222). Obesity in the setting of type 2\ndiabetes worsens insulin resistance and\nsteatohepatitis, promoting the develop-\nment of cirrhosis (223). Therefore, clini-\ncians should enact evidence-based inter-\nventions (as discussed in Section 5,', 'hace décadas surgieron enfoques farmacológicos con varios tipos de fármacos \nreductores de peso que desaparecieron ampliamente debido a su fracaso o \nincluso a su nocividad. Actualmente, se experimenta la promoción de incretinas \no GIP/GLP1-twincretin como los fármacos para la reducción efectiva del peso y \nde la HbA1c. Su impacto seguro, eficaz y sostenible en la vida cotidiana sigue', 'que cuanto mayor era la pérdida de peso inicial, menor era la recuperación de \npeso durante ocho años de seguimiento (16). Como la reducción de peso es fácil \nen comparación con el mantenimiento de un peso reducido, los programas de \nreducción de peso deben estar diseñados para centrarse en la fase de control de \npeso a mediano y largo plazo.', 'una carga emocional y biológica importante para las personas, sus familias y \nentorno, especialmente durante la infancia y adolescencia (160). Se conoce \nque el control metabólico presenta dificultades durante la adolescencia, \nindependientemente de la modalidad de tratamiento (161), lo que determina \nmayor riesgo de complicaciones agudas a corto, mediano y largo plazo (162)', 'con la educación presencial, para promover el empoderamiento para el \nautocuidado de las personas con diabetes?\n• ¿Cómo debería ser la transición de personas con diabetes en edad pediátrica-\nadultos?\n• ¿Cuál es la importancia de la tecnología en la educación en diabetes?\n• ¿Qué impacto psicológico tiene la diabetes, su tratamiento y cómo \ndetectarlo?', 'principal será la medicación/insulina para bajar la glucosa en sangre. Antes de \niniciar la medicación para bajar la glucosa en sangre, una dieta que contenga \nCHO, caracterizada por alimentos de bajo índice glucémico (17) (ver Tab. 3), \ndistribuidos en varias porciones pequeñas de CHO durante el transcurso del día, \npuede ser una opción terapéutica siempre que sea aceptada por el paciente y se', 'cirrhosis. B\nWhile steatohepatitis and cirrhosis occur\nin lean people with diabetes and are be-\nlieved to be linked to genetic predisposi-\ntion, insulin resistance, and environmental\nfactors (218–220), there is ample evidence\nto implicate excess visceral and overall adi-\nposity in people with overweight and obe-\nsity in the pathogenesis of the disease\n(221,222). Obesity in the setting of type 2']","La relación entre el peso corporal y la resistencia a la insulina es significativa. En personas con sobrepeso u obesidad, la resistencia a la insulina es común. La reducción de peso es una terapia primaria para estos pacientes, ya que disminuye o incluso elimina la resistencia a la insulina. Esto es crucial porque, en condiciones normales de peso corporal, la cantidad de insulina necesaria para mantener niveles normales de glucosa es baja y puede ser controlada por la producción de insulina endógena restante.

En personas de peso normal con diabetes tipo 2 (DT2), la capacidad de producción de insulina de las células ß suele ser suficiente y no se observa una resistencia a la insulina pronunciada. Sin embargo, una mayor reducción de peso puede estar contraindicada debido al riesgo de bajo peso y la imposibilidad de mejorar la hemostasia de la glucosa con pérdida de peso adicional.

Por lo tanto, la reducción de peso es una estrategia efectiva para mejorar la resistencia a la insulina en personas con sobrepeso u obesidad, pero debe ser manejada con cuidado en personas de peso normal para evitar complicaciones.","Existe una relación compleja y bidireccional entre el peso corporal y la resistencia a la insulina. El aumento de peso, especialmente la acumulación excesiva de grasa, es un factor importante que contribuye al desarrollo de resistencia a la insulina, donde las células del cuerpo responden menos a la insulina. A su vez, la resistencia a la insulina también puede promover un mayor aumento de peso al dificultar la captación de glucosa y favorecer el almacenamiento de grasa. Este círculo vicioso, impulsado por la obesidad y la resistencia a la insulina que se refuerzan mutuamente, aumenta significativamente el riesgo de desarrollar diabetes tipo 2 y otros trastornos metabólicos. La pérdida de peso mediante dieta y ejercicio ha demostrado mejorar la sensibilidad a la insulina y romper este ciclo.",1.0,0.7754928475416509,,1.0,1.0,0.45167934513410973,0.8389255828500733
¿Cuáles son los principales factores de riesgo para desarrollar diabetes tipo 2?,"['Las recomendaciones no se emitirán para ser implementadas en el nivel de \nurgencias.\nUna de las condiciones claves a tener en cuenta en las recomendaciones, fueron \nlos factores de riesgo cardiovascular asociados a los distintos tipos de diabetes y \nsus complicaciones agudas y crónicas.\nLas intervenciones que cubre la guía están orientadas de la siguiente manera:\nIntervención diagnóstica:', 'paciente y su riesgo cardiovascular (según sus factores de ries-\ngo, la presencia de enfermedad cardiovascular establecida y/o la\npresencia de insuﬁciencia cardíaca crónica). Se considera que\npresentan alto riesgo cardiovascular aquellos adultos con DM2\nque tienen:\nenfermedad cardiovascular ya establecida,\ninsuﬁciencia cardíaca crónica,\nedad de 40 años o más y riesgo por QRISK2 mayor al\n10 %, o', 'carga para los sistemas de salud y la sociedad. Esta carga socioeconómica se \npuede reducir mediante un adecuado control de la glucemia y de los factores \nde riesgo cardiovascular asociados.\nLa educación de las personas con riesgo de desarrollar diabetes se considera \nun aspecto fundamental de las estrategias de prevención y tratamiento de la', '8\nde los aspectos en los que no se hubiere alcanzado el desarrollo requerido, para \nconcretar un verdadero apoyo a las personas con diabetes y sus familiares.\nPoblación objetivo.\nLa guía se dirige a personas con diabetes tipo 1, tipo 2, gestacional y otros tipos \nde diabetes, personas con prediabetes y personas con un puntaje de Findrisc', 'las familias que tienen un miembro con diabetes o en riesgo de desarrollar \nesta condición.\nAsociada a la adopción de hábitos saludables y al uso racional y oportuno de los \nmedicamentos e insumos, la ED tiende a dirigir a una reducción de la necesidad \nde utilizar los servicios de salud de emergencia y a mejorar los marcadores', 'adultos con diabetes tipo 2 con sobrepeso u obesidad, se debe\ndiscutir y acordar un objetivo inicial de pérdida de peso corporal\nde 5 a 10 %.\nLa reducción del riesgo de hipoglucemia será un objetivo pri-', 'de riesgo cardiovascular asociados.\nLa educación de las personas con riesgo de desarrollar diabetes se considera \nun aspecto fundamental de las estrategias de prevención y tratamiento de la \nenfermedad. La educación es un proceso continuo y progresivo, que permite \na la persona comprender y formar parte activa y efectiva de su control y', 'discutir y acordar un objetivo inicial de pérdida de peso corporal\nde 5 a 10 %.\nLa reducción del riesgo de hipoglucemia será un objetivo pri-\nmordial para las personas que usan insulina o un secretagogo de\ninsulina.\nFinalmente, la cirugía bariátrica está indicada para pacientes\ncon un IMC de 35 o más que tengan diabetes tipo 2 de inicio\nreciente (diagnosticada en los 10 años previos).', 'y las recomendaciones para cada una de las características específicas de \nlos diferentes tipos de diabetes y sus etapas. En consecuencia, siguiendo el \nllamamiento a la individualización terapéutica, este tema se subdivide en cuatro \npartes principales:\n• Diabetes de tipo 1 (DT1).\n• Diabetes de tipo 2 (DT2), sobrepeso, recientemente diagnosticada, \nresistente a la insulina.', 'objetivos terapéuticos recomendados, incrementando el riego del desarrollo y \nprogresión de sus complicaciones crónicas (222). Este contexto convierte a la \ndiabetes en un creciente problema de salud pública, constituyendo una pesada \ncarga para los sistemas de salud y la sociedad. Esta carga socioeconómica se \npuede reducir mediante un adecuado control de la glucemia y de los factores', 'partes principales:\n• Diabetes de tipo 1 (DT1).\n• Diabetes de tipo 2 (DT2), sobrepeso, recientemente diagnosticada, \nresistente a la insulina.\n• DT2, peso normal, no resistente a la insulina.\n• DT2, tratamiento con insulina.', 'inflammation, and environmental factors. \nMost common types of diabetes and their risk factors\nRisk factors for type 2 diabetes\n • overweight/obesity\n • physical inactivity\n • age\n • diabetes in first degree relatives\n • history of gestational diabetes \n • cardiovascular disease and its risk factors\n • ethnicity (South Asian, Afro-Caribbean, Hispanic)', '. Family history of Type 2 diabetes\n. Sedentary lifestyle\n. History of gestational diabetes or child birth weighing > 4k g\n. Hypertension (/C21140/90 mmHg)\n. Dyslipidaemia (HDL-cholesterol /C2035 mg/dl [0.9 mmol/L] or/and fasting\ntriglycerides /C21250 mg/dl [2.8 mmol/L])\n. Polycystic ovary syndrome\n. History of impaired fasting glucose or impaired glucose tolerance', 'comprende y utiliza correctamente los aspectos cruciales para su tipo específico \nde diabetes.\nDiabetes Tipo 2.\nLa DT2 se caracteriza por su desarrollo progresivo que está determinado por el \nritmo individualmente diferente en el curso de la insuficiencia/disfunción de las \ncélulas ß (12)(13)(14). Los pacientes con DT2 presentan diferentes características', 'tivity compared to fasting plasma glucose in diagnosing DM.\nTable 1.4. Risk factors for development of Type 2 diabetes mellitus\n. Age /C2145 years\n. Increased body weight (body mass index /C2125 Kg/m2)\n. Family history of Type 2 diabetes\n. Sedentary lifestyle\n. History of gestational diabetes or child birth weighing > 4k g\n. Hypertension (/C21140/90 mmHg)', 'are risk factors for it.\nYour chances go up if:\n\uf0a7 You are living with overweight or obesity.\n\uf0a7 You have a parent, brother, or sister with diabetes.\n\uf0a7 Your family background is Black, Asian American, Latino/Hispanic, Native American,\nor Pacific Islander.\n\uf0a7 You’re 25 years old or older.\n\uf0a7 You’ve had GDM before or you’ve had a baby who weighed more than nine pounds at birth.', 'linked with several risk factors. These include if you: \n• Have a history of hyperglycemia (high blood glucose), such as prediabetes and/or gestational \ndiabetes.\n• Are 45 years old or older. \n• Are Black or African American, Hispanic or Latino, American Indian or Alaska Native, Asian,  \nor Native Hawaiian or other Pacific Islander. \n• Have a parent, brother, or sister with diabetes.', 'Your health care provider will make changes based on your treatment needs.\nRisk Factors for Type 2 Diabetes? \nScientists do not know the exact cause of type 2 diabetes. However, developing type 2 diabetes has been \nlinked with several risk factors. These include if you: \n• Have a history of hyperglycemia (high blood glucose), such as prediabetes and/or gestational \ndiabetes.', 'una glucemia casi normal. Los aspectos generales de la “dieta saludable” \npodrían cubrirse posteriormente, siempre que el paciente haya demostrado que \ncomprende y utiliza correctamente los aspectos cruciales para su tipo específico \nde diabetes.\nDiabetes Tipo 2.\nLa DT2 se caracteriza por su desarrollo progresivo que está determinado por el', 'progresión de la pérdida individual de células ß.\nÉnfasis de la dieta en la terapia de las personas con sobrepeso/obesidad \ncon diagnóstico reciente de DT2 y resistencia a la insulina:\nMedios terapéuticos primarios: En estos pacientes el principal componente \nterapéutico es la reducción de peso para reducir la resistencia a la insulina.', '• age\n • diabetes in first degree relatives\n • history of gestational diabetes \n • cardiovascular disease and its risk factors\n • ethnicity (South Asian, Afro-Caribbean, Hispanic)\nThe most common type of diabetes mellitus is type 2 diabetes (T2DM). The majority \nof people with T2DM are overweight or obese, which either causes or aggravates \n9\nHEARTS – D  Diagnosis and management of Type 2 diabetes', '• Are Black or African American, Hispanic or Latino, American Indian or Alaska Native, Asian,  \nor Native Hawaiian or other Pacific Islander. \n• Have a parent, brother, or sister with diabetes. \n• Are overweight. \n• Are physically inactive. \n• Have high blood pressure or take medication for high blood pressure. \n• Have low HDL cholesterol and/or high triglycerides.', '130\nDT2, sobrepeso, recientemente diagnosticado, resistente a la insulina\nEn una persona con sobrepeso y con una DT2 recientemente diagnosticada, \nes común que se manifieste la resistencia a la insulina. A pesar de la \nhiperinsulinemia, la capacidad restante de producción de insulina de las células \nß no es suficiente para alcanzar niveles normoglucémicos (deficiencia relativa', 'following risk factors:\n\x81 First-degree relative with diabetes\n\x81 High-risk race/ethnicity (e.g., African American, Latino, Native American, Asian American, Paciﬁc Islander)\n\x81 History of CVD\n\x81 Hypertension ($140/90 mmHg or on therapy for hypertension)\n\x81 HDL cholesterol level ,35 mg/dL (0.90 mmol/L) and/or a triglyceride level.250 mg/dL (2.82 mmol/L)\n\x81 Women with polycystic ovary syndrome', 'en sangre, normalmente con insulina.\nObjetivos de aprendizaje / contenidos de la educación sobre la DT2 (peso \nnormal, no resistente a la insulina):\n1. Entender la importancia de mantenerse dentro del rango de peso normal. –› 2. \nIdentificar y elegir alimentos que contengan CHO de bajo índice glucémico. –› \n3. Elaborar un plan individual de distribución de pequeñas porciones de CHO', 'zados especíﬁcamente para personas con diabetes.\nSe sugiere que las recomendaciones al paciente incluyan ade-\nmás otros aspectos de la modiﬁcación del estilo de vida, como el\naumento de la actividad física y la pérdida de peso. En aquellos\nadultos con diabetes tipo 2 con sobrepeso u obesidad, se debe\ndiscutir y acordar un objetivo inicial de pérdida de peso corporal\nde 5 a 10 %.', '\x81 Family history of type 2 diabetes inﬁrst- or second-degree relativeA\n\x81 Race/ethnicity (Native American, African American, Latino, Asian American, Paciﬁc Islander) A\n\x81 Signs of insulin resistance or conditions associated with insulin resistance (acanthosis nigricans, hypertension, dyslipidemia, polycystic ovary syndrome, or\nsmall-for-gestational-age birth weight) B', 'Cómo tratar mi diabetes. 3rd ed. CENEXA-press, Buenos Aires. ISBN 987-98423-4-0\n21. Lencioni C, Lupi R, Del Prato S. Beta-cell failure in type 2 diabetes mellitus. Curr Diab Rep 2008; 8: \n179-84. doi: 10.1007/s11892-008-0031-0\n22. The Look AHEAD Research Group (2014) Eight-year weight losses with an intensive lifestyle \nintervention. Obesity (Silver Spring) 22: 5-13', 'peso. –› 3. Documentar y explorar sus efectos. –› 4. Elegir el método o métodos \nque mejor coincidan con las preferencias individuales para su aplicación. –› 5. \nMantener el contacto.\nDT2, peso normal, no resistente a la insulina\nEn la mayoría de las personas de peso normal con DT2, la capacidad de producción \nrestante de insulina de las células ß es de sobra y no se observa una resistencia', 'de la persona, siendo sensible a su voluntad de cambio y los efec-\ntos en su calidad de vida.\nSe aconseja estimular a los adultos con diabetes tipo 2 a seguir\nlos mismos consejos de alimentación saludable que la población\ngeneral, que incluyen: comer fuentes de carbohidratos con alto\ncontenido de ﬁbra y bajo índice glucémico, como frutas, verdu-', 'En la mayoría de las personas de peso normal con DT2, la capacidad de producción \nrestante de insulina de las células ß es de sobra y no se observa una resistencia \na la insulina (pronunciada). Una mayor reducción de peso está contraindicada \npor el riesgo de bajo peso y la hemostasia de la glucosa que no puede mejorarse', 'factors based on the strength of their association with diabetes:\n\x81 Maternal history of diabetes or GDM during the child’s gestation A\n\x81 Family history of type 2 diabetes inﬁrst- or second-degree relativeA\n\x81 Race/ethnicity (Native American, African American, Latino, Asian American, Paciﬁc Islander) A', 'or surgical weight loss have led to diabe-\ntes remission (86–92) (see Section 8,\n“Obesity and Weight Management for\nthe Prevention and Treatment of Type 2\nDiabetes”).\nThe risk of developing type 2 diabetes\nincreases with age, obesity, and lack of\nphysical activity (93,94). It occurs more\nfrequently in individuals with prediabetes,\nprior gestational diabetes mellitus, or poly-', '(recién diagnosticada, con sobrepeso):\n1. Entender la importancia de la reducción de peso para reducir la resistencia a \nla insulina –› 2. Aprender a saber y experimentar varios métodos de reducción de \npeso. –› 3. Documentar y explorar sus efectos. –› 4. Elegir el método o métodos \nque mejor coincidan con las preferencias individuales para su aplicación. –› 5. \nMantener el contacto.', 'seleccionados para asegurar la transmisión exitosa de lo esencial.\n• Es más probable que se sigan las pocas recomendaciones básicas que una \nserie de abundantes recomendaciones no focalizadas.\nDiabetes Tipo 1.\nEste tipo de diabetes se caracteriza por una falta absoluta de insulina endógena. \nEn el 2021 se celebró el centenario del descubrimiento de la insulina por parte', '•    Being overweight and not being active can contribute to      \n      development of type 2 diabetes, but there are also other factors,    \n      such as genetics, that are out of your control. \n•    Eating more than you planned or not being able to exercise can  \n  happen to anyone. You don’t have to be perfect on your diabetes  \n journey.', 'Población objetivo.\nLa guía se dirige a personas con diabetes tipo 1, tipo 2, gestacional y otros tipos \nde diabetes, personas con prediabetes y personas con un puntaje de Findrisc \nalto, con involucramiento del entorno familiar (porque la población pediátrica \ndepende significativamente del conocimiento adquirido por sus tutores legales,', '10\nIntervención preventiva:\n• Educación orientada a los factores de riesgo de desarrollo de la diabetes.\n• Educación orientada a la comprensión de aspectos fisiopatológicos de \nla diabetes y su tratamiento para evitar el desarrollo de complicaciones \nagudas y crónicas.\nIntervención terapéutica:\n• Educación orientada a adquirir, desarrollar destrezas y mantener', 'creciente a nivel mundial. Asimismo, como consecuencia de la combinación \nde un diagnóstico tardío, inadecuada calidad de la atención y acceso desigual \na la atención y tratamiento, muchas personas con diabetes no alcanzan los \nobjetivos terapéuticos recomendados, incrementando el riego del desarrollo y \nprogresión de sus complicaciones crónicas (222). Este contexto convierte a la', 'manejo adecuado de esta condición. Sin embargo, para que la ED logre sus \nobjetivos, debe ser organizada, estandarizada y puesta a disposición de todas \nlas familias que tienen un miembro con diabetes o en riesgo de desarrollar \nesta condición.\nAsociada a la adopción de hábitos saludables y al uso racional y oportuno de los', 'hiperinsulinemia, la capacidad restante de producción de insulina de las células \nß no es suficiente para alcanzar niveles normoglucémicos (deficiencia relativa \nde insulina). Como la reducción de peso resulta en la reducción o incluso la \nabolición de la resistencia a la insulina, esta es la terapia primaria para estos', 'saludable y brinda apoyo social y emocional, que ayuda a mejora la calidad \nde vida de la persona con diabetes (223). Numerosas evidencias, reportadas \nen la literatura, demuestran que las intervenciones educativas en diabetes son \nefectivas y mejoran a corto y mediano plazo el control metabólico (HbA1c, \nlípidos), los factores de riesgo cardiovascular asociados (peso e hipertensión),', 'Medios terapéuticos primarios: En estos pacientes el principal componente \nterapéutico es la reducción de peso para reducir la resistencia a la insulina.\nObjetivo terapéutico: Alcanzar el objetivo terapéutico de glucemia acordado \nmutuamente mediante la mejor reducción posible de la resistencia a la insulina \nexistente.\nEl papel de la nutrición y el enfoque dietético:  La intervención dietética', 'causes of diabetes. Most, but not all,\npeople with type 2 diabetes have over-\nweight or obesity. Excess weight itself\ncauses some degree of insulin resistance.\nIndividuals who do not have obesity or\noverweight by traditional weight criteria\nmay have an increased percentage of\nbody fat distributed predominantly in\nthe abdominal region, including sites in-\nvolved in nonalcoholic fatty liver disease', '37\nPREGUNTA 2. ¿Cuáles son los temas claves que el equipo de salud debe \ntratar en la consulta de la persona con diabetes para que mejore su manejo \nmetabólico y prevenga o disminuya las complicaciones?\nSe recomienda un programa de apoyo al autocuidado estandarizado, adaptado \na las necesidades de la región, que tenga como mínimo más de 12 horas', 'importancia de la dieta y la lucha contra el sedentarismo para evitar la obesidad, \nasí como para prevenir el inicio de la diabetes y también mostrar el papel de \nestas medidas en el control y el tratamiento de esta enfermedad”. Esta frase fue \ncreada en 1925 por un papá interesado en diabetes y con una gran experiencia \nen la formación de médicos de todo el mundo en el campo de la diabetes', 'capacitar y/o mejorar el autocuidado en las personas con diabetes?\n• ¿Cuáles son los temas claves que el equipo de salud debe tratar en la \nconsulta de la persona con diabetes, para que mejore su manejo metabólico \ny prevenga o disminuyan las complicaciones?\n• ¿Qué variables deben ser tomadas en cuenta, dentro de la evaluación', '19. DeFronzo RA, Bonadonna RC, Ferrannini E. Pathogenesis of NIDDM: A balanced overview. Diabetes \nCare 1992; 15: 318-68. doi: 10.2337/diacare.15.3.318\n20. Gagliardino JJ, Assad D, Gagliardino GG, Kronsbein P, Lahera E, Mercuri N, Rizzuti L, Zufriategui Z. \nCómo tratar mi diabetes. 3rd ed. CENEXA-press, Buenos Aires. ISBN 987-98423-4-0', '21\nLista de preguntas clave.\nEl comité seleccionó las siguientes preguntas, como componentes que se \ncubrieron en la guía:\n• ¿En qué modelo de atención debería basarse un programa educativo para \ncapacitar y/o mejorar el autocuidado en las personas con diabetes?\n• ¿Cuáles son los temas claves que el equipo de salud debe tratar en la', 'Age\nAge is a major risk factor for diabetes.\nTesting should begin at no later than age\n35 years for all people (100). Screening\nshould be considered in adults of any\nage with overweight or obesity and one\nor more risk factors for diabetes.\nMedications\nCertain medications, such as glucocorti-\ncoids, statins (101), proprotein convertase\nsubtilisin/kexin type 9 (PCSK9) inhibitors,']","Los principales factores de riesgo para desarrollar diabetes tipo 2 incluyen:

- Sobrepeso u obesidad
- Inactividad física
- Edad (mayor riesgo a partir de los 45 años)
- Antecedentes familiares de diabetes tipo 2
- Historia de diabetes gestacional
- Enfermedad cardiovascular y sus factores de riesgo
- Etnicidad (especialmente en personas de ascendencia surasiática, afrocaribeña o hispana)
- Hipertensión (presión arterial ≥140/90 mmHg)
- Dislipidemia (HDL-colesterol <35 mg/dL [0.9 mmol/L] o triglicéridos en ayunas ≥250 mg/dL [2.8 mmol/L])
- Síndrome de ovario poliquístico
- Historia de glucemia alterada en ayunas o tolerancia alterada a la glucosa

Estos factores pueden aumentar significativamente el riesgo de desarrollar diabetes tipo 2.","Los principales factores de riesgo para desarrollar diabetes tipo 2 incluyen tener sobrepeso u obesidad, falta de actividad física, antecedentes familiares y genética, aumento de la edad, ciertos orígenes raciales/étnicos, prediabetes y antecedentes de diabetes gestacional. Si bien algunos factores de riesgo como la edad y la genética no se pueden modificar, la obesidad y un estilo de vida inactivo son factores de riesgo modificables que contribuyen significativamente al desarrollo de esta condición. Abordar estos factores mediante el control del peso y el ejercicio regular puede ayudar a reducir el riesgo de diabetes tipo 2.",1.0,0.9999996761047161,,1.0,1.0,0.7228098769167006,0.8912395076668025
¿Cómo influye el sobrepeso en el riesgo de diabetes tipo 2?,"['zados especíﬁcamente para personas con diabetes.\nSe sugiere que las recomendaciones al paciente incluyan ade-\nmás otros aspectos de la modiﬁcación del estilo de vida, como el\naumento de la actividad física y la pérdida de peso. En aquellos\nadultos con diabetes tipo 2 con sobrepeso u obesidad, se debe\ndiscutir y acordar un objetivo inicial de pérdida de peso corporal\nde 5 a 10 %.', 'adultos con diabetes tipo 2 con sobrepeso u obesidad, se debe\ndiscutir y acordar un objetivo inicial de pérdida de peso corporal\nde 5 a 10 %.\nLa reducción del riesgo de hipoglucemia será un objetivo pri-', 'complicando el tratamiento de la diabetes (9)(10).\nConducta alimentaria problemática y trastornos alimentarios son más prevalentes \nen la diabetes, particularmente entre las mujeres jóvenes con diabetes tipo 1 \n(11). Los más comunes son el trastorno por atracón y la bulimia nerviosa, a \nmenudo asociada con una disregulación emocional y disturbios de la imagen.', 'de riesgo cardiovascular asociados.\nLa educación de las personas con riesgo de desarrollar diabetes se considera \nun aspecto fundamental de las estrategias de prevención y tratamiento de la \nenfermedad. La educación es un proceso continuo y progresivo, que permite \na la persona comprender y formar parte activa y efectiva de su control y', '130\nDT2, sobrepeso, recientemente diagnosticado, resistente a la insulina\nEn una persona con sobrepeso y con una DT2 recientemente diagnosticada, \nes común que se manifieste la resistencia a la insulina. A pesar de la \nhiperinsulinemia, la capacidad restante de producción de insulina de las células \nß no es suficiente para alcanzar niveles normoglucémicos (deficiencia relativa', 'partes principales:\n• Diabetes de tipo 1 (DT1).\n• Diabetes de tipo 2 (DT2), sobrepeso, recientemente diagnosticada, \nresistente a la insulina.\n• DT2, peso normal, no resistente a la insulina.\n• DT2, tratamiento con insulina.', 'En la mayoría de las personas de peso normal con DT2, la capacidad de producción \nrestante de insulina de las células ß es de sobra y no se observa una resistencia \na la insulina (pronunciada). Una mayor reducción de peso está contraindicada \npor el riesgo de bajo peso y la hemostasia de la glucosa que no puede mejorarse', 'progresión de la pérdida individual de células ß.\nÉnfasis de la dieta en la terapia de las personas con sobrepeso/obesidad \ncon diagnóstico reciente de DT2 y resistencia a la insulina:\nMedios terapéuticos primarios: En estos pacientes el principal componente \nterapéutico es la reducción de peso para reducir la resistencia a la insulina.', 'or surgical weight loss have led to diabe-\ntes remission (86–92) (see Section 8,\n“Obesity and Weight Management for\nthe Prevention and Treatment of Type 2\nDiabetes”).\nThe risk of developing type 2 diabetes\nincreases with age, obesity, and lack of\nphysical activity (93,94). It occurs more\nfrequently in individuals with prediabetes,\nprior gestational diabetes mellitus, or poly-', 'Obesity is a chronic, often relapsing disease with numerous metabolic, physical, and\npsychosocial complications, including a substantially increased risk for type 2 diabetes\n(1). There is strong and consistent evidence that obesity management can delay the\nprogression from prediabetes to type 2 diabetes (2–6) and is highly beneﬁcial in treat-', 'causes of diabetes. Most, but not all,\npeople with type 2 diabetes have over-\nweight or obesity. Excess weight itself\ncauses some degree of insulin resistance.\nIndividuals who do not have obesity or\noverweight by traditional weight criteria\nmay have an increased percentage of\nbody fat distributed predominantly in\nthe abdominal region, including sites in-\nvolved in nonalcoholic fatty liver disease', 'a la insulina (pronunciada). Una mayor reducción de peso está contraindicada \npor el riesgo de bajo peso y la hemostasia de la glucosa que no puede mejorarse \npor la pérdida de peso adicional. La remisión eventualmente experimentada de \nla diabetes en los últimos años está a punto de desaparecer como resultado de la \nprogresión del deterioro de las células ß individuales.', 'peso. –› 3. Documentar y explorar sus efectos. –› 4. Elegir el método o métodos \nque mejor coincidan con las preferencias individuales para su aplicación. –› 5. \nMantener el contacto.\nDT2, peso normal, no resistente a la insulina\nEn la mayoría de las personas de peso normal con DT2, la capacidad de producción \nrestante de insulina de las células ß es de sobra y no se observa una resistencia', 'en sangre, normalmente con insulina.\nObjetivos de aprendizaje / contenidos de la educación sobre la DT2 (peso \nnormal, no resistente a la insulina):\n1. Entender la importancia de mantenerse dentro del rango de peso normal. –› 2. \nIdentificar y elegir alimentos que contengan CHO de bajo índice glucémico. –› \n3. Elaborar un plan individual de distribución de pequeñas porciones de CHO', 'comprende y utiliza correctamente los aspectos cruciales para su tipo específico \nde diabetes.\nDiabetes Tipo 2.\nLa DT2 se caracteriza por su desarrollo progresivo que está determinado por el \nritmo individualmente diferente en el curso de la insuficiencia/disfunción de las \ncélulas ß (12)(13)(14). Los pacientes con DT2 presentan diferentes características', 'una remisión de la DT2 tras una pérdida de peso sustancial (15), y el objetivo \nterapéutico previsto se puede lograr durante años. No obstante, dicha remisión \nserá temporal (durará desde unos pocos años hasta décadas) dependiendo de la \nprogresión de la pérdida individual de células ß.\nÉnfasis de la dieta en la terapia de las personas con sobrepeso/obesidad', '(recién diagnosticada, con sobrepeso):\n1. Entender la importancia de la reducción de peso para reducir la resistencia a \nla insulina –› 2. Aprender a saber y experimentar varios métodos de reducción de \npeso. –› 3. Documentar y explorar sus efectos. –› 4. Elegir el método o métodos \nque mejor coincidan con las preferencias individuales para su aplicación. –› 5. \nMantener el contacto.', 'una glucemia casi normal. Los aspectos generales de la “dieta saludable” \npodrían cubrirse posteriormente, siempre que el paciente haya demostrado que \ncomprende y utiliza correctamente los aspectos cruciales para su tipo específico \nde diabetes.\nDiabetes Tipo 2.\nLa DT2 se caracteriza por su desarrollo progresivo que está determinado por el', 'estudio, los resultados del ensayo DIRECT se publicaron recientemente. Los \nautores demostraron que, al cabo de un año, la pérdida de peso asociada a la \nintervención sobre el estilo de vida resultó en la remisión de la diabetes en el \n46% de los participantes. Las tasas de remisión estaban relacionadas con la \nmagnitud de la pérdida de peso, aumentando progresivamente del 7% al 86% a', 'discutir y acordar un objetivo inicial de pérdida de peso corporal\nde 5 a 10 %.\nLa reducción del riesgo de hipoglucemia será un objetivo pri-\nmordial para las personas que usan insulina o un secretagogo de\ninsulina.\nFinalmente, la cirugía bariátrica está indicada para pacientes\ncon un IMC de 35 o más que tengan diabetes tipo 2 de inicio\nreciente (diagnosticada en los 10 años previos).', 'Cómo tratar mi diabetes. 3rd ed. CENEXA-press, Buenos Aires. ISBN 987-98423-4-0\n21. Lencioni C, Lupi R, Del Prato S. Beta-cell failure in type 2 diabetes mellitus. Curr Diab Rep 2008; 8: \n179-84. doi: 10.1007/s11892-008-0031-0\n22. The Look AHEAD Research Group (2014) Eight-year weight losses with an intensive lifestyle \nintervention. Obesity (Silver Spring) 22: 5-13', 'tivity compared to fasting plasma glucose in diagnosing DM.\nTable 1.4. Risk factors for development of Type 2 diabetes mellitus\n. Age /C2145 years\n. Increased body weight (body mass index /C2125 Kg/m2)\n. Family history of Type 2 diabetes\n. Sedentary lifestyle\n. History of gestational diabetes or child birth weighing > 4k g\n. Hypertension (/C21140/90 mmHg)', '46% de los participantes. Las tasas de remisión estaban relacionadas con la \nmagnitud de la pérdida de peso, aumentando progresivamente del 7% al 86% a \nmedida que los participantes en el seguimiento de un año lograban reducciones \nde peso bajas (<5%) a importantes (≥15%) (15).\nLos resultados del estudio Look AHEAD demostraron de forma impresionante', 'insulina.\nFinalmente, la cirugía bariátrica está indicada para pacientes\ncon un IMC de 35 o más que tengan diabetes tipo 2 de inicio\nreciente (diagnosticada en los 10 años previos).\n4. Diagnóstico y manejo de la hipertensión arterial\nEl diagnóstico, tratamiento y monitoreo de la hipertensión arte-\nrial (HTA) es, en general, el mismo para las personas con dia-', 'objetivos terapéuticos recomendados, incrementando el riego del desarrollo y \nprogresión de sus complicaciones crónicas (222). Este contexto convierte a la \ndiabetes en un creciente problema de salud pública, constituyendo una pesada \ncarga para los sistemas de salud y la sociedad. Esta carga socioeconómica se \npuede reducir mediante un adecuado control de la glucemia y de los factores', 'and elevated BMI, the crude incidence of\ndiabetes within the placebo group was\n11 cases per 100 person-years, with a cu-\nmulative 3-year incidence of diabetes of\n29% (4). Characteristics of individuals in\nthe DPP/DPPOS who were at particularly\nhigh risk of progression to diabetes (crude\nincidence of diabetes 14–22 cases per 100\nperson-years) included BMI$35 kg/m2,', 'y las recomendaciones para cada una de las características específicas de \nlos diferentes tipos de diabetes y sus etapas. En consecuencia, siguiendo el \nllamamiento a la individualización terapéutica, este tema se subdivide en cuatro \npartes principales:\n• Diabetes de tipo 1 (DT1).\n• Diabetes de tipo 2 (DT2), sobrepeso, recientemente diagnosticada, \nresistente a la insulina.', 'paciente y su riesgo cardiovascular (según sus factores de ries-\ngo, la presencia de enfermedad cardiovascular establecida y/o la\npresencia de insuﬁciencia cardíaca crónica). Se considera que\npresentan alto riesgo cardiovascular aquellos adultos con DM2\nque tienen:\nenfermedad cardiovascular ya establecida,\ninsuﬁciencia cardíaca crónica,\nedad de 40 años o más y riesgo por QRISK2 mayor al\n10 %, o', 'importancia de la dieta y la lucha contra el sedentarismo para evitar la obesidad, \nasí como para prevenir el inicio de la diabetes y también mostrar el papel de \nestas medidas en el control y el tratamiento de esta enfermedad”. Esta frase fue \ncreada en 1925 por un papá interesado en diabetes y con una gran experiencia \nen la formación de médicos de todo el mundo en el campo de la diabetes', 'overweight (body mass index: 27.9 kg/m 2); ii) she has a positive family\nhistory of Type 2 DM (one ﬁrst degree relative with Type 2 DM); and\niii) she most likely had gestational DM in one of her pregnancies\n(a neonate ’s birth weight of > 4 kg is considered to be evidence of\nmacrosomia, most likely due to gestational DM).\nAccording to the recommendations of international scienti ﬁc organi-', 'hiperinsulinemia, la capacidad restante de producción de insulina de las células \nß no es suficiente para alcanzar niveles normoglucémicos (deficiencia relativa \nde insulina). Como la reducción de peso resulta en la reducción o incluso la \nabolición de la resistencia a la insulina, esta es la terapia primaria para estos', '[citado 9 de abril de 2022]. Disponible en: https://diabetesatlas.org/\n2. Afroz A, Alramadan MJ, Hossain MN, Romero L, Alam K, Magliano DJ, et al. Cost-of-illness of type 2 diabetes mellitus in \nlow and lower-middle income countries: a systematic review. BMC Health Serv Res. 17 de diciembre de 2018;18:972.', '(11). Los más comunes son el trastorno por atracón y la bulimia nerviosa, a \nmenudo asociada con una disregulación emocional y disturbios de la imagen. \nPacientes con diabetes tratados con insulina pueden omitir inyecciones con el \nobjetivo de perder peso, lo que se conoce como ‘diabulimia’ con obvio impacto \nsignificativo sobre los riesgos en la salud (12).', 'adultos?\n• ¿Cuál es la importancia de la tecnología en la educación en diabetes?\n• ¿Qué impacto psicológico tiene la diabetes, su tratamiento y cómo \ndetectarlo?\n• ¿Son los campamentos recreativos-educativos una estrategia eficaz para \naumentar el empoderamiento del autocuidado de las personas con \ndiabetes?\n• ¿Cuál es el mejor enfoque con base en la evidencia para lograr cambios', 'adecuadamente, genera complicaciones graves y discapacidades que reducen \nla calidad y cantidad de vida de las personas, elevando los costos de su atención \n(218)(219)(220)(221). La prevalencia de diabetes muestra un incremento \ncreciente a nivel mundial. Asimismo, como consecuencia de la combinación \nde un diagnóstico tardío, inadecuada calidad de la atención y acceso desigual', 'are risk factors for it.\nYour chances go up if:\n\uf0a7 You are living with overweight or obesity.\n\uf0a7 You have a parent, brother, or sister with diabetes.\n\uf0a7 Your family background is Black, Asian American, Latino/Hispanic, Native American,\nor Pacific Islander.\n\uf0a7 You’re 25 years old or older.\n\uf0a7 You’ve had GDM before or you’ve had a baby who weighed more than nine pounds at birth.', 'la observación y el problema deben ser suficientemente atractivos, despertar el \ninterés y ser suficientemente accesibles, es decir, que puedan manejarse.\nEste tipo de estrategia educativa asegura que la transferencia del conocimiento \na la persona sea de manera más efectiva a sus situaciones de la vida real. “La \neducación del paciente es la piedra angular de la terapia”.\nUtilizando el error.', 'de la persona, siendo sensible a su voluntad de cambio y los efec-\ntos en su calidad de vida.\nSe aconseja estimular a los adultos con diabetes tipo 2 a seguir\nlos mismos consejos de alimentación saludable que la población\ngeneral, que incluyen: comer fuentes de carbohidratos con alto\ncontenido de ﬁbra y bajo índice glucémico, como frutas, verdu-', 'y la actividad física para maximizar la capacidad de alcanzar y mantener el \nplan de alimentación (2).\nSi un paciente ya está tratado con medicación oral del tipo sulfonilurea o \nglinida, esta medicación debe ser suspendida desde el primer día de la dieta \nhipocalórica para prevenir el riesgo de hipoglucemia.', 'also demonstrated a high risk of new-\nonset retinopathy and progression of ex-\nisting retinopathy in pregnant individuals\nwith type 1 or type 2 diabetes (110,111).\nType 2 Diabetes\nType 2 diabetes is often associated with\nobesity. Recommended weight gain dur-\ning pregnancy for people with overweight\nis 15–25 lb (6.8–11.3 kg) and for those\nwith obesity is 10–20 lb (4.5–9.1 kg)', 'creciente a nivel mundial. Asimismo, como consecuencia de la combinación \nde un diagnóstico tardío, inadecuada calidad de la atención y acceso desigual \na la atención y tratamiento, muchas personas con diabetes no alcanzan los \nobjetivos terapéuticos recomendados, incrementando el riego del desarrollo y \nprogresión de sus complicaciones crónicas (222). Este contexto convierte a la', 'aumentar el empoderamiento del autocuidado de las personas con \ndiabetes?\n• ¿Cuál es el mejor enfoque con base en la evidencia para lograr cambios \nconductuales en personas con diabetes?', '(1). There is strong and consistent evidence that obesity management can delay the\nprogression from prediabetes to type 2 diabetes (2–6) and is highly beneﬁcial in treat-\ning type 2 diabetes (7–17). In people with type 2 diabetes and overweight or obesity,\nmodest weight loss improves glycemia and reduces the need for glucose-lowering', 'de masa corporal y presión arterial) y metabólicos (HbA1c y dislipidemia) \nde personas con DM tipo 2, y disminuyó un 64% el costo del tratamiento \nmedicamentoso de la hiperglucemia y otros factores de riesgo cardiovascular \nasociados (241). Complementariamente, la implementación de un programa \neducativo de médicos del primer nivel de atención y personas con DM', 'a 10-fold increased risk of developing\ntype 2 diabetes compared with those\nwithout GDM (133). Absolute risk of\ndeveloping type 2 diabetes after GDM\nincreases linearly through a person’s\nlifetime, being approximately 20% at\n10 years, 30% at 20 years, 40% at 30 years,\n5 0 %a t4 0y e a r s ,a n d6 0 %a t5 0y e a r s\n(134). In the prospective Nurses’ Health\nStudy II (NHS II), subsequent diabetes', '7\nIntroducción.\nLa diabetes mellitus es una de las enfermedades crónicas más frecuentes y graves del \nmundo, es una de las principales causas de muerte, discapacidad y pérdidas económicas, \nque impone altos costos individuales, familiares e institucionales, derivados -sobre \ntodo- de las complicaciones (1)(2), mismas que son prevenibles. Por otro lado, es una', 'médico-paciente.\nLa observación de esta relación muestra cómo con frecuencia ambos no piensan \nde forma similar en el enfoque terapéutico. Lo que el paciente tiene que decir \nes más bien subjetivo, mientras que el mensaje del médico es más objetivo. \nCuando se superpone a la subjetividad del paciente, el mensaje médico no', 'type 2 diabetes increased by 18% for ev-\nery 1 unit BMI above the preconception\nbaseline (76). Several medications evalu-\nated for weight loss (e.g., orlistat, phenter-\nmine/topiramate, liraglutide, semaglutide,\nand tirzepatide) have been shown to de-\ncrease the incidence of type 2 diabetes in\nthose with prediabetes (74,77–79).', 'Impacto.\nLa diabetes tiene un profundo impacto en la calidad de vida de los que la \npadecen, incluyendo a la familia, parejas y amigos. En parte debido a las \ndemandas continuas de cuidado diario, y al riesgo de complicaciones agudas \ny crónicas. Alrededor del 30% de personas con diabetes, tanto jóvenes como \nadultos, presentan distrés por diabetes (DD) en algún momento del curso de la', '19. DeFronzo RA, Bonadonna RC, Ferrannini E. Pathogenesis of NIDDM: A balanced overview. Diabetes \nCare 1992; 15: 318-68. doi: 10.2337/diacare.15.3.318\n20. Gagliardino JJ, Assad D, Gagliardino GG, Kronsbein P, Lahera E, Mercuri N, Rizzuti L, Zufriategui Z. \nCómo tratar mi diabetes. 3rd ed. CENEXA-press, Buenos Aires. ISBN 987-98423-4-0']","El sobrepeso y la obesidad son factores de riesgo significativos para el desarrollo de diabetes tipo 2. La obesidad, en particular, está asociada con un aumento en la resistencia a la insulina, lo que puede llevar a una deficiencia relativa de insulina y, en consecuencia, a niveles elevados de glucosa en sangre. En personas con sobrepeso u obesidad, la reducción de peso es una terapia primaria recomendada para mejorar la resistencia a la insulina y, en algunos casos, puede incluso llevar a la remisión de la diabetes.","Tener sobrepeso u obesidad aumenta significativamente el riesgo de desarrollar diabetes tipo 2 mediante mecanismos como la promoción de la resistencia a la insulina, el aumento de factores inflamatorios de las células grasas, la aparición de anomalías metabólicas y la interacción con predisposiciones genéticas. El riesgo aumenta progresivamente con un mayor índice de masa corporal y grado de obesidad. Incluso una pérdida de peso modesta mediante cambios en el estilo de vida puede mejorar la sensibilidad a la insulina y reducir el riesgo en personas con sobrepeso u obesidad. El fuerte vínculo entre el exceso de peso y la diabetes tipo 2 subraya la importancia de mantener un peso corporal saludable.",1.0,0.7075475467583553,,1.0,1.0,0.708021065680333,0.8320842627213321
¿Cuál es la importancia de los antecedentes familiares en el desarrollo de la diabetes tipo 2?,"['comprende y utiliza correctamente los aspectos cruciales para su tipo específico \nde diabetes.\nDiabetes Tipo 2.\nLa DT2 se caracteriza por su desarrollo progresivo que está determinado por el \nritmo individualmente diferente en el curso de la insuficiencia/disfunción de las \ncélulas ß (12)(13)(14). Los pacientes con DT2 presentan diferentes características', 'las familias que tienen un miembro con diabetes o en riesgo de desarrollar \nesta condición.\nAsociada a la adopción de hábitos saludables y al uso racional y oportuno de los \nmedicamentos e insumos, la ED tiende a dirigir a una reducción de la necesidad \nde utilizar los servicios de salud de emergencia y a mejorar los marcadores', '8\nde los aspectos en los que no se hubiere alcanzado el desarrollo requerido, para \nconcretar un verdadero apoyo a las personas con diabetes y sus familiares.\nPoblación objetivo.\nLa guía se dirige a personas con diabetes tipo 1, tipo 2, gestacional y otros tipos \nde diabetes, personas con prediabetes y personas con un puntaje de Findrisc', 'una glucemia casi normal. Los aspectos generales de la “dieta saludable” \npodrían cubrirse posteriormente, siempre que el paciente haya demostrado que \ncomprende y utiliza correctamente los aspectos cruciales para su tipo específico \nde diabetes.\nDiabetes Tipo 2.\nLa DT2 se caracteriza por su desarrollo progresivo que está determinado por el', '2. Educación del paciente\nRecomienda ofrecer -en forma individual y/o grupal- educa-\nción diabetológica a las personas adultas con diabetes tipo 2 y\na sus familiares o cuidadores en el momento del diagnóstico, con\nrefuerzos y revisiones anuales. Se aconseja que estas activida-\ndes educativas procuren el desarrollo de actitudes, conocimien-', 'y las recomendaciones para cada una de las características específicas de \nlos diferentes tipos de diabetes y sus etapas. En consecuencia, siguiendo el \nllamamiento a la individualización terapéutica, este tema se subdivide en cuatro \npartes principales:\n• Diabetes de tipo 1 (DT1).\n• Diabetes de tipo 2 (DT2), sobrepeso, recientemente diagnosticada, \nresistente a la insulina.', 'strong genetic predisposition or family his-\ntory inﬁrst-degree relatives (more so than\ntype 1 diabetes). However, the genetics of\ntype 2 diabetes are poorly understood and\nunder intense investigation in this era of\nprecision medicine (52). In adults without\ntraditional risk factors for type 2 diabetes\nand/or of younger age, consider islet auto-\nantibody testing (e.g., GAD autoantibod-', 'linked with several risk factors. These include if you: \n• Have a history of hyperglycemia (high blood glucose), such as prediabetes and/or gestational \ndiabetes.\n• Are 45 years old or older. \n• Are Black or African American, Hispanic or Latino, American Indian or Alaska Native, Asian,  \nor Native Hawaiian or other Pacific Islander. \n• Have a parent, brother, or sister with diabetes.', '\x81 Family history of type 2 diabetes inﬁrst- or second-degree relativeA\n\x81 Race/ethnicity (Native American, African American, Latino, Asian American, Paciﬁc Islander) A\n\x81 Signs of insulin resistance or conditions associated with insulin resistance (acanthosis nigricans, hypertension, dyslipidemia, polycystic ovary syndrome, or\nsmall-for-gestational-age birth weight) B', 'mon in people with hypertension or\ndyslipidemia and in certain racial and eth-\nnic subgroups (e.g., African American, Na-\ntive American, Hispanic/Latino, and Asian\nAmerican). It is often associated with a\nstrong genetic predisposition or family his-\ntory inﬁrst-degree relatives (more so than\ntype 1 diabetes). However, the genetics of\ntype 2 diabetes are poorly understood and', 'are risk factors for it.\nYour chances go up if:\n\uf0a7 You are living with overweight or obesity.\n\uf0a7 You have a parent, brother, or sister with diabetes.\n\uf0a7 Your family background is Black, Asian American, Latino/Hispanic, Native American,\nor Pacific Islander.\n\uf0a7 You’re 25 years old or older.\n\uf0a7 You’ve had GDM before or you’ve had a baby who weighed more than nine pounds at birth.', 'partes principales:\n• Diabetes de tipo 1 (DT1).\n• Diabetes de tipo 2 (DT2), sobrepeso, recientemente diagnosticada, \nresistente a la insulina.\n• DT2, peso normal, no resistente a la insulina.\n• DT2, tratamiento con insulina.', 'factors based on the strength of their association with diabetes:\n\x81 Maternal history of diabetes or GDM during the child’s gestation A\n\x81 Family history of type 2 diabetes inﬁrst- or second-degree relativeA\n\x81 Race/ethnicity (Native American, African American, Latino, Asian American, Paciﬁc Islander) A', '. Family history of Type 2 diabetes\n. Sedentary lifestyle\n. History of gestational diabetes or child birth weighing > 4k g\n. Hypertension (/C21140/90 mmHg)\n. Dyslipidaemia (HDL-cholesterol /C2035 mg/dl [0.9 mmol/L] or/and fasting\ntriglycerides /C21250 mg/dl [2.8 mmol/L])\n. Polycystic ovary syndrome\n. History of impaired fasting glucose or impaired glucose tolerance', 'Población objetivo.\nLa guía se dirige a personas con diabetes tipo 1, tipo 2, gestacional y otros tipos \nde diabetes, personas con prediabetes y personas con un puntaje de Findrisc \nalto, con involucramiento del entorno familiar (porque la población pediátrica \ndepende significativamente del conocimiento adquirido por sus tutores legales,', 'are risk factors for the development of\ntype 2 diabetes, especially if the individ-\nual has other risk factors, such as obesity\nand family history of type 2 diabetes\n(467–469). Elevated depressive symptoms\nand depressive disorders are common\namong people with diabetes (385,459), af-\nfecting approximately one in four people\nwith type 1 or type 2 diabetes (390), and', '• age\n • diabetes in first degree relatives\n • history of gestational diabetes \n • cardiovascular disease and its risk factors\n • ethnicity (South Asian, Afro-Caribbean, Hispanic)\nThe most common type of diabetes mellitus is type 2 diabetes (T2DM). The majority \nof people with T2DM are overweight or obese, which either causes or aggravates \n9\nHEARTS – D  Diagnosis and management of Type 2 diabetes', 'recomienda determinar el perfil de la persona con diabetes, teniendo en cuenta \nlas siguientes variables: conocimiento de recomendaciones de comportamientos \nde autocuidado, actitudes hacia la diabetes y las tareas de autocuidado, aspectos \nemocionales (angustia por diabetes y depresión), funcionamiento cognitivo, \ndisposición al cambio, apoyo familiar y alfabetización en salud. Punto de buena', 'inflammation, and environmental factors. \nMost common types of diabetes and their risk factors\nRisk factors for type 2 diabetes\n • overweight/obesity\n • physical inactivity\n • age\n • diabetes in first degree relatives\n • history of gestational diabetes \n • cardiovascular disease and its risk factors\n • ethnicity (South Asian, Afro-Caribbean, Hispanic)', 'de aprendizaje y de adherencia al tratamiento, así como la respuesta individual \na la enfermedad (65). En este contexto es muy importante tener en cuenta el \ncriterio de la persona con diabetes y su entorno (69).\nTambién es importante evaluar el entorno en el que la persona con diabetes se \nencuentra, su familia y redes de apoyo, las cuales influirán en forma positiva o', 'Your health care provider will make changes based on your treatment needs.\nRisk Factors for Type 2 Diabetes? \nScientists do not know the exact cause of type 2 diabetes. However, developing type 2 diabetes has been \nlinked with several risk factors. These include if you: \n• Have a history of hyperglycemia (high blood glucose), such as prediabetes and/or gestational \ndiabetes.', 'La diabetes forma parte de la vida cotidiana de las personas y está repleta de \nsignificados relacionados con su contexto vital real y su historia personal y \nrelacional. Tratarse bien mientras se vive con diabetes requiere cambios de \ncomportamiento, adquirir nuevos hábitos y abandonar los antiguos (1)(2). Todos \nlos estudios demuestran que estos resultados pueden alcanzarse a través de', 'following risk factors:\n\x81 First-degree relative with diabetes\n\x81 High-risk race/ethnicity (e.g., African American, Latino, Native American, Asian American, Paciﬁc Islander)\n\x81 History of CVD\n\x81 Hypertension ($140/90 mmHg or on therapy for hypertension)\n\x81 HDL cholesterol level ,35 mg/dL (0.90 mmol/L) and/or a triglyceride level.250 mg/dL (2.82 mmol/L)\n\x81 Women with polycystic ovary syndrome', '• Are Black or African American, Hispanic or Latino, American Indian or Alaska Native, Asian,  \nor Native Hawaiian or other Pacific Islander. \n• Have a parent, brother, or sister with diabetes. \n• Are overweight. \n• Are physically inactive. \n• Have high blood pressure or take medication for high blood pressure. \n• Have low HDL cholesterol and/or high triglycerides.', 'Review of previous treatment plans and responseReview of previous treatment plans and response\nAssess frequency/cause/severity of past hospitalizationsAssess frequency/cause/severity of past hospitalizations\nFamily history of diabetes in a first-degree relativeFamily history of diabetes in a first-degree relative\nFamily history of autoimmune disorderFamily history of autoimmune disorder', 'Family history of diabetes in a first-degree relativeFamily history of diabetes in a first-degree relative\nFamily history of autoimmune disorderFamily history of autoimmune disorder\nCommon comorbidities (e.g., obesity, OSA, NAFLD)Common comorbidities (e.g., obesity, OSA, NAFLD)\nHigh blood pressure or abnormal lipidsHigh blood pressure or abnormal lipids', 'progresión de la pérdida individual de células ß.\nÉnfasis de la dieta en la terapia de las personas con sobrepeso/obesidad \ncon diagnóstico reciente de DT2 y resistencia a la insulina:\nMedios terapéuticos primarios: En estos pacientes el principal componente \nterapéutico es la reducción de peso para reducir la resistencia a la insulina.', 'on the strength of their association with diabetes:\n/C15Maternal history of diabetes or GDM during the child’s gestation A\n/C15Family history of type 2 diabetes inﬁrst- or second-degree relativeA\n/C15Race and ethnicity (e.g., Native American, African American, Latino, Asian American,\nPaciﬁc Islander) A\n/C15Signs of insulin resistance or conditions associated with insulin resistance (acanthosis', 'tivity compared to fasting plasma glucose in diagnosing DM.\nTable 1.4. Risk factors for development of Type 2 diabetes mellitus\n. Age /C2145 years\n. Increased body weight (body mass index /C2125 Kg/m2)\n. Family history of Type 2 diabetes\n. Sedentary lifestyle\n. History of gestational diabetes or child birth weighing > 4k g\n. Hypertension (/C21140/90 mmHg)', 'de riesgo cardiovascular asociados.\nLa educación de las personas con riesgo de desarrollar diabetes se considera \nun aspecto fundamental de las estrategias de prevención y tratamiento de la \nenfermedad. La educación es un proceso continuo y progresivo, que permite \na la persona comprender y formar parte activa y efectiva de su control y', 'importancia de la dieta y la lucha contra el sedentarismo para evitar la obesidad, \nasí como para prevenir el inicio de la diabetes y también mostrar el papel de \nestas medidas en el control y el tratamiento de esta enfermedad”. Esta frase fue \ncreada en 1925 por un papá interesado en diabetes y con una gran experiencia \nen la formación de médicos de todo el mundo en el campo de la diabetes', 'Co-morbilidades psicológicas.\nEstudios epidemiológicos han demostrado que los desórdenes mentales son \nmás prevalentes en personas con diabetes que en la población general (3)(4)\n(5)(6)(7). La depresión es común y está asociada con altos niveles de DD y \nafecta negativamente la calidad de vida de los pacientes, el autocuidado y el', 'However, in some populations, such as Asians, beta-cell dysfunction appears to \nbe a more prominent feature than in populations of European descent. This is also \nobserved in thinner people from low- and middle-income countries such as India, \nand among people of Indian descent living in high-income countries. \nRisk factors for type 1 diabetes\n • certain genetic haplotypes', 'Data Capture (140). Las limitaciones de presupuesto, tiempo y experiencia pueden \nconstituirse en una barrera importante para la implementación de software en la \nasistencia habitual de personas en los servicios de salud, REDCap ofrece una opción \nrentable y accesible para el desarrollo de este tipo de proyectos (141).', 'de la persona, siendo sensible a su voluntad de cambio y los efec-\ntos en su calidad de vida.\nSe aconseja estimular a los adultos con diabetes tipo 2 a seguir\nlos mismos consejos de alimentación saludable que la población\ngeneral, que incluyen: comer fuentes de carbohidratos con alto\ncontenido de ﬁbra y bajo índice glucémico, como frutas, verdu-', '10\nIntervención preventiva:\n• Educación orientada a los factores de riesgo de desarrollo de la diabetes.\n• Educación orientada a la comprensión de aspectos fisiopatológicos de \nla diabetes y su tratamiento para evitar el desarrollo de complicaciones \nagudas y crónicas.\nIntervención terapéutica:\n• Educación orientada a adquirir, desarrollar destrezas y mantener', 'una carga emocional y biológica importante para las personas, sus familias y \nentorno, especialmente durante la infancia y adolescencia (160). Se conoce \nque el control metabólico presenta dificultades durante la adolescencia, \nindependientemente de la modalidad de tratamiento (161), lo que determina \nmayor riesgo de complicaciones agudas a corto, mediano y largo plazo (162)', 'ritmo individualmente diferente en el curso de la insuficiencia/disfunción de las \ncélulas ß (12)(13)(14). Los pacientes con DT2 presentan diferentes características \ny estrategias de tratamiento. Por lo tanto, el papel y la importancia de la terapia \nnutricional van desde la “terapia de primera línea” hasta la “baja” para la \npersona individual con DT2.', 'asistencia habitual de personas en los servicios de salud, REDCap ofrece una opción \nrentable y accesible para el desarrollo de este tipo de proyectos (141).\nExiste evidencia que informa sobre el beneficio de los registros electrónicos en \nsalud vs. los registros en papel (142), con efectos sobre calidad de datos y costos,', 'El cuidado de la enfermedad, está, sobre todo, en manos de la persona con \ndiabetes, por lo tanto, el éxito o el fracaso de cualquier indicación terapéutica, \ndependerá en gran medida, de su nivel de comprensión, motivación, apoyo \nfamiliar, condiciones del entorno y destrezas prácticas para afrontar las \nexigencias del autocuidado diario (65), condicionando de esta manera una', 'a sus familiares o cuidadores en el momento del diagnóstico, con\nrefuerzos y revisiones anuales. Se aconseja que estas activida-\ndes educativas procuren el desarrollo de actitudes, conocimien-\ntos y habilidades para el autocontrol de la diabetes por parte\nde la persona, para lo cual deben estar basadas en evidencia\ny adaptadas a sus necesidades, contar con objetivos especíﬁcos', 'Impacto.\nLa diabetes tiene un profundo impacto en la calidad de vida de los que la \npadecen, incluyendo a la familia, parejas y amigos. En parte debido a las \ndemandas continuas de cuidado diario, y al riesgo de complicaciones agudas \ny crónicas. Alrededor del 30% de personas con diabetes, tanto jóvenes como \nadultos, presentan distrés por diabetes (DD) en algún momento del curso de la', 'respecto sea prematura (78).\nUn estudio reciente, realizado en Latinoamérica durante la pandemia de \nCovid-19, sugiere que los niños con diabetes tipo 1 tuvieron un mayor número \nde visitas y realización de A1c con respecto a los que no tuvieron acceso durante \nel periodo de confinamiento (79).\nPREGUNTA 6. ¿Cómo debería ser la transición de personas con diabetes \nen edad pediátrica-adultos?', 'un familiar de primer grado de enfermedad cardiovascular\nprematura) en alguien menor de 40 años.\nUna vez realizada la evaluación del riesgo cardiovascular, el algo-\nritmo terapéutico continua de la siguiente manera (ver laFigura 1):\nPacientes sin alto riesgo cardiovascular: iniciar tratamiento\ncon metformina.', '(36).\nIn both type 1 and type 2 diabetes, ge-\nnetic and environmental factors can re-\nsult in the progressive loss ofb-cell mass\nand/or function that manifests clinically\nas hyperglycemia. Once hyperglycemia\noccurs, people with all forms of diabetes\nare at risk for developing the same\nchronic complications, although rates of\nprogression may differ. The identiﬁcation', 'paciente y su riesgo cardiovascular (según sus factores de ries-\ngo, la presencia de enfermedad cardiovascular establecida y/o la\npresencia de insuﬁciencia cardíaca crónica). Se considera que\npresentan alto riesgo cardiovascular aquellos adultos con DM2\nque tienen:\nenfermedad cardiovascular ya establecida,\ninsuﬁciencia cardíaca crónica,\nedad de 40 años o más y riesgo por QRISK2 mayor al\n10 %, o', 'debe considerar el proceso de inscripción de los asistentes (selección, \ninformación de contacto, información médica relacionada y no relacionada \na la diabetes, antecedentes del inscrito en campamentos/actividades en \ncaso de tenerlos). Además, se deben generar los protocolos de acción para \nlas acciones médicas, educativas y recreativas. Es aconsejable contar con', 'línea, como una opción beneficiosa para el tratamiento de la prediabetes y \ndiabetes mellitus, sobre todo en personas familiarizadas con esta tecnología. B2\nJustificación\nLa diabetes mellitus es una enfermedad crónica importante que exige el trabajo \nen equipo de varios cuidadores para la prestación de una atención de alta', 'que tienen:\nenfermedad cardiovascular ya establecida,\ninsuﬁciencia cardíaca crónica,\nedad de 40 años o más y riesgo por QRISK2 mayor al\n10 %, o\nriesgo elevado para el desarrollo de enfermedad cardio-\nvascular a lo largo de la vida, deﬁnido como la presencia\nde uno o más factores de riesgo cardiovascular (hiperten-\nsión, dislipidemia, tabaquismo, obesidad y antecedente en', 'make it difﬁcult to sustain healthy lifestyle\nchanges and self-management behaviors\n(41,210–213). Additional risk factors asso-\nciated with type 2 diabetes in youth in-\nclude adiposity, family history of diabetes,\nfemale sex, and low socioeconomic status\n(208).\nAs with type 1 diabetes, youth with\ntype 2 diabetes spend much of the day in\nschool. Therefore, close communication']","Los antecedentes familiares son un factor de riesgo significativo para el desarrollo de la diabetes tipo 2. Tener un familiar de primer grado (padre, hermano o hijo) con diabetes tipo 2 aumenta considerablemente el riesgo de desarrollar la enfermedad. Esto se debe a una combinación de factores genéticos y ambientales que se comparten dentro de las familias. La predisposición genética, aunque no completamente comprendida, juega un papel crucial en la susceptibilidad a la diabetes tipo 2. Además, los hábitos de vida y el entorno familiar, como la dieta y el nivel de actividad física, también influyen en el riesgo de desarrollar la enfermedad. Por lo tanto, es importante que las personas con antecedentes familiares de diabetes tipo 2 estén conscientes de su mayor riesgo y adopten medidas preventivas, como mantener un estilo de vida saludable y realizar chequeos médicos regulares.","Los antecedentes familiares desempeñan un papel importante en el desarrollo de la diabetes tipo 2 a través de una combinación de susceptibilidad genética y factores ambientales/estilo de vida compartidos dentro de las familias. Tener un familiar de primer grado con diabetes tipo 2 se considera un factor de riesgo importante, ya que las personas con antecedentes familiares positivos tienden a mostrar mayor resistencia a la insulina, alteraciones en el metabolismo de la glucosa y otras anomalías metabólicas incluso antes de desarrollar diabetes. Si bien los antecedentes familiares aumentan la percepción de riesgo, los cambios sostenidos en el estilo de vida son cruciales para la prevención. Reconocer este riesgo puede ayudar a identificar a personas de alto riesgo para intervenciones tempranas y modificaciones del estilo de vida.",0.9166666666666666,0.9178674530412315,,1.0,1.0,0.7696861056395881,0.9358872797012097
¿Cómo se relaciona la diabetes gestacional con la diabetes tipo 2?,"['a 10-fold increased risk of developing\ntype 2 diabetes compared with those\nwithout GDM (133). Absolute risk of\ndeveloping type 2 diabetes after GDM\nincreases linearly through a person’s\nlifetime, being approximately 20% at\n10 years, 30% at 20 years, 40% at 30 years,\n5 0 %a t4 0y e a r s ,a n d6 0 %a t5 0y e a r s\n(134). In the prospective Nurses’ Health\nStudy II (NHS II), subsequent diabetes', '75-g OGTT using thresholds for nonpreg-\nnant individuals).\nIndividuals with a history of GDM\nhave an increased lifetime maternal\nrisk for diabetes estimated at 50–60%\n(133,134), and those with GDM have\na 10-fold increased risk of developing\ntype 2 diabetes compared with those\nwithout GDM (133). Absolute risk of\ndeveloping type 2 diabetes after GDM\nincreases linearly through a person’s', 'diabetes in women with a known history of\ngestational diabetes: systematic review and\nmeta-analysis. BMJ 2020;369:m1361\n134. Li Z, Cheng Y , Wang D, et al. Incidence rate\nof type 2 diabetes mellitus after gestational\ndiabetes mellitus: a systematic review and meta-\nanalysis of 170,139 women. J Diabetes Res 2020;\n2020:3076463\n135. Tobias DK, Hu FB, Chavarro J, Rosner B,', 'after their pregnancies, individuals who\nwould have been diagnosed with GDM by\nthe one-step approach, as compared with\nthose without GDM, were at 3.4-fold\nhigher risk of developing prediabetes and\ntype 2 diabetes and had children with a\nhigher risk of obesity and increased body\nfat, suggesting that the larger group of in-\ndividuals identiﬁed as having GDM by the', 'GDM is characterized by an increased risk\nof large-for-gestational-age birth weight\nand neonatal and pregnancy complica-\ntions and an increased risk of long-term\nmaternal type 2 diabetes and abnormal\nglucose metabolism of offspring in child-\nhood. These associations with maternal\noral glucose tolerance test (OGTT) results\nare continuous with no clear inﬂection', 'of developing GDM in the subsequent\npregnancy (137). Development of type 2\ndiabetes is 18% higher per unit of BMI\nincrease from prepregnancy BMI at\nfollow-up, highlighting the importance of\neffective weight management after GDM\n(138). In addition, postdelivery lifestyle in-\nterventions are effective in reducing risk of\ntype 2 diabetes (139).\nBoth metformin and intensive life-', 'overweight (body mass index: 27.9 kg/m 2); ii) she has a positive family\nhistory of Type 2 DM (one ﬁrst degree relative with Type 2 DM); and\niii) she most likely had gestational DM in one of her pregnancies\n(a neonate ’s birth weight of > 4 kg is considered to be evidence of\nmacrosomia, most likely due to gestational DM).\nAccording to the recommendations of international scienti ﬁc organi-', 'factors based on the strength of their association with diabetes:\n\x81 Maternal history of diabetes or GDM during the child’s gestation A\n\x81 Family history of type 2 diabetes inﬁrst- or second-degree relativeA\n\x81 Race/ethnicity (Native American, African American, Latino, Asian American, Paciﬁc Islander) A', 'References\n1. Dabelea D, Hanson RL, Lindsay RS, et al.\nIntrauterine exposure to diabetes conveys risks\nfor type 2 diabetes and obesity: a study of\ndiscordant sibships. Diabetes 2000;49:2208–2211\n2. Holmes VA, Young IS, Patterson CC, et al.;\nDiabetes and Pre-eclampsia Intervention Trial Study\nGroup. Optimal glycemic control, pre-eclampsia,', 'Luengo M, Mart/C19 ınez-Vizca/C19 ıno V. Interpregnancy\nweight change and gestational diabetes mellitus:\na systematic review and meta-analysis. Obesity\n(Silver Spring) 2021;29:454–464\n138. Dennison RA, Chen ES, Green ME, et al. The\nabsolute and relative risk of type 2 diabetes after\ngestational diabetes: a systematic review and\nmeta-analysis of 129 studies. Diabetes Res Clin\nPract 2021;171:108625', '10 years, 30% at 20 years, 40% at 30 years,\n5 0 %a t4 0y e a r s ,a n d6 0 %a t5 0y e a r s\n(134). In the prospective Nurses’ Health\nStudy II (NHS II), subsequent diabetes\nrisk after a history of GDM was signiﬁ-\ncantly lower in those who followed\nhealthy eating patterns (135). Adjusting\nfor BMI attenuated this association mod-\nerately, but not completely. Interpreg-', 'are risk factors for it.\nYour chances go up if:\n\uf0a7 You are living with overweight or obesity.\n\uf0a7 You have a parent, brother, or sister with diabetes.\n\uf0a7 Your family background is Black, Asian American, Latino/Hispanic, Native American,\nor Pacific Islander.\n\uf0a7 You’re 25 years old or older.\n\uf0a7 You’ve had GDM before or you’ve had a baby who weighed more than nine pounds at birth.', 'type 2 diabetes and had children with a\nhigher risk of obesity and increased body\nfat, suggesting that the larger group of in-\ndividuals identiﬁed as having GDM by the\none-step approach would beneﬁtf r o m\nthe increased screening for diabetes and\nprediabetes after pregnancy (210). The\nADA recommends the IADPSG diagnos-\ntic criteria with the intent of optimizing\ngestational outcomes, because these', 'tivity compared to fasting plasma glucose in diagnosing DM.\nTable 1.4. Risk factors for development of Type 2 diabetes mellitus\n. Age /C2145 years\n. Increased body weight (body mass index /C2125 Kg/m2)\n. Family history of Type 2 diabetes\n. Sedentary lifestyle\n. History of gestational diabetes or child birth weighing > 4k g\n. Hypertension (/C21140/90 mmHg)', '. Family history of Type 2 diabetes\n. Sedentary lifestyle\n. History of gestational diabetes or child birth weighing > 4k g\n. Hypertension (/C21140/90 mmHg)\n. Dyslipidaemia (HDL-cholesterol /C2035 mg/dl [0.9 mmol/L] or/and fasting\ntriglycerides /C21250 mg/dl [2.8 mmol/L])\n. Polycystic ovary syndrome\n. History of impaired fasting glucose or impaired glucose tolerance', '“medicalize” pregnancies previously cate-\ngorized as normal. A follow-up study of\nindividuals participating in a study of\npregnancy OGTTs with glucose levels\nblinded to caregivers found that 11 years\nafter their pregnancies, individuals who\nwould have been diagnosed with GDM by\nthe one-step approach, as compared with\nthose without GDM, were at 3.4-fold\nhigher risk of developing prediabetes and', 'ATLANTIC-DIP Investigators. Abnormal glucose\ntolerance post-gestational diabetes mellitus as\ndeﬁned by the International Association of Dia-\nbetes and Pregnancy Study Groups criteria. Eur J\nE\nndocrinol 2016;175:287–297\n202. Kim C, Newton KM, Knopp RH. Gestational\ndiabetes and the incidence of type 2 diabetes: a', 'diabetes mellitus: a systematic review and meta-\nanalysis of 170,139 women. J Diabetes Res 2020;\n2020:3076463\n135. Tobias DK, Hu FB, Chavarro J, Rosner B,\nMozaffarian D, Zhang C. Healthful dietary\npatterns and type 2 diabetes mellitus risk among\nwomen with a history of gestational diabetes\nmellitus. Arch Intern Med 2012;172:1566–1572\n136. Villamor E, Cnattingius S. Interpregnancy', 'partes principales:\n• Diabetes de tipo 1 (DT1).\n• Diabetes de tipo 2 (DT2), sobrepeso, recientemente diagnosticada, \nresistente a la insulina.\n• DT2, peso normal, no resistente a la insulina.\n• DT2, tratamiento con insulina.', '\x81 Family history of type 2 diabetes inﬁrst- or second-degree relativeA\n\x81 Race/ethnicity (Native American, African American, Latino, Asian American, Paciﬁc Islander) A\n\x81 Signs of insulin resistance or conditions associated with insulin resistance (acanthosis nigricans, hypertension, dyslipidemia, polycystic ovary syndrome, or\nsmall-for-gestational-age birth weight) B', 'diabetes, maturity-onset diabetes of the\nyoung, or even developing type 1 diabe-\ntes, individuals with GDM should be\ntested for persistent diabetes or predia-\nbetes at 4–12 weeks postpartum with a\nfasting 75-g OGTT using nonpregnancy\ncriteria as outlined in Section 2,“Diagnosis\nand Classiﬁcation of Diabetes,” speciﬁcally\nTables 2.1 and 2.2. The OGTT is recom-', 'glucose, impaired glucose tolerance, and\ntype 2 diabetes (131,132).\nIndividuals with a history of GDM should\nhave ongoing screening for prediabetes or\ntype 2 diabetes every 1–3y e a r s ,e v e ni f\nthe results of the initial 4–12 week post-\npartum 75-g OGTT are normal. Ongoing\nevaluation may be performed with any rec-\nommended glycemic test (e.g., annual A1C,', 'pregnancy affects her offspring ’sr i s k\nfor obesity, diabetes, and other meta-\nbolic disorders (219,220). Additional\nwell-designed clinical studies are needed\nto determine the optimal intensity of\nmonitoring and treatment of individuals\nwith GDM diagnosed by the one-step\nstrategy.\nTwo-Step Strategy\nIn 2013, the NIH convened a consensus\ndevelopment conference to consider', 'absolute and relative risk of type 2 diabetes after\ngestational diabetes: a systematic review and\nmeta-analysis of 129 studies. Diabetes Res Clin\nPract 2021;171:108625\n139. Li N, Yang Y , Cui D, et al. Effects of lifestyle\nintervention on long-term risk of diabetes in\nwomen with prior gestational diabetes: a\nsystematic review and meta-analysis of randomized', 'glucose levels can cause your baby to gain too much weight during the pregnancy.\nWHAT ARE THE RISK FACTORS FOR GESTATIONAL DIABETES? \nYour chance of getting GDM isn’t caused by something you did or didn’t do, but there\nare risk factors for it.\nYour chances go up if:\n\uf0a7 You are living with overweight or obesity.\n\uf0a7 You have a parent, brother, or sister with diabetes.', 'betes and Pregnancy Study Groups criteria. Eur J\nE\nndocrinol 2016;175:287–297\n202. Kim C, Newton KM, Knopp RH. Gestational\ndiabetes and the incidence of type 2 diabetes: a\nsystematic review. Diabetes Care 2002;25:1862–\n1868\n203. Ratner RE, Christophi CA, Metzger BE,\net al.; Diabetes Prevention Program Research\nGroup. Prevention of diabetes in women with a', 'cannot differentiate between preexisting\ndiabetes and GDM with an A1C.\nGDM is often indicative of underlying\nb-cell dysfunction (200), which confers\nmarked increased risk for later develop-\nment of diabetes, generally but not al-\nways type 2 diabetes, in the mother after\ndelivery (201,202). As effective preven-\ntion interventions are available (203,204),\nindividuals diagnosed with GDM should', 'glucose tolerance testing for women with gestational\ndiabetes. Am J Obstet Gynecol 2020;223:\n439.e1–439.e7\n133. Vounzoulaki E, Khunti K, Abner SC, Tan BK,\nDavies MJ, Gillies CL. Progression to type 2\ndiabetes in women with a known history of\ngestational diabetes: systematic review and\nmeta-analysis. BMJ 2020;369:m1361\n134. Li Z, Cheng Y , Wang D, et al. Incidence rate', 'to untreated GDM have reduced insulin\nsensitivity andb-cell compensation and\nare more likely to have impaired glucose\ntolerance in childhood (57). In other words,\nshort-term and long-term risks increase\nwith progressive maternal hyperglycemia.\nTherefore, all pregnant people should\nbe screened as outlined in Section 2,\n“Diagnosis and Classiﬁcation of Diabetes.”', 'ways type 2 diabetes, in the mother after\ndelivery (201,202). As effective preven-\ntion interventions are available (203,204),\nindividuals diagnosed with GDM should\nreceive lifelong screening for prediabetes\nto allow interventions to reduce diabetes\nrisk and for type 2 diabetes to allow treat-\nment at the earliest possible time (205).\nDiagnosis\nGDM carries risks for the mother, fetus,', 'In addition, diabetes in pregnancy increases the risks of obesity, hypertension, and\ntype 2 diabetes in offspring later in life (1,2).\nPreconception Counseling', '46\nPREGUNTA 7. ¿Cuál es la importancia de la tecnología en la educación \nen diabetes? \nSe sugiere que el uso de la tecnología se individualice en función de las \nnecesidades, los deseos, el nivel de habilidad y la disponibilidad de los \ndispositivos en el entorno. D2\nAutomonitoreo de la glucosa.\nSe recomienda automonitoreo de glucosa en todas las personas que utilizan', 'and type 2 diabetes increasing in individuals of reproductive age, but there is also a\ndramatic increase in the reported rates of gestational diabetes mellitus (GDM). Diabe-\ntes confers signiﬁcantly greater maternal and fetal risk largely related to the degree of\nhyperglycemia but also related to chronic complications and comorbidities of diabe-', 'La evaluación de las necesidades educativas utilizadas en las estrategias de \nempoderamiento, permiten la reducción de HbA1c, el peso y el IMC como \nparámetros importantes para control DM (67).\nUno de los factores críticos en el control de las personas con diabetes, es la \ninversión en la capacidad de autogestión. Sin embargo, si bien la inversión', 'una glucemia casi normal. Los aspectos generales de la “dieta saludable” \npodrían cubrirse posteriormente, siempre que el paciente haya demostrado que \ncomprende y utiliza correctamente los aspectos cruciales para su tipo específico \nde diabetes.\nDiabetes Tipo 2.\nLa DT2 se caracteriza por su desarrollo progresivo que está determinado por el', 'gestational diabetes mellitus and childhood\nglucose metabolism. Diabetes Care 2019;42:\n372–380\n217. Scholtens DM, Kuang A, Lowe LP , et al.;\nHAPO Follow-up Study Cooperative Research\nGroup; HAPO Follow-Up Study Cooperative\nResearch Group. Hyperglycemia and Adverse\nPregnancy Outcome Follow-up Study (HAPO\nFUS): maternal glycemia and childhood glucose\nmetabolism. Diabetes Care 2019;42:381–392', '48\nEn personas con diabetes tipo 2 que no usan insulina, el control rutinario de la \nglucosa puede tener un beneficio clínico adicional limitado. Una consideración \nmuy importante es que la realización del automonitoreo de glucosa por sí solo \nno reduce los niveles de glucosa en sangre. Para ser útil, la información debe \nintegrarse en planes clínicos y de autocuidado.', 'including a reduced risk for type 2\ndiabetes later in life.B\n15.28 Individuals with a history of\nGDM should have lifelong screening\nfor the development of type 2 diabe-\ntes or prediabetes every 1–3y e a r s .B\n15.29 Individuals with a history of\nGDM should seek preconception\nscreening for diabetes and precon-\nception care to identify and treat hy-\nperglycemia and prevent congenital', 'de masa corporal y presión arterial) y metabólicos (HbA1c y dislipidemia) \nde personas con DM tipo 2, y disminuyó un 64% el costo del tratamiento \nmedicamentoso de la hiperglucemia y otros factores de riesgo cardiovascular \nasociados (241). Complementariamente, la implementación de un programa \neducativo de médicos del primer nivel de atención y personas con DM', 'the DPP/DPPOS who were at particularly\nhigh risk of progression to diabetes (crude\nincidence of diabetes 14–22 cases per 100\nperson-years) included BMI$35 kg/m2,\nhigher glucose levels (e.g., fasting plasma\nglucose 110–125 mg/dL [6–6.9 mmol/L],\n2–h postchallenge glucose 173–199 mg/dL\n[9.6–11.0 mmol/L], and A1C $6.0%\n[$42 mmol/mol]), and a history of GDM\n(4,91,92). In contrast, in the community-', 'patterns and type 2 diabetes mellitus risk among\nwomen with a history of gestational diabetes\nmellitus. Arch Intern Med 2012;172:1566–1572\n136. Villamor E, Cnattingius S. Interpregnancy\nweight change and risk of adverse pregnancy\noutcomes: a population-based study. Lancet 2006;\n368:1164–1170\n137. Mart/C19 ınez-Hortelano JA, Cavero-Redondo I,', 'de la enfermedad, como la nefropatía diabética, la neuropatía y la retinopatía \n(4) que disminuyen la calidad y la esperanza de vida del paciente y aumentan \nsignificativamente el coste de los cuidados.\nEl papel de la nutrición y el enfoque dietético: Igualando la cantidad de ingesta \nde carbohidratos que aumentan la glucosa en sangre (CHO) con la cantidad/', 'Gestational Diabetes\nWHAT IS GESTATIONAL DIABETES?\nGestational diabetes (GDM) is diabetes that is only present during pregnancy when you did not \nhave diabetes before you became pregnant. After birth, GDM goes away, but you may develop type \n2 diabetes right away and you are at a higher risk for developing it later in life.  GDM is a condition', 'importancia de la dieta y la lucha contra el sedentarismo para evitar la obesidad, \nasí como para prevenir el inicio de la diabetes y también mostrar el papel de \nestas medidas en el control y el tratamiento de esta enfermedad”. Esta frase fue \ncreada en 1925 por un papá interesado en diabetes y con una gran experiencia \nen la formación de médicos de todo el mundo en el campo de la diabetes', 'risk after a history of GDM was signiﬁ-\ncantly lower in those who followed\nhealthy eating patterns (135). Adjusting\nfor BMI attenuated this association mod-\nerately, but not completely. Interpreg-\nnancy weight gain is associated with\nincreased risk of adverse pregnancy out-\ncomes (136) and higher risk of GDM,\nwhile in people with BMI>25 kg/m2,\nweight loss is associated with lower risk', 'tant factor in reducing the risk of progres-\nsion, with every kilogram of weight loss\nconferring a 16% reduction in risk of pro-\ngression over 3.2 years (12). In individuals\nwith previous history of GDM, the risk of\ntype 2 diabetes increased by 18% for ev-\nery 1 unit BMI above the preconception\nbaseline (76). Several medications evalu-\nated for weight loss (e.g., orlistat, phenter-', 'de insulina muy limitada.\nEl papel de la nutrición y el enfoque dietético: Una dieta que contenga varias \nporciones pequeñas de CHO, con alimentos de bajo índice glucémico (17), \ndurante el día, puede ayudar si es aceptada por el paciente y cumple el objetivo \ndel tratamiento.\nJustificación: La distribución de los alimentos que contienen CHO en 6-7', 'glucose metabolism of offspring in child-\nhood. These associations with maternal\noral glucose tolerance test (OGTT) results\nare continuous with no clear inﬂection\npoints (39,56). Offspring with exposure\nto untreated GDM have reduced insulin\nsensitivity andb-cell compensation and\nare more likely to have impaired glucose\ntolerance in childhood (57). In other words,', 'ensayo clínico piloto aleatorio y controlado de cinco años de duración (7). Los \npacientes seguidos por el Group Care redujeron su peso corporal y mejoraron \nla HbA1c y el colesterol HDL sin aumentar la prescripción de medicamentos. \nNada de lo anterior ocurrió en las personas de control seguidas de la relación \ntradicional proveedor-paciente. El conocimiento de la diabetes y la capacidad de', 'the most common form of diabetes.\nGestational (jes-TAY-shon-al) \ndiabetes — occurs in some women \nwhen they become pregnant.  It \nraises her future risk of developing \ndiabetes, mostly type 2.  It may raise \nher child’s risk of being overweight \nand developing type 2 diabetes.   \n3']","La diabetes gestacional (GDM) se relaciona con la diabetes tipo 2 de varias maneras importantes:

1. **Aumento del Riesgo**: Las mujeres con un historial de GDM tienen un riesgo significativamente mayor de desarrollar diabetes tipo 2 en el futuro. Específicamente, tienen un riesgo 10 veces mayor de desarrollar diabetes tipo 2 en comparación con aquellas sin GDM.

2. **Riesgo a lo Largo de la Vida**: El riesgo absoluto de desarrollar diabetes tipo 2 después de GDM aumenta linealmente con el tiempo. Aproximadamente, el riesgo es del 20% a los 10 años, 30% a los 20 años, 40% a los 30 años, 50% a los 40 años y 60% a los 50 años.

3. **Factores de Riesgo**: Tener un historial de GDM es un factor de riesgo importante para el desarrollo de diabetes tipo 2. Otros factores de riesgo incluyen sobrepeso u obesidad, antecedentes familiares de diabetes tipo 2, y ciertos grupos étnicos.

4. **Intervenciones Posteriores**: Es crucial que las mujeres con un historial de GDM reciban seguimiento y screening continuo para prediabetes o diabetes tipo 2 cada 1-3 años, incluso si los resultados iniciales de la prueba postparto son normales.

5. **Estilo de Vida y Dieta**: Seguir patrones de alimentación saludables y mantener un peso adecuado puede reducir el riesgo de desarrollar diabetes tipo 2 después de GDM. La intervención en el estilo de vida postparto es efectiva en reducir este riesgo.

Estos puntos subrayan la importancia de la vigilancia y el manejo continuo para las mujeres con un historial de GDM para prevenir o retrasar el desarrollo de diabetes tipo 2.","La diabetes gestacional está fuertemente relacionada con un mayor riesgo de desarrollar diabetes tipo 2 más adelante en la vida. Las mujeres que tuvieron diabetes gestacional durante el embarazo tienen un riesgo significativamente mayor, hasta 10 veces más, de progresar a diabetes tipo 2 dentro de los 5-10 años posteriores al parto. La diabetes gestacional y la tipo 2 comparten factores de riesgo y fisiopatología similares, que involucran resistencia a la insulina y secreción de insulina alterada. La diabetes gestacional puede revelar una predisposición subyacente a la diabetes tipo 2, que puede manifestarse completamente después de que se resuelve el estrés metabólico del embarazo. Esto subraya la importancia del cribado posparto, las intervenciones en el estilo de vida y el seguimiento cercano en mujeres con antecedentes de diabetes gestacional para prevenir o retrasar la aparición de la diabetes tipo 2.",1.0,0.9999996868598963,,1.0,1.0,0.5477945401423611,0.878678160569444
¿Por qué la circunferencia de la cintura es una medida relevante para evaluar el riesgo de diabetes?,"['vascular a lo largo de la vida, deﬁnido como la presencia\nde uno o más factores de riesgo cardiovascular (hiperten-\nsión, dislipidemia, tabaquismo, obesidad y antecedente en\nun familiar de primer grado de enfermedad cardiovascular\nprematura) en alguien menor de 40 años.\nUna vez realizada la evaluación del riesgo cardiovascular, el algo-', 'carga para los sistemas de salud y la sociedad. Esta carga socioeconómica se \npuede reducir mediante un adecuado control de la glucemia y de los factores \nde riesgo cardiovascular asociados.\nLa educación de las personas con riesgo de desarrollar diabetes se considera \nun aspecto fundamental de las estrategias de prevención y tratamiento de la', 'de masa corporal y presión arterial) y metabólicos (HbA1c y dislipidemia) \nde personas con DM tipo 2, y disminuyó un 64% el costo del tratamiento \nmedicamentoso de la hiperglucemia y otros factores de riesgo cardiovascular \nasociados (241). Complementariamente, la implementación de un programa \neducativo de médicos del primer nivel de atención y personas con DM', 'de riesgo cardiovascular asociados.\nLa educación de las personas con riesgo de desarrollar diabetes se considera \nun aspecto fundamental de las estrategias de prevención y tratamiento de la \nenfermedad. La educación es un proceso continuo y progresivo, que permite \na la persona comprender y formar parte activa y efectiva de su control y', 'de aprendizaje y de adherencia al tratamiento, así como la respuesta individual \na la enfermedad (65). En este contexto es muy importante tener en cuenta el \ncriterio de la persona con diabetes y su entorno (69).\nTambién es importante evaluar el entorno en el que la persona con diabetes se \nencuentra, su familia y redes de apoyo, las cuales influirán en forma positiva o', 'La evaluación de las necesidades educativas utilizadas en las estrategias de \nempoderamiento, permiten la reducción de HbA1c, el peso y el IMC como \nparámetros importantes para control DM (67).\nUno de los factores críticos en el control de las personas con diabetes, es la \ninversión en la capacidad de autogestión. Sin embargo, si bien la inversión', 'También es importante evaluar el entorno en el que la persona con diabetes se \nencuentra, su familia y redes de apoyo, las cuales influirán en forma positiva o \na veces negativa en su proceso educativo y de autocuidado (70).\nLa evaluación de las necesidades educativas utilizadas en las estrategias de \nempoderamiento, permiten la reducción de HbA1c, el peso y el IMC como', 'un familiar de primer grado de enfermedad cardiovascular\nprematura) en alguien menor de 40 años.\nUna vez realizada la evaluación del riesgo cardiovascular, el algo-\nritmo terapéutico continua de la siguiente manera (ver laFigura 1):\nPacientes sin alto riesgo cardiovascular: iniciar tratamiento\ncon metformina.', 'Impacto.\nLa diabetes tiene un profundo impacto en la calidad de vida de los que la \npadecen, incluyendo a la familia, parejas y amigos. En parte debido a las \ndemandas continuas de cuidado diario, y al riesgo de complicaciones agudas \ny crónicas. Alrededor del 30% de personas con diabetes, tanto jóvenes como \nadultos, presentan distrés por diabetes (DD) en algún momento del curso de la', 'y crónicas. Alrededor del 30% de personas con diabetes, tanto jóvenes como \nadultos, presentan distrés por diabetes (DD) en algún momento del curso de la \nLa diabetes tiene un impacto significativo sobre la vida de las personas que la \npadecen, y factores psicológicos pueden jugar un rol clave en el proceso de \nautocuidado de la enfermedad;', 'La diabetes tiene un impacto significativo sobre la vida de las personas que la \npadecen, y factores psicológicos pueden jugar un rol clave en el proceso de \nautocuidado de la enfermedad;\nLa detección y monitoreo de las necesidades psicológicas deben formar parte \nintegral del cuidado de la diabetes;\nLa atención psicológica de las personas con diabetes puede ayudar significa-', 'importancia de la dieta y la lucha contra el sedentarismo para evitar la obesidad, \nasí como para prevenir el inicio de la diabetes y también mostrar el papel de \nestas medidas en el control y el tratamiento de esta enfermedad”. Esta frase fue \ncreada en 1925 por un papá interesado en diabetes y con una gran experiencia \nen la formación de médicos de todo el mundo en el campo de la diabetes', '39\nPREGUNTA 3. ¿Qué variables deben ser tenidas en cuenta, dentro de \nla evaluación inicial de las personas con diabetes, para determinar sus \nprioridades educativas?\nPara establecer las necesidades educativas en la evaluación inicial, se \nrecomienda determinar el perfil de la persona con diabetes, teniendo en cuenta \nlas siguientes variables: conocimiento de recomendaciones de comportamientos', 'saludable y brinda apoyo social y emocional, que ayuda a mejora la calidad \nde vida de la persona con diabetes (223). Numerosas evidencias, reportadas \nen la literatura, demuestran que las intervenciones educativas en diabetes son \nefectivas y mejoran a corto y mediano plazo el control metabólico (HbA1c, \nlípidos), los factores de riesgo cardiovascular asociados (peso e hipertensión),', 'as i g n iﬁcant risk factor for progression to\ndiabetes as well as cardiovascular disease\nand several other cardiometabolic out-\ncomes. Criteria for screening for diabetes\nor prediabetes in asymptomatic adults are\noutlined inTable 2.4. Prediabetes is asso-\nciated with obesity (especially abdominal\nor visceral obesity), dyslipidemia with high\ntriglycerides and/or low HDL cholesterol,', 'in populations with different body com-\nposition and cardiometabolic risk (28). A\ndiagnosis of obesity should be made\nbased on an overall assessment of the in-\ndividual’s adipose tissue mass (BMI can\nbe used as a general guidance), distribution\n(using other anthropometric measurements\nlike waist circumference, waist-to-hip cir-\ncumference ratio, or waist-to-height', 'Multiple factors, including age, BMI, and\nother comorbidities, may inﬂuence the\nrisk of progression to diabetes and lifetime\nrisk of complications (121,122). Prediabe-\ntes is associated with increased cardiovas-\ncular disease and mortality (102), which\nemphasizes the importance of attending\nto cardiovascular risk in this population.\nIn the DPP, which enrolled high-risk indi-', 'las familias que tienen un miembro con diabetes o en riesgo de desarrollar \nesta condición.\nAsociada a la adopción de hábitos saludables y al uso racional y oportuno de los \nmedicamentos e insumos, la ED tiende a dirigir a una reducción de la necesidad \nde utilizar los servicios de salud de emergencia y a mejorar los marcadores', 'Las recomendaciones no se emitirán para ser implementadas en el nivel de \nurgencias.\nUna de las condiciones claves a tener en cuenta en las recomendaciones, fueron \nlos factores de riesgo cardiovascular asociados a los distintos tipos de diabetes y \nsus complicaciones agudas y crónicas.\nLas intervenciones que cubre la guía están orientadas de la siguiente manera:\nIntervención diagnóstica:', 'recomienda determinar el perfil de la persona con diabetes, teniendo en cuenta \nlas siguientes variables: conocimiento de recomendaciones de comportamientos \nde autocuidado, actitudes hacia la diabetes y las tareas de autocuidado, aspectos \nemocionales (angustia por diabetes y depresión), funcionamiento cognitivo, \ndisposición al cambio, apoyo familiar y alfabetización en salud. Punto de buena', 'interacción e información, incluso acerca de la diabetes.\nHasta hoy, son -muchas veces- ignoradas las creencias de una persona, su \nhistoria y actitudes, su cultura, etnia y lenguaje, su condición financiera, \nvivienda, educación, y otras condiciones como de salud y apoyo social. La \nconsecuencia directa de no considerar esos factores es la baja efectividad de la \nED (42).', 'objetivos terapéuticos recomendados, incrementando el riego del desarrollo y \nprogresión de sus complicaciones crónicas (222). Este contexto convierte a la \ndiabetes en un creciente problema de salud pública, constituyendo una pesada \ncarga para los sistemas de salud y la sociedad. Esta carga socioeconómica se \npuede reducir mediante un adecuado control de la glucemia y de los factores', 'de recomendaciones de autocuidado, actitudes hacia la diabetes y las tareas \nde autocuidado (se sugiere el uso del Cuestionario de Áreas Problemáticas de \nla Diabetes PAID), aspectos emocionales (angustia por diabetes y depresión), \nfuncionamiento cognitivo (memoria y comprensión), disposición al cambio, \napoyo familiar y alfabetización en salud (68).', 'paciente y su riesgo cardiovascular (según sus factores de ries-\ngo, la presencia de enfermedad cardiovascular establecida y/o la\npresencia de insuﬁciencia cardíaca crónica). Se considera que\npresentan alto riesgo cardiovascular aquellos adultos con DM2\nque tienen:\nenfermedad cardiovascular ya establecida,\ninsuﬁciencia cardíaca crónica,\nedad de 40 años o más y riesgo por QRISK2 mayor al\n10 %, o', 'capacitar y/o mejorar el autocuidado en las personas con diabetes?\n• ¿Cuáles son los temas claves que el equipo de salud debe tratar en la \nconsulta de la persona con diabetes, para que mejore su manejo metabólico \ny prevenga o disminuyan las complicaciones?\n• ¿Qué variables deben ser tomadas en cuenta, dentro de la evaluación', 'presence of associated health or well-be-\ning consequences: metabolic, physical, or\npsychological/well-being (29).\nO b e s i t yi sak e yp a t h o p h y s i o l o g i cd r i v e r\nof diabetes, other cardiovascular risk fac-\ntors (e.g., hypertension, hyperlipidemia,\nnonalcoholic fatty liver disease, and in-\nﬂammatory state), and ultimately cardio-\nvascular and kidney disease (30). Diabetes', 'los puntos de vista de las personas con diabetes, sus preguntas y percepciones \nespecíficas sobre la diabetes, su tratamiento y su estado de salud. Dentro de las \náreas importantes del comportamiento a evaluar se encuentran: conocimiento \nde recomendaciones de autocuidado, actitudes hacia la diabetes y las tareas \nde autocuidado (se sugiere el uso del Cuestionario de Áreas Problemáticas de', 'diabetes (who already have, by deﬁni-\ntion, one cardiometabolic risk factor),\nlimitations include the need for better\nvalidation, as cardiometabolic risk factors\nmay carry different weights and thus\nsome may also have lower speciﬁcity as\nsurrogates for insulin resistance (e.g., hy-\npertension). In addition, some people\nmay have insulin resistance and steatosis', 'Age-adjusted rates of obstructive sleep ap-\nnea, a risk factor for cardiovascular dis-\nease, are signiﬁcantly higher (4- to 10-fold)\nwith obesity, especially with central obesity\nS68 Comprehensive Medical Evaluation and Assessment of Comorbidities Diabetes Care Volume 47, Supplement 1, January 2024\n©AmericanDiabetesAssociation', 'Guía de Práctica Clínica de Educación en Diabetes \nRegión Centro y Sudamérica, \nFederación Internacional de Diabetes (IDF-SACA)\nPrólogo\n“Debe haber un programa de educación que explique a la comunidad, la \nimportancia de la dieta y la lucha contra el sedentarismo para evitar la obesidad, \nasí como para prevenir el inicio de la diabetes y también mostrar el papel de', 'be used as a general guidance), distribution\n(using other anthropometric measurements\nlike waist circumference, waist-to-hip cir-\ncumference ratio, or waist-to-height\nratio), or function and, importantly, the\npresence of associated health or well-be-\ning consequences: metabolic, physical, or\npsychological/well-being (29).\nO b e s i t yi sak e yp a t h o p h y s i o l o g i cd r i v e r', 'Población objetivo.\nLa guía se dirige a personas con diabetes tipo 1, tipo 2, gestacional y otros tipos \nde diabetes, personas con prediabetes y personas con un puntaje de Findrisc \nalto, con involucramiento del entorno familiar (porque la población pediátrica \ndepende significativamente del conocimiento adquirido por sus tutores legales,', 'adultos?\n• ¿Cuál es la importancia de la tecnología en la educación en diabetes?\n• ¿Qué impacto psicológico tiene la diabetes, su tratamiento y cómo \ndetectarlo?\n• ¿Son los campamentos recreativos-educativos una estrategia eficaz para \naumentar el empoderamiento del autocuidado de las personas con \ndiabetes?\n• ¿Cuál es el mejor enfoque con base en la evidencia para lograr cambios', 'zados especíﬁcamente para personas con diabetes.\nSe sugiere que las recomendaciones al paciente incluyan ade-\nmás otros aspectos de la modiﬁcación del estilo de vida, como el\naumento de la actividad física y la pérdida de peso. En aquellos\nadultos con diabetes tipo 2 con sobrepeso u obesidad, se debe\ndiscutir y acordar un objetivo inicial de pérdida de peso corporal\nde 5 a 10 %.', 'con la educación presencial, para promover el empoderamiento para el \nautocuidado de las personas con diabetes?\n• ¿Cómo debería ser la transición de personas con diabetes en edad pediátrica-\nadultos?\n• ¿Cuál es la importancia de la tecnología en la educación en diabetes?\n• ¿Qué impacto psicológico tiene la diabetes, su tratamiento y cómo \ndetectarlo?', 'progresión de la pérdida individual de células ß.\nÉnfasis de la dieta en la terapia de las personas con sobrepeso/obesidad \ncon diagnóstico reciente de DT2 y resistencia a la insulina:\nMedios terapéuticos primarios: En estos pacientes el principal componente \nterapéutico es la reducción de peso para reducir la resistencia a la insulina.', 'La diabetes forma parte de la vida cotidiana de las personas y está repleta de \nsignificados relacionados con su contexto vital real y su historia personal y \nrelacional. Tratarse bien mientras se vive con diabetes requiere cambios de \ncomportamiento, adquirir nuevos hábitos y abandonar los antiguos (1)(2). Todos \nlos estudios demuestran que estos resultados pueden alcanzarse a través de', 'elaborador y al grupo encomendador, y fueron discutidos en la primera reunión \nde equipo, en la que no se determinaron conflictos de importancia por ninguno \nde los miembros.\nSe delimitó de manera anticipada, cómo y en qué etapas del proceso de \ndesarrollo de la guía deben incorporarse las perspectivas de las personas con', 'consulta de la persona con diabetes, para que mejore su manejo metabólico \ny prevenga o disminuyan las complicaciones?\n• ¿Qué variables deben ser tomadas en cuenta, dentro de la evaluación \ninicial de las personas con diabetes, para determinar sus prioridades \neducativas?\n• ¿Qué método pedagógico se debería emplear, en los programas educativos,', '46\nPREGUNTA 7. ¿Cuál es la importancia de la tecnología en la educación \nen diabetes? \nSe sugiere que el uso de la tecnología se individualice en función de las \nnecesidades, los deseos, el nivel de habilidad y la disponibilidad de los \ndispositivos en el entorno. D2\nAutomonitoreo de la glucosa.\nSe recomienda automonitoreo de glucosa en todas las personas que utilizan', 'línea, como una opción beneficiosa para el tratamiento de la prediabetes y \ndiabetes mellitus, sobre todo en personas familiarizadas con esta tecnología. B2\nJustificación\nLa diabetes mellitus es una enfermedad crónica importante que exige el trabajo \nen equipo de varios cuidadores para la prestación de una atención de alta', 'Co-morbilidades psicológicas.\nEstudios epidemiológicos han demostrado que los desórdenes mentales son \nmás prevalentes en personas con diabetes que en la población general (3)(4)\n(5)(6)(7). La depresión es común y está asociada con altos niveles de DD y \nafecta negativamente la calidad de vida de los pacientes, el autocuidado y el', 'creciente a nivel mundial. Asimismo, como consecuencia de la combinación \nde un diagnóstico tardío, inadecuada calidad de la atención y acceso desigual \na la atención y tratamiento, muchas personas con diabetes no alcanzan los \nobjetivos terapéuticos recomendados, incrementando el riego del desarrollo y \nprogresión de sus complicaciones crónicas (222). Este contexto convierte a la', 'insulina.\nFinalmente, la cirugía bariátrica está indicada para pacientes\ncon un IMC de 35 o más que tengan diabetes tipo 2 de inicio\nreciente (diagnosticada en los 10 años previos).\n4. Diagnóstico y manejo de la hipertensión arterial\nEl diagnóstico, tratamiento y monitoreo de la hipertensión arte-\nrial (HTA) es, en general, el mismo para las personas con dia-', '8\nde los aspectos en los que no se hubiere alcanzado el desarrollo requerido, para \nconcretar un verdadero apoyo a las personas con diabetes y sus familiares.\nPoblación objetivo.\nLa guía se dirige a personas con diabetes tipo 1, tipo 2, gestacional y otros tipos \nde diabetes, personas con prediabetes y personas con un puntaje de Findrisc', 'diabetes (e.g., hypertension and dyslipidemia) are clear risk factors for ASCVD, and dia-\nbetes itself confers independent risk. Numerous studies have shown the efﬁcacy of\ncontrolling individual cardiovascular risk factors in preventing or slowing ASCVD in peo-\nple with diabetes. Furthermore, large beneﬁts are seen when multiple cardiovascular', 'tivity compared to fasting plasma glucose in diagnosing DM.\nTable 1.4. Risk factors for development of Type 2 diabetes mellitus\n. Age /C2145 years\n. Increased body weight (body mass index /C2125 Kg/m2)\n. Family history of Type 2 diabetes\n. Sedentary lifestyle\n. History of gestational diabetes or child birth weighing > 4k g\n. Hypertension (/C21140/90 mmHg)', 'una presentación. Sabiendo que, en general, una atención elevada solo puede \nmantenerse durante unos minutos, otros factores como la edad, el nivel de fatiga \ny la ansiedad explican por qué se retiene menos del 10% de la información \npresentada. Este método, una reliquia del sistema clásico (escuelas de enfermería, \nfacultades de medicina), es especialmente inadecuado para los pacientes. No', 'de un grupo de pares, función ejecutiva, regulación de las emociones, control de \nimpulsos, depresión y habilidades sociales han sido implicados en esta dificultad \n(164)(165)(166)(167). Se requiere intervenciones que eviten o disminuyan el \ndeterioro del control glicémico durante la adolescencia y ayuden a superar los \nproblemas psicosociales asociados (168).', '(C) o muy bajos (D) y se caracterizaron de la siguiente manera: A, el nivel más \nalto de la evidencia con la menor posibilidad de cambio en la conclusión; B, \nconfianza moderada en la estimación del efecto, pero existe la posibilidad de \ncambio con investigación ulterior; C, la confianza en la estimación del efecto \nes limitada, con una importante posibilidad de cambio; D, el más bajo nivel', 'TITLE: Factores de riesgo para la diabetes tipo 2 - NIDDK\nCONTENT: La circunferencia de la cintura es una medida indirecta de la cantidad de grasa en el abdomen. Tener mucha circunferencia de cintura es un factor de riesgo para la diabetes y las enfermedades cardiacas, incluso si se tiene un IMC normal.\nBibliografía\n[1] American Diabetes Association Professional Practice Committee. Standards of medical care in diabetes—2022. Diabetes Care. 2022;45(suppl 1): S17–S38. doi:10.2337/dc22-S002 [...] Otra forma de estimar el riesgo de desarrollar diabetes es midiendo la circunferencia de la cintura. Los hombres corren un mayor riesgo de desarrollar diabetes si la circunferencia de su cintura está por encima de 40 pulgadas, mientras que las mujeres que no están embarazadas corren un mayor riesgo si la circunferencia de su cintura está por encima de 35 pulgadas.6,7\nURL: https://www.niddk.nih.gov/health-information/informacion-de-la-salud/diabetes/informacion-general/factores-riesgo-tipo-2', 'TITLE: Perímetro de cintura aumentado y riesgo de diabetes - Redalyc\nCONTENT: Este es un estudio de corte transversal, donde se busca determinar la relación de la circunferencia de cintura con la presencia de diabetes siguiendo los criterios de IDF y de población Latinoamericana. Así mismo otros parámetros antropométricos como: el peso, talla, índice de masa corporal, lípidos, hipertensión incluyendo sexo y edad. [...] En este estudio se realiza un acercamiento a la asociación del perímetro de cintura aumentado y la presencia de diabetes, donde se encontró como el perímetro aumentado por criterios de IDF se asocia 1.44 veces el riesgo de diabetes tipo 2 y por criterios latinoamericanos se incrementa 1.42; después de ajustar por otras variables. Este estudio se puede considerar de prueba de concepto, ya que refuerza la relación entre el perímetro abdominal como variable de riesgo de diabetes, independiente de [...] Este estudio encontró mayor riesgo de diabetes en sexo masculino con OR 1.30, estudios en hombres japoneses han demostrado una relación similar que va desde 1.7 veces hasta seis veces más riesgo de diabetes 20.\n\nEste trabajo comprueba el concepto donde el perímetro de cintura por encima de los cortes establecidos es un factor de riesgo para diabetes en población urbana colombiana.\n\nConclusión\nURL: https://www.redalyc.org/journal/1631/163147488007/html/', 'TITLE: Correlación de circunferencia de cintura con factores de riesgo ...\nCONTENT: Conclusiones: La CC es un buen indicador que correlaciona positivamente con los factores de riesgo cardiovascular y síndrome metabólico, por lo tanto, en la\nURL: https://www.elsevier.es/es-revista-medicina-universitaria-304-articulo-correlacion-circunferencia-cintura-con-factores-X1665579612844278', 'TITLE: Distribución de la circunferencia de la cintura y de la relación ...\nCONTENT: factores de riesgo cardiovascular en relación progresiva con su IMC9. Recientemente el seguimiento de la cohorte Data from an Epidemiologic Study on the Insuline Resistance syndrome (DESIR.) ha demostrado la importancia del aumento de la CC y del peso en el desarrollo de diabetes mellitus tipo 2 en pacientes con glucemia basal alterada, señalando su mayor impacto en pacientes sin sobrepeso que en aquellos con sobrepeso u obesidad30. [...] Entre otros factores de variabilidad a considerar para valorar los umbrales patológicos de CC se encuentran el sexo, la condición de diabético, la raza, y la edad21. Se ha señalado que un mismo grado de CC puede conferir diferente riesgo según la población en que se estudia y el sexo. Por ejemplo las mujeres y las poblaciones de origen asiático tienen mayor riesgo relativo de presentar enfermedad cardiovascular a menores valores de CC28. Se hace necesario por tanto conocer la distribución de [...] La relación CT no ha sido considerada lo suficiente, a pesar de ser una buena herramienta para discriminar el riesgo cardiovascular y la diabetes mellitus tipo 2 relacionados con la obesidad, por cuanto incluye tanto la grasa abdominal como la talla. Se han venido considerando niveles de corte para predecir la presencia de factores de riesgo cardiovascular entre 0,46 a 0,62cm/cm, y para actuación de 0,5cm/cm15. Este umbral ha mostrado ser mejor indicador de diabetes y riesgo cardiovascular que\nURL: https://www.elsevier.es/es-revista-endocrinologia-nutricion-12-articulo-distribucioncircunferencia-cintura-relacion-circunferencia-S1575092210001737', 'TITLE: La circunferencia de la cintura como signo vital en la práctica clínica.\nCONTENT: El IMC elevado es un factor de riesgo importante para generar enfermedades no transmisibles como:\n• Enfermedad cardiovascular (ECV) y vascular cerebral (EVC);\n•  Diabetes tipo 2 (DM2);\n• Trastornos musculoesqueléticos, especialmente osteoartrosis;\n• Neoplasias malignas (endometrio, mama, ovario, próstata, hígado, vesícula biliar, riñón y colon).1 \n\nEl riesgo de estas enfermedades no transmisibles aumenta conforme el IMC es más elevado. [...] Por lo tanto, se recomienda integrar la disminución en la circunferencia de la cintura como un objetivo de tratamiento de importancia crítica para reducir los riesgos de salud adversos tanto para hombres como para mujeres. La utilización de esta medida de forma rutinaria y la capacitación para realizar su medición de manera adecuada por los profesionales de la salud es sumamente importante tanto en el ámbito clínico como en el de investigación, así como su adecuado ingreso e interpretación en [...] RCC, la circunferencia de la cintura por sí sola tiene una asociación más fuerte con la cantidad absoluta de grasa intraabdominal o visceral, lugar de los depósitos de grasa que participan en mayor riesgo para la salud. 4\nURL: http://www.incmnsz.mx/opencms/contenido/departamentos/CAIPaDi/boletines/boletinMARZO2021.html']","La circunferencia de la cintura es una medida relevante para evaluar el riesgo de diabetes porque es un indicador indirecto de la cantidad de grasa en el abdomen. Tener una circunferencia de cintura elevada se asocia con un mayor riesgo de desarrollar diabetes tipo 2 y enfermedades cardiovasculares, incluso si se tiene un índice de masa corporal (IMC) normal. Esto se debe a que la grasa abdominal, especialmente la grasa visceral, está relacionada con la resistencia a la insulina y otros factores de riesgo metabólico.

En hombres, una circunferencia de cintura mayor a 40 pulgadas y en mujeres mayor a 35 pulgadas se considera un factor de riesgo significativo para la diabetes. Además, estudios han demostrado que un perímetro de cintura aumentado se asocia con un mayor riesgo de diabetes tipo 2, independientemente de otros factores como el IMC.

La circunferencia de la cintura es una herramienta útil y accesible para los profesionales de la salud, ya que su medición es sencilla y proporciona información valiosa sobre el riesgo de enfermedades metabólicas y cardiovasculares.","La circunferencia de la cintura es una medida relevante para evaluar el riesgo de diabetes porque estima eficazmente la acumulación de grasa abdominal o visceral, que está fuertemente asociada con la resistencia a la insulina y un mayor riesgo de desarrollar diabetes tipo 2. Múltiples estudios han encontrado que la circunferencia de la cintura es un predictor independiente del riesgo de diabetes, incluso después de considerar el índice de masa corporal (IMC). Evaluar tanto el IMC como la circunferencia de la cintura proporciona una estimación más completa del riesgo de diabetes que cualquiera de las dos medidas por separado. La circunferencia de la cintura es una herramienta de cribado simple, económica y práctica que puede mejorar la evaluación del riesgo y la identificación de personas de alto riesgo para intervenciones y esfuerzos de prevención tempranos.",0.8666666666666667,0.7677275139613716,,1.0,1.0,0.7440570590576332,0.9072627189891533
¿Qué pasos se pueden tomar para reducir el riesgo de desarrollar diabetes tipo 2?,"['de riesgo cardiovascular asociados.\nLa educación de las personas con riesgo de desarrollar diabetes se considera \nun aspecto fundamental de las estrategias de prevención y tratamiento de la \nenfermedad. La educación es un proceso continuo y progresivo, que permite \na la persona comprender y formar parte activa y efectiva de su control y', 'terapéuticos en el estilo de vida?\nSe recomienda el uso de un programa conductual para mejorar los resultados \nen las personas con diabetes mellitus. C1\nJustificación\nEl manejo de la diabetes mellitus tipo 1 y tipo 2, implica atención clínica y permite \nque las personas con diabetes adopten comportamientos de autocuidado. Es', 'y la actividad física para maximizar la capacidad de alcanzar y mantener el \nplan de alimentación (2).\nSi un paciente ya está tratado con medicación oral del tipo sulfonilurea o \nglinida, esta medicación debe ser suspendida desde el primer día de la dieta \nhipocalórica para prevenir el riesgo de hipoglucemia.', 'carga para los sistemas de salud y la sociedad. Esta carga socioeconómica se \npuede reducir mediante un adecuado control de la glucemia y de los factores \nde riesgo cardiovascular asociados.\nLa educación de las personas con riesgo de desarrollar diabetes se considera \nun aspecto fundamental de las estrategias de prevención y tratamiento de la', '10\nIntervención preventiva:\n• Educación orientada a los factores de riesgo de desarrollo de la diabetes.\n• Educación orientada a la comprensión de aspectos fisiopatológicos de \nla diabetes y su tratamiento para evitar el desarrollo de complicaciones \nagudas y crónicas.\nIntervención terapéutica:\n• Educación orientada a adquirir, desarrollar destrezas y mantener', 'efectivas y mejoran a corto y mediano plazo el control metabólico (HbA1c, \nlípidos), los factores de riesgo cardiovascular asociados (peso e hipertensión), \nlos conocimientos sobre la diabetes y la adopción de estilos de vida saludable, \nmejorando así la calidad de vida (224)(225)(226).', '37\nPREGUNTA 2. ¿Cuáles son los temas claves que el equipo de salud debe \ntratar en la consulta de la persona con diabetes para que mejore su manejo \nmetabólico y prevenga o disminuya las complicaciones?\nSe recomienda un programa de apoyo al autocuidado estandarizado, adaptado \na las necesidades de la región, que tenga como mínimo más de 12 horas', 'La evaluación de las necesidades educativas utilizadas en las estrategias de \nempoderamiento, permiten la reducción de HbA1c, el peso y el IMC como \nparámetros importantes para control DM (67).\nUno de los factores críticos en el control de las personas con diabetes, es la \ninversión en la capacidad de autogestión. Sin embargo, si bien la inversión', 'zados especíﬁcamente para personas con diabetes.\nSe sugiere que las recomendaciones al paciente incluyan ade-\nmás otros aspectos de la modiﬁcación del estilo de vida, como el\naumento de la actividad física y la pérdida de peso. En aquellos\nadultos con diabetes tipo 2 con sobrepeso u obesidad, se debe\ndiscutir y acordar un objetivo inicial de pérdida de peso corporal\nde 5 a 10 %.', 'de la persona, siendo sensible a su voluntad de cambio y los efec-\ntos en su calidad de vida.\nSe aconseja estimular a los adultos con diabetes tipo 2 a seguir\nlos mismos consejos de alimentación saludable que la población\ngeneral, que incluyen: comer fuentes de carbohidratos con alto\ncontenido de ﬁbra y bajo índice glucémico, como frutas, verdu-', '(recién diagnosticada, con sobrepeso):\n1. Entender la importancia de la reducción de peso para reducir la resistencia a \nla insulina –› 2. Aprender a saber y experimentar varios métodos de reducción de \npeso. –› 3. Documentar y explorar sus efectos. –› 4. Elegir el método o métodos \nque mejor coincidan con las preferencias individuales para su aplicación. –› 5. \nMantener el contacto.', 'physical activity, calorie restriction, weight\nmanagement strategies, and motivation.\nThere is strong and consistent evidence\nthat modest, sustained weight loss can delay\nthe progression from prediabetes to type 2\ndiabetes (103,105,106) (see Section 3,\n“Prevention or Delay of Diabetes and\nAssociated Comorbidities”) and is beneﬁ-\ncial for the management of type 2 diabe-', 'ras, granos integrales y legumbres; elegir productos lácteos bajos\nen grasa; comer pescado; y controlar la ingesta de ácidos grasos\nsaturados y trans, desalentando el uso de alimentos comerciali-\nzados especíﬁcamente para personas con diabetes.\nSe sugiere que las recomendaciones al paciente incluyan ade-\nmás otros aspectos de la modiﬁcación del estilo de vida, como el', 'strategies for patients with Diabetes Mellitus: A systematic review and meta-analysis. Prim Care Diabetes. abril de 2017;11(2):201-11. \n68. Katie Weinger. Behavioral Strategies for Improving Self-Management - Complete Nurse’s Guide to Diabetes Care, 3rd Edition \n[Internet]. [citado 16 de diciembre de 2021]. Disponible en: https://doctorlib.info/medical/childs-guide-diabetes-care/20.html', 'aumentar el empoderamiento del autocuidado de las personas con \ndiabetes?\n• ¿Cuál es el mejor enfoque con base en la evidencia para lograr cambios \nconductuales en personas con diabetes?', 'los mismos consejos de alimentación saludable que la población\ngeneral, que incluyen: comer fuentes de carbohidratos con alto\ncontenido de ﬁbra y bajo índice glucémico, como frutas, verdu-\nras, granos integrales y legumbres; elegir productos lácteos bajos\nen grasa; comer pescado; y controlar la ingesta de ácidos grasos\nsaturados y trans, desalentando el uso de alimentos comerciali-', 'progresión de la pérdida individual de células ß.\nÉnfasis de la dieta en la terapia de las personas con sobrepeso/obesidad \ncon diagnóstico reciente de DT2 y resistencia a la insulina:\nMedios terapéuticos primarios: En estos pacientes el principal componente \nterapéutico es la reducción de peso para reducir la resistencia a la insulina.', 'adultos con diabetes tipo 2 con sobrepeso u obesidad, se debe\ndiscutir y acordar un objetivo inicial de pérdida de peso corporal\nde 5 a 10 %.\nLa reducción del riesgo de hipoglucemia será un objetivo pri-', 'peso. –› 3. Documentar y explorar sus efectos. –› 4. Elegir el método o métodos \nque mejor coincidan con las preferencias individuales para su aplicación. –› 5. \nMantener el contacto.\nDT2, peso normal, no resistente a la insulina\nEn la mayoría de las personas de peso normal con DT2, la capacidad de producción \nrestante de insulina de las células ß es de sobra y no se observa una resistencia', 'achieve and maintain a weight reduc-\ntion of at least 7% of initial body weight\nthrough healthy reduced-calorie diet\nand $150 min/week of moderate-\nintensity physical activity.A\n3.4 A variety of eating patterns can be\nconsidered to prevent type 2 diabetes\nin individuals with prediabetes.B\n3.5Given the cost-effectiveness of lifestyle\nbehavior modiﬁcation programs for diabe-', 'fruits, and vegetables and minimal re-\nﬁned and processed foods, is also associ-\nated with a lower risk of type 2 diabetes\n(21,23–2 5 ) .A si st h ec a s ef o rt h o s ew i t h\ndiabetes, individualized medical nutrition\ntherapy (see Section 5, “Facilitating\nPositive Health Behaviors and Well-being\nto Improve Health Outcomes,” for more\ndetailed information) is effective in lower-', 'highly effective in preventing or delaying\ntype 2 diabetes and improving other car-\ndiometabolic risk factors (such as blood\npressure, lipids, and inﬂammation) (7).\nThe strongest evidence for diabetes pre-\nvention in the U.S. comes from the DPP\ntrial (4). The DPP demonstrated that in-\ntensive lifestyle intervention could reduce\nthe risk of incident type 2 diabetes by', 'tipos de programas de tratamiento y estilo de vida que varían en términos de su \nefectividad (148)(149). Para muchas de estas intervenciones, hay datos limitados \nde ensayos clínicos con seguimiento a largo plazo. Pero, para una persona con \ndiabetes individual, optar por uno de estos programas puede ser útil, y, para \nmuchos, es una opción atractiva.', 'ejecución estructurado. En esta fase inicial, los participantes aprenden a saber \ny aplicar temporalmente varios métodos de reducción de peso. Por ejemplo, \nutilizando dos semanas una dieta de fórmula, seguida de una intervención baja \nen grasas, una baja en carbohidratos y un ayuno intermitente. Los educadores \ncon experiencia en diabetes apoyan este “camino de descubrimiento” que', 'tes Prevention Study (DPS) (5), and the\nDa Qing Diabetes Prevention Study (Da\nQing study) (6), demonstrate that life-\nstyle/behavioral intervention with an indi-\nvidualized reduced-calorie meal plan is\nhighly effective in preventing or delaying\ntype 2 diabetes and improving other car-\ndiometabolic risk factors (such as blood\npressure, lipids, and inﬂammation) (7).', 'diabetes y otros actores involucrados. Para ello, se definieron tres estrategias \ngenerales, fundamentadas en el flujo de información que comparten el grupo \ndesarrollador y el público (5):\n1. Consulta: Se recolectó información de parte de personas con diabetes y \npúblico en general, a través de entrevistas directas y participación en una', 'en sangre, normalmente con insulina.\nObjetivos de aprendizaje / contenidos de la educación sobre la DT2 (peso \nnormal, no resistente a la insulina):\n1. Entender la importancia de mantenerse dentro del rango de peso normal. –› 2. \nIdentificar y elegir alimentos que contengan CHO de bajo índice glucémico. –› \n3. Elaborar un plan individual de distribución de pequeñas porciones de CHO', 'Identificar y elegir alimentos que contengan CHO de bajo índice glucémico. –› \n3. Elaborar un plan individual de distribución de pequeñas porciones de CHO \ndurante el día. –› 4. Consentimiento en esta opción terapéutica. –› 5. Aprender \nel fundamento de un probable paso terapéutico farmacológico posterior.\nDT2, tratado con insulina', 'Cómo tratar mi diabetes. 3rd ed. CENEXA-press, Buenos Aires. ISBN 987-98423-4-0\n21. Lencioni C, Lupi R, Del Prato S. Beta-cell failure in type 2 diabetes mellitus. Curr Diab Rep 2008; 8: \n179-84. doi: 10.1007/s11892-008-0031-0\n22. The Look AHEAD Research Group (2014) Eight-year weight losses with an intensive lifestyle \nintervention. Obesity (Silver Spring) 22: 5-13', 'mutuamente mediante la mejor reducción posible de la resistencia a la insulina \nexistente.\nEl papel de la nutrición y el enfoque dietético:  La intervención dietética \nhipocalórica será según las preferencias individuales y la situación psicosocial', 'metabólico y prevenga o disminuya las complicaciones?\nSe recomienda un programa de apoyo al autocuidado estandarizado, adaptado \na las necesidades de la región, que tenga como mínimo más de 12 horas \nde contacto con los educadores y que contenga los siguientes temas en su \nestructura. C1:\n1. Alimentación saludable.\n2. Actividad física.\n3. Automonitoreo.\n4. Adherencia terapéutica.', 'una glucemia casi normal. Los aspectos generales de la “dieta saludable” \npodrían cubrirse posteriormente, siempre que el paciente haya demostrado que \ncomprende y utiliza correctamente los aspectos cruciales para su tipo específico \nde diabetes.\nDiabetes Tipo 2.\nLa DT2 se caracteriza por su desarrollo progresivo que está determinado por el', 'La Asociación Americana de Diabetes recomienda que la intervención educativa \nde las personas con diabetes tiene mayor impacto cuando se utilizan métodos \nconductuales (205) desde un enfoque preventivo.\nEl modelo transteórico de cambios conductuales, fue originalmente descrito \npara intervenir conductualmente a personas con tabaquismo (206), este propone', '(con respecto a la alimentación y la actividad física) siempre puede ser dominado \neficazmente por una determinada proporción de la cohorte de pacientes. A la \nvista de los que no logran la necesaria modificación del estilo de vida, desde \nhace décadas surgieron enfoques farmacológicos con varios tipos de fármacos \nreductores de peso que desaparecieron ampliamente debido a su fracaso o', 'de comportamiento planificado (Ej.: Inicio de AUTOMONITOREO). El \ncomportamiento diana debe ser simple, mesurable, orientado a la acción, \nrealista y calculado. Un objetivo específico sería: “Caminar tres veces al día \ndurante 15 minutos” o “Cambiar la leche entera (homogeneizada) por leche \ndescremada”.\nEn segundo lugar, se identifica en qué etapa de cambio se encuentra la persona \ncon diabetes:', 'las familias que tienen un miembro con diabetes o en riesgo de desarrollar \nesta condición.\nAsociada a la adopción de hábitos saludables y al uso racional y oportuno de los \nmedicamentos e insumos, la ED tiende a dirigir a una reducción de la necesidad \nde utilizar los servicios de salud de emergencia y a mejorar los marcadores', 'proceso asistencial y administrativo.\nSe dispone de muchos programas en línea que ofrecen asesoramiento sobre el \nestilo de vida para ayudar con la pérdida de peso y aumentar la actividad física \n(143). Hay programas que tienen como objetivo tratar la prediabetes y prevenir \nla progresión a diabetes siguiendo el modelo del Programa de Prevención de', 'capacitar y/o mejorar el autocuidado en las personas con diabetes?\n• ¿Cuáles son los temas claves que el equipo de salud debe tratar en la \nconsulta de la persona con diabetes, para que mejore su manejo metabólico \ny prevenga o disminuyan las complicaciones?\n• ¿Qué variables deben ser tomadas en cuenta, dentro de la evaluación', 'en que cada uno elija sobre la base de experiencias estructuradas y mediadas, \nen vez de seguir un plan determinado según una convicción institucional.\nObjetivos de aprendizaje / contenidos de la educación sobre la diabetes tipo 2 \n(recién diagnosticada, con sobrepeso):\n1. Entender la importancia de la reducción de peso para reducir la resistencia a', '21\nLista de preguntas clave.\nEl comité seleccionó las siguientes preguntas, como componentes que se \ncubrieron en la guía:\n• ¿En qué modelo de atención debería basarse un programa educativo para \ncapacitar y/o mejorar el autocuidado en las personas con diabetes?\n• ¿Cuáles son los temas claves que el equipo de salud debe tratar en la', 'empowerment strategies for patients with Diabetes Mellitus: A systematic review and meta-analysis. Prim Care Diabetes. abril \nde 2017;11(2):201-11. \n241. Gagliardino JJ, Etchegoyen G, PENDID-LA Research Group. A model educational program for people with type 2 \ndiabetes: a cooperative Latin American implementation study (PEDNID-LA). Diabetes Care. junio de 2001;24(6):1001-7.', 'Medios terapéuticos primarios: En estos pacientes el principal componente \nterapéutico es la reducción de peso para reducir la resistencia a la insulina.\nObjetivo terapéutico: Alcanzar el objetivo terapéutico de glucemia acordado \nmutuamente mediante la mejor reducción posible de la resistencia a la insulina \nexistente.\nEl papel de la nutrición y el enfoque dietético:  La intervención dietética', 'saludable y brinda apoyo social y emocional, que ayuda a mejora la calidad \nde vida de la persona con diabetes (223). Numerosas evidencias, reportadas \nen la literatura, demuestran que las intervenciones educativas en diabetes son \nefectivas y mejoran a corto y mediano plazo el control metabólico (HbA1c, \nlípidos), los factores de riesgo cardiovascular asociados (peso e hipertensión),', '(DPP) to achieve and maintain 7% loss of initial body\nweight and increase moderate-intensity physical\nactivity (such as brisk walking) to at least 150\nmin/week.A\n3.3 A variety of eating patterns are acceptable for persons\nwith prediabetes. B\n3.4 Based on patient preference, technology-assisted\ndiabetes prevention interventions may be effective in\npreventing type 2 diabetes and should be consid-', 'y gestacional, para reducir y minimizar complicaciones agudas y crónicas \nque podrían presentarse, permitiéndoles mejorar su calidad de vida.\n• Establecer contenidos básicos que debe abarcar un programa de educación \ndirigido a personas con diabetes.', 'la diabetes y su tratamiento para evitar el desarrollo de complicaciones \nagudas y crónicas.\nIntervención terapéutica:\n• Educación orientada a adquirir, desarrollar destrezas y mantener \ncomportamientos de autocuidado frente a la diabetes, que logran la \ncorrecta adherencia al tratamiento y seguimiento.\nActores clave y usuarios.', 'Propósitos\nLos propósitos de la guía de práctica clínica de educación en diabetes están \norientados a: \n• Sistematizar prácticas educativas basadas en evidencia, para promover, \nconservar y recuperar la salud de las personas con diabetes tipo 1, tipo 2 \ny gestacional, para reducir y minimizar complicaciones agudas y crónicas \nque podrían presentarse, permitiéndoles mejorar su calidad de vida.', 'células ß, es necesario realizar una evaluación periódica de su función para \nasegurarse de que se sigue cumpliendo el objetivo terapéutico con este tipo de \ndieta. La próxima opción terapéutica es la medicación para reducir la glucosa \nen sangre, normalmente con insulina.\nObjetivos de aprendizaje / contenidos de la educación sobre la DT2 (peso \nnormal, no resistente a la insulina):', 'go reevaluar el tratamiento cuando se haya logrado el control de\nla glucemia.\n7.2 Tratamiento farmacológico de primera línea\nLa metformina de liberación estándar se continúa considerando\ncomo tratamiento farmacológico de primera línea; su dosis debe\nincrementarse de manera gradual a lo largo de semanas para\nminimizar el riesgo de efectos secundarios gastrointestinales. En', 'La guía recomienda un enfoque individualizado para el cuidado\nde la diabetes que se adapte a las necesidades y circunstancias\nde las personas adultas con DM2, de acuerdo a sus preferencias\npersonales, comorbilidades y los riesgos de la polifarmacia, y a\nsu probabilidad de beneﬁciarse de las intervenciones en el lar-\ngo plazo. Recomienda realizar reevaluaciones en cada consulta,']","Para reducir el riesgo de desarrollar diabetes tipo 2, se pueden tomar los siguientes pasos:

1. **Educación y Concienciación**: Entender los factores de riesgo y la fisiopatología de la diabetes para evitar complicaciones agudas y crónicas.
2. **Alimentación Saludable**: Comer fuentes de carbohidratos con alto contenido de fibra y bajo índice glucémico, como frutas, verduras, granos integrales y legumbres. Elegir productos lácteos bajos en grasa y controlar la ingesta de ácidos grasos saturados y trans.
3. **Actividad Física**: Aumentar la actividad física y mantener un estilo de vida activo. Se recomienda al menos 150 minutos de actividad física moderada por semana.
4. **Reducción de Peso**: Para personas con sobrepeso u obesidad, establecer un objetivo inicial de pérdida de peso corporal del 5 al 10%. La reducción de peso es crucial para reducir la resistencia a la insulina.
5. **Automontoreo**: Realizar un seguimiento regular de los niveles de glucosa en sangre y otros parámetros de salud.
6. **Adherencia Terapéutica**: Seguir las recomendaciones médicas y adherirse al tratamiento prescrito, incluyendo la toma de medicamentos si es necesario.
7. **Programas de Apoyo al Autocuidado**: Participar en programas estandarizados de apoyo al autocuidado que incluyan educación sobre alimentación saludable, actividad física, automonitoreo y adherencia terapéutica.

Estos pasos, basados en la educación y el empoderamiento del autocuidado, son fundamentales para prevenir y manejar la diabetes tipo 2 de manera efectiva.","Para reducir el riesgo de desarrollar diabetes tipo 2, los pasos clave incluyen mantener un peso saludable mediante dieta y ejercicio, consumir una dieta nutritiva rica en fibra y baja en carbohidratos refinados y bebidas azucaradas, aumentar los niveles de actividad física, dejar de fumar, limitar el consumo de alcohol y controlar la prediabetes mediante cambios en el estilo de vida si está presente. Si bien algunos factores de riesgo como la edad y los antecedentes familiares no se pueden modificar, adoptar un estilo de vida saludable puede reducir significativamente el riesgo, especialmente en personas de alto riesgo. La intervención temprana y las modificaciones sostenidas del estilo de vida son cruciales para una prevención eficaz de la diabetes.",1.0,0.8157085756113923,,1.0,1.0,0.7769108704639445,0.8317633738008057
¿Cómo influye el mantenimiento de un peso saludable en el riesgo de desarrollar diabetes tipo 2?,"['adultos con diabetes tipo 2 con sobrepeso u obesidad, se debe\ndiscutir y acordar un objetivo inicial de pérdida de peso corporal\nde 5 a 10 %.\nLa reducción del riesgo de hipoglucemia será un objetivo pri-', 'medida que los participantes en el seguimiento de un año lograban reducciones \nde peso bajas (<5%) a importantes (≥15%) (15).\nLos resultados del estudio Look AHEAD demostraron de forma impresionante \nque cuanto mayor era la pérdida de peso inicial, menor era la recuperación de \npeso durante ocho años de seguimiento (16). Como la reducción de peso es fácil', 'estudio, los resultados del ensayo DIRECT se publicaron recientemente. Los \nautores demostraron que, al cabo de un año, la pérdida de peso asociada a la \nintervención sobre el estilo de vida resultó en la remisión de la diabetes en el \n46% de los participantes. Las tasas de remisión estaban relacionadas con la \nmagnitud de la pérdida de peso, aumentando progresivamente del 7% al 86% a', 'En la mayoría de las personas de peso normal con DT2, la capacidad de producción \nrestante de insulina de las células ß es de sobra y no se observa una resistencia \na la insulina (pronunciada). Una mayor reducción de peso está contraindicada \npor el riesgo de bajo peso y la hemostasia de la glucosa que no puede mejorarse', '46% de los participantes. Las tasas de remisión estaban relacionadas con la \nmagnitud de la pérdida de peso, aumentando progresivamente del 7% al 86% a \nmedida que los participantes en el seguimiento de un año lograban reducciones \nde peso bajas (<5%) a importantes (≥15%) (15).\nLos resultados del estudio Look AHEAD demostraron de forma impresionante', 'a la insulina (pronunciada). Una mayor reducción de peso está contraindicada \npor el riesgo de bajo peso y la hemostasia de la glucosa que no puede mejorarse \npor la pérdida de peso adicional. La remisión eventualmente experimentada de \nla diabetes en los últimos años está a punto de desaparecer como resultado de la \nprogresión del deterioro de las células ß individuales.', 'de masa corporal y presión arterial) y metabólicos (HbA1c y dislipidemia) \nde personas con DM tipo 2, y disminuyó un 64% el costo del tratamiento \nmedicamentoso de la hiperglucemia y otros factores de riesgo cardiovascular \nasociados (241). Complementariamente, la implementación de un programa \neducativo de médicos del primer nivel de atención y personas con DM', 'discutir y acordar un objetivo inicial de pérdida de peso corporal\nde 5 a 10 %.\nLa reducción del riesgo de hipoglucemia será un objetivo pri-\nmordial para las personas que usan insulina o un secretagogo de\ninsulina.\nFinalmente, la cirugía bariátrica está indicada para pacientes\ncon un IMC de 35 o más que tengan diabetes tipo 2 de inicio\nreciente (diagnosticada en los 10 años previos).', 'atención, redujo la incidencia acumulada de complicaciones relacionadas con \nla diabetes y la mortalidad por todas las causas (54). Las personas con diabetes en \nel grupo de intervención, presentaron una reducción del riesgo de enfermedad \ncardiovascular (ECV) en un 56,6%, complicaciones microvasculares en un \n11,9% y mortalidad en un 66,1%. Por otro lado, la utilización de la atención', 'aumentar el empoderamiento del autocuidado de las personas con \ndiabetes?\n• ¿Cuál es el mejor enfoque con base en la evidencia para lograr cambios \nconductuales en personas con diabetes?', 'de insulina). Como la reducción de peso resulta en la reducción o incluso la \nabolición de la resistencia a la insulina, esta es la terapia primaria para estos \npacientes. En condiciones normales de peso corporal, la cantidad de insulina \nnecesaria para lograr una hemostasia normal de la glucosa es baja y puede ser \ncontrolada por la producción de insulina endógena restante, lo que resulta en', '132\nInformación adicional seleccionada\nEl éxito de la reducción de peso requiere un cambio de estilo de vida activo por \nparte del paciente. Los estudios demuestran que el cambio de comportamiento \n(con respecto a la alimentación y la actividad física) siempre puede ser dominado \neficazmente por una determinada proporción de la cohorte de pacientes. A la', 'hiperinsulinemia, la capacidad restante de producción de insulina de las células \nß no es suficiente para alcanzar niveles normoglucémicos (deficiencia relativa \nde insulina). Como la reducción de peso resulta en la reducción o incluso la \nabolición de la resistencia a la insulina, esta es la terapia primaria para estos', '(recién diagnosticada, con sobrepeso):\n1. Entender la importancia de la reducción de peso para reducir la resistencia a \nla insulina –› 2. Aprender a saber y experimentar varios métodos de reducción de \npeso. –› 3. Documentar y explorar sus efectos. –› 4. Elegir el método o métodos \nque mejor coincidan con las preferencias individuales para su aplicación. –› 5. \nMantener el contacto.', 'las familias que tienen un miembro con diabetes o en riesgo de desarrollar \nesta condición.\nAsociada a la adopción de hábitos saludables y al uso racional y oportuno de los \nmedicamentos e insumos, la ED tiende a dirigir a una reducción de la necesidad \nde utilizar los servicios de salud de emergencia y a mejorar los marcadores', 'zados especíﬁcamente para personas con diabetes.\nSe sugiere que las recomendaciones al paciente incluyan ade-\nmás otros aspectos de la modiﬁcación del estilo de vida, como el\naumento de la actividad física y la pérdida de peso. En aquellos\nadultos con diabetes tipo 2 con sobrepeso u obesidad, se debe\ndiscutir y acordar un objetivo inicial de pérdida de peso corporal\nde 5 a 10 %.', 'una remisión de la DT2 tras una pérdida de peso sustancial (15), y el objetivo \nterapéutico previsto se puede lograr durante años. No obstante, dicha remisión \nserá temporal (durará desde unos pocos años hasta décadas) dependiendo de la \nprogresión de la pérdida individual de células ß.\nÉnfasis de la dieta en la terapia de las personas con sobrepeso/obesidad', 'peso. –› 3. Documentar y explorar sus efectos. –› 4. Elegir el método o métodos \nque mejor coincidan con las preferencias individuales para su aplicación. –› 5. \nMantener el contacto.\nDT2, peso normal, no resistente a la insulina\nEn la mayoría de las personas de peso normal con DT2, la capacidad de producción \nrestante de insulina de las células ß es de sobra y no se observa una resistencia', 'en sangre, normalmente con insulina.\nObjetivos de aprendizaje / contenidos de la educación sobre la DT2 (peso \nnormal, no resistente a la insulina):\n1. Entender la importancia de mantenerse dentro del rango de peso normal. –› 2. \nIdentificar y elegir alimentos que contengan CHO de bajo índice glucémico. –› \n3. Elaborar un plan individual de distribución de pequeñas porciones de CHO', 'progresión de la pérdida individual de células ß.\nÉnfasis de la dieta en la terapia de las personas con sobrepeso/obesidad \ncon diagnóstico reciente de DT2 y resistencia a la insulina:\nMedios terapéuticos primarios: En estos pacientes el principal componente \nterapéutico es la reducción de peso para reducir la resistencia a la insulina.', 'necesaria para lograr una hemostasia normal de la glucosa es baja y puede ser \ncontrolada por la producción de insulina endógena restante, lo que resulta en \nuna situación metabólica normoglucémica. Los estudios recientes informan de \nuna remisión de la DT2 tras una pérdida de peso sustancial (15), y el objetivo \nterapéutico previsto se puede lograr durante años. No obstante, dicha remisión', 'mutuamente mediante la mejor reducción posible de la resistencia a la insulina \nexistente.\nEl papel de la nutrición y el enfoque dietético:  La intervención dietética \nhipocalórica será según las preferencias individuales y la situación psicosocial', 'una glucemia casi normal. Los aspectos generales de la “dieta saludable” \npodrían cubrirse posteriormente, siempre que el paciente haya demostrado que \ncomprende y utiliza correctamente los aspectos cruciales para su tipo específico \nde diabetes.\nDiabetes Tipo 2.\nLa DT2 se caracteriza por su desarrollo progresivo que está determinado por el', '(1). There is strong and consistent evidence that obesity management can delay the\nprogression from prediabetes to type 2 diabetes (2–6) and is highly beneﬁcial in treat-\ning type 2 diabetes (7–17). In people with type 2 diabetes and overweight or obesity,\nmodest weight loss improves glycemia and reduces the need for glucose-lowering', 'ensayo clínico piloto aleatorio y controlado de cinco años de duración (7). Los \npacientes seguidos por el Group Care redujeron su peso corporal y mejoraron \nla HbA1c y el colesterol HDL sin aumentar la prescripción de medicamentos. \nNada de lo anterior ocurrió en las personas de control seguidas de la relación \ntradicional proveedor-paciente. El conocimiento de la diabetes y la capacidad de', '(242)(243)(244). En este caso, se ha demostrado que la implementación de un \nprograma estructurado de modalidad grupal, en 10 países de Latinoamérica, \nmejoró en 12 meses de seguimiento, todos los indicadores clínicos (índice \nde masa corporal y presión arterial) y metabólicos (HbA1c y dislipidemia) \nde personas con DM tipo 2, y disminuyó un 64% el costo del tratamiento', 'risk individuals.\nAmong people with type 2 diabetes\nand overweight or obesity who have in-\nadequate glycemic, blood pressure, and\nlipid management and/or other obesity-\nrelated metabolic complications, modest\nand sustained weight loss (3–7% of body\nweight) improves glycemia, blood pres-\nsure, and lipids and may reduce the need\nfor disease-speciﬁc medications (7–9,40). In', 'diabetes and overweight or obesity (41), it\ndid conﬁrm the feasibility of achieving and\nmaintaining long-term weight loss in peo-\nple with type 2 diabetes. In the intensive\nlifestyle intervention group, mean weight\nloss was 4.7% at 8 years (42). Approxi-\nmately 50% of intensive lifestyle interven-\ntion participants lost and maintained$5%\nof their initial body weight, and 27% lost', 'de la persona, siendo sensible a su voluntad de cambio y los efec-\ntos en su calidad de vida.\nSe aconseja estimular a los adultos con diabetes tipo 2 a seguir\nlos mismos consejos de alimentación saludable que la población\ngeneral, que incluyen: comer fuentes de carbohidratos con alto\ncontenido de ﬁbra y bajo índice glucémico, como frutas, verdu-', 'Medios terapéuticos primarios: En estos pacientes el principal componente \nterapéutico es la reducción de peso para reducir la resistencia a la insulina.\nObjetivo terapéutico: Alcanzar el objetivo terapéutico de glucemia acordado \nmutuamente mediante la mejor reducción posible de la resistencia a la insulina \nexistente.\nEl papel de la nutrición y el enfoque dietético:  La intervención dietética', 'physical activity, calorie restriction, weight\nmanagement strategies, and motivation.\nThere is strong and consistent evidence\nthat modest, sustained weight loss can delay\nthe progression from prediabetes to type 2\ndiabetes (103,105,106) (see Section 3,\n“Prevention or Delay of Diabetes and\nAssociated Comorbidities”) and is beneﬁ-\ncial for the management of type 2 diabe-', 'Cómo tratar mi diabetes. 3rd ed. CENEXA-press, Buenos Aires. ISBN 987-98423-4-0\n21. Lencioni C, Lupi R, Del Prato S. Beta-cell failure in type 2 diabetes mellitus. Curr Diab Rep 2008; 8: \n179-84. doi: 10.1007/s11892-008-0031-0\n22. The Look AHEAD Research Group (2014) Eight-year weight losses with an intensive lifestyle \nintervention. Obesity (Silver Spring) 22: 5-13', 'saludable y brinda apoyo social y emocional, que ayuda a mejora la calidad \nde vida de la persona con diabetes (223). Numerosas evidencias, reportadas \nen la literatura, demuestran que las intervenciones educativas en diabetes son \nefectivas y mejoran a corto y mediano plazo el control metabólico (HbA1c, \nlípidos), los factores de riesgo cardiovascular asociados (peso e hipertensión),', 'carga para los sistemas de salud y la sociedad. Esta carga socioeconómica se \npuede reducir mediante un adecuado control de la glucemia y de los factores \nde riesgo cardiovascular asociados.\nLa educación de las personas con riesgo de desarrollar diabetes se considera \nun aspecto fundamental de las estrategias de prevención y tratamiento de la', 'Los resultados sobre objetivos glicémicos, muestran reducciones transitorias en \nla hemoglobina glicosilada, que requieren de refuerzos posteriores para persistir \nen el tiempo (182). Se ha visto que los mayores beneficios se obtienen con \naquellos participantes que presentan hemoglobinas glicosiladas mayores previo \na la actividad y en quienes asisten más veces (182). También se ha reportado', 'people at risk, 3–7% weight loss reduces\nprogression to diabetes (2,7,8,41,42).\nGreater weight loss may produce addi-\ntional beneﬁts (20,21). Mounting data\nhave shown that>1 0% body weight loss\nusually confers greater beneﬁts on glyce-\nmia and possibly diabetes remission and\nimproves other metabolic comorbidities,\nincluding cardiovascular outcomes, nonal-', 'tant factor in reducing the risk of progres-\nsion, with every kilogram of weight loss\nconferring a 16% reduction in risk of pro-\ngression over 3.2 years (12). In individuals\nwith previous history of GDM, the risk of\ntype 2 diabetes increased by 18% for ev-\nery 1 unit BMI above the preconception\nbaseline (76). Several medications evalu-\nated for weight loss (e.g., orlistat, phenter-', 'que cuanto mayor era la pérdida de peso inicial, menor era la recuperación de \npeso durante ocho años de seguimiento (16). Como la reducción de peso es fácil \nen comparación con el mantenimiento de un peso reducido, los programas de \nreducción de peso deben estar diseñados para centrarse en la fase de control de \npeso a mediano y largo plazo.', 'o GIP/GLP1-twincretin como los fármacos para la reducción efectiva del peso y \nde la HbA1c. Su impacto seguro, eficaz y sostenible en la vida cotidiana sigue \nsiendo objeto de debate.\nComo enfoque nutricional VLCD puro en el control de peso dirigido por la \natención primaria, centrado en los productos de fórmula en la fase inicial del', 'efectivas y mejoran a corto y mediano plazo el control metabólico (HbA1c, \nlípidos), los factores de riesgo cardiovascular asociados (peso e hipertensión), \nlos conocimientos sobre la diabetes y la adopción de estilos de vida saludable, \nmejorando así la calidad de vida (224)(225)(226).', 'adultos?\n• ¿Cuál es la importancia de la tecnología en la educación en diabetes?\n• ¿Qué impacto psicológico tiene la diabetes, su tratamiento y cómo \ndetectarlo?\n• ¿Son los campamentos recreativos-educativos una estrategia eficaz para \naumentar el empoderamiento del autocuidado de las personas con \ndiabetes?\n• ¿Cuál es el mejor enfoque con base en la evidencia para lograr cambios', 'goal of at least 150 min of physical activ-\nity per week, even without achieving the\nweight loss goal, reduced the incidence\nof type 2 diabetes by 44% (12).\nThe 7% weight loss goal was selected\nbecause it was feasible to achieve and\nmaintain and likely to lessen the risk of de-\nveloping diabetes (as well as improve other\ncardiometabolic risk factors). Participants', 'because it was feasible to achieve and\nmaintain and likely to lessen the risk of de-\nveloping diabetes (as well as improve other\ncardiometabolic risk factors). Participants\nwere encouraged to achieve the $7%\nweight loss during theﬁrst 6 months of\nthe intervention. Further analysis suggests\nhigher beneﬁt for prevention of diabetes\nwith at least 7–10% weight loss with life-', 'achieve and maintain a weight reduc-\ntion of at least 7% of initial body weight\nthrough healthy reduced-calorie diet\nand $150 min/week of moderate-\nintensity physical activity.A\n3.4 A variety of eating patterns can be\nconsidered to prevent type 2 diabetes\nin individuals with prediabetes.B\n3.5Given the cost-effectiveness of lifestyle\nbehavior modiﬁcation programs for diabe-', 'ing type 2 diabetes (7–17). In people with type 2 diabetes and overweight or obesity,\nmodest weight loss improves glycemia and reduces the need for glucose-lowering\nmedications (7–9), and larger weight loss substantially reduces A1C and fasting glu-\ncose and may promote sustained diabetes remission (11,18–22). Metabolic surgery,', 'style modiﬁc a t i o nl e dt oa ne q u i v a l e n t\n50% reduction in diabetes risk (91). Both\ninterventions remained highly effective\nduring a 10-year follow-up period (92). By\nthe time of the 15-year follow-up (DPPOS),\nexploratory analyses demonstrated that\nparticipants with a higher baseline fasting\nglucose ($110 mg/dL [$6m m o l / L ]v s .', '(con respecto a la alimentación y la actividad física) siempre puede ser dominado \neficazmente por una determinada proporción de la cohorte de pacientes. A la \nvista de los que no logran la necesaria modificación del estilo de vida, desde \nhace décadas surgieron enfoques farmacológicos con varios tipos de fármacos \nreductores de peso que desaparecieron ampliamente debido a su fracaso o', 'un conjunto inespecífico de reglas, independientemente del tipo, el estadio y \nla estrategia de medicación de la enfermedad. Afortunadamente, en los últimos \naños esta actitud ha cambiado: los componentes relevantes de la intervención \nnutricional en el tratamiento de la diabetes dependen del tipo de diabetes, \nde la medicación utilizada y de las preferencias particulares del paciente. La', 'proceso asistencial y administrativo.\nSe dispone de muchos programas en línea que ofrecen asesoramiento sobre el \nestilo de vida para ayudar con la pérdida de peso y aumentar la actividad física \n(143). Hay programas que tienen como objetivo tratar la prediabetes y prevenir \nla progresión a diabetes siguiendo el modelo del Programa de Prevención de', 'siendo objeto de debate.\nComo enfoque nutricional VLCD puro en el control de peso dirigido por la \natención primaria, centrado en los productos de fórmula en la fase inicial del \nestudio, los resultados del ensayo DIRECT se publicaron recientemente. Los \nautores demostraron que, al cabo de un año, la pérdida de peso asociada a la']","El mantenimiento de un peso saludable es crucial para reducir el riesgo de desarrollar diabetes tipo 2. La evidencia muestra que una pérdida de peso modesta pero sostenida, incluso del 3 al 7%, puede retrasar la progresión de la prediabetes a diabetes tipo 2 y mejorar los factores de riesgo cardiometabólico. Además, una mayor pérdida de peso, especialmente en personas con sobrepeso u obesidad, puede resultar en una mejora significativa en la glicemia y en la reducción de la necesidad de medicamentos para bajar el azúcar en sangre.

En estudios como el Look AHEAD, se demostró que cuanto mayor era la pérdida de peso inicial, menor era la recuperación de peso a lo largo del tiempo, lo que subraya la importancia de mantener un peso saludable a largo plazo. La reducción de peso también está asociada con la reducción de la resistencia a la insulina, lo que es un componente terapéutico primario para personas con diabetes tipo 2 y sobrepeso u obesidad.

En resumen, mantener un peso saludable es una estrategia efectiva para prevenir y manejar la diabetes tipo 2, mejorando tanto los marcadores metabólicos como la calidad de vida de las personas afectadas.","Mantener un peso saludable es una de las estrategias más efectivas para reducir el riesgo de desarrollar diabetes tipo 2. El exceso de peso corporal, especialmente la obesidad abdominal, es un factor de riesgo importante que promueve la resistencia a la insulina y dificulta la regulación del azúcar en sangre. Incluso una pérdida de peso modesta puede mejorar sustancialmente la sensibilidad a la insulina y el metabolismo de la glucosa, reduciendo significativamente el riesgo de progresar de prediabetes a diabetes tipo 2. El riesgo aumenta progresivamente con el aumento del índice de masa corporal por encima del rango normal. El control del peso mediante cambios en la dieta y la actividad física es fundamental en los esfuerzos de prevención de la diabetes, especialmente para personas con sobrepeso u obesidad.",1.0,0.6666515377747125,,1.0,1.0,0.48855407122960454,0.8633071940093273
¿Cómo se relaciona la prediabetes con el desarrollo de la diabetes tipo 2?,"['objetivos terapéuticos recomendados, incrementando el riego del desarrollo y \nprogresión de sus complicaciones crónicas (222). Este contexto convierte a la \ndiabetes en un creciente problema de salud pública, constituyendo una pesada \ncarga para los sistemas de salud y la sociedad. Esta carga socioeconómica se \npuede reducir mediante un adecuado control de la glucemia y de los factores', 'creciente a nivel mundial. Asimismo, como consecuencia de la combinación \nde un diagnóstico tardío, inadecuada calidad de la atención y acceso desigual \na la atención y tratamiento, muchas personas con diabetes no alcanzan los \nobjetivos terapéuticos recomendados, incrementando el riego del desarrollo y \nprogresión de sus complicaciones crónicas (222). Este contexto convierte a la', '8\nde los aspectos en los que no se hubiere alcanzado el desarrollo requerido, para \nconcretar un verdadero apoyo a las personas con diabetes y sus familiares.\nPoblación objetivo.\nLa guía se dirige a personas con diabetes tipo 1, tipo 2, gestacional y otros tipos \nde diabetes, personas con prediabetes y personas con un puntaje de Findrisc', 'comprende y utiliza correctamente los aspectos cruciales para su tipo específico \nde diabetes.\nDiabetes Tipo 2.\nLa DT2 se caracteriza por su desarrollo progresivo que está determinado por el \nritmo individualmente diferente en el curso de la insuficiencia/disfunción de las \ncélulas ß (12)(13)(14). Los pacientes con DT2 presentan diferentes características', 'progresión de la pérdida individual de células ß.\nÉnfasis de la dieta en la terapia de las personas con sobrepeso/obesidad \ncon diagnóstico reciente de DT2 y resistencia a la insulina:\nMedios terapéuticos primarios: En estos pacientes el principal componente \nterapéutico es la reducción de peso para reducir la resistencia a la insulina.', 'Multiple factors, including age, BMI, and\nother comorbidities, may inﬂuence the\nrisk of progression to diabetes and lifetime\nrisk of complications (121,122). Prediabe-\ntes is associated with increased cardiovas-\ncular disease and mortality (102), which\nemphasizes the importance of attending\nto cardiovascular risk in this population.\nIn the DPP, which enrolled high-risk indi-', 'una glucemia casi normal. Los aspectos generales de la “dieta saludable” \npodrían cubrirse posteriormente, siempre que el paciente haya demostrado que \ncomprende y utiliza correctamente los aspectos cruciales para su tipo específico \nde diabetes.\nDiabetes Tipo 2.\nLa DT2 se caracteriza por su desarrollo progresivo que está determinado por el', 'partes principales:\n• Diabetes de tipo 1 (DT1).\n• Diabetes de tipo 2 (DT2), sobrepeso, recientemente diagnosticada, \nresistente a la insulina.\n• DT2, peso normal, no resistente a la insulina.\n• DT2, tratamiento con insulina.', 'the DPP/DPPOS who were at particularly\nhigh risk of progression to diabetes (crude\nincidence of diabetes 14–22 cases per 100\nperson-years) included BMI$35 kg/m2,\nhigher glucose levels (e.g., fasting plasma\nglucose 110–125 mg/dL [6–6.9 mmol/L],\n2–h postchallenge glucose 173–199 mg/dL\n[9.6–11.0 mmol/L], and A1C $6.0%\n[$42 mmol/mol]), and a history of GDM\n(4,91,92). In contrast, in the community-', '(143). Hay programas que tienen como objetivo tratar la prediabetes y prevenir \nla progresión a diabetes siguiendo el modelo del Programa de Prevención de \nDiabetes (DPP) (144)(145). Otros ayudan en la mejora de resultados, mediante el', 'Cómo tratar mi diabetes. 3rd ed. CENEXA-press, Buenos Aires. ISBN 987-98423-4-0\n21. Lencioni C, Lupi R, Del Prato S. Beta-cell failure in type 2 diabetes mellitus. Curr Diab Rep 2008; 8: \n179-84. doi: 10.1007/s11892-008-0031-0\n22. The Look AHEAD Research Group (2014) Eight-year weight losses with an intensive lifestyle \nintervention. Obesity (Silver Spring) 22: 5-13', '130\nDT2, sobrepeso, recientemente diagnosticado, resistente a la insulina\nEn una persona con sobrepeso y con una DT2 recientemente diagnosticada, \nes común que se manifieste la resistencia a la insulina. A pesar de la \nhiperinsulinemia, la capacidad restante de producción de insulina de las células \nß no es suficiente para alcanzar niveles normoglucémicos (deficiencia relativa', 'y las recomendaciones para cada una de las características específicas de \nlos diferentes tipos de diabetes y sus etapas. En consecuencia, siguiendo el \nllamamiento a la individualización terapéutica, este tema se subdivide en cuatro \npartes principales:\n• Diabetes de tipo 1 (DT1).\n• Diabetes de tipo 2 (DT2), sobrepeso, recientemente diagnosticada, \nresistente a la insulina.', '19. DeFronzo RA, Bonadonna RC, Ferrannini E. Pathogenesis of NIDDM: A balanced overview. Diabetes \nCare 1992; 15: 318-68. doi: 10.2337/diacare.15.3.318\n20. Gagliardino JJ, Assad D, Gagliardino GG, Kronsbein P, Lahera E, Mercuri N, Rizzuti L, Zufriategui Z. \nCómo tratar mi diabetes. 3rd ed. CENEXA-press, Buenos Aires. ISBN 987-98423-4-0', 'Your health care provider will make changes based on your treatment needs.\nRisk Factors for Type 2 Diabetes? \nScientists do not know the exact cause of type 2 diabetes. However, developing type 2 diabetes has been \nlinked with several risk factors. These include if you: \n• Have a history of hyperglycemia (high blood glucose), such as prediabetes and/or gestational \ndiabetes.', 'based Atherosclerosis Risk in Communi-\nties (ARIC) study, observational follow-up\nof adults with mean age 75 years with\nlaboratory evidence of prediabetes\n(based on A1C 5.7–6.4% [39–47 mmol/mol]\nand/or fasting glucose 100–125 mg/dL\n[5.6–6.9 mmol/L]), but not meeting speciﬁc\nBMI criteria, found lower progression to\ndiabetesjournals.org/care Prevention or Delay of Diabetes S47', 'prediabetes are deﬁned by the presence\nof IFG and/or IGT and/or A1C 5.7–6.4%\n(39–47 mmol/mol) (Table 2.2). As predi-\nabetes is an intermediate state between\nnormoglycemia and diabetes, it is clearly\nas i g n iﬁcant risk factor for progression to\ndiabetes as well as cardiovascular disease\nand several other cardiometabolic out-\ncomes. Criteria for screening for diabetes', 'Care 2016;39:1635–1642\n122. Rooney MR, Rawlings AM, Pankow JS, et al.\nRisk of progression to diabetes among older\nadults with prediabetes. JAMA Intern Med 2021;\n181:511–519\n123. Lachin JM, Christophi CA, Edelstein SL,\net al.; DDK Research Group. Factors associated\nwith diabetes onset during metformin versus\nplacebo therapy in the diabetes prevention\nprogram. Diabetes 2007;56:1153–1159', 'with insulin resistance. Diabetes Obes Metab\n2022;24:1150–1158\n121. Nadeau KJ, Anderson BJ, Berg EG, et al.\nYouth-onset type 2 diabetes consensus report:\ncurrent status, challenges, and priorities. Diabetes\nCare 2016;39:1635–1642\n122. Rooney MR, Rawlings AM, Pankow JS, et al.\nRisk of progression to diabetes among older\nadults with prediabetes. JAMA Intern Med 2021;\n181:511–519', 'outlined inTable 2.4. Prediabetes is asso-\nciated with obesity (especially abdominal\nor visceral obesity), dyslipidemia with high\ntriglycerides and/or low HDL cholesterol,\nand hypertension. The presence of predi-\nabetes should prompt comprehensive\nscreening for cardiovascular risk factors.\nDiagnosis of Prediabetes\nIFG is deﬁned as FPG levels from 100 to\n125 mg/dL (from 5.6 to 6.9 mmol/L)', 'de riesgo cardiovascular asociados.\nLa educación de las personas con riesgo de desarrollar diabetes se considera \nun aspecto fundamental de las estrategias de prevención y tratamiento de la \nenfermedad. La educación es un proceso continuo y progresivo, que permite \na la persona comprender y formar parte activa y efectiva de su control y', 'ritmo individualmente diferente en el curso de la insuficiencia/disfunción de las \ncélulas ß (12)(13)(14). Los pacientes con DT2 presentan diferentes características \ny estrategias de tratamiento. Por lo tanto, el papel y la importancia de la terapia \nnutricional van desde la “terapia de primera línea” hasta la “baja” para la \npersona individual con DT2.', 'una remisión de la DT2 tras una pérdida de peso sustancial (15), y el objetivo \nterapéutico previsto se puede lograr durante años. No obstante, dicha remisión \nserá temporal (durará desde unos pocos años hasta décadas) dependiendo de la \nprogresión de la pérdida individual de células ß.\nÉnfasis de la dieta en la terapia de las personas con sobrepeso/obesidad', 'Pacientes con alto riesgo cardiovascular: un inhibidor de\nSGLT2.\nFigura 1.Primera línea de tratamiento farmacológico de la diabetes tipo 2 en adultos. Resumen esquemático de las recomendaciones\nde la actualización 2022 de la guía NICE 1. Notas: SGLT2: cotransportador sodio-glucosa tipo 2; DPP-4: Dipeptidil peptidasa-4\n7.3 Progresión del tratamiento', 'HbA1c as a predictor of diabetes and as an\noutcome in the diabetes prevention program: a\nrandomized clinical trial. Diabetes Care 2015;38:\n51–58\n8. Echouffo-Tcheugui JB, Selvin E. Prediabetes\nand what it means: the epidemiological evidence.\nAnnu Rev Public Health 2021;42:59–77\n9. Chadha C, Pittas AG, Lary CW , et al.; D2d\nResearch Group. Reproducibility of a prediabetes', 'diabetes are at an approximately twofold\nhigher risk of developing acute pancreatitis\n(270).\nConversely, prediabetes and/or diabe-\ntes has been found to develop in approxi-\nmately one-third of individuals after an\nepisode of acute pancreatitis (271); thus,\nthe relationship is likely bidirectional.\nPostpancreatitis diabetes may include\neither new-onset disease or previously', 'What is prediabetes?\nPrediabetes is a condition that occurs when your blood \nglucose is higher than normal but not high enoughto be \ndiabetes. This condition puts you at risk for developing \ntype 2 diabetes.\nResults indicating prediabetes are:\n■  an A1C of 5.7%–6.4%.\n■  fasting blood glucose of 100–125 mg/dL.\n■  two-hour blood glucose of 140 mg/dL–199 mg/dL.', 'tivity compared to fasting plasma glucose in diagnosing DM.\nTable 1.4. Risk factors for development of Type 2 diabetes mellitus\n. Age /C2145 years\n. Increased body weight (body mass index /C2125 Kg/m2)\n. Family history of Type 2 diabetes\n. Sedentary lifestyle\n. History of gestational diabetes or child birth weighing > 4k g\n. Hypertension (/C21140/90 mmHg)', 'En la mayoría de las personas de peso normal con DT2, la capacidad de producción \nrestante de insulina de las células ß es de sobra y no se observa una resistencia \na la insulina (pronunciada). Una mayor reducción de peso está contraindicada \npor el riesgo de bajo peso y la hemostasia de la glucosa que no puede mejorarse', 'type 2 diabetes.\nResults indicating prediabetes are:\n■  an A1C of 5.7%–6.4%.\n■  fasting blood glucose of 100–125 mg/dL.\n■  two-hour blood glucose of 140 mg/dL–199 mg/dL.\nReviewers included: Shana Cunningham, MSN, RN, MLDE, BC-ADM, CDCES; Laura Hieronymus, DNP , MSEd, RN, MLDE, \nBC-ADM, CDCES, FADCES; and Sean Petrie', 'those with islet autoantibodies, factors\nthat may increaseb-cell demand includ-\ning less physical activity (65), higher die-\ntary glycemic index (66), and total sugar\nintake (67) are associated with progression\nto clinical diabetes. Similar associations\nhave not been seen in the development of\nautoantibodies. In The Environmental\nDeterminants of Diabetes in the Young', '10\nIntervención preventiva:\n• Educación orientada a los factores de riesgo de desarrollo de la diabetes.\n• Educación orientada a la comprensión de aspectos fisiopatológicos de \nla diabetes y su tratamiento para evitar el desarrollo de complicaciones \nagudas y crónicas.\nIntervención terapéutica:\n• Educación orientada a adquirir, desarrollar destrezas y mantener', 'Es muy importante explicar a las personas con nuevo diagnóstico de diabetes \nmellitus tipo 2 la naturaleza progresiva de la enfermedad, especificando que \nesto incluye la terapia con insulina y no se trata de una consecuencia del fracaso \nde la persona (123)(124).\nTanto en adultos como en grupos de todas las edades, la terapia con pluma puede', 'de masa corporal y presión arterial) y metabólicos (HbA1c y dislipidemia) \nde personas con DM tipo 2, y disminuyó un 64% el costo del tratamiento \nmedicamentoso de la hiperglucemia y otros factores de riesgo cardiovascular \nasociados (241). Complementariamente, la implementación de un programa \neducativo de médicos del primer nivel de atención y personas con DM', 'luar su tolerabilidad y eﬁcacia (Ver Figura 2).\nFigura 2.Intensiﬁcación del tratamiento farmacológico de la diabetes tipo 2 en adultos. Resumen esquemático de las pautas sugeridas\npor la actualización 2022 de la guía NICE 1. Notas: DPP-4: Dipeptidil peptidasa-4; GLP-1: péptido similar al glucagón tipo 1; SGLT2:\ncotransportador sodio-glucosa tipo 2', 'peso. –› 3. Documentar y explorar sus efectos. –› 4. Elegir el método o métodos \nque mejor coincidan con las preferencias individuales para su aplicación. –› 5. \nMantener el contacto.\nDT2, peso normal, no resistente a la insulina\nEn la mayoría de las personas de peso normal con DT2, la capacidad de producción \nrestante de insulina de las células ß es de sobra y no se observa una resistencia', 'Justificación\nEl manejo de la diabetes mellitus tipo 1 y tipo 2, implica atención clínica y permite \nque las personas con diabetes adopten comportamientos de autocuidado. Es \nimportante tener en cuenta que la adquisición de conocimientos por sí sola no es \nsuficiente para que las personas logren cambios de comportamiento, el enfoque', 'proceso asistencial y administrativo.\nSe dispone de muchos programas en línea que ofrecen asesoramiento sobre el \nestilo de vida para ayudar con la pérdida de peso y aumentar la actividad física \n(143). Hay programas que tienen como objetivo tratar la prediabetes y prevenir \nla progresión a diabetes siguiendo el modelo del Programa de Prevención de', 'primario es la insulina para poder sobrevivir.\nEl objetivo terapéutico: La casi-normoglucemia como objetivo terapéutico \nporque previene el desarrollo y la progresión de las complicaciones crónicas \nde la enfermedad, como la nefropatía diabética, la neuropatía y la retinopatía \n(4) que disminuyen la calidad y la esperanza de vida del paciente y aumentan', 'linked with several risk factors. These include if you: \n• Have a history of hyperglycemia (high blood glucose), such as prediabetes and/or gestational \ndiabetes.\n• Are 45 years old or older. \n• Are Black or African American, Hispanic or Latino, American Indian or Alaska Native, Asian,  \nor Native Hawaiian or other Pacific Islander. \n• Have a parent, brother, or sister with diabetes.', 'estudio, los resultados del ensayo DIRECT se publicaron recientemente. Los \nautores demostraron que, al cabo de un año, la pérdida de peso asociada a la \nintervención sobre el estilo de vida resultó en la remisión de la diabetes en el \n46% de los participantes. Las tasas de remisión estaban relacionadas con la \nmagnitud de la pérdida de peso, aumentando progresivamente del 7% al 86% a', 'adultos?\n• ¿Cuál es la importancia de la tecnología en la educación en diabetes?\n• ¿Qué impacto psicológico tiene la diabetes, su tratamiento y cómo \ndetectarlo?\n• ¿Son los campamentos recreativos-educativos una estrategia eficaz para \naumentar el empoderamiento del autocuidado de las personas con \ndiabetes?\n• ¿Cuál es el mejor enfoque con base en la evidencia para lograr cambios', 'de la actualización 2022 de la guía NICE 1. Notas: SGLT2: cotransportador sodio-glucosa tipo 2; DPP-4: Dipeptidil peptidasa-4\n7.3 Progresión del tratamiento\nDe no lograrse el control glucémico con las opciones de prime-\nra línea, iniciar o incrementar la terapia combinada, introduciendo\nlos nuevos medicamentos de manera gradual, con el ﬁn de eva-\nluar su tolerabilidad y eﬁcacia (Ver Figura 2).', 'Nada de lo anterior ocurrió en las personas de control seguidas de la relación \ntradicional proveedor-paciente. El conocimiento de la diabetes y la capacidad de \nresolución de problemas mejoraron de forma constante y seguían mejorando en \nel quinto año entre las personas seguidas por la educación para la autogestión, \naunque la mayoría de ellas eran de edad avanzada y tenían poca o ninguna', '(1). There is strong and consistent evidence that obesity management can delay the\nprogression from prediabetes to type 2 diabetes (2–6) and is highly beneﬁcial in treat-\ning type 2 diabetes (7–17). In people with type 2 diabetes and overweight or obesity,\nmodest weight loss improves glycemia and reduces the need for glucose-lowering', 'necesaria para lograr una hemostasia normal de la glucosa es baja y puede ser \ncontrolada por la producción de insulina endógena restante, lo que resulta en \nuna situación metabólica normoglucémica. Los estudios recientes informan de \nuna remisión de la DT2 tras una pérdida de peso sustancial (15), y el objetivo \nterapéutico previsto se puede lograr durante años. No obstante, dicha remisión', 'complicando el tratamiento de la diabetes (9)(10).\nConducta alimentaria problemática y trastornos alimentarios son más prevalentes \nen la diabetes, particularmente entre las mujeres jóvenes con diabetes tipo 1 \n(11). Los más comunes son el trastorno por atracón y la bulimia nerviosa, a \nmenudo asociada con una disregulación emocional y disturbios de la imagen.', 'vention of type 2 diabetes mellitus by changes in\nlifestyle among subjects with impaired glucose\ntolerance. N Engl J Med 2001;344:1343–1350\n7. Diabetes Prevention Program Research Group.\nHbA1c as a predictor of diabetes and as an\noutcome in the diabetes prevention program: a\nrandomized clinical trial. Diabetes Care 2015;38:\n51–58\n8. Echouffo-Tcheugui JB, Selvin E. Prediabetes', 'la observación y el problema deben ser suficientemente atractivos, despertar el \ninterés y ser suficientemente accesibles, es decir, que puedan manejarse.\nEste tipo de estrategia educativa asegura que la transferencia del conocimiento \na la persona sea de manera más efectiva a sus situaciones de la vida real. “La \neducación del paciente es la piedra angular de la terapia”.\nUtilizando el error.', '(36).\nIn both type 1 and type 2 diabetes, ge-\nnetic and environmental factors can re-\nsult in the progressive loss ofb-cell mass\nand/or function that manifests clinically\nas hyperglycemia. Once hyperglycemia\noccurs, people with all forms of diabetes\nare at risk for developing the same\nchronic complications, although rates of\nprogression may differ. The identiﬁcation']","La prediabetes se relaciona con el desarrollo de la diabetes tipo 2 de varias maneras importantes:

1. **Estado Intermedio**: La prediabetes es un estado intermedio entre la normoglucemia y la diabetes. Esto significa que los niveles de glucosa en sangre están más altos de lo normal, pero no lo suficientemente altos como para ser diagnosticados como diabetes.

2. **Riesgo Elevado**: Las personas con prediabetes tienen un riesgo significativamente mayor de desarrollar diabetes tipo 2 en comparación con aquellas que tienen niveles normales de glucosa en sangre.

3. **Factores de Riesgo**: La prediabetes está asociada con varios factores de riesgo, como la obesidad (especialmente la obesidad abdominal), la dislipidemia (niveles altos de triglicéridos y/o niveles bajos de HDL colesterol), y la hipertensión. Estos factores también aumentan el riesgo de desarrollar diabetes tipo 2.

4. **Progresión a Diabetes**: La prediabetes puede progresar a diabetes tipo 2 si no se toman medidas preventivas. Estudios han demostrado que la intervención en el estilo de vida, como la pérdida de peso y el aumento de la actividad física, puede retrasar o prevenir la progresión a diabetes tipo 2.

5. **Riesgo Cardiovascular**: La prediabetes también está asociada con un mayor riesgo de enfermedades cardiovasculares y otros problemas de salud, lo que subraya la importancia de atender a los factores de riesgo cardiovascular en esta población.

Es fundamental que las personas con prediabetes reciban educación y apoyo para hacer cambios en su estilo de vida y reducir su riesgo de desarrollar diabetes tipo 2.","La prediabetes es una condición de salud grave que aumenta significativamente el riesgo de desarrollar diabetes tipo 2. Es una etapa previa en la que los niveles de azúcar en sangre son más altos de lo normal y las células del cuerpo se vuelven resistentes a la insulina. Sin cambios en el estilo de vida, el riesgo de progresar de prediabetes a diabetes tipo 2 es muy alto, ya que comparten la misma causa subyacente de resistencia a la insulina. Sin embargo, la progresión no es inevitable: intervenciones oportunas como la pérdida de peso, el ejercicio y las modificaciones dietéticas en la etapa de prediabetes pueden ayudar a prevenir o retrasar la aparición de la diabetes tipo 2. La prediabetes ofrece una importante ventana de oportunidad para la prevención mediante cambios en el estilo de vida.",1.0,1.0000000000000002,,1.0,1.0,0.8513603167199014,0.8108466722850114
¿Qué valores de IMC se consideran indicativos de sobrepeso para diferentes grupos étnicos?,"['insulina.\nFinalmente, la cirugía bariátrica está indicada para pacientes\ncon un IMC de 35 o más que tengan diabetes tipo 2 de inicio\nreciente (diagnosticada en los 10 años previos).\n4. Diagnóstico y manejo de la hipertensión arterial\nEl diagnóstico, tratamiento y monitoreo de la hipertensión arte-\nrial (HTA) es, en general, el mismo para las personas con dia-', 'Accessed 3 September 2023. Available from\nhttps://www.who.int/health-topics/obesity#tab=\ntab_1\n26. WHO Expert Consultation. Appropriate\nbody-mass index for Asian populations and its\nimplications for policy and intervention strategies.\nLancet 2004;363:157–163\n27. Araneta MR, Kanaya AM, Hsu WC, et al.\nOptimum BMI cut points to screen Asian Americans', 'implications for policy and intervention strategies.\nLancet 2004;363:157–163\n27. Araneta MR, Kanaya AM, Hsu WC, et al.\nOptimum BMI cut points to screen Asian Americans\nfor type 2 diabetes. Diabetes Care 2015;38:814–820\n28. Aggarwal R, Bibbins-Domingo K, Yeh RW,\net al. Diabetes screening by race and ethnicity in\nthe United States: equivalent body mass index', 'Type 2 diabetes is more common in African Americans, \nHispanics/Latinos, Native Americans, Asian Americans, \nand Native Hawaiians and Pacific Islanders.\nHigher body weight increases diabetes risk for everyone. \nAsian Americans are at increased diabetes risk at lower \nbody weight than the rest of the general public (about 15 \npounds lower).\nIf you scored 5 or higher:\nLower Your Risk', 'in populations with different body com-\nposition and cardiometabolic risk (28). A\ndiagnosis of obesity should be made\nbased on an overall assessment of the in-\ndividual’s adipose tissue mass (BMI can\nbe used as a general guidance), distribution\n(using other anthropometric measurements\nlike waist circumference, waist-to-hip cir-\ncumference ratio, or waist-to-height', 'Exchange Racial Differences Study Group. Racial\ndifferences in the relationship of glucose con-\ncentrations and hemoglobin A1c levels. Ann\nIntern Med 2017;167:95–102\n10. Herman WH, Ma Y, Uwaifo G, et al.; Diabetes\nPrevention Program Research Group. Differences\nin A1C by race and ethnicity among patients with\nimpaired glucose tolerance in the Diabetes\nPrevention Program. Diabetes Care 2007;30:', 'partes principales:\n• Diabetes de tipo 1 (DT1).\n• Diabetes de tipo 2 (DT2), sobrepeso, recientemente diagnosticada, \nresistente a la insulina.\n• DT2, peso normal, no resistente a la insulina.\n• DT2, tratamiento con insulina.', 'discutir y acordar un objetivo inicial de pérdida de peso corporal\nde 5 a 10 %.\nLa reducción del riesgo de hipoglucemia será un objetivo pri-\nmordial para las personas que usan insulina o un secretagogo de\ninsulina.\nFinalmente, la cirugía bariátrica está indicada para pacientes\ncon un IMC de 35 o más que tengan diabetes tipo 2 de inicio\nreciente (diagnosticada en los 10 años previos).', 'populations: a transethnic genome-wide meta-\nanalysis. PLoS Med 2017;14:e1002383\n22. Bergenstal RM, Gal RL, Connor CG, et al.;\nT1D Exchange Racial Differences Study Group.\nRacial differences in the relationship of glucose\nconcentrations and hemoglobin A1c levels. Ann\nIntern Med 2017;167:95–102\n23. Herman WH, Ma Y , Uwaifo G, et al.; Diabetes\nPrevention Program Research Group. Differences', 'concentrations and hemoglobin A1c levels. Ann\nIntern Med 2017;167:95–102\n23. Herman WH, Ma Y , Uwaifo G, et al.; Diabetes\nPrevention Program Research Group. Differences\nin A1C by race and ethnicity among patients with\nimpaired glucose tolerance in the Diabetes\nPrevention Program. Diabetes Care 2007;30:2453–\n2457\n24. Saaddine JB, Fagot-Campagna A, Rolka D,', '46% de los participantes. Las tasas de remisión estaban relacionadas con la \nmagnitud de la pérdida de peso, aumentando progresivamente del 7% al 86% a \nmedida que los participantes en el seguimiento de un año lograban reducciones \nde peso bajas (<5%) a importantes (≥15%) (15).\nLos resultados del estudio Look AHEAD demostraron de forma impresionante', 'peso. –› 3. Documentar y explorar sus efectos. –› 4. Elegir el método o métodos \nque mejor coincidan con las preferencias individuales para su aplicación. –› 5. \nMantener el contacto.\nDT2, peso normal, no resistente a la insulina\nEn la mayoría de las personas de peso normal con DT2, la capacidad de producción \nrestante de insulina de las células ß es de sobra y no se observa una resistencia', 'zados especíﬁcamente para personas con diabetes.\nSe sugiere que las recomendaciones al paciente incluyan ade-\nmás otros aspectos de la modiﬁcación del estilo de vida, como el\naumento de la actividad física y la pérdida de peso. En aquellos\nadultos con diabetes tipo 2 con sobrepeso u obesidad, se debe\ndiscutir y acordar un objetivo inicial de pérdida de peso corporal\nde 5 a 10 %.', 'in A1C by race and ethnicity among patients with\nimpaired glucose tolerance in the Diabetes\nPrevention Program. Diabetes Care 2007;30:2453–\n2457\n24. Saaddine JB, Fagot-Campagna A, Rolka D,\net al. Distribution of HbA(1c) levels for children\nand young adults in the U.S.: Third National\nHealth and Nutrition Examination Survey. Dia-\nbetes Care 2002;25:1326–1330', 'de 30 a 58 para los 9 estudios considerados (17). En el caso del arroz blanco cocido (IG promedio: 59), el \nrango se extiende incluso desde el IG 43 hasta el IG 112 (17).\nLa energía definida\nLa definición de\nmacronutrientes\nla textura definida\nDietas hipocalóricas moderadas (déficit energético diario: \naprox. 500 kcal).\nDietas hipocalóricas (LCD) (ingesta energética diaria:', '130\nDT2, sobrepeso, recientemente diagnosticado, resistente a la insulina\nEn una persona con sobrepeso y con una DT2 recientemente diagnosticada, \nes común que se manifieste la resistencia a la insulina. A pesar de la \nhiperinsulinemia, la capacidad restante de producción de insulina de las células \nß no es suficiente para alcanzar niveles normoglucémicos (deficiencia relativa', 'adultos con diabetes tipo 2 con sobrepeso u obesidad, se debe\ndiscutir y acordar un objetivo inicial de pérdida de peso corporal\nde 5 a 10 %.\nLa reducción del riesgo de hipoglucemia será un objetivo pri-', 'height in meters [kg/m2]) has been used\nwidely to diagnose and stage obesity\n(overweight: BMI 25–29.9 kg/m2;o b e s i t y\nclass I: BMI 30–34.9 kg/m2;o b e s i t yc l a s s\nII: BMI 35–39.9 kg/m2; obesity class III:\nBMI $40 kg/m2); however, BMI should\nnot be relied on as a sole diagnostic and\nstaging tool (19). Despite its ease of mea-\nsurement, BMI is at most an imperfect', 'Prevention Program Research Group. Differences\nin A1C by race and ethnicity among patients with\nimpaired glucose tolerance in the Diabetes\nPrevention Program. Diabetes Care 2007;30:\n2453–2457\n11. Saaddine JB, Fagot-Campagna A, Rolka D,\net al. Distribution of HbA(1c) levels for children\nand young adults in the U.S.: Third National\nHealth and Nutrition Examination Survey. Dia-', 'Asian Americans are at increased diabetes risk at lower \nbody weight than the rest of the general public (about 15 \npounds lower).\nIf you scored 5 or higher:\nLower Your Risk\nThe good news is you can manage your \nrisk for type 2 diabetes. Small steps make \na big difference in helping you live a longer, \nhealthier life.\nIf you are at high risk, your first step is to', 'y las recomendaciones para cada una de las características específicas de \nlos diferentes tipos de diabetes y sus etapas. En consecuencia, siguiendo el \nllamamiento a la individualización terapéutica, este tema se subdivide en cuatro \npartes principales:\n• Diabetes de tipo 1 (DT1).\n• Diabetes de tipo 2 (DT2), sobrepeso, recientemente diagnosticada, \nresistente a la insulina.', 'betes Care 2002;25:1326–1330\n12. Selvin E, Steffes MW, Ballantyne CM,\nHoogeveen RC, Coresh J, Brancati FL. Racial\ndifferences in glycemic markers: a cross-sectional\nanalysis of community-based data. Ann Intern\nMed 2011;154:303–309\n13. Wheeler E, Leong A, Liu CT, et al.; EPIC-CVD\nConsortium; EPIC-InterAct Consortium; Lifelines\nCohort Study. Impact of common genetic deter-', 'ate.E\nObesity is deﬁn e db yt h eW o r l dH e a l t h\nOrganization as an abnormal or excessive\nfat accumulation that presents a risk to\nhealth (25). BMI (calculated as weight\nin kilograms divided by the square of\nheight in meters [kg/m2]) has been used\nwidely to diagnose and stage obesity\n(overweight: BMI 25–29.9 kg/m2;o b e s i t y\nclass I: BMI 30–34.9 kg/m2;o b e s i t yc l a s s', '(recién diagnosticada, con sobrepeso):\n1. Entender la importancia de la reducción de peso para reducir la resistencia a \nla insulina –› 2. Aprender a saber y experimentar varios métodos de reducción de \npeso. –› 3. Documentar y explorar sus efectos. –› 4. Elegir el método o métodos \nque mejor coincidan con las preferencias individuales para su aplicación. –› 5. \nMantener el contacto.', 'BMI and COVID-19 mortality is U-shaped in\nboth type 1 and type 2 diabetes (105).\nCOVID-19 has disproportionately af-\nfected certain groups, such as older people\nand those from some ethnic populations\nw h oa r ek n o w nt oh a v eh i g hp r e v a l e n c eo f\nchronic conditions such as diabetes, car-\ndiovascular disease, kidney disease, and\ncertain respiratory diseases (106). In peo-', 'diabetes in Asia, Latin America, the Middle East and Africa: results from the International Diabetes Management Practices \nStudy (IDMPS). Int J Clin Pract. julio de 2009;63(7):997-1007. \n220. Barcelo A, Arredondo A, Gordillo-Tobar A, Segovia J, Qiang A. The cost of diabetes in Latin America and the Caribbean', 'increases with age, obesity, and lack of\nphysical activity (93,94). It occurs more\nfrequently in individuals with prediabetes,\nprior gestational diabetes mellitus, or poly-\ncystic ovary syndrome. It is also more com-\nmon in people with hypertension or\ndyslipidemia and in certain racial and eth-\nnic subgroups (e.g., African American, Na-\ntive American, Hispanic/Latino, and Asian', 'producto alimenticio tienen una influencia decisiva en la IG. En el caso de los guineos, por ejemplo, se ha \nregistrado un IG promedio de 48 (glucosa de referencia = 100 %; voluntarios: DT2), con un rango de IG \nde 30 a 58 para los 9 estudios considerados (17). En el caso del arroz blanco cocido (IG promedio: 59), el \nrango se extiende incluso desde el IG 43 hasta el IG 112 (17).', 'motivation for weight loss in African American\nthan Caucasian rural patients with hypertension\nand/or diabetes. Ethn Dis 2016;26:77–84\n39. Stoops H, Dar M. Equity and obesity treatment\n- expanding medicaid-covered interventions. N Engl\nJ Med 2023;388:2309–2311\n40. Rothberg AE, McEwen LN, Kraftson AT, et al.\nImpact of weight loss on waist circumference and', 'adults. B\n2.7 Testing for prediabetes and/or type 2 diabetes in\nasymptomatic people should be considered in adults\nof any age with overweight or obesity (BMI$25 kg/m2\nor $23 kg/m2 in Asian Americans) and who have one\nor more additional risk factors for diabetes\n(Table 2.3).B\n2.8 Testing for prediabetes and/or type 2 diabetes\nshould be considered in women planning pregnancy', 'BMI $40 kg/m2); however, BMI should\nnot be relied on as a sole diagnostic and\nstaging tool (19). Despite its ease of mea-\nsurement, BMI is at most an imperfect\nmeasure of adipose tissue mass and does\nnot measure adipose tissue distribution', 'Con la tecnología, estos procedimientos son mucho más sencillos, pero sigue \nsiendo necesario contar con unos conocimientos precisos. Por lo general, las \nenfermeras demuestran cómo funcionan los medidores de glucosa y cómo \nmanejarlos; luego piden a los pacientes que repitan lo que acaban de ver.\nAl combinar acciones y palabras, el educador aumenta la capacidad perceptiva', 'glycemic control in Hispanic patients? A systematic review and meta-analysis. Diabetes Educ. agosto de 2015;41(4):472-84. \n63. Pillay J, Armstrong MJ, Butalia S, Donovan LE, Sigal RJ, Vandermeer B, et al. Behavioral Programs for Type 2 Diabetes \nMellitus: A Systematic Review and Network Meta-analysis. Ann Intern Med. 1 de diciembre de 2015;163(11):848-60.', 'capacitar y/o mejorar el autocuidado en las personas con diabetes?\n• ¿Cuáles son los temas claves que el equipo de salud debe tratar en la \nconsulta de la persona con diabetes, para que mejore su manejo metabólico \ny prevenga o disminuyan las complicaciones?\n• ¿Qué variables deben ser tomadas en cuenta, dentro de la evaluación', 'African American individuals have slightly\nhigher A1C levels than non-Hispanic White\nor Hispanic people (22–25). The glucose-in-\ndependent racial difference in A1C is small\n(/C240.3 percentage points) and may reﬂect\ngenetic differences in hemoglobin or red\ncell turnover that vary by ancestry. There is\nan emerging understanding of the genetic\ndeterminants of A1C (21), but theﬁeld lacks', 'ence of weight-related health or well-being\nconsequences (26,27). BMI is especially\nprone to misclassiﬁcation in individuals\nwho are very muscular or frail, as well as\nin populations with different body com-\nposition and cardiometabolic risk (28). A\ndiagnosis of obesity should be made\nbased on an overall assessment of the in-\ndividual’s adipose tissue mass (BMI can', '37\nPREGUNTA 2. ¿Cuáles son los temas claves que el equipo de salud debe \ntratar en la consulta de la persona con diabetes para que mejore su manejo \nmetabólico y prevenga o disminuya las complicaciones?\nSe recomienda un programa de apoyo al autocuidado estandarizado, adaptado \na las necesidades de la región, que tenga como mínimo más de 12 horas', '8.2a To support the diagnosis of\nobesity, measure height and weight\nto calculate BMI and perform addi-\ntional measurements of body fat distri-\nbution, like waist circumference, waist-\nto-hip ratio, and/or waist-to-height\nratio. E\n8.2b Monitor obesity-related anthropo-\nmetric measurements at least annually\nto inform treatment considerations.E\n8.3 Accommodations should be made', '17\nlas recomendaciones, para tomadores de decisiones. Se estableció una escala \nde 1 a 9, para definir la prioridad de los desenlaces, en donde los desenlaces \ncalificados entre 1-3 son aquellos de importancia limitada, los calificados entre \n4-6 son aquellos importantes pero no críticos para tomar una decisión, y los', 'Hoogeveen RC, Coresh J, Brancati FL. Racial\ndifferences in glycemic markers: a cross-sectional\nanalysis of community-based data. Ann Intern\nMed 2011;154:303–309\n26. Landry LG, Ali N, Williams DR, Rehm HL,\nBonham VL. Lack of diversity in genomic databases', 'edge the expected range of beneﬁts\nacross the spectrum of weight loss.\nRecommendations 8.2a, 8.2b, and 8.3\nwere expanded to incorporate additional\nanthropometric measurements beyond BMI\n(i.e., waist circumference, waist-to-hip ratio,\nand/or waist-to-height ratio) to encourage\nindividualized assessments of body fat mass\nand distribution.\nRecommendation 8.6 was added to', '• Convenio entre IDF - OMS.\n• Convenios entre Ministerio de Salud y Ministerio de Educación, Ministerio \nde economía para difundir, promover, instaurar y apoyar la implementación \nde la práctica educativa en diabetes en los distintos niveles de atención.\n• Encuentro para socializar la motivación de la elaboración de la GPC a \nrepresentantes de las distintas organizaciones involucradas.', 'en sangre, normalmente con insulina.\nObjetivos de aprendizaje / contenidos de la educación sobre la DT2 (peso \nnormal, no resistente a la insulina):\n1. Entender la importancia de mantenerse dentro del rango de peso normal. –› 2. \nIdentificar y elegir alimentos que contengan CHO de bajo índice glucémico. –› \n3. Elaborar un plan individual de distribución de pequeñas porciones de CHO', 'personas con diabetes y sus familias, y para reducir los costos en el sistema de \nsalud. Diferentes estudios indican que los costes del tratamiento hospitalario \nasociado a las complicaciones agudas o crónicas de la diabetes, son muchas \nveces más caros que el manejo recomendado de la enfermedad (24)(25)(26)(27)\n(28)(29). Por lo tanto, la ED debe ser vista como un aliado que permite unir todos', 'y que pueda recomendarse de forma general para la pérdida de peso de \nlas personas con diabetes. Por lo tanto, se justifica un plan individualizado \npara la terapia nutricional de la diabetes, teniendo en cuenta las preferencias \ndietéticas junto con los conocimientos de salud del individuo, los recursos, \nla disponibilidad de alimentos, las habilidades de preparación de comidas', '(242)(243)(244). En este caso, se ha demostrado que la implementación de un \nprograma estructurado de modalidad grupal, en 10 países de Latinoamérica, \nmejoró en 12 meses de seguimiento, todos los indicadores clínicos (índice \nde masa corporal y presión arterial) y metabólicos (HbA1c y dislipidemia) \nde personas con DM tipo 2, y disminuyó un 64% el costo del tratamiento', '139\n \nTabla 3. Índice glucémico de algunos alimentos que contienen CHO (19)\nNota del autor: Hay muchas tablas de IG en circulación, pero sólo unas pocas publicadas en artículos \ncientíficos son adecuadas para ser utilizadas para definir el IG de los alimentos que contienen carbohidratos. \nPara evaluar el IG, hay que tener en cuenta que los valores del IG son básicamente valores medios de varios', 'insulin resistance. Many of those who are not obese by BMI criteria have a higher \nproportion of body fat distributed predominantly in the abdominal region, indicating \nvisceral adiposity, compared to people without diabetes. \nHowever, in some populations, such as Asians, beta-cell dysfunction appears to \nbe a more prominent feature than in populations of European descent. This is also', '21\nLista de preguntas clave.\nEl comité seleccionó las siguientes preguntas, como componentes que se \ncubrieron en la guía:\n• ¿En qué modelo de atención debería basarse un programa educativo para \ncapacitar y/o mejorar el autocuidado en las personas con diabetes?\n• ¿Cuáles son los temas claves que el equipo de salud debe tratar en la', 'noviembre de 2021]. Disponible en: https://apps.who.int/iris/handle/10665/42011\n219. Ringborg A, Cropet C, Jönsson B, Gagliardino JJ, Ramachandran A, Lindgren P. Resource use associated with type 2 \ndiabetes in Asia, Latin America, the Middle East and Africa: results from the International Diabetes Management Practices \nStudy (IDMPS). Int J Clin Pract. julio de 2009;63(7):997-1007.']","Los valores de IMC (Índice de Masa Corporal) que se consideran indicativos de sobrepeso pueden variar ligeramente entre diferentes grupos étnicos. En general, un IMC de 25 a 29.9 kg/m² se considera sobrepeso. Sin embargo, para los asiáticos americanos, un IMC de 23 kg/m² o más se considera sobrepeso debido a un mayor riesgo de diabetes a un peso corporal más bajo en comparación con la población general.

Es importante tener en cuenta que el IMC es solo una medida y no debe ser el único criterio para diagnosticar el sobrepeso u obesidad. Otros factores, como la distribución de la grasa corporal y la composición corporal, también deben ser considerados.","Los valores de IMC considerados indicativos de sobrepeso pueden variar entre diferentes grupos étnicos debido a diferencias en la composición corporal y el riesgo de enfermedad. Si bien un IMC de 25,0-29,9 kg/m2 se utiliza comúnmente para definir el sobrepeso, algunos países asiáticos han reducido el umbral de sobrepeso a alrededor de 23,0-24,9 kg/m2, ya que los asiáticos tienden a tener un mayor porcentaje de grasa corporal con IMC más bajos. Para las poblaciones negras/afroamericanas, un umbral de IMC de 25,0-27,5 kg/m2 puede ser más apropiado, ya que generalmente tienen un menor porcentaje de grasa corporal en comparación con los blancos al mismo IMC. La evidencia emergente sugiere la necesidad de umbrales de IMC específicos por etnia para evaluar mejor el sobrepeso y los riesgos de salud asociados en diferentes poblaciones.",1.0,0.0,,1.0,0.5,0.6942772047552855,0.9021088190211421
¿Cómo pueden las personas evaluar su riesgo de diabetes tipo 2 usando el IMC?,"['discutir y acordar un objetivo inicial de pérdida de peso corporal\nde 5 a 10 %.\nLa reducción del riesgo de hipoglucemia será un objetivo pri-\nmordial para las personas que usan insulina o un secretagogo de\ninsulina.\nFinalmente, la cirugía bariátrica está indicada para pacientes\ncon un IMC de 35 o más que tengan diabetes tipo 2 de inicio\nreciente (diagnosticada en los 10 años previos).', '8\nde los aspectos en los que no se hubiere alcanzado el desarrollo requerido, para \nconcretar un verdadero apoyo a las personas con diabetes y sus familiares.\nPoblación objetivo.\nLa guía se dirige a personas con diabetes tipo 1, tipo 2, gestacional y otros tipos \nde diabetes, personas con prediabetes y personas con un puntaje de Findrisc', 'insulina.\nFinalmente, la cirugía bariátrica está indicada para pacientes\ncon un IMC de 35 o más que tengan diabetes tipo 2 de inicio\nreciente (diagnosticada en los 10 años previos).\n4. Diagnóstico y manejo de la hipertensión arterial\nEl diagnóstico, tratamiento y monitoreo de la hipertensión arte-\nrial (HTA) es, en general, el mismo para las personas con dia-', 'La guía recomienda un enfoque individualizado para el cuidado\nde la diabetes que se adapte a las necesidades y circunstancias\nde las personas adultas con DM2, de acuerdo a sus preferencias\npersonales, comorbilidades y los riesgos de la polifarmacia, y a\nsu probabilidad de beneﬁciarse de las intervenciones en el lar-\ngo plazo. Recomienda realizar reevaluaciones en cada consulta,', 'comprende y utiliza correctamente los aspectos cruciales para su tipo específico \nde diabetes.\nDiabetes Tipo 2.\nLa DT2 se caracteriza por su desarrollo progresivo que está determinado por el \nritmo individualmente diferente en el curso de la insuficiencia/disfunción de las \ncélulas ß (12)(13)(14). Los pacientes con DT2 presentan diferentes características', 'adults. B\n2.7 Testing for prediabetes and/or type 2 diabetes in\nasymptomatic people should be considered in adults\nof any age with overweight or obesity (BMI$25 kg/m2\nor $23 kg/m2 in Asian Americans) and who have one\nor more additional risk factors for diabetes\n(Table 2.3).B\n2.8 Testing for prediabetes and/or type 2 diabetes\nshould be considered in women planning pregnancy', 'peso. –› 3. Documentar y explorar sus efectos. –› 4. Elegir el método o métodos \nque mejor coincidan con las preferencias individuales para su aplicación. –› 5. \nMantener el contacto.\nDT2, peso normal, no resistente a la insulina\nEn la mayoría de las personas de peso normal con DT2, la capacidad de producción \nrestante de insulina de las células ß es de sobra y no se observa una resistencia', 'hyperglycemic crisis.\nTABLE 2.3 Criteria for testing for diabetes or prediabetes in asymptomatic adults\n1. Testing should be considered in adults with overweight or obesity (BMI$25 kg/m2 or $23 kg/m2 in Asian Americans) who have one or more of the\nfollowing risk factors:\n\x81 First-degree relative with diabetes', 'adultos con diabetes tipo 2 con sobrepeso u obesidad, se debe\ndiscutir y acordar un objetivo inicial de pérdida de peso corporal\nde 5 a 10 %.\nLa reducción del riesgo de hipoglucemia será un objetivo pri-', 'Diabetes Prevention Program (DPP) (83),\nand A1C at baseline was a strong pre-\ndictor of the development of glucose-\ndeﬁned diabetes during the DPP and\nits follow-up (7).\nTable 2.4—Criteria for screening for diabetes or prediabetes in asymptomatic\nadults\n1. Testing should be considered in adults with overweight or obesity (BMI$25 kg/m2 or $23 kg/m2', 'partes principales:\n• Diabetes de tipo 1 (DT1).\n• Diabetes de tipo 2 (DT2), sobrepeso, recientemente diagnosticada, \nresistente a la insulina.\n• DT2, peso normal, no resistente a la insulina.\n• DT2, tratamiento con insulina.', 'paciente y su riesgo cardiovascular (según sus factores de ries-\ngo, la presencia de enfermedad cardiovascular establecida y/o la\npresencia de insuﬁciencia cardíaca crónica). Se considera que\npresentan alto riesgo cardiovascular aquellos adultos con DM2\nque tienen:\nenfermedad cardiovascular ya establecida,\ninsuﬁciencia cardíaca crónica,\nedad de 40 años o más y riesgo por QRISK2 mayor al\n10 %, o', 'its follow-up (7).\nTable 2.4—Criteria for screening for diabetes or prediabetes in asymptomatic\nadults\n1. Testing should be considered in adults with overweight or obesity (BMI$25 kg/m2 or $23 kg/m2\nin Asian American individuals) who have one or more of the following risk factors:\n/C15First-degree relative with diabetes', 'shown in Table 2.2/2.5.\nRecommendations\n2.6 Screening for prediabetes and type 2 diabetes with\nan informal assessment of risk factors or validated\ntools should be considered in asymptomatic\nadults. B\n2.7 Testing for prediabetes and/or type 2 diabetes in\nasymptomatic people should be considered in adults\nof any age with overweight or obesity (BMI$25 kg/m2', 'Screening for prediabetes and type 2 diabetes risk through\nan informal assessment of risk factors (Table 2.3) or\nwith an assessment tool such as the ADA risk test\n(diabetes.org/socrisktest) is recommended to guide\nproviders on whether performing a diagnostic test for\nprediabetes and previously undiagnosed type 2\ndiabetes (Table 2.2/2.5) is appropriate. Those who', 'above 45 years of age who have at least one of the risk factors mentioned\nin Table 1.4, are screened more frequently. Also, overweight persons\n(BMI> 25 kg/m2), of lower age (<45 years) with one additional risk factor\nfrom those mentioned in Table 1.4, should be screened for Type 2 DM as\nfor persons aged > 45 years. For all these reasons, therefore, the woman\nin question should be screened for DM.', 'autoantibodies, and glycemic metrics.E\nScreening for prediabetes and type 2 diabetes risk through an assessment of risk factors\n(Table 2.5) or with an assessment tool, such as the American Diabetes Association risk\ntest (Fig. 2.2), is recommended to guide whether to perform a diagnostic test for predi-\nabetes (Table 2.2) and type 2 diabetes (Table 2.1) (see Section 2,“Diagnosis and', 'tivity compared to fasting plasma glucose in diagnosing DM.\nTable 1.4. Risk factors for development of Type 2 diabetes mellitus\n. Age /C2145 years\n. Increased body weight (body mass index /C2125 Kg/m2)\n. Family history of Type 2 diabetes\n. Sedentary lifestyle\n. History of gestational diabetes or child birth weighing > 4k g\n. Hypertension (/C21140/90 mmHg)', '7. What is your weight category? .............................\nSee chart at right.\nYou are at increased risk for having type 2 diabetes. \nHowever, only your doctor can tell for sure if you do \nhave type 2 diabetes or prediabetes, a condition in \nwhich blood glucose levels are higher than normal \nbut not yet high enough to be diagnosed as diabetes.', 'Table 2.5—Risk-based screening for type 2 diabetes or prediabetes in\nasymptomatic children and adolescents in a clinical setting\nScreening should be considered in youth* who have overweight ($85th percentile) or\nobesity ($95th percentile) A and who have one or more additional risk factors based\non the strength of their association with diabetes:', 'tile) or obesity (BMI$95th percentile)\nand who have one or more risk factors\nfor diabetes. (SeeTable 2.5 for evi-\ndence grading of risk factors.)B\n2.15a Consider screening people for\nprediabetes or diabetes if on certain\nmedications, such as glucocorticoids,\nstatins, thiazide diuretics, some HIV\nS26 Diagnosis and Classification of Diabetes Diabetes Care Volume 47, Supplement 1, January 2024', 'be pursued for those considered at very\nhigh risk (e.g., those with A1C>6.0%\n[>42 mmol/mol] and individuals with\nboth IFG and IGT).\nTable 2.4 outlines the criteria for\nscreening for prediabetes. The ADA risk\ntest is an additional option for assess-\nment to determine the appropriateness\nof screening for diabetes or prediabetes\nin asymptomatic adults (Fig. 2.2)( o n l i n e', 'en sangre, normalmente con insulina.\nObjetivos de aprendizaje / contenidos de la educación sobre la DT2 (peso \nnormal, no resistente a la insulina):\n1. Entender la importancia de mantenerse dentro del rango de peso normal. –› 2. \nIdentificar y elegir alimentos que contengan CHO de bajo índice glucémico. –› \n3. Elaborar un plan individual de distribución de pequeñas porciones de CHO', 'implications for policy and intervention strategies.\nLancet 2004;363:157–163\n27. Araneta MR, Kanaya AM, Hsu WC, et al.\nOptimum BMI cut points to screen Asian Americans\nfor type 2 diabetes. Diabetes Care 2015;38:814–820\n28. Aggarwal R, Bibbins-Domingo K, Yeh RW,\net al. Diabetes screening by race and ethnicity in\nthe United States: equivalent body mass index', 'Diabetes Risk Test | American Diabetes Association®\nIf you weigh less than the amount in\nthe left column:0 points\n4’ 10”\n4’ 11”\n5’ 0”\n5’ 1”\n5’ 2”\n5’ 3”\n5’ 4”\n5’ 5”\n5’ 6”\n5’ 7”\n5’ 8”\n5’ 9”\n5’ 10”\n5’ 11”\n6’ 0”\n6’ 1”\n6’ 2”\n6’ 3”\n6’ 4”\n119–142 143–190 191+\n124–147 148–197 198+\n128–152 153–203204+\n132–157 158–210 211+\n136–163 164–217 218+\n141–168 169–224 225+\n145–173 174–231 232+\n150–179 180–239 240+', 'zados especíﬁcamente para personas con diabetes.\nSe sugiere que las recomendaciones al paciente incluyan ade-\nmás otros aspectos de la modiﬁcación del estilo de vida, como el\naumento de la actividad física y la pérdida de peso. En aquellos\nadultos con diabetes tipo 2 con sobrepeso u obesidad, se debe\ndiscutir y acordar un objetivo inicial de pérdida de peso corporal\nde 5 a 10 %.', 'may become more obvious over time and should be\nreevaluated if there is concern.\nScreening and Diagnostic Tests for Prediabetes\nand Type 2 Diabetes\nThe diagnostic criteria for diabetes and prediabetes are\nshown in Table 2.2/2.5.\nRecommendations\n2.6 Screening for prediabetes and type 2 diabetes with\nan informal assessment of risk factors or validated\ntools should be considered in asymptomatic', '(recién diagnosticada, con sobrepeso):\n1. Entender la importancia de la reducción de peso para reducir la resistencia a \nla insulina –› 2. Aprender a saber y experimentar varios métodos de reducción de \npeso. –› 3. Documentar y explorar sus efectos. –› 4. Elegir el método o métodos \nque mejor coincidan con las preferencias individuales para su aplicación. –› 5. \nMantener el contacto.', 'Población objetivo.\nLa guía se dirige a personas con diabetes tipo 1, tipo 2, gestacional y otros tipos \nde diabetes, personas con prediabetes y personas con un puntaje de Findrisc \nalto, con involucramiento del entorno familiar (porque la población pediátrica \ndepende significativamente del conocimiento adquirido por sus tutores legales,', 'betes risk through a targeted assessment\nof risk factors (Table 2.4)o rw i t ha n\nassessment tool, such as the ADA risk\ntest (Fig. 2.2) (online at diabetes.org/\nsocrisktest), is recommended to guide\nhealth care professionals on whether\nperforming a diagnostic test (Table 2.1)\nis appropriate. Prediabetes and type 2\ndiabetes meet criteria for conditions in', '130\nDT2, sobrepeso, recientemente diagnosticado, resistente a la insulina\nEn una persona con sobrepeso y con una DT2 recientemente diagnosticada, \nes común que se manifieste la resistencia a la insulina. A pesar de la \nhiperinsulinemia, la capacidad restante de producción de insulina de las células \nß no es suficiente para alcanzar niveles normoglucémicos (deficiencia relativa', 'utilizando herramientas validadas y breves, así como también resultados \nreportados por los pacientes (RRP). Son muy útiles los cuestionarios de \nautoevaluación para usarlos en diabetes; están disponibles y pueden ayudar a \nidentificar aquellos pacientes que pueden requerir derivación para diagnóstico y \ntratamiento. Hay versiones abreviadas que toman menos de cinco minutos para', 'with overweight or obesity and/or who have\none or more additional risk factor for diabetes\n(Table 2.3). C\n2.9 For all people, testing should begin at age 45 years.B\n2.10 If tests are normal, repeat testing carried out at a\nminimum of 3-year intervals is reasonable.C\n2.12 In patients with prediabetes and type 2 diabetes,\nidentify and treat other CVD risk factors.B', 'capacitar y/o mejorar el autocuidado en las personas con diabetes?\n• ¿Cuáles son los temas claves que el equipo de salud debe tratar en la \nconsulta de la persona con diabetes, para que mejore su manejo metabólico \ny prevenga o disminuyan las complicaciones?\n• ¿Qué variables deben ser tomadas en cuenta, dentro de la evaluación', 'with symptoms or change in risk (e.g.,\nweight gain).C\n2.12 To screen for prediabetes and\ntype 2 diabetes, FPG, 2-h PG during\n75-g OGTT, and A1C are each appro-\npriate (Table 2.1and Table 2.2). B\n2.13 When using OGTT as a screen for\nprediabetes or diabetes, adequate car-\nbohydrate intake (at least 150 g/day)\nshould be assured for 3 days prior to\ntesting.A\n2.14 Risk-based screening for predia-', '139\n \nTabla 3. Índice glucémico de algunos alimentos que contienen CHO (19)\nNota del autor: Hay muchas tablas de IG en circulación, pero sólo unas pocas publicadas en artículos \ncientíficos son adecuadas para ser utilizadas para definir el IG de los alimentos que contienen carbohidratos. \nPara evaluar el IG, hay que tener en cuenta que los valores del IG son básicamente valores medios de varios', 'providers on whether performing a diagnostic test for\nprediabetes and previously undiagnosed type 2\ndiabetes (Table 2.2/2.5) is appropriate. Those who\nare determined to be at high risk for type 2 diabetes,\nincluding people with an A1C of 5.7–6.4% (39–47\nmmol/mol), impaired glucose tolerance, or impaired\nfasting glucose, are ideal candidates for diabetes\nprevention efforts.\nLifestyle Interventions', 'who have one or more additional\nrisk factors for diabetes (seeTable 2.5\nfor evidence grading of other risk\nfactors).\n14.49 If screening is normal, repeat\nscreening at a minimum of 3-year in-\ntervals,E or more frequently if BMI is\nincreasing.C\n14.50 Fasting plasma glucose, 2-h\nplasma glucose during a 75-g oral glu-\ncose tolerance test, and A1C can be\nused to test for prediabetes or diabe-', 'Introducción.\nLa investigación científica ha encontrado su lugar en la definición de métodos \ny procedimientos en la educación. Es la base de las soluciones operativas para \nla educación y ofrecer formas en las que las personas con diabetes pueden \naprender nuevos comportamientos de salud, con base en la autonomía de \nla persona y en su capacidad de introspección. La educación se dirige, por', 'ción renal o la pérdida repentina de peso.\n6.3 Automonitoreo de la glucemia capilar\nSe recomienda no ofrecer de manera rutinaria el automonito-\nreo de los niveles de glucemia capilar a las personas adultos con\nDM2, a menos que:\nutilicen insulina,\npresenten episodios de hipoglucemia,\nutilicen medicamentos orales que pueden aumentar el\nriesgo de hipoglucemia mientras conducen u operan\nmaquinaria,', '37\nPREGUNTA 2. ¿Cuáles son los temas claves que el equipo de salud debe \ntratar en la consulta de la persona con diabetes para que mejore su manejo \nmetabólico y prevenga o disminuya las complicaciones?\nSe recomienda un programa de apoyo al autocuidado estandarizado, adaptado \na las necesidades de la región, que tenga como mínimo más de 12 horas', 'de la persona, siendo sensible a su voluntad de cambio y los efec-\ntos en su calidad de vida.\nSe aconseja estimular a los adultos con diabetes tipo 2 a seguir\nlos mismos consejos de alimentación saludable que la población\ngeneral, que incluyen: comer fuentes de carbohidratos con alto\ncontenido de ﬁbra y bajo índice glucémico, como frutas, verdu-', 'prevent or delay the development of type 2\ndiabetes. B\nTABLE 2.4 Risk-based screening for type 2 diabetes or prediabetes in asymptomatic children and adolescents in a clinical\nsetting\nTesting should be considered in youth* with overweight ($85th percentile) or obesity ($95th percentile) A who have one or more additional risk\nfactors based on the strength of their association with diabetes:', 'terapéuticos en el estilo de vida?\nSe recomienda el uso de un programa conductual para mejorar los resultados \nen las personas con diabetes mellitus. C1\nJustificación\nEl manejo de la diabetes mellitus tipo 1 y tipo 2, implica atención clínica y permite \nque las personas con diabetes adopten comportamientos de autocuidado. Es', 'the DPP/DPPOS who were at particularly\nhigh risk of progression to diabetes (crude\nincidence of diabetes 14–22 cases per 100\nperson-years) included BMI$35 kg/m2,\nhigher glucose levels (e.g., fasting plasma\nglucose 110–125 mg/dL [6–6.9 mmol/L],\n2–h postchallenge glucose 173–199 mg/dL\n[9.6–11.0 mmol/L], and A1C $6.0%\n[$42 mmol/mol]), and a history of GDM\n(4,91,92). In contrast, in the community-', '21\nLista de preguntas clave.\nEl comité seleccionó las siguientes preguntas, como componentes que se \ncubrieron en la guía:\n• ¿En qué modelo de atención debería basarse un programa educativo para \ncapacitar y/o mejorar el autocuidado en las personas con diabetes?\n• ¿Cuáles son los temas claves que el equipo de salud debe tratar en la', 'cally, especially in racial and ethnic mi-\nnority populations (114). SeeTable 2.5\nfor recommendations on risk-based\nscreening for type 2 diabetes or predia-\nbetes in asymptomatic children and\nadolescents in a clinical setting (113).\nSeeTable 2.1and Table 2.2for the cri-\nteria for the diagnosis of diabetes and\nprediabetes, respectively, that apply to\nchildren, adolescents, and adults. See', 'las familias que tienen un miembro con diabetes o en riesgo de desarrollar \nesta condición.\nAsociada a la adopción de hábitos saludables y al uso racional y oportuno de los \nmedicamentos e insumos, la ED tiende a dirigir a una reducción de la necesidad \nde utilizar los servicios de salud de emergencia y a mejorar los marcadores', 'betes or type 2 diabetes should be con-\nsidered after the onset of puberty or\nafter 10 years of age, whichever occurs\nearlier, in children and adolescents\nwith overweight (BMI$85th percen-\ntile) or obesity (BMI$95th percentile)\nand who have one or more risk factors\nfor diabetes. (SeeTable 2.5 for evi-\ndence grading of risk factors.)B\n2.15a Consider screening people for', 'de las personas con diabetes. La observación y el diálogo permanente con los \npacientes son puntos fundamentales para comprender, a través de su experiencia \ndirecta, la diabetes o, de forma más general, la patología que se quiere tratar. \nLa diabetes forma parte de la vida cotidiana de las personas y está repleta de \nsignificados relacionados con su contexto vital real y su historia personal y']","Para evaluar su riesgo de diabetes tipo 2 usando el Índice de Masa Corporal (IMC), las personas pueden seguir estos pasos:

1. **Calcular el IMC**: El IMC se calcula dividiendo el peso en kilogramos por la altura en metros al cuadrado (kg/m²). Por ejemplo, si una persona pesa 80 kg y mide 1.75 m, su IMC sería 80 / (1.75 x 1.75) = 26.12.

2. **Interpretar el IMC**:
   - Un IMC de 25 kg/m² o más se considera sobrepeso.
   - Un IMC de 30 kg/m² o más se considera obesidad.

3. **Evaluar el riesgo**:
   - Las personas con sobrepeso (IMC ≥ 25 kg/m²) o obesidad (IMC ≥ 30 kg/m²) tienen un mayor riesgo de desarrollar diabetes tipo 2, especialmente si tienen otros factores de riesgo como antecedentes familiares de diabetes, estilo de vida sedentario, hipertensión, o haber tenido diabetes gestacional.

4. **Considerar otros factores de riesgo**: Además del IMC, es importante considerar otros factores de riesgo como la edad, la etnia, la historia familiar de diabetes, y la presencia de otros problemas de salud como hipertensión o colesterol alto.

5. **Consultar a un profesional de la salud**: Si el IMC indica sobrepeso u obesidad y hay otros factores de riesgo presentes, es recomendable consultar a un profesional de la salud para una evaluación más completa y para discutir posibles intervenciones, como cambios en el estilo de vida o la necesidad de pruebas adicionales.

Recuerda que el IMC es solo una herramienta y no debe ser el único factor considerado para evaluar el riesgo de diabetes tipo 2. Es importante tener en cuenta otros aspectos de la salud y el estilo de vida.","Las personas pueden evaluar su riesgo de diabetes tipo 2 utilizando los valores de IMC. Un IMC entre 25-29,9 kg/m2 se considera sobrepeso, mientras que 30 kg/m2 o más es obesidad. Los valores más altos de IMC, incluso en el rango de sobrepeso, están fuertemente asociados con un mayor riesgo de diabetes de manera progresiva. El riesgo aumenta progresivamente con cada aumento de 1 kg/m2 por encima del IMC normal. Si bien el IMC estima la adiposidad general, combinarlo con la medición de la circunferencia de la cintura proporciona una mejor evaluación, considerando la distribución de la grasa corporal. Las directrices actuales recomiendan el cribado de diabetes en adultos con IMC ≥25 kg/m2 debido al mayor riesgo a este nivel.",0.8666666666666667,0.9173057665872147,,0.6666666666666666,1.0,0.4828687345311017,0.8600463666958353
¿Cuáles son los cambios clave en el estilo de vida recomendados para reducir las probabilidades de desarrollar diabetes tipo 2?,"['terapéuticos en el estilo de vida?\nSe recomienda el uso de un programa conductual para mejorar los resultados \nen las personas con diabetes mellitus. C1\nJustificación\nEl manejo de la diabetes mellitus tipo 1 y tipo 2, implica atención clínica y permite \nque las personas con diabetes adopten comportamientos de autocuidado. Es', 'estudio, los resultados del ensayo DIRECT se publicaron recientemente. Los \nautores demostraron que, al cabo de un año, la pérdida de peso asociada a la \nintervención sobre el estilo de vida resultó en la remisión de la diabetes en el \n46% de los participantes. Las tasas de remisión estaban relacionadas con la \nmagnitud de la pérdida de peso, aumentando progresivamente del 7% al 86% a', 'aumentar el empoderamiento del autocuidado de las personas con \ndiabetes?\n• ¿Cuál es el mejor enfoque con base en la evidencia para lograr cambios \nconductuales en personas con diabetes?', 'mento: reforzar los consejos sobre plan alimentario, estilo\nde vida y la adherencia al tratamiento farmacológico; apo-\nyar a la persona para que llegue a un nivel de HbA1c de\n7,0 % e intensiﬁcar el tratamiento farmacológico.\nConsiderar la posibilidad de no ser tan estricto con el objetivo\nmetabólico de la HbA1c, especialmente en adultos mayores o frá-', 'zados especíﬁcamente para personas con diabetes.\nSe sugiere que las recomendaciones al paciente incluyan ade-\nmás otros aspectos de la modiﬁcación del estilo de vida, como el\naumento de la actividad física y la pérdida de peso. En aquellos\nadultos con diabetes tipo 2 con sobrepeso u obesidad, se debe\ndiscutir y acordar un objetivo inicial de pérdida de peso corporal\nde 5 a 10 %.', 'ras, granos integrales y legumbres; elegir productos lácteos bajos\nen grasa; comer pescado; y controlar la ingesta de ácidos grasos\nsaturados y trans, desalentando el uso de alimentos comerciali-\nzados especíﬁcamente para personas con diabetes.\nSe sugiere que las recomendaciones al paciente incluyan ade-\nmás otros aspectos de la modiﬁcación del estilo de vida, como el', 'de la persona, siendo sensible a su voluntad de cambio y los efec-\ntos en su calidad de vida.\nSe aconseja estimular a los adultos con diabetes tipo 2 a seguir\nlos mismos consejos de alimentación saludable que la población\ngeneral, que incluyen: comer fuentes de carbohidratos con alto\ncontenido de ﬁbra y bajo índice glucémico, como frutas, verdu-', '(recién diagnosticada, con sobrepeso):\n1. Entender la importancia de la reducción de peso para reducir la resistencia a \nla insulina –› 2. Aprender a saber y experimentar varios métodos de reducción de \npeso. –› 3. Documentar y explorar sus efectos. –› 4. Elegir el método o métodos \nque mejor coincidan con las preferencias individuales para su aplicación. –› 5. \nMantener el contacto.', 'progresión de la pérdida individual de células ß.\nÉnfasis de la dieta en la terapia de las personas con sobrepeso/obesidad \ncon diagnóstico reciente de DT2 y resistencia a la insulina:\nMedios terapéuticos primarios: En estos pacientes el principal componente \nterapéutico es la reducción de peso para reducir la resistencia a la insulina.', 'achieve and maintain a weight reduc-\ntion of at least 7% of initial body weight\nthrough healthy reduced-calorie diet\nand $150 min/week of moderate-\nintensity physical activity.A\n3.4 A variety of eating patterns can be\nconsidered to prevent type 2 diabetes\nin individuals with prediabetes.B\n3.5Given the cost-effectiveness of lifestyle\nbehavior modiﬁcation programs for diabe-', 'los mismos consejos de alimentación saludable que la población\ngeneral, que incluyen: comer fuentes de carbohidratos con alto\ncontenido de ﬁbra y bajo índice glucémico, como frutas, verdu-\nras, granos integrales y legumbres; elegir productos lácteos bajos\nen grasa; comer pescado; y controlar la ingesta de ácidos grasos\nsaturados y trans, desalentando el uso de alimentos comerciali-', 'de comportamiento planificado (Ej.: Inicio de AUTOMONITOREO). El \ncomportamiento diana debe ser simple, mesurable, orientado a la acción, \nrealista y calculado. Un objetivo específico sería: “Caminar tres veces al día \ndurante 15 minutos” o “Cambiar la leche entera (homogeneizada) por leche \ndescremada”.\nEn segundo lugar, se identifica en qué etapa de cambio se encuentra la persona \ncon diabetes:', 'physical activity, calorie restriction, weight\nmanagement strategies, and motivation.\nThere is strong and consistent evidence\nthat modest, sustained weight loss can delay\nthe progression from prediabetes to type 2\ndiabetes (103,105,106) (see Section 3,\n“Prevention or Delay of Diabetes and\nAssociated Comorbidities”) and is beneﬁ-\ncial for the management of type 2 diabe-', 'adultos con diabetes tipo 2 con sobrepeso u obesidad, se debe\ndiscutir y acordar un objetivo inicial de pérdida de peso corporal\nde 5 a 10 %.\nLa reducción del riesgo de hipoglucemia será un objetivo pri-', 'La diabetes forma parte de la vida cotidiana de las personas y está repleta de \nsignificados relacionados con su contexto vital real y su historia personal y \nrelacional. Tratarse bien mientras se vive con diabetes requiere cambios de \ncomportamiento, adquirir nuevos hábitos y abandonar los antiguos (1)(2). Todos \nlos estudios demuestran que estos resultados pueden alcanzarse a través de', 'Medios terapéuticos primarios: En estos pacientes el principal componente \nterapéutico es la reducción de peso para reducir la resistencia a la insulina.\nObjetivo terapéutico: Alcanzar el objetivo terapéutico de glucemia acordado \nmutuamente mediante la mejor reducción posible de la resistencia a la insulina \nexistente.\nEl papel de la nutrición y el enfoque dietético:  La intervención dietética', 'mutuamente mediante la mejor reducción posible de la resistencia a la insulina \nexistente.\nEl papel de la nutrición y el enfoque dietético:  La intervención dietética \nhipocalórica será según las preferencias individuales y la situación psicosocial', 'Recommendations\n3.3 Refer adults with overweight or\nobesity at high risk of type 2 diabetes,\nas seen in the Diabetes Prevention\nProgram (DPP), to an intensive life-\nstyle behavior change program to\nachieve and maintain a weight reduc-\ntion of at least 7% of initial body weight\nthrough healthy reduced-calorie diet\nand $150 min/week of moderate-\nintensity physical activity.A', 'ejecución estructurado. En esta fase inicial, los participantes aprenden a saber \ny aplicar temporalmente varios métodos de reducción de peso. Por ejemplo, \nutilizando dos semanas una dieta de fórmula, seguida de una intervención baja \nen grasas, una baja en carbohidratos y un ayuno intermitente. Los educadores \ncon experiencia en diabetes apoyan este “camino de descubrimiento” que', 'durante 15 minutos” o “Cambiar la leche entera (homogeneizada) por leche \ndescremada”.\nEn segundo lugar, se identifica en qué etapa de cambio se encuentra la persona \ncon diabetes:\nPrecontemplación: Fase en la que no hay cambios durante al menos seis \nmeses. Existe una falta de conocimientos o de una decisión consciente. Muy', 'cambio real. Todas las oportunidades que favorezcan el acceso al tratamiento, los \ncomportamientos de autocuidado y el empoderamiento de la persona, deben ser \npriorizados.\nRecomendaciones.\nPREGUNTA 1. ¿En qué modelo de atención debería basarse un programa \neducativo para capacitar y/o mejorar el comportamiento de autocuidado en \nlas personas con diabetes?', 'La guía recomienda un enfoque individualizado para el cuidado\nde la diabetes que se adapte a las necesidades y circunstancias\nde las personas adultas con DM2, de acuerdo a sus preferencias\npersonales, comorbilidades y los riesgos de la polifarmacia, y a\nsu probabilidad de beneﬁciarse de las intervenciones en el lar-\ngo plazo. Recomienda realizar reevaluaciones en cada consulta,', 'A base de alimentos sólidos.\nEnfoques asociados a la salud pública\nEnfoques asoiados al tratamiento/prevención (por ej. DASH,\nDPP, DPS).\nDieta de estilo mediterráneo. Dieta vegetariana o vegana.\nAyuno intermitente. Reducción de peso con ayuda\nde una aplicación \nMÉTODO RESUMEN\nAdicionalmente', 'tipos de programas de tratamiento y estilo de vida que varían en términos de su \nefectividad (148)(149). Para muchas de estas intervenciones, hay datos limitados \nde ensayos clínicos con seguimiento a largo plazo. Pero, para una persona con \ndiabetes individual, optar por uno de estos programas puede ser útil, y, para \nmuchos, es una opción atractiva.', 'proceso asistencial y administrativo.\nSe dispone de muchos programas en línea que ofrecen asesoramiento sobre el \nestilo de vida para ayudar con la pérdida de peso y aumentar la actividad física \n(143). Hay programas que tienen como objetivo tratar la prediabetes y prevenir \nla progresión a diabetes siguiendo el modelo del Programa de Prevención de', '(con respecto a la alimentación y la actividad física) siempre puede ser dominado \neficazmente por una determinada proporción de la cohorte de pacientes. A la \nvista de los que no logran la necesaria modificación del estilo de vida, desde \nhace décadas surgieron enfoques farmacológicos con varios tipos de fármacos \nreductores de peso que desaparecieron ampliamente debido a su fracaso o', 'La Asociación Americana de Diabetes recomienda que la intervención educativa \nde las personas con diabetes tiene mayor impacto cuando se utilizan métodos \nconductuales (205) desde un enfoque preventivo.\nEl modelo transteórico de cambios conductuales, fue originalmente descrito \npara intervenir conductualmente a personas con tabaquismo (206), este propone', 'Cómo tratar mi diabetes. 3rd ed. CENEXA-press, Buenos Aires. ISBN 987-98423-4-0\n21. Lencioni C, Lupi R, Del Prato S. Beta-cell failure in type 2 diabetes mellitus. Curr Diab Rep 2008; 8: \n179-84. doi: 10.1007/s11892-008-0031-0\n22. The Look AHEAD Research Group (2014) Eight-year weight losses with an intensive lifestyle \nintervention. Obesity (Silver Spring) 22: 5-13', 'y que pueda recomendarse de forma general para la pérdida de peso de \nlas personas con diabetes. Por lo tanto, se justifica un plan individualizado \npara la terapia nutricional de la diabetes, teniendo en cuenta las preferencias \ndietéticas junto con los conocimientos de salud del individuo, los recursos, \nla disponibilidad de alimentos, las habilidades de preparación de comidas', 'y la actividad física para maximizar la capacidad de alcanzar y mantener el \nplan de alimentación (2).\nSi un paciente ya está tratado con medicación oral del tipo sulfonilurea o \nglinida, esta medicación debe ser suspendida desde el primer día de la dieta \nhipocalórica para prevenir el riesgo de hipoglucemia.', 'prevention efforts.\nLifestyle Interventions\nRecommendations\n3.2 Refer patients with prediabetes to an intensive\nbehavioral lifestyle intervention program\nmodeled on the Diabetes Prevention Program\n(DPP) to achieve and maintain 7% loss of initial body\nweight and increase moderate-intensity physical\nactivity (such as brisk walking) to at least 150\nmin/week.A', 'Identificar y elegir alimentos que contengan CHO de bajo índice glucémico. –› \n3. Elaborar un plan individual de distribución de pequeñas porciones de CHO \ndurante el día. –› 4. Consentimiento en esta opción terapéutica. –› 5. Aprender \nel fundamento de un probable paso terapéutico farmacológico posterior.\nDT2, tratado con insulina', '42\nPREGUNTA 4.  ¿Qué metodología pedagógica se debería emplear, en \nlos programas educativos, para que las personas con diabetes aumenten \nsu adherencia al tratamiento farmacológico e implementen cambios \nterapéuticos en el estilo de vida?\nSe recomienda el uso de un programa conductual para mejorar los resultados \nen las personas con diabetes mellitus. C1\nJustificación', 'tes Prevention Study (DPS) (5), and the\nDa Qing Diabetes Prevention Study (Da\nQing study) (6), demonstrate that life-\nstyle/behavioral intervention with an indi-\nvidualized reduced-calorie meal plan is\nhighly effective in preventing or delaying\ntype 2 diabetes and improving other car-\ndiometabolic risk factors (such as blood\npressure, lipids, and inﬂammation) (7).', 'fruits, and vegetables and minimal re-\nﬁned and processed foods, is also associ-\nated with a lower risk of type 2 diabetes\n(21,23–2 5 ) .A si st h ec a s ef o rt h o s ew i t h\ndiabetes, individualized medical nutrition\ntherapy (see Section 5, “Facilitating\nPositive Health Behaviors and Well-being\nto Improve Health Outcomes,” for more\ndetailed information) is effective in lower-', '134\nÉnfasis de la dieta en la terapia de personas de peso normal, no resistentes \na la insulina con DT2:\nMedios terapéuticos primarios: En estos pacientes el componente terapéutico \nprincipal será la medicación/insulina para bajar la glucosa en sangre. Antes de \niniciar la medicación para bajar la glucosa en sangre, una dieta que contenga', 'potenciar sus efectos.\nAdemás de la ED, el acceso a profesionales de salud capacitados, a medicamentos \ne insumos para el control, es esencial para aumentar la calidad de vida de las \npersonas con diabetes y sus familias, y para reducir los costos en el sistema de \nsalud. Diferentes estudios indican que los costes del tratamiento hospitalario', '(DPP) to achieve and maintain 7% loss of initial body\nweight and increase moderate-intensity physical\nactivity (such as brisk walking) to at least 150\nmin/week.A\n3.3 A variety of eating patterns are acceptable for persons\nwith prediabetes. B\n3.4 Based on patient preference, technology-assisted\ndiabetes prevention interventions may be effective in\npreventing type 2 diabetes and should be consid-', 'capacitar y/o mejorar el autocuidado en las personas con diabetes?\n• ¿Cuáles son los temas claves que el equipo de salud debe tratar en la \nconsulta de la persona con diabetes, para que mejore su manejo metabólico \ny prevenga o disminuyan las complicaciones?\n• ¿Qué variables deben ser tomadas en cuenta, dentro de la evaluación', 'peso. –› 3. Documentar y explorar sus efectos. –› 4. Elegir el método o métodos \nque mejor coincidan con las preferencias individuales para su aplicación. –› 5. \nMantener el contacto.\nDT2, peso normal, no resistente a la insulina\nEn la mayoría de las personas de peso normal con DT2, la capacidad de producción \nrestante de insulina de las células ß es de sobra y no se observa una resistencia', 'en sangre, normalmente con insulina.\nObjetivos de aprendizaje / contenidos de la educación sobre la DT2 (peso \nnormal, no resistente a la insulina):\n1. Entender la importancia de mantenerse dentro del rango de peso normal. –› 2. \nIdentificar y elegir alimentos que contengan CHO de bajo índice glucémico. –› \n3. Elaborar un plan individual de distribución de pequeñas porciones de CHO', '21\nLista de preguntas clave.\nEl comité seleccionó las siguientes preguntas, como componentes que se \ncubrieron en la guía:\n• ¿En qué modelo de atención debería basarse un programa educativo para \ncapacitar y/o mejorar el autocuidado en las personas con diabetes?\n• ¿Cuáles son los temas claves que el equipo de salud debe tratar en la', 'and interest for stage-speciﬁc treatments,\nparticipation in clinical research, and avail-\nability and burden of testing.\nLIFESTYLE BEHAVIOR CHANGE\nFOR DIABETES PREVENTION\nRecommendations\n3.3 Refer adults with overweight or\nobesity at high risk of type 2 diabetes,\nas seen in the Diabetes Prevention\nProgram (DPP), to an intensive life-\nstyle behavior change program to', 'de grandes volúmenes de información, es de crucial importancia el definir las \nmejores opciones para gestionar eficientemente los datos provenientes de todo el \nproceso asistencial y administrativo.\nSe dispone de muchos programas en línea que ofrecen asesoramiento sobre el \nestilo de vida para ayudar con la pérdida de peso y aumentar la actividad física', 'una glucemia casi normal. Los aspectos generales de la “dieta saludable” \npodrían cubrirse posteriormente, siempre que el paciente haya demostrado que \ncomprende y utiliza correctamente los aspectos cruciales para su tipo específico \nde diabetes.\nDiabetes Tipo 2.\nLa DT2 se caracteriza por su desarrollo progresivo que está determinado por el', 'metabólico y prevenga o disminuya las complicaciones?\nSe recomienda un programa de apoyo al autocuidado estandarizado, adaptado \na las necesidades de la región, que tenga como mínimo más de 12 horas \nde contacto con los educadores y que contenga los siguientes temas en su \nestructura. C1:\n1. Alimentación saludable.\n2. Actividad física.\n3. Automonitoreo.\n4. Adherencia terapéutica.', 'inicial de las personas con diabetes, para determinar sus prioridades \neducativas?\n• ¿Qué método pedagógico se debería emplear, en los programas educativos, \npara que las personas con diabetes aumenten su adherencia al tratamiento \nfarmacológico e implementen cambios terapéuticos en el estilo de vida?\n• ¿Es igualmente efectiva la educación virtual o a distancia, comparada', 'una remisión de la DT2 tras una pérdida de peso sustancial (15), y el objetivo \nterapéutico previsto se puede lograr durante años. No obstante, dicha remisión \nserá temporal (durará desde unos pocos años hasta décadas) dependiendo de la \nprogresión de la pérdida individual de células ß.\nÉnfasis de la dieta en la terapia de las personas con sobrepeso/obesidad', 'monitoreo diario de datos clínicos, educación y retroalimentación personal \ndemostraron ser más exitosos para realizar cambios de comportamiento y \nreducir costos. Aunque los hallazgos sugieren que tanto la teleconsulta como la \nvideoconferencia son métodos prácticos, rentables y confiables, lastimosamente \nla diversidad en el diseño de los estudios hacen que una conclusión sólida al', 'sucesivamente recomendaciones de macro y micronutrientes siguiendo la idea \ngeneral de una “alimentación saludable”.\nEl objetivo es destacar los aspectos principales, relacionados con la nutrición \ny las recomendaciones para cada una de las características específicas de \nlos diferentes tipos de diabetes y sus etapas. En consecuencia, siguiendo el']","Para reducir las probabilidades de desarrollar diabetes tipo 2, se recomiendan los siguientes cambios clave en el estilo de vida:

1. **Pérdida de peso**: Lograr y mantener una reducción de al menos el 7% del peso inicial a través de una dieta saludable y baja en calorías.
2. **Actividad física**: Aumentar la actividad física moderada, como caminar rápido, a al menos 150 minutos por semana.
3. **Alimentación saludable**: Seguir una dieta que incluya fuentes de carbohidratos con alto contenido de fibra y bajo índice glucémico, como frutas, verduras, granos integrales y legumbres; elegir productos lácteos bajos en grasa; comer pescado; y controlar la ingesta de ácidos grasos saturados y trans.

Estos cambios han demostrado ser efectivos en la prevención o retraso de la diabetes tipo 2 y en la mejora de otros factores de riesgo cardiometabólico.","Los cambios clave en el estilo de vida recomendados para reducir las probabilidades de desarrollar diabetes tipo 2 incluyen lograr y mantener un peso corporal saludable mediante dieta y ejercicio, adoptar un patrón de alimentación equilibrado centrado en alimentos ricos en fibra y limitar los carbohidratos refinados y las bebidas azucaradas, aumentar los niveles de actividad física, dejar de fumar y limitar el consumo de alcohol. Para quienes tienen prediabetes, participar en un programa estructurado de intervención en el estilo de vida puede reducir significativamente la progresión a diabetes tipo 2. Las modificaciones tempranas y sostenidas del estilo de vida centradas en el control del peso, la dieta y la actividad física son cruciales para una prevención eficaz de la diabetes.",1.0,0.954866637181491,,0.8333333333333334,1.0,0.6954662689793676,0.8618650759174704
¿Qué debe hacer alguien si le diagnostican prediabetes?,"['un familiar de primer grado de enfermedad cardiovascular\nprematura) en alguien menor de 40 años.\nUna vez realizada la evaluación del riesgo cardiovascular, el algo-\nritmo terapéutico continua de la siguiente manera (ver laFigura 1):\nPacientes sin alto riesgo cardiovascular: iniciar tratamiento\ncon metformina.', 'consulta de la persona con diabetes, para que mejore su manejo metabólico \ny prevenga o disminuyan las complicaciones?\n• ¿Qué variables deben ser tomadas en cuenta, dentro de la evaluación \ninicial de las personas con diabetes, para determinar sus prioridades \neducativas?\n• ¿Qué método pedagógico se debería emplear, en los programas educativos,', '(recién diagnosticada, con sobrepeso):\n1. Entender la importancia de la reducción de peso para reducir la resistencia a \nla insulina –› 2. Aprender a saber y experimentar varios métodos de reducción de \npeso. –› 3. Documentar y explorar sus efectos. –› 4. Elegir el método o métodos \nque mejor coincidan con las preferencias individuales para su aplicación. –› 5. \nMantener el contacto.', 'zados especíﬁcamente para personas con diabetes.\nSe sugiere que las recomendaciones al paciente incluyan ade-\nmás otros aspectos de la modiﬁcación del estilo de vida, como el\naumento de la actividad física y la pérdida de peso. En aquellos\nadultos con diabetes tipo 2 con sobrepeso u obesidad, se debe\ndiscutir y acordar un objetivo inicial de pérdida de peso corporal\nde 5 a 10 %.', 'se encuentran cursando una enfermedad intercurrente, si siguen\nuna dieta muy baja en carbohidratos o cetogénica): de ser así,\nintervenir sobre los factores de riesgo de desarrollo de cetosis\nque sean modiﬁcables, educando al paciente al respecto.\nLos inhibidores de SGLT2 también pueden indicarse luego a lo\nlargo del tratamiento si el paciente progresa a alto riesgo cardio-\nvascular.', 'y la actividad física para maximizar la capacidad de alcanzar y mantener el \nplan de alimentación (2).\nSi un paciente ya está tratado con medicación oral del tipo sulfonilurea o \nglinida, esta medicación debe ser suspendida desde el primer día de la dieta \nhipocalórica para prevenir el riesgo de hipoglucemia.', 'adultos con diabetes tipo 2 con sobrepeso u obesidad, se debe\ndiscutir y acordar un objetivo inicial de pérdida de peso corporal\nde 5 a 10 %.\nLa reducción del riesgo de hipoglucemia será un objetivo pri-', 'mento: reforzar los consejos sobre plan alimentario, estilo\nde vida y la adherencia al tratamiento farmacológico; apo-\nyar a la persona para que llegue a un nivel de HbA1c de\n7,0 % e intensiﬁcar el tratamiento farmacológico.\nConsiderar la posibilidad de no ser tan estricto con el objetivo\nmetabólico de la HbA1c, especialmente en adultos mayores o frá-', 'de la persona, siendo sensible a su voluntad de cambio y los efec-\ntos en su calidad de vida.\nSe aconseja estimular a los adultos con diabetes tipo 2 a seguir\nlos mismos consejos de alimentación saludable que la población\ngeneral, que incluyen: comer fuentes de carbohidratos con alto\ncontenido de ﬁbra y bajo índice glucémico, como frutas, verdu-', 'progresión de la pérdida individual de células ß.\nÉnfasis de la dieta en la terapia de las personas con sobrepeso/obesidad \ncon diagnóstico reciente de DT2 y resistencia a la insulina:\nMedios terapéuticos primarios: En estos pacientes el principal componente \nterapéutico es la reducción de peso para reducir la resistencia a la insulina.', 'peso. –› 3. Documentar y explorar sus efectos. –› 4. Elegir el método o métodos \nque mejor coincidan con las preferencias individuales para su aplicación. –› 5. \nMantener el contacto.\nDT2, peso normal, no resistente a la insulina\nEn la mayoría de las personas de peso normal con DT2, la capacidad de producción \nrestante de insulina de las células ß es de sobra y no se observa una resistencia', 'en sangre, normalmente con insulina.\nObjetivos de aprendizaje / contenidos de la educación sobre la DT2 (peso \nnormal, no resistente a la insulina):\n1. Entender la importancia de mantenerse dentro del rango de peso normal. –› 2. \nIdentificar y elegir alimentos que contengan CHO de bajo índice glucémico. –› \n3. Elaborar un plan individual de distribución de pequeñas porciones de CHO', 'proceso asistencial y administrativo.\nSe dispone de muchos programas en línea que ofrecen asesoramiento sobre el \nestilo de vida para ayudar con la pérdida de peso y aumentar la actividad física \n(143). Hay programas que tienen como objetivo tratar la prediabetes y prevenir \nla progresión a diabetes siguiendo el modelo del Programa de Prevención de', 'principal será la medicación/insulina para bajar la glucosa en sangre. Antes de \niniciar la medicación para bajar la glucosa en sangre, una dieta que contenga \nCHO, caracterizada por alimentos de bajo índice glucémico (17) (ver Tab. 3), \ndistribuidos en varias porciones pequeñas de CHO durante el transcurso del día, \npuede ser una opción terapéutica siempre que sea aceptada por el paciente y se', 'células ß, es necesario realizar una evaluación periódica de su función para \nasegurarse de que se sigue cumpliendo el objetivo terapéutico con este tipo de \ndieta. La próxima opción terapéutica es la medicación para reducir la glucosa \nen sangre, normalmente con insulina.\nObjetivos de aprendizaje / contenidos de la educación sobre la DT2 (peso \nnormal, no resistente a la insulina):', 'de comportamiento planificado (Ej.: Inicio de AUTOMONITOREO). El \ncomportamiento diana debe ser simple, mesurable, orientado a la acción, \nrealista y calculado. Un objetivo específico sería: “Caminar tres veces al día \ndurante 15 minutos” o “Cambiar la leche entera (homogeneizada) por leche \ndescremada”.\nEn segundo lugar, se identifica en qué etapa de cambio se encuentra la persona \ncon diabetes:', 'a sus familiares o cuidadores en el momento del diagnóstico, con\nrefuerzos y revisiones anuales. Se aconseja que estas activida-\ndes educativas procuren el desarrollo de actitudes, conocimien-\ntos y habilidades para el autocontrol de la diabetes por parte\nde la persona, para lo cual deben estar basadas en evidencia\ny adaptadas a sus necesidades, contar con objetivos especíﬁcos', 'los mismos consejos de alimentación saludable que la población\ngeneral, que incluyen: comer fuentes de carbohidratos con alto\ncontenido de ﬁbra y bajo índice glucémico, como frutas, verdu-\nras, granos integrales y legumbres; elegir productos lácteos bajos\nen grasa; comer pescado; y controlar la ingesta de ácidos grasos\nsaturados y trans, desalentando el uso de alimentos comerciali-', '(143). Hay programas que tienen como objetivo tratar la prediabetes y prevenir \nla progresión a diabetes siguiendo el modelo del Programa de Prevención de \nDiabetes (DPP) (144)(145). Otros ayudan en la mejora de resultados, mediante el', 'enfermedad de fácil detección, pero con sintomatología inespecífica, y todas las medidas \npreventivas dependen principalmente de la implementación de estrategias orientadas al \napoyo al autocuidado, a través de programas de educación en diabetes.\nLa Guía de Práctica Clínica (GPC) propuesta por la Federación Internacional de Diabetes', 'including people with an A1C of 5.7–6.4% (39–47\nmmol/mol), impaired glucose tolerance, or impaired\nfasting glucose, are ideal candidates for diabetes\nprevention efforts.\nLifestyle Interventions\nRecommendations\n3.2 Refer patients with prediabetes to an intensive\nbehavioral lifestyle intervention program\nmodeled on the Diabetes Prevention Program', 'Identificar y elegir alimentos que contengan CHO de bajo índice glucémico. –› \n3. Elaborar un plan individual de distribución de pequeñas porciones de CHO \ndurante el día. –› 4. Consentimiento en esta opción terapéutica. –› 5. Aprender \nel fundamento de un probable paso terapéutico farmacológico posterior.\nDT2, tratado con insulina', 'una glucemia casi normal. Los aspectos generales de la “dieta saludable” \npodrían cubrirse posteriormente, siempre que el paciente haya demostrado que \ncomprende y utiliza correctamente los aspectos cruciales para su tipo específico \nde diabetes.\nDiabetes Tipo 2.\nLa DT2 se caracteriza por su desarrollo progresivo que está determinado por el', '130\nDT2, sobrepeso, recientemente diagnosticado, resistente a la insulina\nEn una persona con sobrepeso y con una DT2 recientemente diagnosticada, \nes común que se manifieste la resistencia a la insulina. A pesar de la \nhiperinsulinemia, la capacidad restante de producción de insulina de las células \nß no es suficiente para alcanzar niveles normoglucémicos (deficiencia relativa', 'Medios terapéuticos primarios: En estos pacientes el principal componente \nterapéutico es la reducción de peso para reducir la resistencia a la insulina.\nObjetivo terapéutico: Alcanzar el objetivo terapéutico de glucemia acordado \nmutuamente mediante la mejor reducción posible de la resistencia a la insulina \nexistente.\nEl papel de la nutrición y el enfoque dietético:  La intervención dietética', 'dietéticas junto con los conocimientos de salud del individuo, los recursos, \nla disponibilidad de alimentos, las habilidades de preparación de comidas \ny la actividad física para maximizar la capacidad de alcanzar y mantener el \nplan de alimentación (2).\nSi un paciente ya está tratado con medicación oral del tipo sulfonilurea o', 'La diabetes forma parte de la vida cotidiana de las personas y está repleta de \nsignificados relacionados con su contexto vital real y su historia personal y \nrelacional. Tratarse bien mientras se vive con diabetes requiere cambios de \ncomportamiento, adquirir nuevos hábitos y abandonar los antiguos (1)(2). Todos \nlos estudios demuestran que estos resultados pueden alcanzarse a través de', 'la práctica deportiva. B1\nSe sugiere utilizar glucómetros aprobados por las autoridades sanitarias locales. D1\nSe recomienda iniciar un programa de educación y apoyo al autocuidado de \ndiabetes antes de iniciar automonitoreo, para ayudar en la toma de decisiones. \nEs importante entrenar en el registro e interpretación de los resultados, para \ntomar decisiones en la vida diaria. B1\nJustificación', 'mutuamente mediante la mejor reducción posible de la resistencia a la insulina \nexistente.\nEl papel de la nutrición y el enfoque dietético:  La intervención dietética \nhipocalórica será según las preferencias individuales y la situación psicosocial', 'durante 15 minutos” o “Cambiar la leche entera (homogeneizada) por leche \ndescremada”.\nEn segundo lugar, se identifica en qué etapa de cambio se encuentra la persona \ncon diabetes:\nPrecontemplación: Fase en la que no hay cambios durante al menos seis \nmeses. Existe una falta de conocimientos o de una decisión consciente. Muy', 'metabólico y prevenga o disminuya las complicaciones?\nSe recomienda un programa de apoyo al autocuidado estandarizado, adaptado \na las necesidades de la región, que tenga como mínimo más de 12 horas \nde contacto con los educadores y que contenga los siguientes temas en su \nestructura. C1:\n1. Alimentación saludable.\n2. Actividad física.\n3. Automonitoreo.\n4. Adherencia terapéutica.', 'de riesgo cardiovascular asociados.\nLa educación de las personas con riesgo de desarrollar diabetes se considera \nun aspecto fundamental de las estrategias de prevención y tratamiento de la \nenfermedad. La educación es un proceso continuo y progresivo, que permite \na la persona comprender y formar parte activa y efectiva de su control y', 'para poder subir de nivel, constituyéndose por tanto en una herramienta que \nle permite conocer a todo el personal de la unidad sanitaria en qué nivel de \nestructuración se encuentra para brindar asistencia a personas con enfermedades \ncrónicas, y además qué debe hacer administrativa y asistencialmente para \nescalar de nivel, es decir, la hoja de ruta para la optimización de la calidad del', 'ras, granos integrales y legumbres; elegir productos lácteos bajos\nen grasa; comer pescado; y controlar la ingesta de ácidos grasos\nsaturados y trans, desalentando el uso de alimentos comerciali-\nzados especíﬁcamente para personas con diabetes.\nSe sugiere que las recomendaciones al paciente incluyan ade-\nmás otros aspectos de la modiﬁcación del estilo de vida, como el', 'que hacer constantemente juicios, decisiones, correcciones y adaptaciones \npara mantener la actitud adecuada.\nUtilizando esta analogía, el personal sanitario puede ayudar al paciente a \nrealizar una serie de actividades que le permitan probar progresivamente nuevas \nhabilidades, descubrir errores, pensar en soluciones, etc. Estas actividades', 'discutir y acordar un objetivo inicial de pérdida de peso corporal\nde 5 a 10 %.\nLa reducción del riesgo de hipoglucemia será un objetivo pri-\nmordial para las personas que usan insulina o un secretagogo de\ninsulina.\nFinalmente, la cirugía bariátrica está indicada para pacientes\ncon un IMC de 35 o más que tengan diabetes tipo 2 de inicio\nreciente (diagnosticada en los 10 años previos).', 'test in 3–6m o n t h s .\n3. PREVENTION OR DELAY OF TYPE 2 DIABETES\nRecommendation\n3.1 At least annualmonitoringforthedevelopmentoftype\n2 diabetes in those with prediabetes is suggested.E\nTABLE 2.2/2.5 Criteria for the screening and diagnosis of prediabetes and diabetes\nPrediabetes Diabetes\nA1C 5.7 –6.4% (39–47 mmol/mol)* $6.5% (48 mmol/mol)†', 'suficiente quedarse en silencio? Aunque guardar silencio es un requisito previo \npara escuchar, se necesita algo más. El trabajador sanitario también debe tener \nuna actitud receptiva y perceptiva. Cuando los médicos escuchan el pecho del \npaciente de forma receptiva, escuchan para hacer un diagnóstico. Escuchan', 'performed without delay. If the patient has a test result\nnear the margins of the diagnostic threshold, the pro-\nvider should follow the patient closely and repeat the\ntest in 3–6m o n t h s .\n3. PREVENTION OR DELAY OF TYPE 2 DIABETES\nRecommendation\n3.1 At least annualmonitoringforthedevelopmentoftype\n2 diabetes in those with prediabetes is suggested.E', 'crónicas, y además qué debe hacer administrativa y asistencialmente para \nescalar de nivel, es decir, la hoja de ruta para la optimización de la calidad del \nservicio. Se accede a mencionada herramienta a través del siguiente enlace: \nhttp://www.hgp.gob.ec/clay/redcap/surveys/?s=FE4E3FTT7M.\nSe recomienda aplicar la encuesta ACIC, dos veces al año, e ir midiendo los', 'recomienda determinar el perfil de la persona con diabetes, teniendo en cuenta \nlas siguientes variables: conocimiento de recomendaciones de comportamientos \nde autocuidado, actitudes hacia la diabetes y las tareas de autocuidado, aspectos \nemocionales (angustia por diabetes y depresión), funcionamiento cognitivo, \ndisposición al cambio, apoyo familiar y alfabetización en salud. Punto de buena', 'Guía de Práctica Clínica de Educación en Diabetes \nRegión Centro y Sudamérica, \nFederación Internacional de Diabetes (IDF-SACA)\nPrólogo\n“Debe haber un programa de educación que explique a la comunidad, la \nimportancia de la dieta y la lucha contra el sedentarismo para evitar la obesidad, \nasí como para prevenir el inicio de la diabetes y también mostrar el papel de', 'capacitar y/o mejorar el autocuidado en las personas con diabetes?\n• ¿Cuáles son los temas claves que el equipo de salud debe tratar en la \nconsulta de la persona con diabetes, para que mejore su manejo metabólico \ny prevenga o disminuyan las complicaciones?\n• ¿Qué variables deben ser tomadas en cuenta, dentro de la evaluación', 'importancia de la dieta y la lucha contra el sedentarismo para evitar la obesidad, \nasí como para prevenir el inicio de la diabetes y también mostrar el papel de \nestas medidas en el control y el tratamiento de esta enfermedad”. Esta frase fue \ncreada en 1925 por un papá interesado en diabetes y con una gran experiencia \nen la formación de médicos de todo el mundo en el campo de la diabetes', 'a los pacientes a aprender, porque no toma en cuenta su forma de entender, sus \ncreencias y su experiencia personal como pacientes.\nEnseñar a los pacientes mediante un monólogo es un método arriesgado. ¿Cómo \nse puede saber si el paciente ha entendido y también ha aceptado lo que se le \nha dicho? El método correcto es dar a los pacientes tiempo suficiente para', 'con diabetes:\nPrecontemplación: Fase en la que no hay cambios durante al menos seis \nmeses. Existe una falta de conocimientos o de una decisión consciente. Muy \nbaja autoconfianza. Predominan los contras sobre los pros (las razones para \nno cambiar serán numerosas). En la etapa de Precontemplación, la persona no \nestá lista para realizar un cambio. Esto podría suceder porque no sabe que un', 'La guía recomienda un enfoque individualizado para el cuidado\nde la diabetes que se adapte a las necesidades y circunstancias\nde las personas adultas con DM2, de acuerdo a sus preferencias\npersonales, comorbilidades y los riesgos de la polifarmacia, y a\nsu probabilidad de beneﬁciarse de las intervenciones en el lar-\ngo plazo. Recomienda realizar reevaluaciones en cada consulta,', 'se puede saber si el paciente ha entendido y también ha aceptado lo que se le \nha dicho? El método correcto es dar a los pacientes tiempo suficiente para \nque expliquen sus pensamientos, miedos y creencias sobre la enfermedad y su \ntratamiento, antes de que el médico dé más información.\nEscuchar y reformular\nEscuchar es una idea clave, un paso ineludible según los expertos en', 'ejecución estructurado. En esta fase inicial, los participantes aprenden a saber \ny aplicar temporalmente varios métodos de reducción de peso. Por ejemplo, \nutilizando dos semanas una dieta de fórmula, seguida de una intervención baja \nen grasas, una baja en carbohidratos y un ayuno intermitente. Los educadores \ncon experiencia en diabetes apoyan este “camino de descubrimiento” que', 'cambio real. Todas las oportunidades que favorezcan el acceso al tratamiento, los \ncomportamientos de autocuidado y el empoderamiento de la persona, deben ser \npriorizados.\nRecomendaciones.\nPREGUNTA 1. ¿En qué modelo de atención debería basarse un programa \neducativo para capacitar y/o mejorar el comportamiento de autocuidado en \nlas personas con diabetes?']","Si te diagnostican prediabetes, es importante tomar medidas para prevenir o retrasar el desarrollo de diabetes tipo 2. Aquí hay algunos pasos clave que puedes seguir:

1. **Modificación del Estilo de Vida**:
   - **Alimentación Saludable**: Adopta una dieta equilibrada que incluya fuentes de carbohidratos con alto contenido de fibra y bajo índice glucémico, como frutas, verduras, granos integrales y legumbres. Elige productos lácteos bajos en grasa y controla la ingesta de ácidos grasos saturados y trans.
   - **Actividad Física**: Aumenta tu nivel de actividad física. Esto puede incluir caminar, nadar, andar en bicicleta o cualquier otra actividad que disfrutes. Un objetivo específico podría ser caminar tres veces al día durante 15 minutos.
   - **Pérdida de Peso**: Si tienes sobrepeso u obesidad, discute y acuerda un objetivo inicial de pérdida de peso corporal del 5 al 10%.

2. **Educación y Apoyo**:
   - **Programas Educativos**: Participa en programas de educación en diabetes que te ayuden a entender mejor la enfermedad y cómo manejarla. Estos programas deben estar basados en evidencia y adaptados a tus necesidades.
   - **Automonitoreo**: Aprende a usar un glucómetro para monitorear tus niveles de glucosa en sangre. Esto te ayudará a tomar decisiones informadas sobre tu dieta y actividad física.

3. **Seguimiento Médico**:
   - **Consultas Regulares**: Mantén un contacto regular con tu equipo de salud para reevaluar tu progreso y ajustar tu plan de manejo según sea necesario.
   - **Monitoreo**: Realiza pruebas periódicas para monitorear tu progreso y asegurarte de que no estás desarrollando diabetes tipo 2. Si tus resultados están cerca del umbral diagnóstico, tu médico debería seguirte de cerca y repetir las pruebas cada 3-6 meses.

4. **Apoyo Psicosocial**:
   - **Familia y Amigos**: Involucra a tu familia y amigos en tu proceso de cambio. Su apoyo puede ser crucial para mantenerte motivado y comprometido.
   - **Grupos de Apoyo**: Considera unirte a grupos de apoyo para personas con prediabetes o diabetes. Compartir experiencias y estrategias con otros puede ser muy útil.

Recuerda que el manejo de la prediabetes es un proceso continuo y progresivo. Cada pequeño cambio que hagas puede tener un impacto significativo en tu salud a largo plazo.","Si le diagnostican prediabetes, es crucial realizar cambios en el estilo de vida para prevenir la progresión a diabetes tipo 2. Los pasos clave incluyen perder peso mediante una dieta saludable y mayor actividad física, unirse a un programa estructurado de cambio de estilo de vida centrado en dieta y ejercicio, monitorear regularmente los valores de salud con un profesional, dormir lo suficiente y limitar el consumo de alcohol y tabaco. La intervención temprana con modificaciones en el estilo de vida puede reducir significativamente el riesgo de desarrollar diabetes tipo 2 en personas con prediabetes.",1.0,0.9070480958441034,,0.8333333333333334,1.0,0.4962137987360969,0.8235648723637425
¿Qué pasos se deben tomar para reducir el riesgo de diabetes tipo 2 después de haber tenido diabetes gestacional?,"['discutir y acordar un objetivo inicial de pérdida de peso corporal\nde 5 a 10 %.\nLa reducción del riesgo de hipoglucemia será un objetivo pri-\nmordial para las personas que usan insulina o un secretagogo de\ninsulina.\nFinalmente, la cirugía bariátrica está indicada para pacientes\ncon un IMC de 35 o más que tengan diabetes tipo 2 de inicio\nreciente (diagnosticada en los 10 años previos).', 'of developing GDM in the subsequent\npregnancy (137). Development of type 2\ndiabetes is 18% higher per unit of BMI\nincrease from prepregnancy BMI at\nfollow-up, highlighting the importance of\neffective weight management after GDM\n(138). In addition, postdelivery lifestyle in-\nterventions are effective in reducing risk of\ntype 2 diabetes (139).\nBoth metformin and intensive life-', '(recién diagnosticada, con sobrepeso):\n1. Entender la importancia de la reducción de peso para reducir la resistencia a \nla insulina –› 2. Aprender a saber y experimentar varios métodos de reducción de \npeso. –› 3. Documentar y explorar sus efectos. –› 4. Elegir el método o métodos \nque mejor coincidan con las preferencias individuales para su aplicación. –› 5. \nMantener el contacto.', 'effective weight management after GDM\n(138). In addition, postdelivery lifestyle in-\nterventions are effective in reducing risk of\ntype 2 diabetes (139).\nBoth metformin and intensive life-\nstyle intervention prevent or delay pro-\ngression to diabetes in individuals with\nprediabetes and a history of GDM. Only\nﬁve to six individuals with prediabetes\nand a history of GDM need to be treated', 'zados especíﬁcamente para personas con diabetes.\nSe sugiere que las recomendaciones al paciente incluyan ade-\nmás otros aspectos de la modiﬁcación del estilo de vida, como el\naumento de la actividad física y la pérdida de peso. En aquellos\nadultos con diabetes tipo 2 con sobrepeso u obesidad, se debe\ndiscutir y acordar un objetivo inicial de pérdida de peso corporal\nde 5 a 10 %.', 'tant factor in reducing the risk of progres-\nsion, with every kilogram of weight loss\nconferring a 16% reduction in risk of pro-\ngression over 3.2 years (12). In individuals\nwith previous history of GDM, the risk of\ntype 2 diabetes increased by 18% for ev-\nery 1 unit BMI above the preconception\nbaseline (76). Several medications evalu-\nated for weight loss (e.g., orlistat, phenter-', 'case of diabetes over 3 years (140). In\nthese individuals, lifestyle intervention\nand metformin reduced progression to di-\nabetes by 35% and 40%, respectively,\nover 10 years compared with placebo\n(141). If the pregnancy has motivated the\nadoption of healthy nutrition, building on\nthese gains to support weight loss is rec-\nommended in the postpartum period.\n(See Section 3,“Prevention or Delay of', '139. Li N, Yang Y , Cui D, et al. Effects of lifestyle\nintervention on long-term risk of diabetes in\nwomen with prior gestational diabetes: a\nsystematic review and meta-analysis of randomized\ncontrolled trials. Obes Rev 2021;22:e13122\n140. Ratner RE, Christophi CA, Metzger BE,\net al.; Diabetes Prevention Program Research\nGroup. Prevention of diabetes in women with', 'absolute and relative risk of type 2 diabetes after\ngestational diabetes: a systematic review and\nmeta-analysis of 129 studies. Diabetes Res Clin\nPract 2021;171:108625\n139. Li N, Yang Y , Cui D, et al. Effects of lifestyle\nintervention on long-term risk of diabetes in\nwomen with prior gestational diabetes: a\nsystematic review and meta-analysis of randomized', 'peso. –› 3. Documentar y explorar sus efectos. –› 4. Elegir el método o métodos \nque mejor coincidan con las preferencias individuales para su aplicación. –› 5. \nMantener el contacto.\nDT2, peso normal, no resistente a la insulina\nEn la mayoría de las personas de peso normal con DT2, la capacidad de producción \nrestante de insulina de las células ß es de sobra y no se observa una resistencia', 'risk after a history of GDM was signiﬁ-\ncantly lower in those who followed\nhealthy eating patterns (135). Adjusting\nfor BMI attenuated this association mod-\nerately, but not completely. Interpreg-\nnancy weight gain is associated with\nincreased risk of adverse pregnancy out-\ncomes (136) and higher risk of GDM,\nwhile in people with BMI>25 kg/m2,\nweight loss is associated with lower risk', 'adultos con diabetes tipo 2 con sobrepeso u obesidad, se debe\ndiscutir y acordar un objetivo inicial de pérdida de peso corporal\nde 5 a 10 %.\nLa reducción del riesgo de hipoglucemia será un objetivo pri-', 'adoption of healthy nutrition, building on\nthese gains to support weight loss is rec-\nommended in the postpartum period.\n(See Section 3,“Prevention or Delay of\nDiabetes and Associated Comorbidities.”)\nIndividuals with prediabetes or a his-\ntory of GDM will need preconception\nevaluation for as long as they have child-\nbearing potential.\nPreexisting Type 1 and Type 2\nDiabetes Postpartum Care', 'terventions and/or metformin to prevent diabetes.A\n14.25 Women with a history of GDM should have\nlifelong screening for the development of\ntype 2 diabetes or prediabetes at least every\n3 years. B\n14.26 Women with a history of GDM should seek pre-\nconception screening for diabetes and pre-\nconception care to identify and treat hyperglycemia\nand prevent congenital malformations.E', 'los mismos consejos de alimentación saludable que la población\ngeneral, que incluyen: comer fuentes de carbohidratos con alto\ncontenido de ﬁbra y bajo índice glucémico, como frutas, verdu-\nras, granos integrales y legumbres; elegir productos lácteos bajos\nen grasa; comer pescado; y controlar la ingesta de ácidos grasos\nsaturados y trans, desalentando el uso de alimentos comerciali-', 'glucose tolerance test and clinically appropriate\nnonpregnancy diagnostic criteria.B\n14.24 Women with a history of GDM found to have pre-\ndiabetes should receive intensive lifestyle in-\nterventions and/or metformin to prevent diabetes.A\n14.25 Women with a history of GDM should have\nlifelong screening for the development of\ntype 2 diabetes or prediabetes at least every\n3 years. B', 'progresión de la pérdida individual de células ß.\nÉnfasis de la dieta en la terapia de las personas con sobrepeso/obesidad \ncon diagnóstico reciente de DT2 y resistencia a la insulina:\nMedios terapéuticos primarios: En estos pacientes el principal componente \nterapéutico es la reducción de peso para reducir la resistencia a la insulina.', 'diabetes mellitus: a systematic review and meta-\nanalysis of 170,139 women. J Diabetes Res 2020;\n2020:3076463\n135. Tobias DK, Hu FB, Chavarro J, Rosner B,\nMozaffarian D, Zhang C. Healthful dietary\npatterns and type 2 diabetes mellitus risk among\nwomen with a history of gestational diabetes\nmellitus. Arch Intern Med 2012;172:1566–1572\n136. Villamor E, Cnattingius S. Interpregnancy', '10 years, 30% at 20 years, 40% at 30 years,\n5 0 %a t4 0y e a r s ,a n d6 0 %a t5 0y e a r s\n(134). In the prospective Nurses’ Health\nStudy II (NHS II), subsequent diabetes\nrisk after a history of GDM was signiﬁ-\ncantly lower in those who followed\nhealthy eating patterns (135). Adjusting\nfor BMI attenuated this association mod-\nerately, but not completely. Interpreg-', 'y gestacional, para reducir y minimizar complicaciones agudas y crónicas \nque podrían presentarse, permitiéndoles mejorar su calidad de vida.\n• Establecer contenidos básicos que debe abarcar un programa de educación \ndirigido a personas con diabetes.', 'diabetes in women with a known history of\ngestational diabetes: systematic review and\nmeta-analysis. BMJ 2020;369:m1361\n134. Li Z, Cheng Y , Wang D, et al. Incidence rate\nof type 2 diabetes mellitus after gestational\ndiabetes mellitus: a systematic review and meta-\nanalysis of 170,139 women. J Diabetes Res 2020;\n2020:3076463\n135. Tobias DK, Hu FB, Chavarro J, Rosner B,', 'Lifestyle and Behavioral Management\nAfter diagnosis, treatment starts with\nmedical nutrition therapy, physical activ-\nity, and weight management, depending\non pregestational weight, as outlined in\nthe section below on preexisting type 2\ndiabetes, as well as glucose monitoring\naiming for the goals recommended by the\nFifth International Workshop-Conference\non Gestational Diabetes Mellitus (63):', 'ways type 2 diabetes, in the mother after\ndelivery (201,202). As effective preven-\ntion interventions are available (203,204),\nindividuals diagnosed with GDM should\nreceive lifelong screening for prediabetes\nto allow interventions to reduce diabetes\nrisk and for type 2 diabetes to allow treat-\nment at the earliest possible time (205).\nDiagnosis\nGDM carries risks for the mother, fetus,', 'mutuamente mediante la mejor reducción posible de la resistencia a la insulina \nexistente.\nEl papel de la nutrición y el enfoque dietético:  La intervención dietética \nhipocalórica será según las preferencias individuales y la situación psicosocial', 'effective as lifestyle modiﬁca tion in par-\nticipants with BMI $35 kg/m2 and in\nyounger participants aged 25–44 years\n(4). In individuals with a history of GDM\nin the DPP , metformin and intensive life-\nstyle modiﬁc a t i o nl e dt oa ne q u i v a l e n t\n50% reduction in diabetes risk (91). Both\ninterventions remained highly effective\nduring a 10-year follow-up period (92). By', 'sia, and superimposed preeclampsia have\ntheir blood pressures observed for 72 h in\nthe hospital and 7–10 days postpartum.\nLong-term follow-up is recommended\nfor these individuals, as they have in-\ncreased lifetime cardiovascular risk\n(51). See Section 15, “Management of\nDiabetes in Pregnancy,” for additional\ninformation.\nTreatment Strategies\nLifestyle Intervention\nRecommendation', 'y la actividad física para maximizar la capacidad de alcanzar y mantener el \nplan de alimentación (2).\nSi un paciente ya está tratado con medicación oral del tipo sulfonilurea o \nglinida, esta medicación debe ser suspendida desde el primer día de la dieta \nhipocalórica para prevenir el riesgo de hipoglucemia.', 'Identificar y elegir alimentos que contengan CHO de bajo índice glucémico. –› \n3. Elaborar un plan individual de distribución de pequeñas porciones de CHO \ndurante el día. –› 4. Consentimiento en esta opción terapéutica. –› 5. Aprender \nel fundamento de un probable paso terapéutico farmacológico posterior.\nDT2, tratado con insulina', 'metformin to prevent diabetes.A\n15.27 Breastfeeding efforts are rec-\nommended for all individuals with\ndiabetes.A Breastfeeding is recom-\nmended for individuals with a his-\ntory of GDM for multiple beneﬁts, A\nincluding a reduced risk for type 2\ndiabetes later in life.B\n15.28 Individuals with a history of\nGDM should have lifelong screening\nfor the development of type 2 diabe-', 'de la persona, siendo sensible a su voluntad de cambio y los efec-\ntos en su calidad de vida.\nSe aconseja estimular a los adultos con diabetes tipo 2 a seguir\nlos mismos consejos de alimentación saludable que la población\ngeneral, que incluyen: comer fuentes de carbohidratos con alto\ncontenido de ﬁbra y bajo índice glucémico, como frutas, verdu-', 'en sangre, normalmente con insulina.\nObjetivos de aprendizaje / contenidos de la educación sobre la DT2 (peso \nnormal, no resistente a la insulina):\n1. Entender la importancia de mantenerse dentro del rango de peso normal. –› 2. \nIdentificar y elegir alimentos que contengan CHO de bajo índice glucémico. –› \n3. Elaborar un plan individual de distribución de pequeñas porciones de CHO', 'Luengo M, Mart/C19 ınez-Vizca/C19 ıno V. Interpregnancy\nweight change and gestational diabetes mellitus:\na systematic review and meta-analysis. Obesity\n(Silver Spring) 2021;29:454–464\n138. Dennison RA, Chen ES, Green ME, et al. The\nabsolute and relative risk of type 2 diabetes after\ngestational diabetes: a systematic review and\nmeta-analysis of 129 studies. Diabetes Res Clin\nPract 2021;171:108625', 'complicando el tratamiento de la diabetes (9)(10).\nConducta alimentaria problemática y trastornos alimentarios son más prevalentes \nen la diabetes, particularmente entre las mujeres jóvenes con diabetes tipo 1 \n(11). Los más comunes son el trastorno por atracón y la bulimia nerviosa, a \nmenudo asociada con una disregulación emocional y disturbios de la imagen.', 'r e c o m m e n d e da sa no p t i o nf o rh i g h - r i s k\nindividuals (e.g., younger individuals, those\nwith history of GDM, or those with BMI\n$35 kg/m2). A recent Chinese open-label\nrandomized controlled trial showed that\nmetformin combined with standard life-\nstyle intervention further reduced the risk\nof developing diabetes than lifestyle inter-\nvention alone by/C2417% over 2 years (95).', '37\nPREGUNTA 2. ¿Cuáles son los temas claves que el equipo de salud debe \ntratar en la consulta de la persona con diabetes para que mejore su manejo \nmetabólico y prevenga o disminuya las complicaciones?\nSe recomienda un programa de apoyo al autocuidado estandarizado, adaptado \na las necesidades de la región, que tenga como mínimo más de 12 horas', 'including a reduced risk for type 2\ndiabetes later in life.B\n15.28 Individuals with a history of\nGDM should have lifelong screening\nfor the development of type 2 diabe-\ntes or prediabetes every 1–3y e a r s .B\n15.29 Individuals with a history of\nGDM should seek preconception\nscreening for diabetes and precon-\nception care to identify and treat hy-\nperglycemia and prevent congenital', 'Los resultados sobre objetivos glicémicos, muestran reducciones transitorias en \nla hemoglobina glicosilada, que requieren de refuerzos posteriores para persistir \nen el tiempo (182). Se ha visto que los mayores beneficios se obtienen con \naquellos participantes que presentan hemoglobinas glicosiladas mayores previo \na la actividad y en quienes asisten más veces (182). También se ha reportado', 'ensayos controlados aleatorios en contextos de países desarrollados, y los \nhallazgos típicamente sugieren que las intervenciones educativas son costo-\nefectivas en relación con la atención habitual (229)(230)(231)(232)(233)(234)\n(235)(236)(237)(238)(239)(240).\nResultados similares se han obtenido para la región de Latinoamérica (241)', 'lifestyle interventions. J Clin Endocrinol Metab\n2008;93:4774–4779\n92. Aroda VR, Christophi CA, Edelstein SL, et al.;\nDiabetes Prevention Program Research Group.\nThe effect of lifestyle intervention and metformin\non preventing or delaying diabetes among\nwomen with and without gestational diabetes:\nthe Diabetes Prevention Program Outcomes Study\n10-year follow-up. J Clin Endocrinol Metab 2015;', 'capacitar y/o mejorar el autocuidado en las personas con diabetes?\n• ¿Cuáles son los temas claves que el equipo de salud debe tratar en la \nconsulta de la persona con diabetes, para que mejore su manejo metabólico \ny prevenga o disminuyan las complicaciones?\n• ¿Qué variables deben ser tomadas en cuenta, dentro de la evaluación', 'células ß, es necesario realizar una evaluación periódica de su función para \nasegurarse de que se sigue cumpliendo el objetivo terapéutico con este tipo de \ndieta. La próxima opción terapéutica es la medicación para reducir la glucosa \nen sangre, normalmente con insulina.\nObjetivos de aprendizaje / contenidos de la educación sobre la DT2 (peso \nnormal, no resistente a la insulina):', 'Medios terapéuticos primarios: En estos pacientes el principal componente \nterapéutico es la reducción de peso para reducir la resistencia a la insulina.\nObjetivo terapéutico: Alcanzar el objetivo terapéutico de glucemia acordado \nmutuamente mediante la mejor reducción posible de la resistencia a la insulina \nexistente.\nEl papel de la nutrición y el enfoque dietético:  La intervención dietética', '21\nLista de preguntas clave.\nEl comité seleccionó las siguientes preguntas, como componentes que se \ncubrieron en la guía:\n• ¿En qué modelo de atención debería basarse un programa educativo para \ncapacitar y/o mejorar el autocuidado en las personas con diabetes?\n• ¿Cuáles son los temas claves que el equipo de salud debe tratar en la', 'estudio, los resultados del ensayo DIRECT se publicaron recientemente. Los \nautores demostraron que, al cabo de un año, la pérdida de peso asociada a la \nintervención sobre el estilo de vida resultó en la remisión de la diabetes en el \n46% de los participantes. Las tasas de remisión estaban relacionadas con la \nmagnitud de la pérdida de peso, aumentando progresivamente del 7% al 86% a', 'saludable y brinda apoyo social y emocional, que ayuda a mejora la calidad \nde vida de la persona con diabetes (223). Numerosas evidencias, reportadas \nen la literatura, demuestran que las intervenciones educativas en diabetes son \nefectivas y mejoran a corto y mediano plazo el control metabólico (HbA1c, \nlípidos), los factores de riesgo cardiovascular asociados (peso e hipertensión),', 'physical activity, calorie restriction, weight\nmanagement strategies, and motivation.\nThere is strong and consistent evidence\nthat modest, sustained weight loss can delay\nthe progression from prediabetes to type 2\ndiabetes (103,105,106) (see Section 3,\n“Prevention or Delay of Diabetes and\nAssociated Comorbidities”) and is beneﬁ-\ncial for the management of type 2 diabe-', 'una remisión de la DT2 tras una pérdida de peso sustancial (15), y el objetivo \nterapéutico previsto se puede lograr durante años. No obstante, dicha remisión \nserá temporal (durará desde unos pocos años hasta décadas) dependiendo de la \nprogresión de la pérdida individual de células ß.\nÉnfasis de la dieta en la terapia de las personas con sobrepeso/obesidad', 'Propósitos\nLos propósitos de la guía de práctica clínica de educación en diabetes están \norientados a: \n• Sistematizar prácticas educativas basadas en evidencia, para promover, \nconservar y recuperar la salud de las personas con diabetes tipo 1, tipo 2 \ny gestacional, para reducir y minimizar complicaciones agudas y crónicas \nque podrían presentarse, permitiéndoles mejorar su calidad de vida.', 'efectivas y mejoran a corto y mediano plazo el control metabólico (HbA1c, \nlípidos), los factores de riesgo cardiovascular asociados (peso e hipertensión), \nlos conocimientos sobre la diabetes y la adopción de estilos de vida saludable, \nmejorando así la calidad de vida (224)(225)(226).', 'el dolor que perciben, ya que ellos suelen abordar este tema espontáneamente; \nen este grupo de edad es útil el uso de estrategias específicas, de acuerdo a la \nedad, para abordar la administración de insulina (122)(123).\nEs muy importante explicar a las personas con nuevo diagnóstico de diabetes \nmellitus tipo 2 la naturaleza progresiva de la enfermedad, especificando que']","Para reducir el riesgo de desarrollar diabetes tipo 2 después de haber tenido diabetes gestacional, se recomiendan los siguientes pasos:

1. **Manejo efectivo del peso**: La gestión del peso es crucial. Cada kilogramo de pérdida de peso reduce el riesgo de progresión a diabetes tipo 2 en un 16% sobre 3.2 años.

2. **Intervenciones en el estilo de vida**: Las intervenciones postparto en el estilo de vida son efectivas para reducir el riesgo de diabetes tipo 2. Esto incluye una dieta saludable y actividad física regular.

3. **Uso de metformina**: En algunos casos, se puede considerar el uso de metformina junto con intervenciones en el estilo de vida para prevenir o retrasar la progresión a diabetes tipo 2.

4. **Monitoreo continuo**: Las mujeres con un historial de diabetes gestacional deben someterse a un seguimiento de por vida para detectar la aparición de diabetes tipo 2 o prediabetes, al menos cada 1-3 años.

5. **Evaluación preconcepcional**: Si planea quedar embarazada nuevamente, es importante realizar una evaluación preconcepcional para identificar y tratar la hiperglucemia y prevenir malformaciones congénitas.

6. **Lactancia materna**: Se recomienda la lactancia materna debido a sus múltiples beneficios, incluyendo una reducción del riesgo de diabetes tipo 2 en el futuro.

Estos pasos pueden ayudar a minimizar el riesgo de desarrollar diabetes tipo 2 después de haber tenido diabetes gestacional.","Si tuvo diabetes gestacional durante el embarazo, es fundamental adoptar un estilo de vida saludable después del parto para reducir el mayor riesgo de desarrollar diabetes tipo 2. Los pasos clave incluyen lograr y mantener un peso saludable mediante una dieta equilibrada y ejercicio regular, amamantar si es posible, hacerse pruebas de azúcar en sangre regularmente y enseñar hábitos saludables a su hijo desde una edad temprana. Se recomiendan cambios sostenidos en el estilo de vida centrados en el control del peso, la dieta y la actividad física para mitigar el mayor riesgo futuro de diabetes después de la diabetes gestacional.",1.0,0.8269784947201951,,0.75,1.0,0.9630182761476564,0.8520731045906259
¿Por qué es importante la actividad física para prevenir la diabetes tipo 2?,"['y la actividad física para maximizar la capacidad de alcanzar y mantener el \nplan de alimentación (2).\nSi un paciente ya está tratado con medicación oral del tipo sulfonilurea o \nglinida, esta medicación debe ser suspendida desde el primer día de la dieta \nhipocalórica para prevenir el riesgo de hipoglucemia.', 'aquellos participantes que presentan hemoglobinas glicosiladas mayores previo \na la actividad y en quienes asisten más veces (182). También se ha reportado \nmejoría en el conocimiento relacionado a la diabetes, pero que no siempre se \nasocia a un descenso en los parámetros glicémicos (182).\nLa satisfacción de los asistentes y sus familias, respecto a la diversión y', 'Los resultados sobre objetivos glicémicos, muestran reducciones transitorias en \nla hemoglobina glicosilada, que requieren de refuerzos posteriores para persistir \nen el tiempo (182). Se ha visto que los mayores beneficios se obtienen con \naquellos participantes que presentan hemoglobinas glicosiladas mayores previo \na la actividad y en quienes asisten más veces (182). También se ha reportado', 'zados especíﬁcamente para personas con diabetes.\nSe sugiere que las recomendaciones al paciente incluyan ade-\nmás otros aspectos de la modiﬁcación del estilo de vida, como el\naumento de la actividad física y la pérdida de peso. En aquellos\nadultos con diabetes tipo 2 con sobrepeso u obesidad, se debe\ndiscutir y acordar un objetivo inicial de pérdida de peso corporal\nde 5 a 10 %.', 'saludable y brinda apoyo social y emocional, que ayuda a mejora la calidad \nde vida de la persona con diabetes (223). Numerosas evidencias, reportadas \nen la literatura, demuestran que las intervenciones educativas en diabetes son \nefectivas y mejoran a corto y mediano plazo el control metabólico (HbA1c, \nlípidos), los factores de riesgo cardiovascular asociados (peso e hipertensión),', 'diabetes (26).\nPhysical Activity\nModerate-intensity physical activity, such\nas brisk walking for 150 min/week, has\nshown beneﬁcial effects in those with\nprediabetes (4). Similarly, moderate-\nintensity physical activity has been shown\nto improve insulin sensitivity and reduce\nabdominal fat in children and young\nadults (27,28). Health care professionals\nare encouraged to promote a DPP-style', 'overweight people with diabetes (296). The\nADA position statement“Physical Activity/\nExercise and Diabetes” reviews the evi-\ndence for the beneﬁts of exercise in people\nwith type 1 and type 2 diabetes and offers\nspeciﬁc recommendations (297). Increased\nphysical activity (soccer training) has also\nbeen shown to be beneﬁcial for improving\noverallﬁtness in Latino men with obesity,', 'program to all individuals who have been\nidentiﬁed to be at an increased risk of\ntype 2 diabetes. In addition to aerobic\nactivity, a physical activity plan designed\nto prevent diabetes may include resis-\ntance training (11,29,30). Breaking up\nprolonged sedentary time may also be\nencouraged, as it is associated with\nmoderately lower postprandial glucose\nlevels (31,32). The effects of physical ac-', 'Physical activity includes any movement that elevates your heart rate (which can improve \nheart health), increases your metabolism, aids weight loss, lowers your blood pressure, \nincreases your HDL (“good”) cholesterol, and boosts your mood.\nPhysical activity is especially beneficial for people with prediabetes and diabetes because', 'cose. Simple carbohydrates will result in\nhigher postmeal excursions.\nPhysical Activity\nA systematic review demonstrated im-\nprovements in glucose outcomes and re-\nductions in need to start insulin or insulin\ndose requirements with an exercise inter-\nvention. There was heterogeneity in the\ntypes of effective exercise (aerobic, resis-\ntance, or both) and duration of exercise', 'efectivas y mejoran a corto y mediano plazo el control metabólico (HbA1c, \nlípidos), los factores de riesgo cardiovascular asociados (peso e hipertensión), \nlos conocimientos sobre la diabetes y la adopción de estilos de vida saludable, \nmejorando así la calidad de vida (224)(225)(226).', '2017;30:250–257\n110. Jeon CY , Lokken RP, Hu FB, van Dam RM.\nPhysical activity of moderate intensity and risk of\ntype 2 diabetes: a systematic review. Diabetes\nCare 2007;30:744–752\n111. Duncan GE, Perri MG, Theriaque DW,\nHutson AD, Eckel RH, Stacpoole PW . Exercise\ntraining, without weight loss, increases insulin\nsensitivity and postheparin plasma lipase activity', 'increases your HDL (“good”) cholesterol, and boosts your mood.\nPhysical activity is especially beneficial for people with prediabetes and diabetes because \nit can help lower your blood glucose (also called blood sugar) by increasing your body’s \nability to use it for energy (by increasing insulin sensitivity). \nWEIGHT TRAINING\nLifting weights builds muscle mass, which', 'ity and exercise are important. Exercise\nhas been shown to improve blood glu-\ncose levels, reduce cardiovascular risk\nfactors, contribute to weight loss, and\nimprove well-being (286). Physical activ-\nity is as important for those with type 1\ndiabetes as it is for the general popula-\ntion, but its speciﬁc role in the preven-\ntion of diabetes complications and the', 'ference, and body mass (294). In adults\nwith type 2 diabetes, higher levels of exer-\ncise intensity are associated with greater\ni m p r o v e m e n t si nA 1 Ca n di nc a r d i o r e s p i r a -\ntoryﬁtness (295); sustained improvements\nin cardiorespiratoryﬁtness and weight loss\nhave also been associated with a lower risk\nof heart failure (258). Other beneﬁts in-', 'progresión de la pérdida individual de células ß.\nÉnfasis de la dieta en la terapia de las personas con sobrepeso/obesidad \ncon diagnóstico reciente de DT2 y resistencia a la insulina:\nMedios terapéuticos primarios: En estos pacientes el principal componente \nterapéutico es la reducción de peso para reducir la resistencia a la insulina.', 'manage type 2 diabetes. These activities are great for anyone with diabetes, but \ntalk to your health care professional before beginning any new type of exercise.\nPhysical activity includes any movement that elevates your heart rate (which can improve \nheart health), increases your metabolism, aids weight loss, lowers your blood pressure,', 'mutuamente mediante la mejor reducción posible de la resistencia a la insulina \nexistente.\nEl papel de la nutrición y el enfoque dietético:  La intervención dietética \nhipocalórica será según las preferencias individuales y la situación psicosocial', '(recién diagnosticada, con sobrepeso):\n1. Entender la importancia de la reducción de peso para reducir la resistencia a \nla insulina –› 2. Aprender a saber y experimentar varios métodos de reducción de \npeso. –› 3. Documentar y explorar sus efectos. –› 4. Elegir el método o métodos \nque mejor coincidan con las preferencias individuales para su aplicación. –› 5. \nMantener el contacto.', 'tance training (11,29,30). Breaking up\nprolonged sedentary time may also be\nencouraged, as it is associated with\nmoderately lower postprandial glucose\nlevels (31,32). The effects of physical ac-\ntivity appear to extend to the prevention\nof gestational diabetes mellitus (GDM)\n(33).\nDelivery and Dissemination of\nLifestyle Behavior Change for\nDiabetes Prevention', 'ventions in individuals with type 2 diabetes\nimprove depression, A1C, and overall psy-\nchosocial well-being (318).\nPhysical Activity and Glycemic\nManagement\nClinical trials have provided strong evi-\nd e n c ef o rt h eA 1 C - l o w e r i n gv a l u eo fr e s i s -\ntance training in older adults with type 2\ndiabetes (297) and for an additive beneﬁt\nof combined aerobic and resistance exer-', 'also good physical activity options.\nYOGA\nYou’ve probably heard that yoga helps \nreduce stress. Higher stress levels mean \nhigher blood glucose, so adding yoga into \nyour routine is a win-win for people with or \nat risk for type 2 diabetes.\nGet active now and prevent,  \ndelay, or manage type 2 diabetes!', 'aumentar el empoderamiento del autocuidado de las personas con \ndiabetes?\n• ¿Cuál es el mejor enfoque con base en la evidencia para lograr cambios \nconductuales en personas con diabetes?', 'hiperinsulinemia, la capacidad restante de producción de insulina de las células \nß no es suficiente para alcanzar niveles normoglucémicos (deficiencia relativa \nde insulina). Como la reducción de peso resulta en la reducción o incluso la \nabolición de la resistencia a la insulina, esta es la terapia primaria para estos', 'ejercicio, prevención de las complicaciones crónicas y aspectos de motivación, \naceptación de la diabetes, problemas psicosociales y estrategias de supervivencia. \nCada reunión de grupo se estructuró en cuatro fases: “1) la bienvenida e \nintroducción al tema que se va a examinar, 2) el aprendizaje interactivo, 3) \nhablar de algunas experiencias de la vida real de las personas con diabetes, y', 'activities (310,311). Participating in leisure-\ntime activity and avoiding extended seden-\ntary periods may help prevent type 2 dia-\nbetes for those at risk and may also aid in\nglycemic management for those with dia-\nbetes (312,313).\nA systematic review and meta-analysis\nfound higher frequency of regular lei-', 'therapy (see Section 5, “Facilitating\nPositive Health Behaviors and Well-being\nto Improve Health Outcomes,” for more\ndetailed information) is effective in lower-\ning A1C in individuals diagnosed with pre-\ndiabetes (26).\nPhysical Activity\nModerate-intensity physical activity, such\nas brisk walking for 150 min/week, has\nshown beneﬁcial effects in those with\nprediabetes (4). Similarly, moderate-', 'cludes all movement that increases en-\nergy use and is an important part of the\ndiabetes management plan. Exercise is a\nmore speciﬁc form of physical activity\nthat is structured and designed to im-\nprove physicalﬁtness. Both physical activ-\nity and exercise are important. Exercise\nhas been shown to improve blood glu-\ncose levels, reduce cardiovascular risk\nfactors, contribute to weight loss, and', 'e\nxercise interventions of at least 8 weeks’\nduration have been shown to lower A1C\nby an average of 0.66% in people with\ntype 2 diabetes, even without a signiﬁ-\ncant change in BMI (292). There are also\nconsiderable data for the health beneﬁts\n(e.g., increased cardiovascular ﬁtness,\ngreater muscle strength, improved insulin', 'speciﬁc recommendations (297). Increased\nphysical activity (soccer training) has also\nbeen shown to be beneﬁcial for improving\noverallﬁtness in Latino men with obesity,\ndemonstrating feasible methods to increase\nphysical activity in this population (298).\nPhysical activity and exercise should be rec-\nommended and prescribed to all individuals\nwho are at risk for or with diabetes as part', 'toryﬁtness (295); sustained improvements\nin cardiorespiratoryﬁtness and weight loss\nhave also been associated with a lower risk\nof heart failure (258). Other beneﬁts in-\nclude slowing the decline in mobility among\noverweight people with diabetes (296). The\nADA position statement“Physical Activity/\nExercise and Diabetes” reviews the evi-\ndence for the beneﬁts of exercise in people', 'program that is appropriate to their abilities [1C].\n\uf0b7 Physical activity for healthy adults. Physical activity should be an integral component of the diabetes care plan to\noptimize glucose control, decrease cardiovascular risk factors, and achieve or maintain optimal body weight\n[1A].\n\uf0b7 A moderate-intensity aerobic (endurance) physical activity minimum of 30 minutes 5 days (150 minutes) per', '48\nEn personas con diabetes tipo 2 que no usan insulina, el control rutinario de la \nglucosa puede tener un beneficio clínico adicional limitado. Una consideración \nmuy importante es que la realización del automonitoreo de glucosa por sí solo \nno reduce los niveles de glucosa en sangre. Para ser útil, la información debe \nintegrarse en planes clínicos y de autocuidado.', 'are usually advised in these cases. Intense\nactivities may actually raise blood glucose\nlevels instead of lowering them, especially\nif pre-exercise glucose levels are elevated\nFigure 5.1— Importance of 24-h physical behaviors for type 2 diabetes. Reprinted from Davies et al. (97).\ndiabetesjournals.org/care Facilitating Positive Health Behaviors and Well-being S89\n©AmericanDiabetesAssociation', 'no reduce los niveles de glucosa en sangre. Para ser útil, la información debe \nintegrarse en planes clínicos y de autocuidado.\nExisten varios estándares para garantizar la precisión de los glucómetros, uno \nde los más utilizados es el de la Organización Internacional de Normalización \n(ISO), ISO 15197:2013. En los Estados Unidos, además existen los estándares de', 'en sangre, normalmente con insulina.\nObjetivos de aprendizaje / contenidos de la educación sobre la DT2 (peso \nnormal, no resistente a la insulina):\n1. Entender la importancia de mantenerse dentro del rango de peso normal. –› 2. \nIdentificar y elegir alimentos que contengan CHO de bajo índice glucémico. –› \n3. Elaborar un plan individual de distribución de pequeñas porciones de CHO', 'comprende y utiliza correctamente los aspectos cruciales para su tipo específico \nde diabetes.\nDiabetes Tipo 2.\nLa DT2 se caracteriza por su desarrollo progresivo que está determinado por el \nritmo individualmente diferente en el curso de la insuficiencia/disfunción de las \ncélulas ß (12)(13)(14). Los pacientes con DT2 presentan diferentes características', 'dietéticas junto con los conocimientos de salud del individuo, los recursos, \nla disponibilidad de alimentos, las habilidades de preparación de comidas \ny la actividad física para maximizar la capacidad de alcanzar y mantener el \nplan de alimentación (2).\nSi un paciente ya está tratado con medicación oral del tipo sulfonilurea o', 'peso. –› 3. Documentar y explorar sus efectos. –› 4. Elegir el método o métodos \nque mejor coincidan con las preferencias individuales para su aplicación. –› 5. \nMantener el contacto.\nDT2, peso normal, no resistente a la insulina\nEn la mayoría de las personas de peso normal con DT2, la capacidad de producción \nrestante de insulina de las células ß es de sobra y no se observa una resistencia', 'Co-morbilidades psicológicas.\nEstudios epidemiológicos han demostrado que los desórdenes mentales son \nmás prevalentes en personas con diabetes que en la población general (3)(4)\n(5)(6)(7). La depresión es común y está asociada con altos niveles de DD y \nafecta negativamente la calidad de vida de los pacientes, el autocuidado y el', 'de la persona, siendo sensible a su voluntad de cambio y los efec-\ntos en su calidad de vida.\nSe aconseja estimular a los adultos con diabetes tipo 2 a seguir\nlos mismos consejos de alimentación saludable que la población\ngeneral, que incluyen: comer fuentes de carbohidratos con alto\ncontenido de ﬁbra y bajo índice glucémico, como frutas, verdu-', 'with HbA1c levels in type 2 diabetes a systematic review and meta-analysis. JAMA. 2011;305(17):1790-1799. doi: \n10.1001/jama.2011.576. \nColberg SR, Sigal RJ, Yardley JE, et al. Physical activity/exercise and diabetes: a position statement of the American \nDiabetes Association. Diabetes Care. 2016;39(11):2065- 2079. doi: 10.2337/dc16-1728.', '46\nPREGUNTA 7. ¿Cuál es la importancia de la tecnología en la educación \nen diabetes? \nSe sugiere que el uso de la tecnología se individualice en función de las \nnecesidades, los deseos, el nivel de habilidad y la disponibilidad de los \ndispositivos en el entorno. D2\nAutomonitoreo de la glucosa.\nSe recomienda automonitoreo de glucosa en todas las personas que utilizan', 'la práctica deportiva. B1\nSe sugiere utilizar glucómetros aprobados por las autoridades sanitarias locales. D1\nSe recomienda iniciar un programa de educación y apoyo al autocuidado de \ndiabetes antes de iniciar automonitoreo, para ayudar en la toma de decisiones. \nEs importante entrenar en el registro e interpretación de los resultados, para \ntomar decisiones en la vida diaria. B1\nJustificación', '49\nJustificación\nLos MCG miden la glucosa intersticial, que se correlaciona bien con los niveles \nde glucosa plasmática, aunque a veces pueden retrasarse si los niveles aumentan \no disminuyen rápidamente (91). Existen dos tipos básicos de dispositivos de \nMCG:\n• MCG en tiempo real, que mide y muestra los niveles de glucosa en forma \ncontinua.', 'de insulina). Como la reducción de peso resulta en la reducción o incluso la \nabolición de la resistencia a la insulina, esta es la terapia primaria para estos \npacientes. En condiciones normales de peso corporal, la cantidad de insulina \nnecesaria para lograr una hemostasia normal de la glucosa es baja y puede ser \ncontrolada por la producción de insulina endógena restante, lo que resulta en', 'from being physically active, and meta-\nanalyses have demonstrated a signiﬁcant\nassociation between physical activity and\nlower A1C (300). Thus, an active lifestyle\nshould be recommended to all (301). Youth\nwith type 1 diabetes who engage in more\nphysical activity may have better health\noutcomes and health-related quality of life\n(302,303). See Section 14,“Children and\nAdolescents,”for details.', 'un conjunto inespecífico de reglas, independientemente del tipo, el estadio y \nla estrategia de medicación de la enfermedad. Afortunadamente, en los últimos \naños esta actitud ha cambiado: los componentes relevantes de la intervención \nnutricional en el tratamiento de la diabetes dependen del tipo de diabetes, \nde la medicación utilizada y de las preferencias particulares del paciente. La', 'necesaria para lograr una hemostasia normal de la glucosa es baja y puede ser \ncontrolada por la producción de insulina endógena restante, lo que resulta en \nuna situación metabólica normoglucémica. Los estudios recientes informan de \nuna remisión de la DT2 tras una pérdida de peso sustancial (15), y el objetivo \nterapéutico previsto se puede lograr durante años. No obstante, dicha remisión', 'educación y la capacitación sobre la diabetes\nPara los educadores en diabetes, se recomienda no mezclar los mensajes \nprincipales con los contenidos de prioridad secundaria. Los aspectos de \nsegundo orden/subordinados de la alimentación para el tratamiento de la DT1 \npodrían diluir y poner en peligro la comprensión y la aplicación de los mensajes']","La actividad física es crucial para prevenir la diabetes tipo 2 porque ayuda a mejorar la sensibilidad a la insulina y reducir la resistencia a la insulina, lo cual es fundamental para mantener niveles normales de glucosa en sangre. Además, la actividad física contribuye a la pérdida de peso, lo que es especialmente beneficioso para personas con sobrepeso u obesidad, ya que la reducción de peso es una terapia primaria para estos pacientes.

La actividad física también mejora el control metabólico, reduce los factores de riesgo cardiovascular asociados (como el peso y la hipertensión), y mejora la calidad de vida. Incluso actividades de intensidad moderada, como caminar a paso ligero durante 150 minutos a la semana, han demostrado ser beneficiosas para personas con prediabetes y diabetes.

En resumen, la actividad física es una parte esencial del plan de manejo de la diabetes, ya que no solo ayuda a prevenir la enfermedad, sino que también mejora la salud general y el bienestar de las personas en riesgo o ya diagnosticadas.","La actividad física regular es crucial para prevenir la diabetes tipo 2 porque mejora la sensibilidad a la insulina y el metabolismo de la glucosa, ayuda a perder peso y previene el aumento excesivo de peso, controla otros factores de riesgo como la presión arterial alta y los niveles de colesterol, y genera adaptaciones metabólicas beneficiosas que reducen el riesgo de diabetes. Numerosos estudios muestran que la actividad física moderada por sí sola puede reducir el riesgo de desarrollar diabetes tipo 2 en un 30-60%, incluso sin pérdida de peso. Adoptar un estilo de vida activo desde una etapa temprana es una estrategia preventiva esencial contra la diabetes tipo 2.",1.0,0.9999996821590598,,0.6666666666666666,1.0,0.8217411903762362,0.9185437088733659
¿Qué papel juega la dieta en la prevención de la diabetes tipo 2?,"['progresión de la pérdida individual de células ß.\nÉnfasis de la dieta en la terapia de las personas con sobrepeso/obesidad \ncon diagnóstico reciente de DT2 y resistencia a la insulina:\nMedios terapéuticos primarios: En estos pacientes el principal componente \nterapéutico es la reducción de peso para reducir la resistencia a la insulina.', 'un conjunto inespecífico de reglas, independientemente del tipo, el estadio y \nla estrategia de medicación de la enfermedad. Afortunadamente, en los últimos \naños esta actitud ha cambiado: los componentes relevantes de la intervención \nnutricional en el tratamiento de la diabetes dependen del tipo de diabetes, \nde la medicación utilizada y de las preferencias particulares del paciente. La', 'de riesgo cardiovascular asociados.\nLa educación de las personas con riesgo de desarrollar diabetes se considera \nun aspecto fundamental de las estrategias de prevención y tratamiento de la \nenfermedad. La educación es un proceso continuo y progresivo, que permite \na la persona comprender y formar parte activa y efectiva de su control y', 'importancia de la dieta y la lucha contra el sedentarismo para evitar la obesidad, \nasí como para prevenir el inicio de la diabetes y también mostrar el papel de \nestas medidas en el control y el tratamiento de esta enfermedad”. Esta frase fue \ncreada en 1925 por un papá interesado en diabetes y con una gran experiencia \nen la formación de médicos de todo el mundo en el campo de la diabetes', 'carga para los sistemas de salud y la sociedad. Esta carga socioeconómica se \npuede reducir mediante un adecuado control de la glucemia y de los factores \nde riesgo cardiovascular asociados.\nLa educación de las personas con riesgo de desarrollar diabetes se considera \nun aspecto fundamental de las estrategias de prevención y tratamiento de la', 'y la actividad física para maximizar la capacidad de alcanzar y mantener el \nplan de alimentación (2).\nSi un paciente ya está tratado con medicación oral del tipo sulfonilurea o \nglinida, esta medicación debe ser suspendida desde el primer día de la dieta \nhipocalórica para prevenir el riesgo de hipoglucemia.', '134\nÉnfasis de la dieta en la terapia de personas de peso normal, no resistentes \na la insulina con DT2:\nMedios terapéuticos primarios: En estos pacientes el componente terapéutico \nprincipal será la medicación/insulina para bajar la glucosa en sangre. Antes de \niniciar la medicación para bajar la glucosa en sangre, una dieta que contenga', '127\nla época anterior a la insulina no pudieron salvar a los pacientes de la muerte. \nHoy en día, sin embargo, se utilizan estrategias nutricionales específicas para \napoyar el éxito de la terapia con insulina, siempre con el objetivo de lograr una \nsituación de glucemia casi normoglucémica.\nÉnfasis de la dieta en la DT1\nLos medios terapéuticos primarios: En la DT1 el componente terapéutico', 'fruits, and vegetables and minimal re-\nﬁned and processed foods, is also associ-\nated with a lower risk of type 2 diabetes\n(21,23–2 5 ) .A si st h ec a s ef o rt h o s ew i t h\ndiabetes, individualized medical nutrition\ntherapy (see Section 5, “Facilitating\nPositive Health Behaviors and Well-being\nto Improve Health Outcomes,” for more\ndetailed information) is effective in lower-', 'de la persona, siendo sensible a su voluntad de cambio y los efec-\ntos en su calidad de vida.\nSe aconseja estimular a los adultos con diabetes tipo 2 a seguir\nlos mismos consejos de alimentación saludable que la población\ngeneral, que incluyen: comer fuentes de carbohidratos con alto\ncontenido de ﬁbra y bajo índice glucémico, como frutas, verdu-', 'nutricional en el tratamiento de la diabetes dependen del tipo de diabetes, \nde la medicación utilizada y de las preferencias particulares del paciente. La \nalimentación tiene que ser individualizada y no existe una “estrategia de dieta \núnica” que se pueda aplicar en términos generales (1)(2). A diferencia de la \ngran mayoría de los artículos de nutrición publicados, este artículo no presenta', 'Medios terapéuticos primarios: En estos pacientes el principal componente \nterapéutico es la reducción de peso para reducir la resistencia a la insulina.\nObjetivo terapéutico: Alcanzar el objetivo terapéutico de glucemia acordado \nmutuamente mediante la mejor reducción posible de la resistencia a la insulina \nexistente.\nEl papel de la nutrición y el enfoque dietético:  La intervención dietética', '47:107–116\n23. Ley SH, Hamdy O, Mohan V, Hu FB.\nPrevention and management of type 2 diabetes:\ndietary components and nutritional strategies.\nLancet 2014;383:1999–2007\n24. Jacobs S, Harmon BE, Boushey CJ, et al. A\npriori-deﬁned diet quality indexes and risk of type 2\ndiabetes: the Multiethnic Cohort. Diabetologia\n2015;58:98–112\n25. Chiuve SE, Fung TT, Rimm EB, et al.', 'mutuamente mediante la mejor reducción posible de la resistencia a la insulina \nexistente.\nEl papel de la nutrición y el enfoque dietético:  La intervención dietética \nhipocalórica será según las preferencias individuales y la situación psicosocial', 'animal products), and Dietary Approaches\nto Stop Hypertension (DASH) eating pat-\nterns are associated with a lower risk of\ndeveloping type 2 diabetes (19–22). Evi-\ndence suggests that the overall quality of\nfood consumed (as measured by the\nHealthy Eating Index, Alternative Healthy\nEating Index, and DASH score), with an\nemphasis on whole grains, legumes, nuts,', 'highly effective in preventing or delaying\ntype 2 diabetes and improving other car-\ndiometabolic risk factors (such as blood\npressure, lipids, and inﬂammation) (7).\nThe strongest evidence for diabetes pre-\nvention in the U.S. comes from the DPP\ntrial (4). The DPP demonstrated that in-\ntensive lifestyle intervention could reduce\nthe risk of incident type 2 diabetes by', 'tes Prevention Study (DPS) (5), and the\nDa Qing Diabetes Prevention Study (Da\nQing study) (6), demonstrate that life-\nstyle/behavioral intervention with an indi-\nvidualized reduced-calorie meal plan is\nhighly effective in preventing or delaying\ntype 2 diabetes and improving other car-\ndiometabolic risk factors (such as blood\npressure, lipids, and inﬂammation) (7).', 'diet, change in dietary patterns, and diabetes risk:\na prospective study. Nutr Diabetes 2018;8:12\n20. Lee Y, Park K. Adherence to a vegetarian diet\nand diabetes risk: a systematic review and meta-\nanalysis of observational studies. Nutrients 2017;\n9:603\nS48 Prevention or Delay of Diabetes Diabetes Care Volume 47, Supplement 1, January 2024\n©AmericanDiabetesAssociation', 'ras, granos integrales y legumbres; elegir productos lácteos bajos\nen grasa; comer pescado; y controlar la ingesta de ácidos grasos\nsaturados y trans, desalentando el uso de alimentos comerciali-\nzados especíﬁcamente para personas con diabetes.\nSe sugiere que las recomendaciones al paciente incluyan ade-\nmás otros aspectos de la modiﬁcación del estilo de vida, como el', '1335–1344\n2 2 . E s p o s i t oK ,C h i o d i n iP ,M a i o r i n oM I ,\nBellastella G, Panagiotakos D, Giugliano D. Which\ndiet for prevention of type 2 diabetes? A meta-\nanalysis of prospective studies. Endocrine 2014;\n47:107–116\n23. Ley SH, Hamdy O, Mohan V, Hu FB.\nPrevention and management of type 2 diabetes:\ndietary components and nutritional strategies.\nLancet 2014;383:1999–2007', 'A base de alimentos sólidos.\nEnfoques asociados a la salud pública\nEnfoques asoiados al tratamiento/prevención (por ej. DASH,\nDPP, DPS).\nDieta de estilo mediterráneo. Dieta vegetariana o vegana.\nAyuno intermitente. Reducción de peso con ayuda\nde una aplicación \nMÉTODO RESUMEN\nAdicionalmente', 'zados especíﬁcamente para personas con diabetes.\nSe sugiere que las recomendaciones al paciente incluyan ade-\nmás otros aspectos de la modiﬁcación del estilo de vida, como el\naumento de la actividad física y la pérdida de peso. En aquellos\nadultos con diabetes tipo 2 con sobrepeso u obesidad, se debe\ndiscutir y acordar un objetivo inicial de pérdida de peso corporal\nde 5 a 10 %.', 'appropriate for individuals with prediabe-\ntes (13), including Mediterranean-style and\nlow-carbohydrate eating plans (15–18). Ob-\nservational studies have also shown that\nvegetarian, plant-based (may include some\nanimal products), and Dietary Approaches\nto Stop Hypertension (DASH) eating pat-\nterns are associated with a lower risk of\ndeveloping type 2 diabetes (19–22). Evi-', '21. Qian F, Liu G, Hu FB, Bhupathiraju SN, Sun Q.\nAssociation between plant-based dietary patterns\nand risk of type 2 diabetes: a systematic review\nand meta-analysis. JAMA Intern Med 2019;179:\n1335–1344\n2 2 . E s p o s i t oK ,C h i o d i n iP ,M a i o r i n oM I ,\nBellastella G, Panagiotakos D, Giugliano D. Which\ndiet for prevention of type 2 diabetes? A meta-', 'strategies for patients with Diabetes Mellitus: A systematic review and meta-analysis. Prim Care Diabetes. abril de 2017;11(2):201-11. \n68. Katie Weinger. Behavioral Strategies for Improving Self-Management - Complete Nurse’s Guide to Diabetes Care, 3rd Edition \n[Internet]. [citado 16 de diciembre de 2021]. Disponible en: https://doctorlib.info/medical/childs-guide-diabetes-care/20.html', 'aumentar el empoderamiento del autocuidado de las personas con \ndiabetes?\n• ¿Cuál es el mejor enfoque con base en la evidencia para lograr cambios \nconductuales en personas con diabetes?', 'los mismos consejos de alimentación saludable que la población\ngeneral, que incluyen: comer fuentes de carbohidratos con alto\ncontenido de ﬁbra y bajo índice glucémico, como frutas, verdu-\nras, granos integrales y legumbres; elegir productos lácteos bajos\nen grasa; comer pescado; y controlar la ingesta de ácidos grasos\nsaturados y trans, desalentando el uso de alimentos comerciali-', 'ritmo individualmente diferente en el curso de la insuficiencia/disfunción de las \ncélulas ß (12)(13)(14). Los pacientes con DT2 presentan diferentes características \ny estrategias de tratamiento. Por lo tanto, el papel y la importancia de la terapia \nnutricional van desde la “terapia de primera línea” hasta la “baja” para la \npersona individual con DT2.', 'physical activity, calorie restriction, weight\nmanagement strategies, and motivation.\nThere is strong and consistent evidence\nthat modest, sustained weight loss can delay\nthe progression from prediabetes to type 2\ndiabetes (103,105,106) (see Section 3,\n“Prevention or Delay of Diabetes and\nAssociated Comorbidities”) and is beneﬁ-\ncial for the management of type 2 diabe-', 'y que pueda recomendarse de forma general para la pérdida de peso de \nlas personas con diabetes. Por lo tanto, se justifica un plan individualizado \npara la terapia nutricional de la diabetes, teniendo en cuenta las preferencias \ndietéticas junto con los conocimientos de salud del individuo, los recursos, \nla disponibilidad de alimentos, las habilidades de preparación de comidas', 'estudio, los resultados del ensayo DIRECT se publicaron recientemente. Los \nautores demostraron que, al cabo de un año, la pérdida de peso asociada a la \nintervención sobre el estilo de vida resultó en la remisión de la diabetes en el \n46% de los participantes. Las tasas de remisión estaban relacionadas con la \nmagnitud de la pérdida de peso, aumentando progresivamente del 7% al 86% a', 'han mostrado resultados mixtos en cuanto a los efectos sobre el peso, la \nHbA1c, los lípidos séricos y la presión arterial. Como resultado, las pruebas \nno identifican un plan de alimentación que sea claramente superior a otros \ny que pueda recomendarse de forma general para la pérdida de peso de \nlas personas con diabetes. Por lo tanto, se justifica un plan individualizado', 'Cómo tratar mi diabetes. 3rd ed. CENEXA-press, Buenos Aires. ISBN 987-98423-4-0\n21. Lencioni C, Lupi R, Del Prato S. Beta-cell failure in type 2 diabetes mellitus. Curr Diab Rep 2008; 8: \n179-84. doi: 10.1007/s11892-008-0031-0\n22. The Look AHEAD Research Group (2014) Eight-year weight losses with an intensive lifestyle \nintervention. Obesity (Silver Spring) 22: 5-13', 'una glucemia casi normal. Los aspectos generales de la “dieta saludable” \npodrían cubrirse posteriormente, siempre que el paciente haya demostrado que \ncomprende y utiliza correctamente los aspectos cruciales para su tipo específico \nde diabetes.\nDiabetes Tipo 2.\nLa DT2 se caracteriza por su desarrollo progresivo que está determinado por el', 'dence suggests that the overall quality of\nfood consumed (as measured by the\nHealthy Eating Index, Alternative Healthy\nEating Index, and DASH score), with an\nemphasis on whole grains, legumes, nuts,\nfruits, and vegetables and minimal re-\nﬁned and processed foods, is also associ-\nated with a lower risk of type 2 diabetes\n(21,23–2 5 ) .A si st h ec a s ef o rt h o s ew i t h', 'individualizado y continuo de un profesional de la salud con expe-\nriencia y competencias especíﬁcas en nutrición. El asesoramiento\ndietético deberá adaptarse a las necesidades, cultura y creencias\nde la persona, siendo sensible a su voluntad de cambio y los efec-\ntos en su calidad de vida.\nSe aconseja estimular a los adultos con diabetes tipo 2 a seguir', 'de macronutrientes o del patrón de alimentación, es crucial para el éxito. Los \nestudios que investigan planes de alimentación específicos utilizando una \namplia gama de composición de macronutrientes en personas con diabetes \nhan mostrado resultados mixtos en cuanto a los efectos sobre el peso, la \nHbA1c, los lípidos séricos y la presión arterial. Como resultado, las pruebas', 'etapa de la enfermedad (masa funcional restante de células ß).\nEl papel de la nutrición y el enfoque dietético.\nPara la terapia de insulina intensificada, la terapia de insulina convencional \ny una estrategia de insulina solo prandial, de acción corta, ver para la idea \ngeneral en la parte de DT1.\nEn el caso de una estrategia de insulina basal, de acción prolongada, la nutrición', 'tipos de programas de tratamiento y estilo de vida que varían en términos de su \nefectividad (148)(149). Para muchas de estas intervenciones, hay datos limitados \nde ensayos clínicos con seguimiento a largo plazo. Pero, para una persona con \ndiabetes individual, optar por uno de estos programas puede ser útil, y, para \nmuchos, es una opción atractiva.', '(recién diagnosticada, con sobrepeso):\n1. Entender la importancia de la reducción de peso para reducir la resistencia a \nla insulina –› 2. Aprender a saber y experimentar varios métodos de reducción de \npeso. –› 3. Documentar y explorar sus efectos. –› 4. Elegir el método o métodos \nque mejor coincidan con las preferencias individuales para su aplicación. –› 5. \nMantener el contacto.', 'una remisión de la DT2 tras una pérdida de peso sustancial (15), y el objetivo \nterapéutico previsto se puede lograr durante años. No obstante, dicha remisión \nserá temporal (durará desde unos pocos años hasta décadas) dependiendo de la \nprogresión de la pérdida individual de células ß.\nÉnfasis de la dieta en la terapia de las personas con sobrepeso/obesidad', 'diabetes prevention: a systematic review and\nmeta-analysis. J Acad Nutr Diet 2017;117:404–\n421.e36\n51. Briggs Early K, Stanley K. Position of the\nAcademy of Nutrition and Dietetics: the role of\nmedical nutrition therapy and registered dietitian\nnutritionists in the prevention and treatment of\nprediabetes and type 2 diabetes. J Acad Nutr Diet\n2018;118:343–353', 'tasas de hipoglucemia grave en niños y adultos (131). No existe un consenso \npara guiar la elección sobre qué forma de administración de insulina es mejor \npara una persona con diabetes determinada, y se necesita más investigación \npara orientar esta toma de decisiones (132). Por lo tanto, la elección de MDI o \nCSII se realiza con base en las características individuales de la persona y las', 'Mellitus: A Systematic Review and Network Meta-analysis. Ann Intern Med. 1 de diciembre de 2015;163(11):848-60. \n64. aade7_healthy_eating_sp_rev.pdf [Internet]. [citado 2 de noviembre de 2021]. Disponible en: https://www.diabeteseducator.\norg/docs/default-source/living-with-diabetes/tip-sheets/aade7/aade7_healthy_eating_sp_rev.pdf?sfvrsn=22888a58_16', 'adultos?\n• ¿Cuál es la importancia de la tecnología en la educación en diabetes?\n• ¿Qué impacto psicológico tiene la diabetes, su tratamiento y cómo \ndetectarlo?\n• ¿Son los campamentos recreativos-educativos una estrategia eficaz para \naumentar el empoderamiento del autocuidado de las personas con \ndiabetes?\n• ¿Cuál es el mejor enfoque con base en la evidencia para lograr cambios', 'diabetes y otros actores involucrados. Para ello, se definieron tres estrategias \ngenerales, fundamentadas en el flujo de información que comparten el grupo \ndesarrollador y el público (5):\n1. Consulta: Se recolectó información de parte de personas con diabetes y \npúblico en general, a través de entrevistas directas y participación en una', 'Aunque las soluciones de telemedicina, para el cuidado de las personas con \ndiabetes, son factibles y aceptables, la evidencia de su efectividad para mejorar \nla hemoglobina glicosilada (A1c), reducir costos o mejorar otros aspectos en el \nmanejo, no es sólida (77).', 'empowerment strategies for patients with Diabetes Mellitus: A systematic review and meta-analysis. Prim Care Diabetes. abril \nde 2017;11(2):201-11. \n241. Gagliardino JJ, Etchegoyen G, PENDID-LA Research Group. A model educational program for people with type 2 \ndiabetes: a cooperative Latin American implementation study (PEDNID-LA). Diabetes Care. junio de 2001;24(6):1001-7.', 'intervention for remission of type 2 diabetes: 2-year\nresults of the DiRECT open-label, cluster-randomised\ntrial. Lancet Diabetes Endocrinol 2019;7:344–355\n167. Raben A, Vestentoft PS, Brand-Miller J,\net al. The PREVIEW intervention study: results\nfrom a 3-year randomized 2 x 2 factorial\nmultinational trial investigating the role of\nprotein, glycaemic index and physical activity for', 'con la educación presencial, para promover el empoderamiento para el \nautocuidado de las personas con diabetes?\n• ¿Cómo debería ser la transición de personas con diabetes en edad pediátrica-\nadultos?\n• ¿Cuál es la importancia de la tecnología en la educación en diabetes?\n• ¿Qué impacto psicológico tiene la diabetes, su tratamiento y cómo \ndetectarlo?']","La dieta juega un papel crucial en la prevención de la diabetes tipo 2. La evidencia sugiere que una alimentación de alta calidad, que incluye granos enteros, legumbres, nueces, frutas y verduras, y mínimos alimentos refinados y procesados, está asociada con un menor riesgo de desarrollar diabetes tipo 2. Además, dietas específicas como la mediterránea, vegetariana o vegana, y el enfoque DASH (Dietary Approaches to Stop Hypertension) también se han mostrado efectivas en la prevención de la enfermedad. La intervención dietética debe ser individualizada y adaptada a las preferencias y necesidades del paciente, considerando su situación psicosocial y su voluntad de cambio.","La dieta desempeña un papel crucial en la prevención de la diabetes tipo 2. Una dieta equilibrada y rica en fibra, centrada en alimentos vegetales mínimamente procesados como verduras, frutas, cereales integrales y proteínas magras, mientras se limitan los carbohidratos refinados, las bebidas azucaradas y las grasas no saludables, puede reducir significativamente el riesgo de desarrollar la enfermedad. La pérdida de peso modesta mediante cambios dietéticos y reducción de calorías también mejora la sensibilidad a la insulina y el metabolismo de la glucosa, reduciendo el riesgo de diabetes. Adoptar un patrón dietético saludable, junto con mayor actividad física y control del peso, es un componente clave de las intervenciones en el estilo de vida para una prevención eficaz de la diabetes tipo 2.",1.0,0.9788838036971903,,1.0,1.0,0.6057825077395399,0.857912639653812
¿Qué debo hacer si planeo quedar embarazada y tengo diabetes?,"['y gestacional, para reducir y minimizar complicaciones agudas y crónicas \nque podrían presentarse, permitiéndoles mejorar su calidad de vida.\n• Establecer contenidos básicos que debe abarcar un programa de educación \ndirigido a personas con diabetes.', 'y protocolos escritos que permiten minimizar los riesgos.\nCon base en el éxito reportado por estas asociaciones y de acuerdo a las guías de \nla Asociación Americana de Diabetes (ADA) (196) y la Asociación de Educación \ny Camping en Diabetes (DECA) (197), se aconseja que los campamentos para \nniños y jóvenes con DM1 consideren los siguientes aspectos:', 'los mismos consejos de alimentación saludable que la población\ngeneral, que incluyen: comer fuentes de carbohidratos con alto\ncontenido de ﬁbra y bajo índice glucémico, como frutas, verdu-\nras, granos integrales y legumbres; elegir productos lácteos bajos\nen grasa; comer pescado; y controlar la ingesta de ácidos grasos\nsaturados y trans, desalentando el uso de alimentos comerciali-', 'is safely possible, ideally A1C,6.5% (48 mmol/mol),\nto reduce the risk of congenital anomalies, preeclampsia,\nmacrosomia, and other complications.B\nPreconception Care\nRecommendations\n14.4 Women with preexisting diabetes who are plan-\nning a pregnancy should ideally be managed be-\nginning in preconception in a multidisciplinary\nclinic including an endocrinologist, maternal-fetal', 'include an explanation of the risks to\nmother and fetus related to pregnancies\nassociated with diabetes and the ways\nto reduce risks, including glycemic goal\nsetting, lifestyle and behavioral man-\nagement, and medical nutrition therapy\n(18). The most important diabetes-\nspeciﬁc component of preconception\ncare is the attainment of glycemic\ngoals prior to conception. In addition,', '14.4 Women with preexisting diabetes who are plan-\nning a pregnancy should ideally be managed be-\nginning in preconception in a multidisciplinary\nclinic including an endocrinologist, maternal-fetal\nmedicine specialist, dietitian, and diabetes educator,\nwhen available.B\n14.5 In addition to focused attention on achieving gly-\ncemic targets A, standard preconception care', 'w Nutrition and medication plan to achieve glycemic goals prior to conception, including appropriate\nimplementation of monitoring, continuous glucose monitoring, and pump technology\nw Contraceptive plan to prevent pregnancy until glycemic goals are achieved\nw Management plan for general health, gynecologic concerns, comorbid conditions, or', 'medicine specialist, dietitian, and diabetes educator,\nwhen available.B\n14.5 In addition to focused attention on achieving gly-\ncemic targets A, standard preconception care\nshould be augmented with extra focus on nutrition,\ndiabetes education, and screening for diabetes\ncomorbidities and complications.E\n14.6 Women with preexisting type 1 or type 2 diabetes', 'insulin resistance in pregnancy and postpartum; preconception glycemic goals; avoidance of\nDKA/severe hyperglycemia; avoidance of severe hypoglycemia; progression of retinopathy;\nPCOS (if applicable); fertility in people with diabetes; genetics of diabetes; risks to\npregnancy including miscarriage, still birth, congenital malformations, macrosomia, preterm', 'pregnancy is critical in individuals with\npreexisting diabetes to achieve the opti-\nmal glycemic goals necessary to prevent\ncongenital malformations and reduce\nthe risk of other complications. There-\nfore, all individuals with diabetes of\nchildbearing potential should have fam-\nily planning options reviewed at regular\nintervals to make sure that effective\ncontraception is implemented and main-', 'mia, and insulin dosing may need to be\nadjusted.\nContraception\nA major barrier to effective preconcep-\ntion care is the fact that the majority\nof pregnancies are unplanned. Planning\npregnancy is critical in individuals with\npreexisting diabetes to achieve the opti-\nmal glycemic goals necessary to prevent\ncongenital malformations and reduce\nthe risk of other complications. There-', 'consulta de la persona con diabetes, para que mejore su manejo metabólico \ny prevenga o disminuyan las complicaciones?\n• ¿Qué variables deben ser tomadas en cuenta, dentro de la evaluación \ninicial de las personas con diabetes, para determinar sus prioridades \neducativas?\n• ¿Qué método pedagógico se debería emplear, en los programas educativos,', 'also associated with reductions in perina-\ntal mortality and small-for-gestational-age\nbirth weight (18). A key point is the\nneed to incorporate a question about\nplans for pregnancy into the routine pri-\nmary and gynecologic care of people\nwith diabetes. Preconception care for\npeople with diabetes should include the\nstandard screening and care recom-\nmended for any person planning preg-', 'la persona se encuentre embarazada o esté planiﬁcando\nun embarazo.\nConsiderar el automonitoreo a corto plazo en adultos con DM2 al\niniciar el tratamiento con corticosteroides orales o intravenosos y\npara conﬁrmar la sospecha de hipoglucemia.\nTener en cuenta que en los adultos con DM2 que cursan\nuna enfermedad intercurrente aguda presentan mayor riesgo de\nempeorar la hiperglucemia.', 'Gynecologists (ACOG) Committee Opinion\n762,“Prepregnancy Counseling” (10). Pre-\nconception counseling for pregnant peo-\nple with preexisting type 1 or type 2\ndiabetes is highly effective in reducing\nthe risk of congenital malformations\nand decreasing the risk of preterm deliv-\nery and admission to neonatal intensive\ncare units. Preconception counseling is', '(recién diagnosticada, con sobrepeso):\n1. Entender la importancia de la reducción de peso para reducir la resistencia a \nla insulina –› 2. Aprender a saber y experimentar varios métodos de reducción de \npeso. –› 3. Documentar y explorar sus efectos. –› 4. Elegir el método o métodos \nque mejor coincidan con las preferencias individuales para su aplicación. –› 5. \nMantener el contacto.', 'tes who are planning a pregnancy\nshould ideally begin receiving interpro-\nfessional care for preconception, which\nincludes an endocrinology health care\nprofessional, maternal-fetal medicine\nspecialist, registered dietitian nutrition-\nist, and diabetes care and education\nspecialist, when available.B\n15.5 In addition to focused attention\non achieving glycemic targets,A stan-', 'agement, and medical nutrition therapy\n(18). The most important diabetes-\nspeciﬁc component of preconception\ncare is the attainment of glycemic\ngoals prior to conception. In addition,\nthe presence of microvascular compli-\ncations is associated with higher risk of\ndisease progression and adverse preg-\nnancy outcomes (22). Diabetes-speciﬁc\ntesting should include A1C, creatinine, and', 'w Contraceptive plan to prevent pregnancy until glycemic goals are achieved\nw Management plan for general health, gynecologic concerns, comorbid conditions, or\ncomplications, if present, including hypertension, nephropathy, retinopathy; Rh\nincompatibility; and thyroid dysfunction\nCreated using information from American College of Obstetricians and Gynecologists (10) and Ra-', 'pregnant (12–16).\nTo minimize the occurrence of com-\nplications, beginning at the onset of\npuberty or at diagnosis, all adults and\nadolescents with diabetes of childbear-\ning potential should receive education\nabout 1) the risks of malformations\nassociated with unplanned pregnancies\nand even with mild hyperglycemia and\n2) the use of effective contraception at', 'All individuals with diabetes and childbear-\ning potential should be informed about\nthe importance of achieving and maintain-\ning as near euglycemia as safely possible\nprior to conception and throughout preg-\nnancy. Observational studies show an\nincreased risk of diabetic embryopathy,\nespecially anencephaly, microcephaly,\ncongenital heart disease, renal anoma-', 'reversible contraception) should be prescribed and\nused until a woman’s treatment regimen and A1C\nare optimized for pregnancy.A\n14.3 Preconception counseling should address the impor-\ntance of achieving glucose le v e l sa sc l o s et on o r m a la s\nis safely possible, ideally A1C,6.5% (48 mmol/mol),\nto reduce the risk of congenital anomalies, preeclampsia,\nmacrosomia, and other complications.B', 'lescents with diabetes and childbearing\npotential about the risks of unplanned\npregnancies and about improved mater-\nnal and fetal outcomes with pregnancy\nplanning (9). Education and counseling\nshould be offered, even when individu-\nals already use contraception or do not\nintend to conceive. Effective preconcep-\ntion counseling could avert substantial\nhealth and associated cost (10) burdens', 'or more additional risk factors for diabetes\n(Table 2.3).B\n2.8 Testing for prediabetes and/or type 2 diabetes\nshould be considered in women planning pregnancy\nVOLUME 38, NUMBER 1, WINTER 2020 11\nAMERICAN DIABETES ASSOCIATION\nDownloaded from http://diabetesjournals.org/clinical/article-pdf/38/1/10/501543/10.pdf by guest on 02 March 2025', 'should be discussed, including the bene-\nﬁts of long-acting, reversible contracep-\ntion, and effective contraception should\nbe prescribed and used until the individ-\nual is prepared and ready to become\npregnant (12–16).\nTo minimize the occurrence of com-\nplications, beginning at the onset of\npuberty or at diagnosis, all adults and\nadolescents with diabetes of childbear-', 'until an individual’s treatment plan and A1C are optimized for pregnancy.A\n15.3 Preconception counseling should address the importance of achieving\nglucose levels as close to normal as is safely possible, ideally A1C <6.5%\n(<48 mmol/mol), to reduce the risk of congenital anomalies, preeclampsia,\nmacrosomia, preterm birth, and other complications.A\n*A complete list of members of the American', 'individuals with diabetes and childbear-\ning potential. The risk of an unplanned\npregnancy outweighs the risk of any cur-\nrently available contraception option.\nReferences\n1. Dabelea D, Hanson RL, Lindsay RS, et al.\nIntrauterine exposure to diabetes conveys risks\nfor type 2 diabetes and obesity: a study of\ndiscordant sibships. Diabetes 2000;49:2208–2211', 'manejo de la hipertensión, 5) Terapia antiplaquetaria, 6) Control\nde la glucemia, 7) Tratamiento farmacológico y 8) Manejo de las\ncomplicaciones.\n1. Atención individualizada\nLa guía recomienda un enfoque individualizado para el cuidado\nde la diabetes que se adapte a las necesidades y circunstancias\nde las personas adultas con DM2, de acuerdo a sus preferencias', 'nopathy and as recommended by\nthe eye care health care profes-\nsional. B\nThe importance of preconception care\nfor all pregnant people is highlighted by\nAmerican College of Obstetricians and\nGynecologists (ACOG) Committee Opinion\n762,“Prepregnancy Counseling” (10). Pre-\nconception counseling for pregnant peo-\nple with preexisting type 1 or type 2\ndiabetes is highly effective in reducing', 'w Tdap (tetanus, diphtheria, and pertussis)\nw COVID-19 (certain populations)\nw Hepatitis A and hepatitis B (certain populations)\nw Others if indicated\nPreconception plan should include:\nw Nutrition and medication plan to achieve glycemic goals prior to conception, including appropriate\nimplementation of monitoring, continuous glucose monitoring, and pump technology', 'capacitar y/o mejorar el autocuidado en las personas con diabetes?\n• ¿Cuáles son los temas claves que el equipo de salud debe tratar en la \nconsulta de la persona con diabetes, para que mejore su manejo metabólico \ny prevenga o disminuyan las complicaciones?\n• ¿Qué variables deben ser tomadas en cuenta, dentro de la evaluación', 'mento: reforzar los consejos sobre plan alimentario, estilo\nde vida y la adherencia al tratamiento farmacológico; apo-\nyar a la persona para que llegue a un nivel de HbA1c de\n7,0 % e intensiﬁcar el tratamiento farmacológico.\nConsiderar la posibilidad de no ser tan estricto con el objetivo\nmetabólico de la HbA1c, especialmente en adultos mayores o frá-', 'In addition, diabetes in pregnancy increases the risks of obesity, hypertension, and\ntype 2 diabetes in offspring later in life (1,2).\nPreconception Counseling\nRecommendations\n15.1 Starting at puberty and continuing in all people with diabetes and child-\nbearing potential, preconception counseling should be incorporated into rou-\ntine diabetes care.A', 'de la persona, siendo sensible a su voluntad de cambio y los efec-\ntos en su calidad de vida.\nSe aconseja estimular a los adultos con diabetes tipo 2 a seguir\nlos mismos consejos de alimentación saludable que la población\ngeneral, que incluyen: comer fuentes de carbohidratos con alto\ncontenido de ﬁbra y bajo índice glucémico, como frutas, verdu-', 'diagnosed diabetes should be identiﬁed\npreconception in individuals with risk fac-\ntors or in high-risk populations (182–187),\nas the preconception care of people with\npreexisting diabetes results in lower A1C\nand reduced risk of birth defects, preterm\ndelivery, perinatal mortality, small-for-\ngestational-age birth weight, and neona-\ntal intensive care unit admission (188). If', '17. AmericanDiabetes Association. Diabetes and\nReproductive Health for Girls. 2016. Accessed 25\nSeptember 2023. Available from https://diabetes.\norg/sites/default/ﬁles/2021-06/16_ready_girls\n_book_proof_4.15.16%5B1%5D.pdf\n18. Wahabi HA, Fayed A, Esmaeil S, et al.\nSystematic review and meta-analysis of the effe-\nctiveness of pre-pregnancy care for women with', 'la individualidad clínica, demográfica y social  de cada persona, los valores \ny preferencias de las personas con diabetes  y sus familiares, los costos y la \npresencia o no de políticas de apoyo, lo que implica que un programa educativo \ndeba tener un enfoque multicomponente para que pueda lograr los objetivos \nplanteados.', 'zados especíﬁcamente para personas con diabetes.\nSe sugiere que las recomendaciones al paciente incluyan ade-\nmás otros aspectos de la modiﬁcación del estilo de vida, como el\naumento de la actividad física y la pérdida de peso. En aquellos\nadultos con diabetes tipo 2 con sobrepeso u obesidad, se debe\ndiscutir y acordar un objetivo inicial de pérdida de peso corporal\nde 5 a 10 %.', 'in teens with diabetes. Diabetes Care 2013;36:\n3870–3874\n10. ACOG Committee Opinion No. 762: Pre-\npregnancy counseling. Obstet Gynecol 2019;133:\ne78–e89\n11. Peterson C, Grosse SD, Li R, et al. Preven-\ntable health and cost burden of adverse birth', 'respecto sea prematura (78).\nUn estudio reciente, realizado en Latinoamérica durante la pandemia de \nCovid-19, sugiere que los niños con diabetes tipo 1 tuvieron un mayor número \nde visitas y realización de A1c con respecto a los que no tuvieron acceso durante \nel periodo de confinamiento (79).\nPREGUNTA 6. ¿Cómo debería ser la transición de personas con diabetes \nen edad pediátrica-adultos?', 'enfermedad. La educación es un proceso continuo y progresivo, que permite \na la persona comprender y formar parte activa y efectiva de su control y \ntratamiento, proporciona estímulos para la adopción de un estilo de vida \nsaludable y brinda apoyo social y emocional, que ayuda a mejora la calidad \nde vida de la persona con diabetes (223). Numerosas evidencias, reportadas', 'sucesivamente recomendaciones de macro y micronutrientes siguiendo la idea \ngeneral de una “alimentación saludable”.\nEl objetivo es destacar los aspectos principales, relacionados con la nutrición \ny las recomendaciones para cada una de las características específicas de \nlos diferentes tipos de diabetes y sus etapas. En consecuencia, siguiendo el', 'saludable y brinda apoyo social y emocional, que ayuda a mejora la calidad \nde vida de la persona con diabetes (223). Numerosas evidencias, reportadas \nen la literatura, demuestran que las intervenciones educativas en diabetes son \nefectivas y mejoran a corto y mediano plazo el control metabólico (HbA1c, \nlípidos), los factores de riesgo cardiovascular asociados (peso e hipertensión),', 'Identificar y elegir alimentos que contengan CHO de bajo índice glucémico. –› \n3. Elaborar un plan individual de distribución de pequeñas porciones de CHO \ndurante el día. –› 4. Consentimiento en esta opción terapéutica. –› 5. Aprender \nel fundamento de un probable paso terapéutico farmacológico posterior.\nDT2, tratado con insulina', 'tine diabetes care.A\n15.2 Family planning should be discussed, and effective contraception (with con-\nsideration of long-acting, reversible contraception) should be prescribed and used\nuntil an individual’s treatment plan and A1C are optimized for pregnancy.A\n15.3 Preconception counseling should address the importance of achieving', 'han mostrado resultados mixtos en cuanto a los efectos sobre el peso, la \nHbA1c, los lípidos séricos y la presión arterial. Como resultado, las pruebas \nno identifican un plan de alimentación que sea claramente superior a otros \ny que pueda recomendarse de forma general para la pérdida de peso de \nlas personas con diabetes. Por lo tanto, se justifica un plan individualizado', 'con la educación presencial, para promover el empoderamiento para el \nautocuidado de las personas con diabetes?\n• ¿Cómo debería ser la transición de personas con diabetes en edad pediátrica-\nadultos?\n• ¿Cuál es la importancia de la tecnología en la educación en diabetes?\n• ¿Qué impacto psicológico tiene la diabetes, su tratamiento y cómo \ndetectarlo?', 'prevención, la promoción de la salud y la lucha contra los mitos y los estigmas.\nAlgo importante que hay que tener en cuenta es que la ED no debe ser la \nresponsabilidad de un solo profesional de la salud, ni debe quedar en el \ndominio exclusivo de los servicios terciarios o de las asociaciones de personas \ncon diabetes. Es decir que muchas veces el líder de la comunidad y otros', 'PCOS (if applicable); fertility in people with diabetes; genetics of diabetes; risks to\npregnancy including miscarriage, still birth, congenital malformations, macrosomia, preterm\nlabor and delivery, hypertensive disorders in pregnancy, etc.\nw Supplementation\n/C15Folic acid supplement (400mg routine)\n/C15Appropriate use of over-the-counter medications and supplements', 'natal mortality, small-for-gestational-age\nbirths, and neonatal intensive care unit\nadmissions (8).\nThere are opportunities at any health\ncare visit to educate all adults and ado-\nlescents with diabetes and childbearing\npotential about the risks of unplanned\npregnancies and about improved mater-\nnal and fetal outcomes with pregnancy\nplanning (9). Education and counseling']","Si planeas quedar embarazada y tienes diabetes, es crucial que sigas estos pasos para minimizar los riesgos y asegurar un embarazo saludable:

1. **Consulta a un equipo multidisciplinario**: Idealmente, deberías ser atendida en una clínica multidisciplinaria que incluya un endocrinólogo, un especialista en medicina materno-fetal, un dietista y un educador en diabetes.

2. **Logra tus objetivos glucémicos**: Es fundamental alcanzar niveles de glucosa lo más cercanos a la normalidad antes de la concepción. El objetivo de A1C debe ser menor al 6.5% (48 mmol/mol) para reducir el riesgo de anomalías congénitas, preeclampsia, macrosomía y otras complicaciones.

3. **Planificación familiar**: Discutir y planificar el embarazo es esencial. Esto incluye el uso de métodos anticonceptivos efectivos hasta que tus niveles de glucosa y tu plan de tratamiento estén optimizados para el embarazo.

4. **Nutrición y medicación**: Desarrolla un plan de nutrición y medicación para alcanzar tus objetivos glucémicos antes de la concepción. Esto puede incluir el uso de monitoreo continuo de glucosa y tecnología de bomba de insulina si es necesario.

5. **Educación y asesoramiento**: Recibe educación sobre los riesgos asociados con el embarazo y la diabetes, así como sobre cómo reducir esos riesgos mediante la gestión del estilo de vida y el comportamiento.

6. **Evaluación de comorbilidades**: Asegúrate de que cualquier comorbilidad, como hipertensión, nefropatía, retinopatía, o disfunción tiroidea, esté bien controlada antes de la concepción.

7. **Suplementación**: Considera la suplementación con ácido fólico (400 mg) y el uso adecuado de medicamentos y suplementos de venta libre según las recomendaciones de tu equipo de salud.

Recuerda que la planificación y el cuidado adecuado antes de la concepción son cruciales para un embarazo saludable y para minimizar las complicaciones tanto para ti como para tu bebé.","Si planea quedar embarazada y tiene diabetes, es fundamental consultar a su médico y equipo de atención de la diabetes de 3 a 6 meses antes de intentar concebir. Los pasos clave son lograr un excelente control de la diabetes optimizando los niveles de azúcar en sangre, la dieta y los medicamentos; tomar suplementos de ácido fólico; y someterse a chequeos de salud completos. Esta planificación preconcepcional, combinada con un monitoreo frecuente y ajustes durante el embarazo bajo supervisión médica, es esencial para reducir los riesgos de complicaciones y tener un embarazo saludable. La clave es prepararse con anticipación trabajando estrechamente con su equipo de atención médica.",1.0,0.6524500065144964,,1.0,1.0,0.7419913727547349,0.8810089692798093
¿Qué actividades se recomiendan para alguien que comienza a aumentar su actividad física para prevenir la diabetes?,"['proceso asistencial y administrativo.\nSe dispone de muchos programas en línea que ofrecen asesoramiento sobre el \nestilo de vida para ayudar con la pérdida de peso y aumentar la actividad física \n(143). Hay programas que tienen como objetivo tratar la prediabetes y prevenir \nla progresión a diabetes siguiendo el modelo del Programa de Prevención de', 'Guía de Práctica Clínica de Educación en Diabetes \nRegión Centro y Sudamérica, \nFederación Internacional de Diabetes (IDF-SACA)\nPrólogo\n“Debe haber un programa de educación que explique a la comunidad, la \nimportancia de la dieta y la lucha contra el sedentarismo para evitar la obesidad, \nasí como para prevenir el inicio de la diabetes y también mostrar el papel de', 'diabetes (26).\nPhysical Activity\nModerate-intensity physical activity, such\nas brisk walking for 150 min/week, has\nshown beneﬁcial effects in those with\nprediabetes (4). Similarly, moderate-\nintensity physical activity has been shown\nto improve insulin sensitivity and reduce\nabdominal fat in children and young\nadults (27,28). Health care professionals\nare encouraged to promote a DPP-style', 'program that is appropriate to their abilities [1C].\n\uf0b7 Physical activity for healthy adults. Physical activity should be an integral component of the diabetes care plan to\noptimize glucose control, decrease cardiovascular risk factors, and achieve or maintain optimal body weight\n[1A].\n\uf0b7 A moderate-intensity aerobic (endurance) physical activity minimum of 30 minutes 5 days (150 minutes) per', 'program to all individuals who have been\nidentiﬁed to be at an increased risk of\ntype 2 diabetes. In addition to aerobic\nactivity, a physical activity plan designed\nto prevent diabetes may include resis-\ntance training (11,29,30). Breaking up\nprolonged sedentary time may also be\nencouraged, as it is associated with\nmoderately lower postprandial glucose\nlevels (31,32). The effects of physical ac-', 'zados especíﬁcamente para personas con diabetes.\nSe sugiere que las recomendaciones al paciente incluyan ade-\nmás otros aspectos de la modiﬁcación del estilo de vida, como el\naumento de la actividad física y la pérdida de peso. En aquellos\nadultos con diabetes tipo 2 con sobrepeso u obesidad, se debe\ndiscutir y acordar un objetivo inicial de pérdida de peso corporal\nde 5 a 10 %.', '2\nAerobic, Resistance, Balance and Flexibility Exercises  |   American Diabetes Association ®\nAerobic Exercises\nStart by choosing an aerobic activity that you can do almost daily, such as taking 5-minute walks \nthroughout the day or parking farther away so you will take more steps. You don’t even have to \nbreak a sweat or change clothes.\n J Seated March', 'crease in physical activity (walking, yoga,\nhousework, gardening, swimming, and\ndancing) above baseline (304). Health\ncare professionals should counsel people\nwith diabetes to engage in aerobic and re-\nsistance exercise regularly (240). Aerobic\nactivity bouts should last at least 10 min,\nwith the goal of/C2430 min/day or more\nmost days of the week for adults with', 'also good physical activity options.\nYOGA\nYou’ve probably heard that yoga helps \nreduce stress. Higher stress levels mean \nhigher blood glucose, so adding yoga into \nyour routine is a win-win for people with or \nat risk for type 2 diabetes.\nGet active now and prevent,  \ndelay, or manage type 2 diabetes!', 'la práctica deportiva. B1\nSe sugiere utilizar glucómetros aprobados por las autoridades sanitarias locales. D1\nSe recomienda iniciar un programa de educación y apoyo al autocuidado de \ndiabetes antes de iniciar automonitoreo, para ayudar en la toma de decisiones. \nEs importante entrenar en el registro e interpretación de los resultados, para \ntomar decisiones en la vida diaria. B1\nJustificación', 'tai chi may be included based on indi-\nvidual preferences to increaseﬂexibil-\nity, muscular strength, and balance.C\n5.31 For all people with diabetes, eval-\nuate baseline physical activity and time\nspent in sedentary behavior (i.e., quiet\nsitting, lying, and leaning). For people\nwho do not meet activity guidelines,\nencourage increase in physical activities\n(e.g., walking, yoga, housework, gar-', 'manage type 2 diabetes. These activities are great for anyone with diabetes, but \ntalk to your health care professional before beginning any new type of exercise.\nPhysical activity includes any movement that elevates your heart rate (which can improve \nheart health), increases your metabolism, aids weight loss, lowers your blood pressure,', '(recién diagnosticada, con sobrepeso):\n1. Entender la importancia de la reducción de peso para reducir la resistencia a \nla insulina –› 2. Aprender a saber y experimentar varios métodos de reducción de \npeso. –› 3. Documentar y explorar sus efectos. –› 4. Elegir el método o métodos \nque mejor coincidan con las preferencias individuales para su aplicación. –› 5. \nMantener el contacto.', 'ommended 2–3 times/week for older adults with\ndiabetes. Yoga and tai chi may be included based on\nindividual preferences to increaseﬂexibility, mus-\ncular strength, and balance.C\nThe ADA position statement“Physical Activity/Exercise\nand Diabetes” offers speciﬁc recommendations and\nprecautions related to type of diabetes, age, activity done,\nand presence of diabetes-related health complications', 'Over time, activities should progress in in-\ntensity, frequency, and/or duration to at\nleast 150 min/week of moderate-intensity\nexercise. Adults able to run at 6 miles/h\n(9.7 km/h) for at least 25 min can beneﬁt\nsufﬁciently from shorter durations of vigor-\nous-intensity activity or interval training\n(75 min/week) (297). Many adults, including\nmost with type 2 diabetes, may be unable', 'de comportamiento planificado (Ej.: Inicio de AUTOMONITOREO). El \ncomportamiento diana debe ser simple, mesurable, orientado a la acción, \nrealista y calculado. Un objetivo específico sería: “Caminar tres veces al día \ndurante 15 minutos” o “Cambiar la leche entera (homogeneizada) por leche \ndescremada”.\nEn segundo lugar, se identifica en qué etapa de cambio se encuentra la persona \ncon diabetes:', 'spent in sedentary behavior (i.e., quiet\nsitting, lying, and leaning). For people\nwho do not meet activity guidelines,\nencourage increase in physical activities\n(e.g., walking, yoga, housework, gar-\ndening, swimming, and dancing) above\nbaseline (type 1 diabetesE and type 2\ndiabetes B). Counsel that prolonged\nsitting should be interrupted every\n30 min for blood glucose beneﬁts. C', 'dening, swimming, and dancing) above\nbaseline (type 1 diabetesE and type 2\ndiabetes B). Counsel that prolonged\nsitting should be interrupted every\n30 min for blood glucose beneﬁts. C\nPhysical activity is a general term that in-\ncludes all movement that increases en-\nergy use and is an important part of the\ndiabetes management plan. Exercise is a\nmore speciﬁc form of physical activity', 'bone-strengthening activities at least 3 days/week.C\n5.25 Most adults with type 1C and type 2B diabetes\nshould engage in 150 min or more of moderate- to\nvigorous-intensity aerobic activity per week, spread\nover at least 3 days/week, with no more than 2\nconsecutive days without activity. Shorter durations\n(minimum 75 min/week) of vigorous-intensity or\ninterval training may be sufﬁcient for younger', '5.2 PHYSICAL ACTIVITY \n\uf0b7 All adults should consult their healthcare provider and/or see an exercise physiologist to discuss a safe exercise\nprogram that is appropriate to their abilities [1C].\n\uf0b7 Physical activity for healthy adults. Physical activity should be an integral component of the diabetes care plan to', 'when recommending the type and dura-\ntion of exercise for a given individual (293).\nIndividuals of childbearing potential with\npreexisting diabetes, particularly type 2 dia-\nbetes, and those at risk for or presenting\nwith gestational diabetes mellitus should\nbe advised to engage in regular moderate\nphysical activity prior to and during their\npregnancies as tolerated (297).', 'Physical activity includes any movement that elevates your heart rate (which can improve \nheart health), increases your metabolism, aids weight loss, lowers your blood pressure, \nincreases your HDL (“good”) cholesterol, and boosts your mood.\nPhysical activity is especially beneficial for people with prediabetes and diabetes because', 'Activity\nFor all people with diabetes, evaluate\nbaseline physical activity and time spent\nin sedentary behavior (quiet sitting, lying,\nand leaning). For people who do not\nmeet activity guidelines, encourage an in-\ncrease in physical activity (walking, yoga,\nhousework, gardening, swimming, and\ndancing) above baseline (304). Health\ncare professionals should counsel people', 'in 2–3 sessions/week of resistance ex-\nercise on nonconsecutive days.\n5.30 Recommend ﬂexibility training\nand balance training 2–3 times/week\nfor older adults with diabetes. Yoga and\ntai chi may be included based on indi-\nvidual preferences to increaseﬂexibil-\nity, muscular strength, and balance.C\n5.31 For all people with diabetes, eval-\nuate baseline physical activity and time', 'ejecución estructurado. En esta fase inicial, los participantes aprenden a saber \ny aplicar temporalmente varios métodos de reducción de peso. Por ejemplo, \nutilizando dos semanas una dieta de fórmula, seguida de una intervención baja \nen grasas, una baja en carbohidratos y un ayuno intermitente. Los educadores \ncon experiencia en diabetes apoyan este “camino de descubrimiento” que', 'Physical Activity\nRecommendations\n5.24 Children and adolescents with type 1 or type 2\ndiabetes or prediabetes should engage in 60 min/day\nor more of moderate- or vigorous-intensity aerobic\nactivity , with vigorous muscle-strengthening and\nbone-strengthening activities at least 3 days/week.C\n5.25 Most adults with type 1C and type 2B diabetes\nshould engage in 150 min or more of moderate- to', 'speciﬁc recommendations (297). Increased\nphysical activity (soccer training) has also\nbeen shown to be beneﬁcial for improving\noverallﬁtness in Latino men with obesity,\ndemonstrating feasible methods to increase\nphysical activity in this population (298).\nPhysical activity and exercise should be rec-\nommended and prescribed to all individuals\nwho are at risk for or with diabetes as part', 'physical activity in this population (298).\nPhysical activity and exercise should be rec-\nommended and prescribed to all individuals\nwho are at risk for or with diabetes as part\nof management of glycemia and overall\nhealth. Speciﬁc recommendations and pre-\ncautions will vary by the type of diabetes,\nage, activity, and presence of diabetes-\nrelated health complications. Recommen-', 'tance training (11,29,30). Breaking up\nprolonged sedentary time may also be\nencouraged, as it is associated with\nmoderately lower postprandial glucose\nlevels (31,32). The effects of physical ac-\ntivity appear to extend to the prevention\nof gestational diabetes mellitus (GDM)\n(33).\nDelivery and Dissemination of\nLifestyle Behavior Change for\nDiabetes Prevention', 'de la persona, siendo sensible a su voluntad de cambio y los efec-\ntos en su calidad de vida.\nSe aconseja estimular a los adultos con diabetes tipo 2 a seguir\nlos mismos consejos de alimentación saludable que la población\ngeneral, que incluyen: comer fuentes de carbohidratos con alto\ncontenido de ﬁbra y bajo índice glucémico, como frutas, verdu-', 'cal activity per week, such as brisk walk-\ning. Although weight loss was the most\nimportant factor in reducing the risk of in-\ncident diabetes, achieving the behavioral\ngoal of at least 150 min of physical activ-\nity per week, even without achieving the\nweight loss goal, reduced the incidence\nof type 2 diabetes by 44% (12).\nThe 7% weight loss goal was selected', 'with low energy expenditure (e.g., seated\nwork at a computer or watching televi-\nsion)— by breaking up bouts of sedentary\nactivity (>30 min) by brieﬂys t a n d i n g ,\nwalking, or performing other light physical\nactivities (310,311). Participating in leisure-\ntime activity and avoiding extended seden-\ntary periods may help prevent type 2 dia-\nbetes for those at risk and may also aid in', 'adultos con diabetes tipo 2 con sobrepeso u obesidad, se debe\ndiscutir y acordar un objetivo inicial de pérdida de peso corporal\nde 5 a 10 %.\nLa reducción del riesgo de hipoglucemia será un objetivo pri-', 'capacitar y/o mejorar el autocuidado en las personas con diabetes?\n• ¿Cuáles son los temas claves que el equipo de salud debe tratar en la \nconsulta de la persona con diabetes, para que mejore su manejo metabólico \ny prevenga o disminuyan las complicaciones?\n• ¿Qué variables deben ser tomadas en cuenta, dentro de la evaluación', '21\nLista de preguntas clave.\nEl comité seleccionó las siguientes preguntas, como componentes que se \ncubrieron en la guía:\n• ¿En qué modelo de atención debería basarse un programa educativo para \ncapacitar y/o mejorar el autocuidado en las personas con diabetes?\n• ¿Cuáles son los temas claves que el equipo de salud debe tratar en la', 'metabólico y prevenga o disminuya las complicaciones?\nSe recomienda un programa de apoyo al autocuidado estandarizado, adaptado \na las necesidades de la región, que tenga como mínimo más de 12 horas \nde contacto con los educadores y que contenga los siguientes temas en su \nestructura. C1:\n1. Alimentación saludable.\n2. Actividad física.\n3. Automonitoreo.\n4. Adherencia terapéutica.', 'aspartame-and-other-sweeteners-food.\nPHYSICAL ACTIVITY\nRecommendations\n5.27 Counsel youth with type 1 dia-\nbetes C or type 2 diabetesB to engage\nin 60 min/day or more of moderate- or\nvigorous-intensity aerobic activity, with\nvigorous muscle-strengthening and\nbone-strengthening activities at least\n3 days/week.\n5.28 Counsel most adults with type 1\ndiabetesC and type 2 diabetesB to en-', '37\nPREGUNTA 2. ¿Cuáles son los temas claves que el equipo de salud debe \ntratar en la consulta de la persona con diabetes para que mejore su manejo \nmetabólico y prevenga o disminuya las complicaciones?\nSe recomienda un programa de apoyo al autocuidado estandarizado, adaptado \na las necesidades de la región, que tenga como mínimo más de 12 horas', 'Los resultados sobre objetivos glicémicos, muestran reducciones transitorias en \nla hemoglobina glicosilada, que requieren de refuerzos posteriores para persistir \nen el tiempo (182). Se ha visto que los mayores beneficios se obtienen con \naquellos participantes que presentan hemoglobinas glicosiladas mayores previo \na la actividad y en quienes asisten más veces (182). También se ha reportado', 'apoyo psicológico (157).\nPREGUNTA 9. ¿Son los campamentos recreativos-educativos una \nestrategia eficaz para aumentar el empoderamiento del autocuidado de \nlas personas con diabetes?\nSe sugiere promover la participación voluntaria de niños y jóvenes con diabetes \nen actividades con sus pares. El costo no debe ser un factor que determine la \nparticipación. C2', 'ing aerobic activity, weight-bearing exer-\ncise, and/or resistance training, should\nbe encouraged in all older adults with\ndiabetes who can safely engage in such\nactivities.B\n13.13 For older adults with type 2 di-\nabetes, overweight/obesity, and ca-\npacity to safely exercise, an intensive\nlifestyle intervention focused on die-\ntary changes, physical activity, and', 'therapy (see Section 5, “Facilitating\nPositive Health Behaviors and Well-being\nto Improve Health Outcomes,” for more\ndetailed information) is effective in lower-\ning A1C in individuals diagnosed with pre-\ndiabetes (26).\nPhysical Activity\nModerate-intensity physical activity, such\nas brisk walking for 150 min/week, has\nshown beneﬁcial effects in those with\nprediabetes (4). Similarly, moderate-', 'dichas actividades (194). Los campamentos que más destacan en la región son los \nde Brasil (ADJ) y Chile (FDJ) (195), por la cantidad de asistentes recibidos, historia y \norganización. Estas actividades se caracterizan por tener una organización estable \ny protocolos escritos que permiten minimizar los riesgos.\nCon base en el éxito reportado por estas asociaciones y de acuerdo a las guías de', 'Kayaking, pickle ball, bowling, martial arts, \ntai chi, water aerobics, kickboxing, rowing, \nstationary bike, tennis, cross-country \nskiing, and high-intensity interval training \n(done at lots of different fitness levels) are \nalso good physical activity options.\nYOGA\nYou’ve probably heard that yoga helps \nreduce stress. Higher stress levels mean \nhigher blood glucose, so adding yoga into', 'ja que el profesional tratante titule de forma escalonada la dosis\nde insulina, abordando las indicaciones para prevenir y tratar los\neventuales episodios de hipoglucemia. Siempre que no haya con-\ntraindicación, el tratamiento con metformina debe continuarse al\nadicionar la insulina, y se debe evaluar de manera continua la\nnecesidad de otras terapias para un control metabólico adecua-\ndo.', 'ommended to improve strength, balance,\nand the ability to engage in activities of\ndaily living throughout the life span.\nHealth care professionals should support\npeople with diabetes to set stepwise goals\ntoward meeting the recommended exer-\ncise goals. As individuals intensify their ex-\nercise program, medical monitoring may\nbe indicated to ensure safety and evalu-', 'activities (310,311). Participating in leisure-\ntime activity and avoiding extended seden-\ntary periods may help prevent type 2 dia-\nbetes for those at risk and may also aid in\nglycemic management for those with dia-\nbetes (312,313).\nA systematic review and meta-analysis\nfound higher frequency of regular lei-', 'con el programa KiDS de la Federación Internacional de Diabetes (IDF) (48)(49).\nConsideraciones finales.\nExisten muchos factores que son obstáculos para el éxito de la ED, pero ya son \nconocidas las maneras de minimizarlos, y las asociaciones de diabetes tienen \nun rol central en eso. Es necesario observar las características del educando,', 'sufﬁciently from shorter durations of vigor-\nous-intensity activity or interval training\n(75 min/week) (297). Many adults, including\nmost with type 2 diabetes, may be unable\nor unwilling to participate in such intense\nexercise and should engage in moderate\nexercise for the recommended duration.\nAdults with diabetes are encouraged to\nengage in 2–3 sessions/week of resis-', 'otorgar un contacto telefónico para responder consultas, expli-\ncar cómo realizar los controles de glucemia por automonitoreo\ny solicitarles que realicen esos controles. Asimismo, se aconse-\nja que el profesional tratante titule de forma escalonada la dosis\nde insulina, abordando las indicaciones para prevenir y tratar los\neventuales episodios de hipoglucemia. Siempre que no haya con-']","Para alguien que comienza a aumentar su actividad física para prevenir la diabetes, se recomiendan actividades aeróbicas de intensidad moderada, como caminar a paso ligero durante 150 minutos a la semana. Además, se sugiere incluir actividades de resistencia y evitar períodos prolongados de sedentarismo, interrumpiendo el tiempo sentado cada 30 minutos con breves actividades físicas como caminar o estar de pie. Otras actividades recomendadas incluyen yoga, tareas domésticas, jardinería, natación y baile. Es importante comenzar con actividades que se puedan realizar casi a diario y aumentar gradualmente la intensidad, frecuencia y duración de los ejercicios.","Para alguien que comienza a aumentar su actividad física para prevenir la diabetes, se recomiendan actividades de bajo impacto como caminar, nadar, andar en bicicleta y tareas domésticas o de jardinería activas. La clave es comenzar despacio con actividades de intensidad baja a moderada que sean agradables e ir aumentando gradualmente hasta al menos 150 minutos por semana de ejercicio aeróbico repartidos en la mayoría de los días. Consultar a un profesional de la salud, especialmente si tiene complicaciones de la diabetes, puede ayudar a garantizar que las actividades sean seguras y adecuadas para sus necesidades.",1.0,0.8068741023836222,,1.0,1.0,0.8374492390004051,0.9122969560016201
